{"name": "2359", "title": "We\u2019ve Got the Achievement-Happiness Connection Backwards. Here\u2019s How to Fix\u00a0It.", "sentences": [{"8f3e": "We\u2019ve Got the Achievement-Happiness Connection Backwards. Here\u2019s How to Fix\u00a0It."}, {"44e5": "The Founding Fathers Must Have Been Aristotle Groupies"}, {"4d38": "Happy people in a positive environment perform better than grumpy ones in a negative environment. Happiness directly impacts performance. The data is in, and it really is that simple."}, {"dab0": "But something doesn\u2019t seem quite right. Aren\u2019t happy people less serious? They\u2019re so busy having fun, when do they actually have time to get any work done? Because there\u2019s no way work is fun\u2026 that\u2019s why it\u2019s called work\u2026 right?"}, {"b7ae": "Happiness is the state of well-being characterized by emotions ranging from contentment to intense joy.-Siri"}, {"d6ad": "Siri\u2019s definition sounds lovely, but there\u2019s got to be more to it than that. The founding fathers didn\u2019t declare life, liberty, and the pursuit of positive emotions as our inalienable rights. Certainly they meant something more than that."}, {"e854": "The founding fathers likely meant something closer to Aristotle\u2019s definition\u200a\u2014\u200ahuman flourishing, or psychologist Shawn Achor\u2019s\u200a\u2014\u200athe joy we feel striving after our potential, or Leo Rosten\u2019s:"}, {"957e": "Happiness comes only when we push our brains and hearts to the farthest reaches of which we are capable.-Leo\u00a0Rosten"}, {"e6d7": "Now that\u2019s more like it. With those definitions, it\u2019s easier to see the links between happiness and performance. Life, liberty, and the pursuit of human flourishing."}, {"4658": "Positive Emotions are Performance Enhancing Drugs"}, {"7a56": "When we experience positive emotions, our brains increase the production of dopamine and serotonin\u200a\u2014\u200achemicals that help us think more quickly and creatively, and improve our analytical and complex problem solving skills."}, {"7dd9": "Subjects hooked up to fMRI machines show increased activity in the pre-frontal cortex when they are in a good mood. This is the part of our brain (right behind our forehead) that separates us from other primates and allows us to do our deepest, most complex thinking."}, {"9aea": "When we experience negative pressure or stress, cortisol displaces those good chemicals, activating our amygdala\u200a\u2014\u200athe \u2018oldest\u2019 part of our brain (just above our spinal cord) that we share with the rest of the animal kingdom\u200a\u2014\u200atriggering a \u2018fight or flight\u2019 response."}, {"1a2a": "In some situations, \u2018fight or flight\u2019 is absolutely appropriate:We stumble across a grizzly bear on our evening stroll.\u00a0Those shapes moving towards us at the end of the dark alley.The comments section of our latest social media post."}, {"d125": "When our amygdala is firing, we\u2019re not thinking any more critically than a lizard or a puppy dog. We just don\u2019t want to be\u00a0eaten."}, {"971d": "Leaders and managers have an enormous impact on the environment that their teams walk into every\u00a0day."}, {"5fd0": "They aren\u2019t just choosing their own mood, thereby impacting their own performance\u200a\u2014\u200athey\u2019re setting the tone for everyone around them."}, {"5d35": "Through small choices in behaviors\u200a\u2014\u200achoosing to thank someone for \u201cjust doing her job\u201d or choosing to ask about how someone\u2019s vacation or weekend was\u200a\u2014\u200amanagers send ripples through the organization."}, {"a8b0": "Ripples that really do get people thinking more deeply and creatively. And really do get people doing better work."}, {"ad92": "A study cited in Shawn Achor\u2019s \u201cThe Happiness Advantage\u201d found that teams with encouraging managers outperformed their peers by 31%. That\u2019s quite a happiness advantage."}, {"af9f": "For years, we\u2019ve had the achievement / happiness loop backwards."}, {"2aa2": "I\u2019ll be so happy when this project is done.Once I get that promotion, I\u2019ll finally feel like I\u2019ve made it.Things will be so much better after I hit my numbers."}, {"bcfd": "It\u2019s time to flip that logic. Happiness first, and the results will follow."}, {"7ad1": "If you\u2019d like some guidance on incorporating the concepts from this post in your life or work, I\u2019d love to help. Find me at Christopher Sowers\u200a\u2014\u200aCoach Profile on Coach.me. You can use the promo code CHRIS11873WEEK for a free week of online coaching."}], "child": "2359_1\t2359_2\t2359_32359_1\t2359_2\t2359_32359_1\t2359_2\t2359_32359_1\t2359_2\t2359_3", "timestamp": "Feb 27", "content": "We\u2019ve Got the Achievement-Happiness Connection Backwards. Here\u2019s How to Fix\u00a0It. The Founding Fathers Must Have Been Aristotle Groupies Happy people in a positive environment perform better than grumpy ones in a negative environment. Happiness directly impacts performance. The data is in, and it really is that simple. But something doesn\u2019t seem quite right. Aren\u2019t happy people less serious? They\u2019re so busy having fun, when do they actually have time to get any work done? Because there\u2019s no way work is fun\u2026 that\u2019s why it\u2019s called work\u2026 right? Happiness is the state of well-being characterized by emotions ranging from contentment to intense joy.-Siri Siri\u2019s definition sounds lovely, but there\u2019s got to be more to it than that. The founding fathers didn\u2019t declare life, liberty, and the pursuit of positive emotions as our inalienable rights. Certainly they meant something more than that. The founding fathers likely meant something closer to Aristotle\u2019s definition\u200a\u2014\u200ahuman flourishing, or psychologist Shawn Achor\u2019s\u200a\u2014\u200athe joy we feel striving after our potential, or Leo Rosten\u2019s: Happiness comes only when we push our brains and hearts to the farthest reaches of which we are capable.-Leo\u00a0Rosten Now that\u2019s more like it. With those definitions, it\u2019s easier to see the links between happiness and performance. Life, liberty, and the pursuit of human flourishing. Positive Emotions are Performance Enhancing Drugs When we experience positive emotions, our brains increase the production of dopamine and serotonin\u200a\u2014\u200achemicals that help us think more quickly and creatively, and improve our analytical and complex problem solving skills. Subjects hooked up to fMRI machines show increased activity in the pre-frontal cortex when they are in a good mood. This is the part of our brain (right behind our forehead) that separates us from other primates and allows us to do our deepest, most complex thinking. When we experience negative pressure or stress, cortisol displaces those good chemicals, activating our amygdala\u200a\u2014\u200athe \u2018oldest\u2019 part of our brain (just above our spinal cord) that we share with the rest of the animal kingdom\u200a\u2014\u200atriggering a \u2018fight or flight\u2019 response. In some situations, \u2018fight or flight\u2019 is absolutely appropriate:We stumble across a grizzly bear on our evening stroll.\u00a0Those shapes moving towards us at the end of the dark alley.The comments section of our latest social media post. When our amygdala is firing, we\u2019re not thinking any more critically than a lizard or a puppy dog. We just don\u2019t want to be\u00a0eaten. Leaders and managers have an enormous impact on the environment that their teams walk into every\u00a0day. They aren\u2019t just choosing their own mood, thereby impacting their own performance\u200a\u2014\u200athey\u2019re setting the tone for everyone around them. Through small choices in behaviors\u200a\u2014\u200achoosing to thank someone for \u201cjust doing her job\u201d or choosing to ask about how someone\u2019s vacation or weekend was\u200a\u2014\u200amanagers send ripples through the organization. Ripples that really do get people thinking more deeply and creatively. And really do get people doing better work. A study cited in Shawn Achor\u2019s \u201cThe Happiness Advantage\u201d found that teams with encouraging managers outperformed their peers by 31%. That\u2019s quite a happiness advantage. For years, we\u2019ve had the achievement / happiness loop backwards. I\u2019ll be so happy when this project is done.Once I get that promotion, I\u2019ll finally feel like I\u2019ve made it.Things will be so much better after I hit my numbers. It\u2019s time to flip that logic. Happiness first, and the results will follow. If you\u2019d like some guidance on incorporating the concepts from this post in your life or work, I\u2019d love to help. Find me at Christopher Sowers\u200a\u2014\u200aCoach Profile on Coach.me. You can use the promo code CHRIS11873WEEK for a free week of online coaching. ", "author": "Christopher Sowers", "parent": ""}