{"timestamp": "Apr 11", "child": "2391_1\t2391_2", "title": "Startup: Apakah Semua\u00a0Sama?", "content": "Startup: Apakah Semua\u00a0Sama? Disclaimer\u00a0: Segala sesuatu yang saya katakan mungkin akan lebih megarah kepada pemikiran subjektif, dan saya tidak sedang mencari pembenaran, tetapi kebenaran. Silahkan berikan komentar di bawah, jika ada yang kurang sesuai untuk kita cari kebenarannya. Introduction Beberapa waktu yang lalu, saya sempat mengalami pergumulan tentang bagaimana Startup saya, NED Studio, seharusnya bekerja, berjalan ataupun beroperasi. Bagaimana kami seharusnya mendefinisikan nilai jual (value) startup kami, bagaimana seharusnya mengembangkam nilai(value) startup kami, bersamaan dengan bertahan hidup. Dan beberapa pandangan yang sering membuat saya \u201cgalau\u201d adalah ketika seseorang mengatakan \u201cliat startup X, mereka begini\u201d atau \u201ccontohlah startup X, dia bisa memperoleh uang\u201d. Saya secara subjectif tidak ingin meniru mereka, tetapi saya tidak mampu menjelaskan dengan objektif. Dan akhirnya saya mencoba mempelajari beberapa startup dengan jalan yang mereka tempuh dan bagaimana hal tersebut relevan terhadap startup dan mimpi kami. Dan salah satu hal utama yang saya temukan adalah prinsip dasar tentang apa yang diinginkan founder terhadap startupnya sehingga ia membentuk sebuah startup yang dijelaskan Steve Blank dengan judul \u201cSix Types of Startup\u201d Jenis Startup Steve Blank, dalam penjelasan di video youtube, Customer Development: Second Decade, menjelaskan bahwa terdapat 6 jenis Startup yaitu: 1. Lifestyle Startup Lifestyle Startup adalah startup yang dibentuk untuk menghidupi atau menjiwai atau menikmati passion dari founder-nya. Kata kunci untuk jenis ini adalah \u201clive founders passion\u201d. 2. Social\u00a0Startup Social Startup adalah startup yang dibentuk untuk mengubah dunia menjadi lebih baik. Kata kunci untuk jenis ini adalah \u201cmake the world better\u201d. 3. Small-Business Startup Small-Business Startup adalah startup yang dibentuk untuk mencukupi kehidupan keluarga. Kata kunci untuk jenis ini adalah \u201cfeed the familty\u201d. 4. Buyable\u00a0Startup Buyable Startup adalah startup yang dibentuk untuk dijual kepada perusahaan yang lebih besar. Kata kunci untuk jenis ini adalah \u201cacquired by other company\u201d. 5. Scalable\u00a0Startup Scalable Startup adalah startup yang dibentuk untuk benar-benar menjadi perusahaan besar atau raksasa. Kata kunci untuk jenis ini adalah \u201cborn to be big\u201d. Real Impact Dalam implementasi nyatanya, hal ini penting sebagai fondasi dasar untuk mengambilan keputusan. Hal tersebut adalah level subjektif dari founder tentang bagaimana menjalankan startupnya yang selanjutnya berhubungan dengan kesiapan untuk menangung konsekuensinya. Dan untuk memberi gambaran lebih jelas, saya berikan contoh berikut ini\u00a0: Saya rasa Anda mengerti tentang kata \u201cTentu tidak\u201d yang saya maksud adalah secara prinsip. Hal tersebut saya katakan tanpa memperhatikan faktor lain karena faktor lain tersebut terlalu luas untuk dibahas di sini. Hahaha\u00a0:P Hal di atas adalah contoh kecil dari bagaimana pengambilan keputusan itu sangat dipengaruhi oleh \u201cApa yang founder inginkan sehinga dia membangun startup\u201d atau jika mengunakan bahasa formal adalah \u201cApa Visi dari Startup tersebut\u201d. Oleh karena itu, jika Anda sampai pada titik mengalami \u201cke-galau-an\u201d seperti saya di atas, coba Anda mendalami lebih dalam tentang founder dan visi startup Anda. Hal ini untuk melihat keinginan dan kesiapan founder Anda. Jika kamu tahu apa perbedaanmu dengan orang lain, maka kamu akan tahu apa yang harus kamu tiru atau tidak dari orang lain. ", "sentences": [{"c460": "Startup: Apakah Semua\u00a0Sama?"}, {"2ac6": "Disclaimer\u00a0: Segala sesuatu yang saya katakan mungkin akan lebih megarah kepada pemikiran subjektif, dan saya tidak sedang mencari pembenaran, tetapi kebenaran. Silahkan berikan komentar di bawah, jika ada yang kurang sesuai untuk kita cari kebenarannya."}, {"a026": "Introduction"}, {"7370": "Beberapa waktu yang lalu, saya sempat mengalami pergumulan tentang bagaimana Startup saya, NED Studio, seharusnya bekerja, berjalan ataupun beroperasi. Bagaimana kami seharusnya mendefinisikan nilai jual (value) startup kami, bagaimana seharusnya mengembangkam nilai(value) startup kami, bersamaan dengan bertahan hidup. Dan beberapa pandangan yang sering membuat saya \u201cgalau\u201d adalah ketika seseorang mengatakan \u201cliat startup X, mereka begini\u201d atau \u201ccontohlah startup X, dia bisa memperoleh uang\u201d. Saya secara subjectif tidak ingin meniru mereka, tetapi saya tidak mampu menjelaskan dengan objektif. Dan akhirnya saya mencoba mempelajari beberapa startup dengan jalan yang mereka tempuh dan bagaimana hal tersebut relevan terhadap startup dan mimpi kami. Dan salah satu hal utama yang saya temukan adalah prinsip dasar tentang apa yang diinginkan founder terhadap startupnya sehingga ia membentuk sebuah startup yang dijelaskan Steve Blank dengan judul \u201cSix Types of Startup\u201d"}, {"1c4b": "Jenis Startup"}, {"b0d1": "Steve Blank, dalam penjelasan di video youtube, Customer Development: Second Decade, menjelaskan bahwa terdapat 6 jenis Startup yaitu:"}, {"8340": "1. Lifestyle Startup"}, {"acf0": "Lifestyle Startup adalah startup yang dibentuk untuk menghidupi atau menjiwai atau menikmati passion dari founder-nya. Kata kunci untuk jenis ini adalah \u201clive founders passion\u201d."}, {"ca12": "2. Social\u00a0Startup"}, {"3afa": "Social Startup adalah startup yang dibentuk untuk mengubah dunia menjadi lebih baik. Kata kunci untuk jenis ini adalah \u201cmake the world better\u201d."}, {"82ce": "3. Small-Business Startup"}, {"64d4": "Small-Business Startup adalah startup yang dibentuk untuk mencukupi kehidupan keluarga. Kata kunci untuk jenis ini adalah \u201cfeed the familty\u201d."}, {"9c5a": "4. Buyable\u00a0Startup"}, {"5a53": "Buyable Startup adalah startup yang dibentuk untuk dijual kepada perusahaan yang lebih besar. Kata kunci untuk jenis ini adalah \u201cacquired by other company\u201d."}, {"6483": "5. Scalable\u00a0Startup"}, {"8caa": "Scalable Startup adalah startup yang dibentuk untuk benar-benar menjadi perusahaan besar atau raksasa. Kata kunci untuk jenis ini adalah \u201cborn to be big\u201d."}, {"5db7": "Real Impact"}, {"fcbb": "Dalam implementasi nyatanya, hal ini penting sebagai fondasi dasar untuk mengambilan keputusan. Hal tersebut adalah level subjektif dari founder tentang bagaimana menjalankan startupnya yang selanjutnya berhubungan dengan kesiapan untuk menangung konsekuensinya. Dan untuk memberi gambaran lebih jelas, saya berikan contoh berikut ini\u00a0:"}, {"bcc5": "Saya rasa Anda mengerti tentang kata \u201cTentu tidak\u201d yang saya maksud adalah secara prinsip. Hal tersebut saya katakan tanpa memperhatikan faktor lain karena faktor lain tersebut terlalu luas untuk dibahas di sini. Hahaha\u00a0:P"}, {"36fc": "Hal di atas adalah contoh kecil dari bagaimana pengambilan keputusan itu sangat dipengaruhi oleh \u201cApa yang founder inginkan sehinga dia membangun startup\u201d atau jika mengunakan bahasa formal adalah \u201cApa Visi dari Startup tersebut\u201d."}, {"81ae": "Oleh karena itu, jika Anda sampai pada titik mengalami \u201cke-galau-an\u201d seperti saya di atas, coba Anda mendalami lebih dalam tentang founder dan visi startup Anda. Hal ini untuk melihat keinginan dan kesiapan founder Anda."}, {"e088": "Jika kamu tahu apa perbedaanmu dengan orang lain, maka kamu akan tahu apa yang harus kamu tiru atau tidak dari orang lain."}], "author": "Leo Pripos Marbun", "name": "2391", "parent": ""}