{"sentences": [{"61a6": "7,000 massive methane gas bubbles under the Russian permafrost could explode\u00a0anytime"}, {"35e3": "Scorching March brings Arctic temperatures up to 20\u00b0F warmer than\u00a0normal."}, {"b3b4": "Crater formed from underground methane explosion in Siberia. CREDIT: Siberia\u00a0Times"}, {"c72a": "Russian scientists have recently discovered some 7,000 underground methane bubbles in Siberia that could explode anytime."}, {"4e2d": "\u2018Their appearance at such high latitudes is most likely linked to thawing permafrost,\u201d explained a Russian Academy of Science spokesperson, \u201cwhich is in turn linked to overall rise of temperature on the north of Eurasia during last several decades.\u201d"}, {"fcab": "Video of one of Russia\u2019s methane bubbles, which have been called \u2018trembling tundra\u2019."}, {"1148": "This discovery is especially worrisome for three reasons. First, methane traps 86 times as much heat as CO2 over a 20-year period. Thawing permafrost creates both CO2 and methane (CH4), but most models of thawing permafrost assume only CO2 is created. If, as it appears, a lot of methane is being generated, then we\u2019ll see even more extra warming than scientists have projected."}, {"781a": "Second, a recent study found global warming will defrost much more permafrost than we thought."}, {"ce38": "Earth\u2019s melting permafrost threatens to unleash a dangerous climate feedback loopNew permafrost study underscores the critical importance of ambitious climate targets, like the Paris agreement.thinkprogress.org"}, {"7165": "Third, the permafrost has already been warming at an alarming rate. In general, the Arctic warms twice as fast as the planet as a whole."}, {"997e": "Last summer saw \u201can abnormally warm summer in 2016 on the Yamal peninsula\u201d of Siberia where many of these bubbles have been found, noted the Russian Academy."}, {"435e": "But in March, Siberia again saw stunning temperatures, according to NASA\u2019s latest monthly report. Globally, it was the second hottest March on record, losing out only to March 2016. Parts of Siberia and the Arctic were as much as 12.1\u00b0C (22\u00b0F) above the 1951\u20131980 average."}, {"1651": "NASA\u2019s land and ocean temperature index (deviation from 1951\u20131980 average) for March. CREDIT:\u00a0NASA"}, {"6c2c": "Finally, you may be wondering if the United States has any of these methane land mines, what are called \u201cexploding\u201d or \u201calternative\u201d pingos. (A regular pingo is \u201cmound of earth-covered ice,\u201d so they don\u2019t generally explode.)"}, {"d0b1": "Vladimir E. Romanovsky, a permafrost decay expert at the University of Alaska in Fairbanks, told the Washington Post that the methane-filled alternate pingos are \u201cdefinitely related to warming,\u201d and could appear in Canada or Alaska."}, {"392a": "\u201cIt is just a matter of time when some of those craters appear in North America as well,\u201d Romanovsky said. Already, several pingos have emerged \u201cright under the Alaskan pipeline,\u201d the scientist said. If one of those bulges turned out to be an alternative pingo, that\u2019s not good news, either."}], "content": "7,000 massive methane gas bubbles under the Russian permafrost could explode\u00a0anytime Scorching March brings Arctic temperatures up to 20\u00b0F warmer than\u00a0normal. Crater formed from underground methane explosion in Siberia. CREDIT: Siberia\u00a0Times Russian scientists have recently discovered some 7,000 underground methane bubbles in Siberia that could explode anytime. \u2018Their appearance at such high latitudes is most likely linked to thawing permafrost,\u201d explained a Russian Academy of Science spokesperson, \u201cwhich is in turn linked to overall rise of temperature on the north of Eurasia during last several decades.\u201d Video of one of Russia\u2019s methane bubbles, which have been called \u2018trembling tundra\u2019. This discovery is especially worrisome for three reasons. First, methane traps 86 times as much heat as CO2 over a 20-year period. Thawing permafrost creates both CO2 and methane (CH4), but most models of thawing permafrost assume only CO2 is created. If, as it appears, a lot of methane is being generated, then we\u2019ll see even more extra warming than scientists have projected. Second, a recent study found global warming will defrost much more permafrost than we thought. Earth\u2019s melting permafrost threatens to unleash a dangerous climate feedback loopNew permafrost study underscores the critical importance of ambitious climate targets, like the Paris agreement.thinkprogress.org Third, the permafrost has already been warming at an alarming rate. In general, the Arctic warms twice as fast as the planet as a whole. Last summer saw \u201can abnormally warm summer in 2016 on the Yamal peninsula\u201d of Siberia where many of these bubbles have been found, noted the Russian Academy. But in March, Siberia again saw stunning temperatures, according to NASA\u2019s latest monthly report. Globally, it was the second hottest March on record, losing out only to March 2016. Parts of Siberia and the Arctic were as much as 12.1\u00b0C (22\u00b0F) above the 1951\u20131980 average. NASA\u2019s land and ocean temperature index (deviation from 1951\u20131980 average) for March. CREDIT:\u00a0NASA Finally, you may be wondering if the United States has any of these methane land mines, what are called \u201cexploding\u201d or \u201calternative\u201d pingos. (A regular pingo is \u201cmound of earth-covered ice,\u201d so they don\u2019t generally explode.) Vladimir E. Romanovsky, a permafrost decay expert at the University of Alaska in Fairbanks, told the Washington Post that the methane-filled alternate pingos are \u201cdefinitely related to warming,\u201d and could appear in Canada or Alaska. \u201cIt is just a matter of time when some of those craters appear in North America as well,\u201d Romanovsky said. Already, several pingos have emerged \u201cright under the Alaskan pipeline,\u201d the scientist said. If one of those bulges turned out to be an alternative pingo, that\u2019s not good news, either. ", "title": "7,000 massive methane gas bubbles under the Russian permafrost could explode\u00a0anytime", "parent": "", "name": "2480", "timestamp": "Apr 17", "author": "Joe Romm", "child": "2480_1\t2480_2\t2480_3\t2480_4\t2480_5\t2480_6\t2480_7\t2480_8\t2480_9\t2480_10\t2480_11"}