{"sentences": [{"dcf2": "6 Things You Didn\u2019t Know About Bluetooth"}, {"288a": "Like the fact that Bluetooth is named after a Viking and works by using slavery\u2026"}, {"f62f": "Invented by Ericsson in 1994, Bluetooth was intended to enable wireless headsets. Bluetooth has since expanded into a broad variety of applications including Bluetooth headsets, speakers, printers, video game controllers, and much more."}, {"7e10": "Bluetooth is also important for the rapidly growing Internet of Things, including smart homes and industrial applications. Given the importance of Bluetooth and it\u2019s usage in an increasing number of applications, here are 6 interesting things about Bluetooth that you didn\u2019t know!"}, {"4507": "And to start it off, do you know what Bluetooth actually is?"}, {"c80d": "1) Bluetooth is a Wireless Technology Standard"}, {"9d16": "Wireless technology standards require both a hardware and software component. The hardware is required to be able to send the necessary signal via radio frequency, and the software determines what\u2019s sent over that signal and how it\u2019s interpreted."}, {"c631": "This means that, to use Bluetooth, a device must have a tiny computer chip with a Bluetooth radio. This also means that the software must be universally accepted across all devices (hence, \u201cstandard\u201d), otherwise they wouldn\u2019t be able to communicate."}, {"48ab": "A Bluetooth radio chip next to a watch\u00a0batter"}, {"2fa3": "This standard is managed by the Bluetooth Special Interest Group (SIG), but Bluetooth SIG didn\u2019t choose the name, instead the name was proposed by Jim Kardach in 1997\u2026"}, {"5d72": "2) Bluetooth is Named after a\u00a0Viking"}, {"ecd5": "Jim Kardach had been reading \u201cThe Long Ships\u201d, by Frans G. Bengtsson, which is set in the Viking Age and includes Harald \u201cBl\u00e5tand\u201d Gormsson, King of Denmark and Norway."}, {"fc92": "The Anglicised version of Harald \u201cBl\u00e5tand\u201d is Harald Bluetooth. He\u2019s known for uniting dissonant Viking tribes into the Kingdom of Denmark. In a similar way, Bluetooth is thus meant to unite the many wireless communications protocols under one standard."}, {"5b21": "The Bluetooth logo is also a combination of the runes for Harald Bluetooth\u2019s initials, H.B."}, {"d926": "Though unintentional, there\u2019s another parallel between the Vikings and Bluetooth. Vikings made use of slaves (called thralls), and so does Bluetooth\u2026"}, {"8bc7": "3) Bluetooth Uses\u00a0Slavery"}, {"94e5": "When Bluetooth devices connect to each other (for example, your phone and your wireless speaker), it\u2019s known as a master-slave relationship. One of the devices is the master and the other devices are slaves. The master transmits information to the slave and the slave listens for information from the master."}, {"906e": "A master can have up to 7 slaves, which is why your computer can be connected via Bluetooth to multiple devices at the same time (for example, a wireless keyboard, mouse, printer, speaker, etc.). When devices are connected together via Bluetooth, it\u2019s called a \u201cpiconet\u201d."}, {"cacc": "Not only can a device be a master in one piconet and a slave in a different piconet at the same time, but the master-slave relationship can also switch. That\u2019s why you need to put your Bluetooth device in pairing mode to connect it. It\u2019s becoming the master so that it can establish a connection and then becomes the slave."}, {"c62f": "This easy set-up for Bluetooth connections is part of why\u2026"}, {"6ee4": "4) Bluetooth is Better than Wi-Fi (Sometimes)"}, {"bac4": "Wi-Fi is also a wireless technology standard, but Bluetooth and Wi-Fi serve two separate purposes. Wi-Fi (which is the brand name for the IEEE.802.11 standard) was meant to replace high-speed cables, so it takes some setting up but supports high bandwidth."}, {"a68a": "On the other hand, Bluetooth was meant for portable equipment and related applications. It\u2019s great when you need to connect two devices with minimal configuration (often just pressing a button). Also, because Bluetooth uses weak signals, there\u2019s limited interference and devices can communicate in \u201cnoisy\u201d environments. That\u2019s why\u2026"}, {"f2f0": "5) Bluetooth is Great for the Internet of\u00a0Things"}, {"4124": "In the Industrial Internet of Things, machines often need to send short bursts of data in extremely noisy environments. With potentially hundreds of sensors and devices sending data, Wi-Fi poses too much hassle to setup."}, {"3cdd": "A drawback of Bluetooth is lower bandwidth, but for many industrial applications this higher bandwidth simply isn\u2019t needed."}, {"bac3": "Bluetooth is also useful in a smart home setting. Again, many devices in the smart home don\u2019t need high bandwidth connections and it\u2019s much easier to set up Bluetooth."}, {"c509": "Furthermore, newer versions of Bluetooth can create a self-healing mesh network which means that individual devices can still communicate even if one device runs out of power or is disconnected. If your door locks, HVAC system, washer, dryer, fridge, and lights are all connected, you certainly wouldn\u2019t want them all to fail just because one goes down."}, {"c9b7": "One of the drawbacks of Bluetooth is the low range, which could be problematic in a smart home (depending on how big your home is). Fortunately\u2026"}, {"62d2": "6) We\u2019re on Bluetooth Version\u00a05"}, {"f3ec": "The Bluetooth Special Interest Group officially adopted Bluetooth 5 as the latest version of Bluetooth back in December 2016."}, {"bf2a": "\u201cWith Bluetooth 5, Bluetooth continues to revolutionize how people experience the IoT. Bluetooth continues to embrace technological advancements and push the unlimited potential of the IoT.\u201d\u2014Bluetooth 5 Now Available"}, {"479b": "As is clear from Bluetooth SIG\u2019s announcement, Bluetooth 5 is specifically aimed that the Internet of Things. It boasts quadruple the range, double the speed, and boosts broadcast messaging capacity by 800%. It also introduces the mesh networking capability mentioned above."}, {"8608": "Bluetooth 5 is backwards-compatible with previous versions of Bluetooth, but new hardware is required to take advantage of the new benefits listed above. So it might be awhile until we see all the benefits that Bluetooth 5 has to offer, but it\u2019s an exciting development as the Internet of Things continue to gain traction!"}, {"249d": "Still have IoT questions?"}, {"9c6f": "Every week we\u2019ll write new Medium posts explaining IoT concepts in simple, non-technical terms. If you have any concepts you\u2019d like explained in a post, please let us know in the comments below! Or if you have a short question you\u2019d like answered quickly, just tweet us using #askIoT!"}, {"7eaf": "\u2190Previously"}, {"e2a1": "How to Deal with the Noise FloorGet a room, get loud, or go stealth.iot-for-all.com"}, {"91c5": "Up Next\u2192"}, {"e961": "This is the most recent post in Explanations! Other series on IoT For All:Critical Thinking\u200a\u2014\u200aFor Developers\u200a\u2014\u200aIndustry News"}], "content": "6 Things You Didn\u2019t Know About Bluetooth Like the fact that Bluetooth is named after a Viking and works by using slavery\u2026 Invented by Ericsson in 1994, Bluetooth was intended to enable wireless headsets. Bluetooth has since expanded into a broad variety of applications including Bluetooth headsets, speakers, printers, video game controllers, and much more. Bluetooth is also important for the rapidly growing Internet of Things, including smart homes and industrial applications. Given the importance of Bluetooth and it\u2019s usage in an increasing number of applications, here are 6 interesting things about Bluetooth that you didn\u2019t know! And to start it off, do you know what Bluetooth actually is? 1) Bluetooth is a Wireless Technology Standard Wireless technology standards require both a hardware and software component. The hardware is required to be able to send the necessary signal via radio frequency, and the software determines what\u2019s sent over that signal and how it\u2019s interpreted. This means that, to use Bluetooth, a device must have a tiny computer chip with a Bluetooth radio. This also means that the software must be universally accepted across all devices (hence, \u201cstandard\u201d), otherwise they wouldn\u2019t be able to communicate. A Bluetooth radio chip next to a watch\u00a0batter This standard is managed by the Bluetooth Special Interest Group (SIG), but Bluetooth SIG didn\u2019t choose the name, instead the name was proposed by Jim Kardach in 1997\u2026 2) Bluetooth is Named after a\u00a0Viking Jim Kardach had been reading \u201cThe Long Ships\u201d, by Frans G. Bengtsson, which is set in the Viking Age and includes Harald \u201cBl\u00e5tand\u201d Gormsson, King of Denmark and Norway. The Anglicised version of Harald \u201cBl\u00e5tand\u201d is Harald Bluetooth. He\u2019s known for uniting dissonant Viking tribes into the Kingdom of Denmark. In a similar way, Bluetooth is thus meant to unite the many wireless communications protocols under one standard. The Bluetooth logo is also a combination of the runes for Harald Bluetooth\u2019s initials, H.B. Though unintentional, there\u2019s another parallel between the Vikings and Bluetooth. Vikings made use of slaves (called thralls), and so does Bluetooth\u2026 3) Bluetooth Uses\u00a0Slavery When Bluetooth devices connect to each other (for example, your phone and your wireless speaker), it\u2019s known as a master-slave relationship. One of the devices is the master and the other devices are slaves. The master transmits information to the slave and the slave listens for information from the master. A master can have up to 7 slaves, which is why your computer can be connected via Bluetooth to multiple devices at the same time (for example, a wireless keyboard, mouse, printer, speaker, etc.). When devices are connected together via Bluetooth, it\u2019s called a \u201cpiconet\u201d. Not only can a device be a master in one piconet and a slave in a different piconet at the same time, but the master-slave relationship can also switch. That\u2019s why you need to put your Bluetooth device in pairing mode to connect it. It\u2019s becoming the master so that it can establish a connection and then becomes the slave. This easy set-up for Bluetooth connections is part of why\u2026 4) Bluetooth is Better than Wi-Fi (Sometimes) Wi-Fi is also a wireless technology standard, but Bluetooth and Wi-Fi serve two separate purposes. Wi-Fi (which is the brand name for the IEEE.802.11 standard) was meant to replace high-speed cables, so it takes some setting up but supports high bandwidth. On the other hand, Bluetooth was meant for portable equipment and related applications. It\u2019s great when you need to connect two devices with minimal configuration (often just pressing a button). Also, because Bluetooth uses weak signals, there\u2019s limited interference and devices can communicate in \u201cnoisy\u201d environments. That\u2019s why\u2026 5) Bluetooth is Great for the Internet of\u00a0Things In the Industrial Internet of Things, machines often need to send short bursts of data in extremely noisy environments. With potentially hundreds of sensors and devices sending data, Wi-Fi poses too much hassle to setup. A drawback of Bluetooth is lower bandwidth, but for many industrial applications this higher bandwidth simply isn\u2019t needed. Bluetooth is also useful in a smart home setting. Again, many devices in the smart home don\u2019t need high bandwidth connections and it\u2019s much easier to set up Bluetooth. Furthermore, newer versions of Bluetooth can create a self-healing mesh network which means that individual devices can still communicate even if one device runs out of power or is disconnected. If your door locks, HVAC system, washer, dryer, fridge, and lights are all connected, you certainly wouldn\u2019t want them all to fail just because one goes down. One of the drawbacks of Bluetooth is the low range, which could be problematic in a smart home (depending on how big your home is). Fortunately\u2026 6) We\u2019re on Bluetooth Version\u00a05 The Bluetooth Special Interest Group officially adopted Bluetooth 5 as the latest version of Bluetooth back in December 2016. \u201cWith Bluetooth 5, Bluetooth continues to revolutionize how people experience the IoT. Bluetooth continues to embrace technological advancements and push the unlimited potential of the IoT.\u201d\u2014Bluetooth 5 Now Available As is clear from Bluetooth SIG\u2019s announcement, Bluetooth 5 is specifically aimed that the Internet of Things. It boasts quadruple the range, double the speed, and boosts broadcast messaging capacity by 800%. It also introduces the mesh networking capability mentioned above. Bluetooth 5 is backwards-compatible with previous versions of Bluetooth, but new hardware is required to take advantage of the new benefits listed above. So it might be awhile until we see all the benefits that Bluetooth 5 has to offer, but it\u2019s an exciting development as the Internet of Things continue to gain traction! Still have IoT questions? Every week we\u2019ll write new Medium posts explaining IoT concepts in simple, non-technical terms. If you have any concepts you\u2019d like explained in a post, please let us know in the comments below! Or if you have a short question you\u2019d like answered quickly, just tweet us using #askIoT! \u2190Previously How to Deal with the Noise FloorGet a room, get loud, or go stealth.iot-for-all.com Up Next\u2192 This is the most recent post in Explanations! Other series on IoT For All:Critical Thinking\u200a\u2014\u200aFor Developers\u200a\u2014\u200aIndustry News ", "title": "6 Things You Didn\u2019t Know About Bluetooth", "parent": "", "name": "2499", "timestamp": "Apr 16", "author": "Calum McClelland", "child": "2499_1\t2499_2\t2499_3\t2499_4\t2499_5\t2499_6\t2499_7\t2499_82499_1\t2499_2\t2499_3\t2499_4\t2499_5\t2499_6\t2499_7\t2499_8"}