{"name": "1014", "parent": "", "title": "Held Up at Gun\u00a0Point", "sentences": [{"57a4": "Held Up at Gun\u00a0Point"}, {"f498": "The Day I Walked\u00a0Away"}, {"10ee": "I slammed the phone down, grabbed my coat and hurried outside to hail a cab. I stood there on the street, camouflaged in the chaos of the city as cabs continued to drive past me. My heart was racing as I stepped off of the curb and into the street. I had to be the first one there. I could hardly breathe. I\u2019ve been hanging from a thread already and messing this up will do me in. I waved my arm with a rapid motion until a cab finally came to a halt, brakes screeching. I jumped into the cab."}, {"a225": "\u201cThe fastest route to the corner of 47th and Roosevelt, please.\u201d"}, {"157d": "His eyes flashed at me in the rearview mirror. \u201cYes ma\u2019am,\u201d the driver said. \u201cI\u2019ll do my best.\u201d"}, {"04ec": "Ten minutes had gone by and we\u2019d hardly made it two blocks. Rush hour traffic was monstrous. Horns were honking, drivers were yelling out their windows and bicyclist were weaving in and out of stopped cars."}, {"9e56": "\u201cI\u2019ll get out here,\u201d I said as I threw a twenty on the front seat and got out of the car. I booked it up over the curb and went running down the sidewalk."}, {"9843": "As I approached the building, there were police cars parked up and down the street, lights flashing. A SWAT van pulled up on the curb and an ambulance off in the distance, parked in the street on the next block."}, {"914e": "Jacobs and Hager were already there. I\u2019m screwed, I thought. As I approached I noticed Hager looked unusually exhausted. He wore dark patches beneath his eyes. Jacobs looked like his every day pretty boy self. He beamed his smile at me as I drew closer. My heart sunk knowing they got here before me."}, {"c3e2": "\u201cSo what\u2019s the scoop, boys? I hoped they would give me details I could send in."}, {"1110": "\u201cNot much to tell yet, Bell. They holed themselves up in the bank,\u201d Jacobs informed me."}, {"de11": "\u201cThey\u2019ve got hostages in there,\u201d Hager said. \u201cThe police are looking for a way in while they distract them with the negotiations.\u201d"}, {"e920": "\u201cI heard gunshots when I first got here,\u201d Jacobs chimed, \u201cbut the police don\u2019t want to rush the building to avoid hostages from getting hurt.\u201d"}, {"4507": "The bank was an old cobblestone building. It was solid concrete inside and out. The windows were tinted making it impossible to see inside. Rust colored water stains ran down the building where drain pipes were clogged. A K-9 now stood where the doorman once was."}, {"dc93": "I decided to head around the block. If I didn\u2019t show up with a lead the boss was going to have my head."}, {"02d5": "I walked around the building looking for anything that stood out. Perhaps an eyewitness or clues that led to the robbers themselves. That\u2019s when I noticed it. A white minivan with out-of-state plates. Before approaching, I checked my surrounds; no one was looking. I hustled over to the van and opened the door. I looked up and there was a gun in my face. \u201cMove and you\u2019ll regret it.\u201d"}, {"124f": "He spoke quietly, the anger of his words being forced through his teeth. He was tall, lanky and not wearing a mask. My body froze. I was doing my best not to look him in the eyes. I kept my head down and stared at the ground."}, {"d4c3": "\u201cWho are you?\u201d He demanded."}, {"352e": "\u201cMy name is Lidia Bell,\u201d I quivered. \u201cI\u2019m a reporter for the Chicago Gazette.\u201d"}, {"a24a": "\u201cHow did you know I was in here?\u201d"}, {"9095": "\u201cI didn\u2019t. I suspected the van may be associated with the robbery so I walked over to check it out.\u201d"}, {"25a8": "\u201cYou can step back now. Let\u2019s go.\u201d"}, {"c414": "It occurred to me that I had seen his face. The chances of him letting me go were bleak."}, {"da26": "\u201cWhat\u2019s the best way out of here without anyone seeing me?\u201d"}, {"7999": "I stood silent. He nudged my shoulder with the gun."}, {"a43c": "\u201cLook at me when I\u2019m talking to you.\u201d"}, {"0902": "I turned to face him and he looked me dead center in the eyes. I noticed something moving above his head. I glanced up. It was a man dressed in a SWAT uniform moving his hand in a down motion."}, {"e72b": "\u201cWhat are you looking at?\u201d"}, {"ca2b": "\u201cNothing,\u201d I said but he didn\u2019t believe me. As he turned to look I ducked. A sniper from the roof top behind me shot him in the shoulder and he went down. I couldn\u2019t move. Every muscle in my body seized."}, {"d833": "I snapped to when he sat up. His torso covered in his blood. I ran. As I came around the side of the building I crashed straight into the officer that had signaled me to duck. \u201cAre you alright, miss?\u201d"}, {"725b": "\u201cWhat?\u201d My thoughts were scrambled."}, {"7cdc": "\u201cI want you to get checked out by the medics.\u201d he said. He took me by the arm and walked me over."}, {"2cff": "I scowled. \u201cI don\u2019t need a medic. I need to get downtown.\u201d"}, {"33e7": "He sat me down on the edge of the ambulance. I saw the boss roughly 30 feet away. The medic looked me over and quickly saw that I was okay physically."}, {"1504": "The boss approached. \u201cYou doing alright, Bell?\u201d"}, {"b13e": "\u201cYeah. I\u2019m good.\u201d"}, {"3aa1": "\u201cDid you get the scoop?\u201d"}, {"e402": "\u201cWhich one? The robbers holed up inside the bank or the one where the getaway guy put a gun on me before getting taken down by a sniper?\u201d"}, {"18a4": "\u201cThe bank. Bell. Did you get any info about the bank?\u201d"}, {"fc79": "What I\u2019d experienced hadn\u2019t even fazed him."}, {"4187": "\u201cNope. I must have missed that, Boss,\u201d I said through grinding teeth."}, {"f450": "\u201cI know after the hostages were released SWAT rushed in and nabbed the robbers,\u201d he said. \u201cLooks like Hager and Jacobs got another story.\u201d"}, {"a586": "\u201cI guess so,\u201d I responded."}, {"b0ce": "Hours later I was sitting at my desk in the center of the newsroom. My heart was racing and my thoughts were fuzzy. Keep it together, Lidia. The clickity clank of fingertips beating on keyboards were growing louder. The room was closing in on me. It was shrinking. Don\u2019t freak out, don\u2019t."}, {"4f3d": "\u201cBell, do you not hear me?\u201d The boss hollered. \u201cHello Bell, come back to planet earth.\u201d"}, {"0373": "\u201cWhat do you want Boss?\u201d"}, {"7055": "\u201cSorry to interrupt your daydream. I want you to come in my office.\u201d"}, {"2e40": "I locked my computer as if I had written something of any importance and needed to hide it. As I walked across the newsroom everyone stared. They all knew what happened to me. That\u2019s the thing with journalists: news travels fast. I walked into the boss\u2019s office and closed the door."}, {"a57d": "\u201cI\u2019ll give you front page, Bell\u201d"}, {"5f81": "\u201cI told you at the bank, I didn\u2019t get any details. Hager and Jacobs should get front page.\u201d"}, {"5430": "\u201cI\u2019m not talking about the robbery, Bell.\u201d"}, {"3477": "I knew what he meant but I didn\u2019t want to acknowledge him. I felt my legs shaking. I tried to settle them with no avail. I stood up to make it stop."}, {"e33e": "I walked over to the window and looked down at the traffic nine floors below me. The sun was starting to set and the sky looked back at me with shades of yellow and purple. I couldn\u2019t feel the sun through the thick window glass but I knew it was warm. I saw the strength in its glow."}, {"97f8": "Boss broke the silence. \u201cI want the story on my desk by 8:00 pm.\u201d He was commanding me to do something I wasn\u2019t going to do."}, {"3e9e": "\u201cNo.\u201d I took a deep breath. The air expanded my lungs. As I exhaled I said, \u201cNo,\u201d again. This time more stern."}, {"fa45": "\u201cWhat are you talking about, Bell?\u201d"}, {"a5cb": "\u201cHow long we been working together, Boss?\u201d"}, {"6995": "\u201cLidia.\u201d"}, {"1c1e": "\u201cHow long, Boss?\u201d"}, {"c299": "\u201cGeez, a decade or so.\u201d"}, {"48fb": "I filled with anger, my blood rising to a boil. I walked back toward him and put my hands on his desk. \u201cHow could you ask me to write the story?\u201d"}, {"cca6": "\u201cI offered front page.\u201d"}, {"59c1": "\u201cYou offered front because I had a gun in my face, only five hours ago. I won\u2019t write the story. I refuse.\u201d"}, {"5ba2": "\u201cYou\u2019re being irrational.\u201d"}, {"72af": "Keep yourself together, Bell. I tried but I couldn\u2019t. A wave took over me. \u201cYou think not writing the story is irrational?\u201d I was yelling now."}, {"c755": "\u201cDon\u2019t push me, Bell.\u201d"}, {"5a1d": "\u201cDon\u2019t push you?\u201d I stood silent. The events of the morning were flashing through my mind. I didn\u2019t know where to go from here or how to rid myself of it. \u201cI quit. How\u2019s that for irrational?\u201d"}, {"c410": "The slight breeze from storming away caused papers to rise from the top of his desk. I slammed the door behind me. I went back to my desk, pulled out a box of old copy prints and dumped them onto the floor. I swept the length of my arm across my desk and pushed my stuff in the box. I tore my badge off my lapel and threw it on the desk. It slid until the computer monitor stopped it."}, {"d98f": "I grabbed the box and walked away."}], "content": "Held Up at Gun\u00a0Point The Day I Walked\u00a0Away I slammed the phone down, grabbed my coat and hurried outside to hail a cab. I stood there on the street, camouflaged in the chaos of the city as cabs continued to drive past me. My heart was racing as I stepped off of the curb and into the street. I had to be the first one there. I could hardly breathe. I\u2019ve been hanging from a thread already and messing this up will do me in. I waved my arm with a rapid motion until a cab finally came to a halt, brakes screeching. I jumped into the cab. \u201cThe fastest route to the corner of 47th and Roosevelt, please.\u201d His eyes flashed at me in the rearview mirror. \u201cYes ma\u2019am,\u201d the driver said. \u201cI\u2019ll do my best.\u201d Ten minutes had gone by and we\u2019d hardly made it two blocks. Rush hour traffic was monstrous. Horns were honking, drivers were yelling out their windows and bicyclist were weaving in and out of stopped cars. \u201cI\u2019ll get out here,\u201d I said as I threw a twenty on the front seat and got out of the car. I booked it up over the curb and went running down the sidewalk. As I approached the building, there were police cars parked up and down the street, lights flashing. A SWAT van pulled up on the curb and an ambulance off in the distance, parked in the street on the next block. Jacobs and Hager were already there. I\u2019m screwed, I thought. As I approached I noticed Hager looked unusually exhausted. He wore dark patches beneath his eyes. Jacobs looked like his every day pretty boy self. He beamed his smile at me as I drew closer. My heart sunk knowing they got here before me. \u201cSo what\u2019s the scoop, boys? I hoped they would give me details I could send in. \u201cNot much to tell yet, Bell. They holed themselves up in the bank,\u201d Jacobs informed me. \u201cThey\u2019ve got hostages in there,\u201d Hager said. \u201cThe police are looking for a way in while they distract them with the negotiations.\u201d \u201cI heard gunshots when I first got here,\u201d Jacobs chimed, \u201cbut the police don\u2019t want to rush the building to avoid hostages from getting hurt.\u201d The bank was an old cobblestone building. It was solid concrete inside and out. The windows were tinted making it impossible to see inside. Rust colored water stains ran down the building where drain pipes were clogged. A K-9 now stood where the doorman once was. I decided to head around the block. If I didn\u2019t show up with a lead the boss was going to have my head. I walked around the building looking for anything that stood out. Perhaps an eyewitness or clues that led to the robbers themselves. That\u2019s when I noticed it. A white minivan with out-of-state plates. Before approaching, I checked my surrounds; no one was looking. I hustled over to the van and opened the door. I looked up and there was a gun in my face. \u201cMove and you\u2019ll regret it.\u201d He spoke quietly, the anger of his words being forced through his teeth. He was tall, lanky and not wearing a mask. My body froze. I was doing my best not to look him in the eyes. I kept my head down and stared at the ground. \u201cWho are you?\u201d He demanded. \u201cMy name is Lidia Bell,\u201d I quivered. \u201cI\u2019m a reporter for the Chicago Gazette.\u201d \u201cHow did you know I was in here?\u201d \u201cI didn\u2019t. I suspected the van may be associated with the robbery so I walked over to check it out.\u201d \u201cYou can step back now. Let\u2019s go.\u201d It occurred to me that I had seen his face. The chances of him letting me go were bleak. \u201cWhat\u2019s the best way out of here without anyone seeing me?\u201d I stood silent. He nudged my shoulder with the gun. \u201cLook at me when I\u2019m talking to you.\u201d I turned to face him and he looked me dead center in the eyes. I noticed something moving above his head. I glanced up. It was a man dressed in a SWAT uniform moving his hand in a down motion. \u201cWhat are you looking at?\u201d \u201cNothing,\u201d I said but he didn\u2019t believe me. As he turned to look I ducked. A sniper from the roof top behind me shot him in the shoulder and he went down. I couldn\u2019t move. Every muscle in my body seized. I snapped to when he sat up. His torso covered in his blood. I ran. As I came around the side of the building I crashed straight into the officer that had signaled me to duck. \u201cAre you alright, miss?\u201d \u201cWhat?\u201d My thoughts were scrambled. \u201cI want you to get checked out by the medics.\u201d he said. He took me by the arm and walked me over. I scowled. \u201cI don\u2019t need a medic. I need to get downtown.\u201d He sat me down on the edge of the ambulance. I saw the boss roughly 30 feet away. The medic looked me over and quickly saw that I was okay physically. The boss approached. \u201cYou doing alright, Bell?\u201d \u201cYeah. I\u2019m good.\u201d \u201cDid you get the scoop?\u201d \u201cWhich one? The robbers holed up inside the bank or the one where the getaway guy put a gun on me before getting taken down by a sniper?\u201d \u201cThe bank. Bell. Did you get any info about the bank?\u201d What I\u2019d experienced hadn\u2019t even fazed him. \u201cNope. I must have missed that, Boss,\u201d I said through grinding teeth. \u201cI know after the hostages were released SWAT rushed in and nabbed the robbers,\u201d he said. \u201cLooks like Hager and Jacobs got another story.\u201d \u201cI guess so,\u201d I responded. Hours later I was sitting at my desk in the center of the newsroom. My heart was racing and my thoughts were fuzzy. Keep it together, Lidia. The clickity clank of fingertips beating on keyboards were growing louder. The room was closing in on me. It was shrinking. Don\u2019t freak out, don\u2019t. \u201cBell, do you not hear me?\u201d The boss hollered. \u201cHello Bell, come back to planet earth.\u201d \u201cWhat do you want Boss?\u201d \u201cSorry to interrupt your daydream. I want you to come in my office.\u201d I locked my computer as if I had written something of any importance and needed to hide it. As I walked across the newsroom everyone stared. They all knew what happened to me. That\u2019s the thing with journalists: news travels fast. I walked into the boss\u2019s office and closed the door. \u201cI\u2019ll give you front page, Bell\u201d \u201cI told you at the bank, I didn\u2019t get any details. Hager and Jacobs should get front page.\u201d \u201cI\u2019m not talking about the robbery, Bell.\u201d I knew what he meant but I didn\u2019t want to acknowledge him. I felt my legs shaking. I tried to settle them with no avail. I stood up to make it stop. I walked over to the window and looked down at the traffic nine floors below me. The sun was starting to set and the sky looked back at me with shades of yellow and purple. I couldn\u2019t feel the sun through the thick window glass but I knew it was warm. I saw the strength in its glow. Boss broke the silence. \u201cI want the story on my desk by 8:00 pm.\u201d He was commanding me to do something I wasn\u2019t going to do. \u201cNo.\u201d I took a deep breath. The air expanded my lungs. As I exhaled I said, \u201cNo,\u201d again. This time more stern. \u201cWhat are you talking about, Bell?\u201d \u201cHow long we been working together, Boss?\u201d \u201cLidia.\u201d \u201cHow long, Boss?\u201d \u201cGeez, a decade or so.\u201d I filled with anger, my blood rising to a boil. I walked back toward him and put my hands on his desk. \u201cHow could you ask me to write the story?\u201d \u201cI offered front page.\u201d \u201cYou offered front because I had a gun in my face, only five hours ago. I won\u2019t write the story. I refuse.\u201d \u201cYou\u2019re being irrational.\u201d Keep yourself together, Bell. I tried but I couldn\u2019t. A wave took over me. \u201cYou think not writing the story is irrational?\u201d I was yelling now. \u201cDon\u2019t push me, Bell.\u201d \u201cDon\u2019t push you?\u201d I stood silent. The events of the morning were flashing through my mind. I didn\u2019t know where to go from here or how to rid myself of it. \u201cI quit. How\u2019s that for irrational?\u201d The slight breeze from storming away caused papers to rise from the top of his desk. I slammed the door behind me. I went back to my desk, pulled out a box of old copy prints and dumped them onto the floor. I swept the length of my arm across my desk and pushed my stuff in the box. I tore my badge off my lapel and threw it on the desk. It slid until the computer monitor stopped it. I grabbed the box and walked away. ", "child": "1014_1\t1014_2\t1014_3"}