{"name": "1069", "parent": "", "title": "Louisiana senator\u2019s town hall goes completely off the\u00a0rails", "sentences": [{"fd41": "Louisiana senator\u2019s town hall goes completely off the\u00a0rails"}, {"19c3": "Bill Cassidy\u2019s plans for a quiet presentation were quickly foiled by hundreds of angry constituents."}, {"f17a": "METAIRIE, LOUISIANA\u200a\u2014\u200a\u201cIt was fun,\u201d Republican Senator Bill Cassidy told reporters as he emerged from a town hall in which hundreds of angry constituents heckled and booed him for the better part of an hour."}, {"15ce": "Cassidy had intended to present a PowerPoint on his proposed legislation to replace the Affordable Care Act (ACA) and respond to written questions selected from index cards. That didn\u2019t happen."}, {"2959": "Instead, the senator was greeted with shouts of \u201cshame\u201d and exited an hour later to chants of \u201cdo your job.\u201d"}, {"cbd0": "Protesters shouted the senator down when he attempted to refer to his PowerPoint slides. \u201cWe\u2019ve already read it, we want to ask questions!\u201d audience members yelled."}, {"6047": "Dozens of people stood up and turned their backs to him until he agreed to take questions from the audience."}, {"5eca": "Cassidy later told reporters this was the first time he had seen more than a hundred people at a town hall. The first-term senator, like many of his colleagues in Congress, is facing protests over his support of President Donald Trump\u2019s cabinet nominees and his party\u2019s agenda\u200a\u2014\u200ain particular their plan to roll back health care reform, potentially leaving millions of Americans suddenly uninsured."}, {"0c6e": "Republicans\u2019 town halls all over the country have erupted in anger. Some lawmakers are avoiding their constituents entirely. One Congressman even sneaked away from his own event when faced with questions about the Affordable Care Act."}, {"8d22": "Hundreds of protesters waited for hours outside the East Jefferson Parish Library, but only 200 could get in. CREDIT: Aviva\u00a0Shen"}, {"44cd": "Cassidy came close to ducking the same level of attention. The meeting was scheduled on a weekday afternoon, when most people are at work or picking up their children from school. It also coincided with the beginning of a major Mardi Gras parade in nearby New Orleans, which drew thousands of onlookers and bogged down traffic for miles."}, {"cbed": "Kenny Francis, a pre-kindergarten teacher at Schaumburg Elementary in New Orleans, didn\u2019t think this planning was an accident. He had been fruitlessly calling Cassidy\u2019s office every day for weeks demanding he oppose the nomination of Education Secretary Betsy DeVos. Then his friend texted him a picture of a mailer advertising Cassidy\u2019s town hall."}, {"7614": "\u201cIt took me about a week and a half to get anyone in any of Cassidy\u2019s offices to confirm it was actually happening,\u201d he told ThinkProgress. Once he did, he created a Facebook event for the town hall that quickly took off. By Tuesday, thousands of people had said they would attend."}, {"1f05": "Francis\u2019 primary goal was to hold Cassidy accountable for voting to confirm DeVos, but as a teacher, he\u2019s worried about other repercussions the Republican agenda will have on his students."}, {"cd96": "\u201cI know I have students whose families are not legal,\u201d he said. \u201cI know I have parents who are very concerned about what\u2019s going to happen to them and their kids.\u201d"}, {"e84f": "Francis\u2019 school was also devastated by the tornadoes that unexpectedly swept through the region earlier this month."}, {"ea30": "\u201cA lot of students lost their homes, a lot of parents lost their jobs, their transportation. There\u2019s a lot of hardship happening right now,\u201d he said."}, {"cb47": "Cassidy, who denies the human role in climate change, has been touring tornado damage around southern Louisiana as he holds town halls. Francis said he found Cassidy\u2019s professed concern about tornado victims \u201coffensive.\u201d"}, {"c1d0": "\u201cHe had the nerve to talk about how he wants to help with the tornado recovery,\u201d Francis said. \u201cIt is offensive to me to hear him talk about how he wants to help those families when you want to take away their health care that literally allows them to be able to make sure their kids stay healthy.\u201d"}, {"3854": "CREDIT: Aviva\u00a0Shen"}, {"b04a": "\u201cThe majority of our students qualify for free or reduced lunch. The majority of those families also have coverage for their children through Medicaid,\u201d he said. \u201cSo what is going to happen to the literally thousands of kids that have coverage through Medicaid when they repeal the ACA? We\u2019re just going to leave them without health care?\u201d"}, {"0b37": "Throughout the town hall, Cassidy repeatedly attempted to pitch his ACA replacement, which would allow states to maintain the ACA if they wanted it, adopt a watered down version, or opt out entirely, creating a patchwork of health care access varying by geography. It would also likely make insurance premiums rise, as the bill would maintain some of the ACA\u2019s popular consumer protections while removing the individual mandate and tax credits that make them affordable."}, {"24a8": "It also isn\u2019t clear if Republican support will coalesce around his bill\u200a\u2014\u200aor if they will wait to repeal the ACA until they are ready to implement a replacement."}, {"ccd2": "\u201cWill you vote to repeal Obamacare with or without this in place?\u201d one attendee, Sean Marx, demanded to know at one point. A chorus of people chanted \u201cYes or no?\u201d as Cassidy stayed silent and waited for the man to be escorted from the room by sheriff\u2019s deputies."}, {"4362": "As he was led out of the room, Marx yelled, \u201c2020\u200a\u2014\u200ayou\u2019re done!\u201d"}, {"a1cf": "Aviva Shen, a former ThinkProgress editor, is now a freelance writer in New Orleans focused on criminal justice."}], "content": "Louisiana senator\u2019s town hall goes completely off the\u00a0rails Bill Cassidy\u2019s plans for a quiet presentation were quickly foiled by hundreds of angry constituents. METAIRIE, LOUISIANA\u200a\u2014\u200a\u201cIt was fun,\u201d Republican Senator Bill Cassidy told reporters as he emerged from a town hall in which hundreds of angry constituents heckled and booed him for the better part of an hour. Cassidy had intended to present a PowerPoint on his proposed legislation to replace the Affordable Care Act (ACA) and respond to written questions selected from index cards. That didn\u2019t happen. Instead, the senator was greeted with shouts of \u201cshame\u201d and exited an hour later to chants of \u201cdo your job.\u201d Protesters shouted the senator down when he attempted to refer to his PowerPoint slides. \u201cWe\u2019ve already read it, we want to ask questions!\u201d audience members yelled. Dozens of people stood up and turned their backs to him until he agreed to take questions from the audience. Cassidy later told reporters this was the first time he had seen more than a hundred people at a town hall. The first-term senator, like many of his colleagues in Congress, is facing protests over his support of President Donald Trump\u2019s cabinet nominees and his party\u2019s agenda\u200a\u2014\u200ain particular their plan to roll back health care reform, potentially leaving millions of Americans suddenly uninsured. Republicans\u2019 town halls all over the country have erupted in anger. Some lawmakers are avoiding their constituents entirely. One Congressman even sneaked away from his own event when faced with questions about the Affordable Care Act. Hundreds of protesters waited for hours outside the East Jefferson Parish Library, but only 200 could get in. CREDIT: Aviva\u00a0Shen Cassidy came close to ducking the same level of attention. The meeting was scheduled on a weekday afternoon, when most people are at work or picking up their children from school. It also coincided with the beginning of a major Mardi Gras parade in nearby New Orleans, which drew thousands of onlookers and bogged down traffic for miles. Kenny Francis, a pre-kindergarten teacher at Schaumburg Elementary in New Orleans, didn\u2019t think this planning was an accident. He had been fruitlessly calling Cassidy\u2019s office every day for weeks demanding he oppose the nomination of Education Secretary Betsy DeVos. Then his friend texted him a picture of a mailer advertising Cassidy\u2019s town hall. \u201cIt took me about a week and a half to get anyone in any of Cassidy\u2019s offices to confirm it was actually happening,\u201d he told ThinkProgress. Once he did, he created a Facebook event for the town hall that quickly took off. By Tuesday, thousands of people had said they would attend. Francis\u2019 primary goal was to hold Cassidy accountable for voting to confirm DeVos, but as a teacher, he\u2019s worried about other repercussions the Republican agenda will have on his students. \u201cI know I have students whose families are not legal,\u201d he said. \u201cI know I have parents who are very concerned about what\u2019s going to happen to them and their kids.\u201d Francis\u2019 school was also devastated by the tornadoes that unexpectedly swept through the region earlier this month. \u201cA lot of students lost their homes, a lot of parents lost their jobs, their transportation. There\u2019s a lot of hardship happening right now,\u201d he said. Cassidy, who denies the human role in climate change, has been touring tornado damage around southern Louisiana as he holds town halls. Francis said he found Cassidy\u2019s professed concern about tornado victims \u201coffensive.\u201d \u201cHe had the nerve to talk about how he wants to help with the tornado recovery,\u201d Francis said. \u201cIt is offensive to me to hear him talk about how he wants to help those families when you want to take away their health care that literally allows them to be able to make sure their kids stay healthy.\u201d CREDIT: Aviva\u00a0Shen \u201cThe majority of our students qualify for free or reduced lunch. The majority of those families also have coverage for their children through Medicaid,\u201d he said. \u201cSo what is going to happen to the literally thousands of kids that have coverage through Medicaid when they repeal the ACA? We\u2019re just going to leave them without health care?\u201d Throughout the town hall, Cassidy repeatedly attempted to pitch his ACA replacement, which would allow states to maintain the ACA if they wanted it, adopt a watered down version, or opt out entirely, creating a patchwork of health care access varying by geography. It would also likely make insurance premiums rise, as the bill would maintain some of the ACA\u2019s popular consumer protections while removing the individual mandate and tax credits that make them affordable. It also isn\u2019t clear if Republican support will coalesce around his bill\u200a\u2014\u200aor if they will wait to repeal the ACA until they are ready to implement a replacement. \u201cWill you vote to repeal Obamacare with or without this in place?\u201d one attendee, Sean Marx, demanded to know at one point. A chorus of people chanted \u201cYes or no?\u201d as Cassidy stayed silent and waited for the man to be escorted from the room by sheriff\u2019s deputies. As he was led out of the room, Marx yelled, \u201c2020\u200a\u2014\u200ayou\u2019re done!\u201d Aviva Shen, a former ThinkProgress editor, is now a freelance writer in New Orleans focused on criminal justice. ", "child": "1069_1\t1069_2\t1069_3\t1069_4\t1069_5\t1069_6\t1069_7\t1069_8\t1069_9\t1069_10\t1069_111069_1\t1069_2\t1069_3\t1069_4\t1069_5\t1069_6\t1069_7\t1069_8\t1069_9\t1069_10\t1069_11"}