{"name": "1082", "parent": "", "title": "Trump budget boss: If you want insurance to cover maternity care, lobby your state legislature", "sentences": [{"26dc": "Trump budget boss: If you want insurance to cover maternity care, lobby your state legislature"}, {"e37a": "Trumpcare: Giving you the freedom to purchase health insurance that covers\u00a0nothing."}, {"7cc3": "CREDIT: CBS screengrab"}, {"4983": "On Thursday, President Trump and the House Freedom Caucus tentatively worked out a deal: Trump would agree to remove mandatory coverage of \u201cessential services\u201d from his health care bill in order to win the far-right caucus\u2019 support for it."}, {"7c7e": "Essential services include maternity and newborn care, pediatric care, emergency services, substance abuse treatment, and prescription drug coverage. Under the Affordable Care Act, every health insurance plan sold in the US must cover them."}, {"9746": "House GOP leaders agree to gut essential health benefits, begin hemorrhaging moderate votesA short-sighted attempt to appease conservatives could easily backfire.thinkprogress.org"}, {"35d9": "But with no women present, the Trump administration and House Republicans decided on a plan that would allow insurers to sell health care policies without maternity care coverage in states that allow it."}, {"55e7": "Vice President Mike Pence tweeted out a photo from the room:"}, {"1b96": "On Friday morning\u200a\u2014\u200ahours ahead of the expected House vote on the bill\u200a\u2014\u200aBudget Director Mick Mulvaney went on CBS This Morning to defend a bill he\u2019s played a key role in crafting. While on the program, he offered some advice to people who require essential benefits but live in states that wouldn\u2019t require them under the law: If you don\u2019t like it, just move."}, {"e2c0": "The New York Times reports that on Thursday, Mulvaney issued an ultimatum on Trump\u2019s behalf to \u201crecalcitrant\u201d House Republicans asking them \u201cto fall in line behind a broad health insurance overhaul\u201d on Friday \u201cor see their opportunity to repeal the Affordable Care Act vanish.\u201d"}, {"d0a8": "On CBS, Mulvaney said that \u201cwe have made the bill much better over the course of the last weeks.\u201d"}, {"6e55": "\u201cThe point of the matter is this\u200a\u2014\u200athey know they don\u2019t like Obamacare, people back home know they don\u2019t like it,\u201d he continued. \u201cIt takes the control of their own health care out of their hands, it takes affordability away from them and they want something better. What\u2019s sitting in the House today is better than that.\u201d"}, {"c6eb": "In response, host Alex Wagner shot back, \u201cMr. Mulvaney, when you talk about something better, does that include the slashing of essential services, included maternity care, emergency services, and prescription drugs?\u201d"}, {"57b9": "Mulvaney responded by arguing that essential services coverage is really a states\u2019 rights issue."}, {"7950": "\u201cStates not only have the ability to require those services, many of them already do,\u201d Mulvaney said. \u201cI talked to some folks from the Northeast and it was like, \u2018Yeah, we don\u2019t really mind that much about essential health benefits because our states already require insurance policies sold in those states to have that.\u2019 What we\u2019re doing is taking away the federal control of these systems.\u201d"}, {"6c5e": "Asked \u201cwhat about a state that doesn\u2019t do that,\u201d Mulvaney advised, \u201cThen you can figure out a way to change the state you live in.\u201d"}, {"a8d8": "While the elimination of essential benefits makes Trumpcare more appealing for some Freedom Caucus members, House Republicans with different priorities argue it has made the bill worse."}, {"d846": "And many medical professionals are appalled. Hal Lawrence, CEO of the American Congress of Obstetricians and Gynecologists, told USA Today that eliminating essential benefits requirements was a \u201chorrible idea.\u201d"}, {"bb82": "\u201cIt\u2019s a horrible idea that takes away women\u2019s access to preventive and maternity care,\u201d he said. \u201cWhat [members of Congress] will do is increase illness, pregnancy complications, cancer and death.\u201d"}], "content": "Trump budget boss: If you want insurance to cover maternity care, lobby your state legislature Trumpcare: Giving you the freedom to purchase health insurance that covers\u00a0nothing. CREDIT: CBS screengrab On Thursday, President Trump and the House Freedom Caucus tentatively worked out a deal: Trump would agree to remove mandatory coverage of \u201cessential services\u201d from his health care bill in order to win the far-right caucus\u2019 support for it. Essential services include maternity and newborn care, pediatric care, emergency services, substance abuse treatment, and prescription drug coverage. Under the Affordable Care Act, every health insurance plan sold in the US must cover them. House GOP leaders agree to gut essential health benefits, begin hemorrhaging moderate votesA short-sighted attempt to appease conservatives could easily backfire.thinkprogress.org But with no women present, the Trump administration and House Republicans decided on a plan that would allow insurers to sell health care policies without maternity care coverage in states that allow it. Vice President Mike Pence tweeted out a photo from the room: On Friday morning\u200a\u2014\u200ahours ahead of the expected House vote on the bill\u200a\u2014\u200aBudget Director Mick Mulvaney went on CBS This Morning to defend a bill he\u2019s played a key role in crafting. While on the program, he offered some advice to people who require essential benefits but live in states that wouldn\u2019t require them under the law: If you don\u2019t like it, just move. The New York Times reports that on Thursday, Mulvaney issued an ultimatum on Trump\u2019s behalf to \u201crecalcitrant\u201d House Republicans asking them \u201cto fall in line behind a broad health insurance overhaul\u201d on Friday \u201cor see their opportunity to repeal the Affordable Care Act vanish.\u201d On CBS, Mulvaney said that \u201cwe have made the bill much better over the course of the last weeks.\u201d \u201cThe point of the matter is this\u200a\u2014\u200athey know they don\u2019t like Obamacare, people back home know they don\u2019t like it,\u201d he continued. \u201cIt takes the control of their own health care out of their hands, it takes affordability away from them and they want something better. What\u2019s sitting in the House today is better than that.\u201d In response, host Alex Wagner shot back, \u201cMr. Mulvaney, when you talk about something better, does that include the slashing of essential services, included maternity care, emergency services, and prescription drugs?\u201d Mulvaney responded by arguing that essential services coverage is really a states\u2019 rights issue. \u201cStates not only have the ability to require those services, many of them already do,\u201d Mulvaney said. \u201cI talked to some folks from the Northeast and it was like, \u2018Yeah, we don\u2019t really mind that much about essential health benefits because our states already require insurance policies sold in those states to have that.\u2019 What we\u2019re doing is taking away the federal control of these systems.\u201d Asked \u201cwhat about a state that doesn\u2019t do that,\u201d Mulvaney advised, \u201cThen you can figure out a way to change the state you live in.\u201d While the elimination of essential benefits makes Trumpcare more appealing for some Freedom Caucus members, House Republicans with different priorities argue it has made the bill worse. And many medical professionals are appalled. Hal Lawrence, CEO of the American Congress of Obstetricians and Gynecologists, told USA Today that eliminating essential benefits requirements was a \u201chorrible idea.\u201d \u201cIt\u2019s a horrible idea that takes away women\u2019s access to preventive and maternity care,\u201d he said. \u201cWhat [members of Congress] will do is increase illness, pregnancy complications, cancer and death.\u201d ", "child": "1082_1\t1082_2\t1082_3\t1082_4\t1082_5\t1082_6\t1082_7\t1082_8\t1082_9\t1082_10\t1082_11\t1082_12"}