{"name": "1083", "parent": "", "title": "White House says maternity care won\u2019t be more expensive for women \u2014if they\u2019re on a family\u00a0plan", "sentences": [{"d8b0": "White House says maternity care won\u2019t be more expensive for women \u2014if they\u2019re on a family\u00a0plan"}, {"b121": "A story of male priorities on women\u2019s health care, in two\u00a0acts."}, {"31c2": "White House press secretary Sean Spicer speaks to the media during the daily briefing in the Brady Press Briefing Room of the White House in Washington, Wednesday, March 22, 2017. CREDIT: AP Photo/Pablo Martinez Monsivais"}, {"daee": "White House Press Secretary Sean Spicer told reporters on Thursday that women wouldn\u2019t have to worry about paying more for maternity care under Trumpcare, as long as they\u2019re on a family plan."}, {"ffbb": "The exchange came as a reporter pressed Spicer on reports that the GOP is considering repealing Obamacare\u2019s 10 essential health benefits mandate\u200a\u2014\u200aa requirement that all insurance plans cover services such as hospitalizations, prescriptions, preventative care, and pregnancy, maternity, and newborn care."}, {"902b": "Spicer called the furor over these benefits a \u201cphilosophical discussion,\u201d and argued that repealing them was a way to bring premiums down."}, {"6d32": "\u201cIt\u2019s about a series of benefits being mandated for everybody, so what has happened is the cost of health care for every individual has gone up and the choice has gone down,\u201d he said."}, {"3ebc": "Premiums would go down, however, because people would be able to buy plans so skimpy as to be meaningless\u200a\u2014\u200aand meanwhile, the cost for people buying plans that actually cover expenses like maternity care would go up."}, {"82c9": "\u201cIs the president concerned that without having those essential benefits you will have a situation where women are de facto paying higher insurance? Obviously they would be paying for maternity leave,\u201d the reporter asked as a follow up."}, {"8530": "\u201cNo, you could have a family plan,\u201d Spicer replied."}, {"9ece": "At best, Spicer\u2019s answer is extraordinarily dismissive of single mothers\u200a\u2014\u200athe reality is that not every woman who needs maternity care is going to be on a family plan, which are designed for couples and those with children or other dependents. At worst, it\u2019s a tacit endorsement of only married women having access to affordable maternity care."}, {"c536": "Even if they got their insurance through a family plan, that family plan would still cost more if they wanted it to include maternity care. And, not all pregnancies are planned\u200a\u2014\u200awhich is why Obamacare treats it as an unexpected medical expense like any other."}, {"1653": "In reality, health care experts project women paying more for health insurance just because they are women is exactly what would happen if the essential benefits provision is repealed."}, {"d28b": "That\u2019s because it\u2019s integral to how insurance works. If maternity care becomes an add-on option, only people who expect to use it are likely to purchase it. That makes the pool of people buying it both small and expensive for insurers\u200a\u2014\u200aso the price will skyrocket. At the same time, fewer insurers are likely to offer it. Essentially, segmenting out maternity care starts its own death spiral, with women footing the bill."}, {"a36f": "It\u2019s more than a hypothetical situation. Prior to Obamacare, 62 percent of those on the individual market didn\u2019t have maternity coverage, according to a study by the Center on Budget and Policy Priorities. Only nine states mandated that plans covered maternity care, and in states that didn\u2019t, only six percent of plans offered it, according to a study by the National Women\u2019s Law Center."}, {"67d5": "If women wanted to purchase maternity coverage as a rider, the cost was typically prohibitive. In Kansas, for example, if a woman wanted maternity insurance she\u2019d have to shell out an extra $1,600 a month\u200a\u2014\u200aon top of her overall coverage plan. Many of these policies had maternity-specific deductibles going up to $10,000."}, {"2541": "This had an effect on women on employee insurance plans too\u200a\u2014\u200awho typically still paid $10,000\u200a\u2014\u200a$20,000 for just childbirth, with the cost depending on state and which type of birth, according to a study by Truven. Prior to Obamacare, women also were commonly charged more than men for exactly the same level of coverage. Overall, the NWLC estimates these disparities cost women on average $1 billion per year."}, {"54ec": "By forcing everyone to purchase coverage for things like maternal care and neonatal care, Obamacare lowered the cost for those who need it."}, {"b6d4": "The fact that men have to purchase health insurance for women\u2019s services, however, has been one of Republicans\u2019 favorite complaints with the law."}, {"0710": "Also on Thursday, Sen. Pat Roberts (R-KS) deadpanned to Talking Points Memo that he wouldn\u2019t want to lose his mammogram coverage if the essential health benefits were repealed (he later apologized via Twitter for the quip)."}, {"43b1": "And during a hearing on the bill on March 10th, Rep. John Shimkus (R-IL) objected to Obamacare requiring men to purchase prenatal care."}, {"b176": "\u201cWhat about men having to purchase prenatal care?\u201d Shimkus told a colleague who asked what the issue with mandates was. \u201cIs that not correct? And should they?\u201d"}, {"91d0": "GOP congressman says we need to repeal Obamacare so men don\u2019t have to pay for prenatal careIt used to be legal for women to be charged more for the same health insurance as men. Obamacare changed that.thinkprogress.org"}, {"d026": "Originally, Republicans were going to leave the essential health benefits mandate\u200a\u2014\u200awhich requires coverage for maternity and childcare and birth control\u200a\u2014\u200aintact, in part because they couldn\u2019t make policy changes to the bill without needing Democratic votes in the Senate."}, {"a8c3": "These mandates, however, are deeply unpopular with the House Freedom Caucus, who threatened to sink the bill. Reportedly, the Caucus took their concerns to President Trump, who agreed to negotiate, spawning a flurry of overnight rewrites as leadership reportedly sought to bargain the essential health benefits provision for votes."}, {"9d30": "The House Freedom Caucus doesn\u2019t publish a list of its members. But according to current reports, deductions from its own Twitter account, lists compiled by PEW and others, and photographs of their meeting with Trump on Thursday, the group taking aim at women\u2019s health benefits is currently entirely composed of men."}], "content": "White House says maternity care won\u2019t be more expensive for women \u2014if they\u2019re on a family\u00a0plan A story of male priorities on women\u2019s health care, in two\u00a0acts. White House press secretary Sean Spicer speaks to the media during the daily briefing in the Brady Press Briefing Room of the White House in Washington, Wednesday, March 22, 2017. CREDIT: AP Photo/Pablo Martinez Monsivais White House Press Secretary Sean Spicer told reporters on Thursday that women wouldn\u2019t have to worry about paying more for maternity care under Trumpcare, as long as they\u2019re on a family plan. The exchange came as a reporter pressed Spicer on reports that the GOP is considering repealing Obamacare\u2019s 10 essential health benefits mandate\u200a\u2014\u200aa requirement that all insurance plans cover services such as hospitalizations, prescriptions, preventative care, and pregnancy, maternity, and newborn care. Spicer called the furor over these benefits a \u201cphilosophical discussion,\u201d and argued that repealing them was a way to bring premiums down. \u201cIt\u2019s about a series of benefits being mandated for everybody, so what has happened is the cost of health care for every individual has gone up and the choice has gone down,\u201d he said. Premiums would go down, however, because people would be able to buy plans so skimpy as to be meaningless\u200a\u2014\u200aand meanwhile, the cost for people buying plans that actually cover expenses like maternity care would go up. \u201cIs the president concerned that without having those essential benefits you will have a situation where women are de facto paying higher insurance? Obviously they would be paying for maternity leave,\u201d the reporter asked as a follow up. \u201cNo, you could have a family plan,\u201d Spicer replied. At best, Spicer\u2019s answer is extraordinarily dismissive of single mothers\u200a\u2014\u200athe reality is that not every woman who needs maternity care is going to be on a family plan, which are designed for couples and those with children or other dependents. At worst, it\u2019s a tacit endorsement of only married women having access to affordable maternity care. Even if they got their insurance through a family plan, that family plan would still cost more if they wanted it to include maternity care. And, not all pregnancies are planned\u200a\u2014\u200awhich is why Obamacare treats it as an unexpected medical expense like any other. In reality, health care experts project women paying more for health insurance just because they are women is exactly what would happen if the essential benefits provision is repealed. That\u2019s because it\u2019s integral to how insurance works. If maternity care becomes an add-on option, only people who expect to use it are likely to purchase it. That makes the pool of people buying it both small and expensive for insurers\u200a\u2014\u200aso the price will skyrocket. At the same time, fewer insurers are likely to offer it. Essentially, segmenting out maternity care starts its own death spiral, with women footing the bill. It\u2019s more than a hypothetical situation. Prior to Obamacare, 62 percent of those on the individual market didn\u2019t have maternity coverage, according to a study by the Center on Budget and Policy Priorities. Only nine states mandated that plans covered maternity care, and in states that didn\u2019t, only six percent of plans offered it, according to a study by the National Women\u2019s Law Center. If women wanted to purchase maternity coverage as a rider, the cost was typically prohibitive. In Kansas, for example, if a woman wanted maternity insurance she\u2019d have to shell out an extra $1,600 a month\u200a\u2014\u200aon top of her overall coverage plan. Many of these policies had maternity-specific deductibles going up to $10,000. This had an effect on women on employee insurance plans too\u200a\u2014\u200awho typically still paid $10,000\u200a\u2014\u200a$20,000 for just childbirth, with the cost depending on state and which type of birth, according to a study by Truven. Prior to Obamacare, women also were commonly charged more than men for exactly the same level of coverage. Overall, the NWLC estimates these disparities cost women on average $1 billion per year. By forcing everyone to purchase coverage for things like maternal care and neonatal care, Obamacare lowered the cost for those who need it. The fact that men have to purchase health insurance for women\u2019s services, however, has been one of Republicans\u2019 favorite complaints with the law. Also on Thursday, Sen. Pat Roberts (R-KS) deadpanned to Talking Points Memo that he wouldn\u2019t want to lose his mammogram coverage if the essential health benefits were repealed (he later apologized via Twitter for the quip). And during a hearing on the bill on March 10th, Rep. John Shimkus (R-IL) objected to Obamacare requiring men to purchase prenatal care. \u201cWhat about men having to purchase prenatal care?\u201d Shimkus told a colleague who asked what the issue with mandates was. \u201cIs that not correct? And should they?\u201d GOP congressman says we need to repeal Obamacare so men don\u2019t have to pay for prenatal careIt used to be legal for women to be charged more for the same health insurance as men. Obamacare changed that.thinkprogress.org Originally, Republicans were going to leave the essential health benefits mandate\u200a\u2014\u200awhich requires coverage for maternity and childcare and birth control\u200a\u2014\u200aintact, in part because they couldn\u2019t make policy changes to the bill without needing Democratic votes in the Senate. These mandates, however, are deeply unpopular with the House Freedom Caucus, who threatened to sink the bill. Reportedly, the Caucus took their concerns to President Trump, who agreed to negotiate, spawning a flurry of overnight rewrites as leadership reportedly sought to bargain the essential health benefits provision for votes. The House Freedom Caucus doesn\u2019t publish a list of its members. But according to current reports, deductions from its own Twitter account, lists compiled by PEW and others, and photographs of their meeting with Trump on Thursday, the group taking aim at women\u2019s health benefits is currently entirely composed of men. ", "child": "1083_1\t1083_2\t1083_3\t1083_4\t1083_5\t1083_6\t1083_7\t1083_8\t1083_9\t1083_10\t1083_11\t1083_12\t1083_13\t1083_14\t1083_15\t1083_16\t1083_17\t1083_18\t1083_19\t1083_20\t1083_21"}