{"name": "1087", "parent": "", "title": "Some GOP lawmakers back away from Trumpcare after learning millions will lose insurance", "sentences": [{"f5f3": "Some GOP lawmakers back away from Trumpcare after learning millions will lose insurance"}, {"4321": "Not all Republicans are eager to back a plan that could cost 24 million people their health insurance."}, {"dda7": "Keith Hall is the GOP\u2019s handpicked Congressional Budget Office director. CREDIT: AP Photo/J. Scott Applewhite"}, {"0baa": "On Monday, the Congressional Budget Office released its analysis of House Republicans\u2019 plan to replace the Affordable Care Act with a series of smaller tax incentives for consumers and a massive tax cut for health insurance companies with overpaid CEOs. And its assessment that the legislation would result in 24 million more uninsured Americans over ten years has some congressional Republicans worried."}, {"907b": "Trumpcare could cost 24 million people their insurance, government analysis findsThe Congressional Budget Office just released its much anticipated report. Republicans were right to be scared.thinkprogress.org"}, {"1f78": "To push back on the CBO\u2019s findings, Trump administration and Republican leaders have alternately attempted to cherry-pick favorable pieces of the scoring and to undermine the credibility of the non-partisan budget office (which is run by an economist who was handpicked by the congressional GOP leadership in 2015)."}, {"f7ae": "But a growing number of Republican legislators are indicating that the CBO scoring has given them pause or led them to oppose Trumpcare outright."}, {"fa98": "Sen. Roy Blunt (R-MO): Blunt cheered the money-saving numbers in the CBO score, but conceded reservations about the report as a whole. \u201cIn terms of coverage, we need to get a better sense of what Health and Human Services can do,\u201d he observed, adding that the 24 million number was \u201ctroublesome\u201d to efforts to pass the bill."}, {"c43c": "Sen. Bill Cassidy (R-LA): A physician himself, Cassidy told Politico, \u201cCan\u2019t sugarcoat it. Doesn\u2019t look good,\u201d adding, \u201cThe CBO score was, shall we say, an eye-popper.\u201d He told TPM the score was \u201cawful.\u201d \u201cPresident Trump says he wants as many people covered as under Obamacare, and in that Washington Post article he said health care should be affordable. So if there\u2019s truly 24 million people [losing coverage], of course it\u2019s a concern.\u201d"}, {"44d6": "Sen. Susan Collins (R-ME): Collins said on Monday: \u201cThe CBO estimate that millions of Americans could lose their health insurance coverage if the House bill were to become law is cause for alarm. It should prompt the House to slow down and reconsider certain provisions of the bill.\u201d"}, {"822b": "Sen. Tom Cotton (R-AR): In a radio interview on Tuesday, Cotton opined that while the CBO \u201cis not Moses,\u201d he believes the House should have waited for the scoring before taking up the Trumpcare legislation. \u201cIt has a lot of useful information for us to digest,\u201d he said. \u201cI think it\u2019s incumbent upon us to evaluate their evidence and facts [to] help improve the bill.\u201d"}, {"41ba": "Sen. Ted Cruz (R-TX):According to an ABC News reporter, Cruz said Tuesday that the scoring showed that \u201cunder the House bill, premiums would continue to rise next year and the year thereafter. That is unacceptable.\u201d"}, {"cfde": "Sen. Steve Daines (R-MT): In a statement in response to the CBO report, Daines said, \u201cWe need to do better\u2026 I want to see costs and premiums go down to make health care more affordable for Montana families.\u201d"}, {"dc0a": "Sen. Cory Gardner (R-CO): According to Politico, Gardner\u200a\u2014\u200awho has expressed concerns about the Medicaid rollback provisions in Trumpcare\u200a\u2014\u200asaid, \u201cWe\u2019ve got work to do here\u201d in response to the CBO score."}, {"eb73": "Sen. Lindsey Graham (R-SC): Graham told reporters on Monday, \u201cAt the end of the day we should pause and try to improve the product in the light of the CBO analysis rather than just rejecting it.\u201d He defended the nonpartisan effort, observing, \u201cWe like the CBO when they agree with us. When they don\u2019t, they\u2019re a bunch of losers\u2026 If half of what they\u2019re saying is true, then I think we should slow down and see if we address it.\u201d"}, {"a667": "Sen. Orrin Hatch (R-UT): In response to questions about the increase in uninsured estimated by the CBO, the Senate Finance Chairman said, \u201cNaturally, I\u2019m concerned.\u201d"}, {"d8f2": "Sen. John McCain (R-AZ): TPM reported on Monday that McCain said that while the CBO was \u201cwildly wrong on the initial estimates of Obamacare,\u201d he also conceded, \u201cI\u2019m very worried about what the House bill would do to Arizona.\u201d"}, {"c320": "Sen. David Perdue (R-GA): According to the Washington Post, after the CBO report, Perdue told reporters, \u201cI\u2019m not going to tell the House what to do, but it\u2019s important that we slow this down and get this right.\u201d"}, {"32de": "Rep. Mark Amodei (R-NV): In response to the CBO scoring, Amodei told the Associated Press that he was disappointed in the GOP leadership for not getting more testimony before writing the bill and that if he had to vote today, he would likely vote no. He observed, \u201cQuite frankly it looks right now that Nancy Pelosi was much more efficient.\u201d"}, {"50e7": "Rep. Ron DeSantis (R-FL): DeSantis told Fox Business on Tuesday that the \u201cdamaging part of that CBO report was they predicted\u200a\u2014\u200aand I don\u2019t know if this is true but I think there\u2019s an argument that it is\u200a\u2014\u200a15 to 20 percent premium increases over the next several years over and above the Obamacare increases. Well, if that happens, then I think it\u2019s gonna be even more difficult for people.\u201d"}, {"c237": "Rep. Mark Walker (R-NC): The chairman of the 170-plus member Republican Study Committee put out a statement noting that the CBO score \u201cdoes little to alleviate our conservative concerns for this Obamacare replacement bill.\u201d"}, {"7e53": "Rep. Rob Wittman (R-VA): Wittman announced his opposition to the Trumpcare legislation on Monday. \u201cAfter reviewing this legislation and receiving the Congressional Budget Office score today, it is clear that this bill is not consistent with the repeal and replace principles for which I stand,\u201d he explained, adding that as he does not think the proposal will do \u201cwhat is necessary for the short and long-term best interests of Virginians.\u201d"}, {"a1fa": "This post will be updated as more members make statements."}], "content": "Some GOP lawmakers back away from Trumpcare after learning millions will lose insurance Not all Republicans are eager to back a plan that could cost 24 million people their health insurance. Keith Hall is the GOP\u2019s handpicked Congressional Budget Office director. CREDIT: AP Photo/J. Scott Applewhite On Monday, the Congressional Budget Office released its analysis of House Republicans\u2019 plan to replace the Affordable Care Act with a series of smaller tax incentives for consumers and a massive tax cut for health insurance companies with overpaid CEOs. And its assessment that the legislation would result in 24 million more uninsured Americans over ten years has some congressional Republicans worried. Trumpcare could cost 24 million people their insurance, government analysis findsThe Congressional Budget Office just released its much anticipated report. Republicans were right to be scared.thinkprogress.org To push back on the CBO\u2019s findings, Trump administration and Republican leaders have alternately attempted to cherry-pick favorable pieces of the scoring and to undermine the credibility of the non-partisan budget office (which is run by an economist who was handpicked by the congressional GOP leadership in 2015). But a growing number of Republican legislators are indicating that the CBO scoring has given them pause or led them to oppose Trumpcare outright. Sen. Roy Blunt (R-MO): Blunt cheered the money-saving numbers in the CBO score, but conceded reservations about the report as a whole. \u201cIn terms of coverage, we need to get a better sense of what Health and Human Services can do,\u201d he observed, adding that the 24 million number was \u201ctroublesome\u201d to efforts to pass the bill. Sen. Bill Cassidy (R-LA): A physician himself, Cassidy told Politico, \u201cCan\u2019t sugarcoat it. Doesn\u2019t look good,\u201d adding, \u201cThe CBO score was, shall we say, an eye-popper.\u201d He told TPM the score was \u201cawful.\u201d \u201cPresident Trump says he wants as many people covered as under Obamacare, and in that Washington Post article he said health care should be affordable. So if there\u2019s truly 24 million people [losing coverage], of course it\u2019s a concern.\u201d Sen. Susan Collins (R-ME): Collins said on Monday: \u201cThe CBO estimate that millions of Americans could lose their health insurance coverage if the House bill were to become law is cause for alarm. It should prompt the House to slow down and reconsider certain provisions of the bill.\u201d Sen. Tom Cotton (R-AR): In a radio interview on Tuesday, Cotton opined that while the CBO \u201cis not Moses,\u201d he believes the House should have waited for the scoring before taking up the Trumpcare legislation. \u201cIt has a lot of useful information for us to digest,\u201d he said. \u201cI think it\u2019s incumbent upon us to evaluate their evidence and facts [to] help improve the bill.\u201d Sen. Ted Cruz (R-TX):According to an ABC News reporter, Cruz said Tuesday that the scoring showed that \u201cunder the House bill, premiums would continue to rise next year and the year thereafter. That is unacceptable.\u201d Sen. Steve Daines (R-MT): In a statement in response to the CBO report, Daines said, \u201cWe need to do better\u2026 I want to see costs and premiums go down to make health care more affordable for Montana families.\u201d Sen. Cory Gardner (R-CO): According to Politico, Gardner\u200a\u2014\u200awho has expressed concerns about the Medicaid rollback provisions in Trumpcare\u200a\u2014\u200asaid, \u201cWe\u2019ve got work to do here\u201d in response to the CBO score. Sen. Lindsey Graham (R-SC): Graham told reporters on Monday, \u201cAt the end of the day we should pause and try to improve the product in the light of the CBO analysis rather than just rejecting it.\u201d He defended the nonpartisan effort, observing, \u201cWe like the CBO when they agree with us. When they don\u2019t, they\u2019re a bunch of losers\u2026 If half of what they\u2019re saying is true, then I think we should slow down and see if we address it.\u201d Sen. Orrin Hatch (R-UT): In response to questions about the increase in uninsured estimated by the CBO, the Senate Finance Chairman said, \u201cNaturally, I\u2019m concerned.\u201d Sen. John McCain (R-AZ): TPM reported on Monday that McCain said that while the CBO was \u201cwildly wrong on the initial estimates of Obamacare,\u201d he also conceded, \u201cI\u2019m very worried about what the House bill would do to Arizona.\u201d Sen. David Perdue (R-GA): According to the Washington Post, after the CBO report, Perdue told reporters, \u201cI\u2019m not going to tell the House what to do, but it\u2019s important that we slow this down and get this right.\u201d Rep. Mark Amodei (R-NV): In response to the CBO scoring, Amodei told the Associated Press that he was disappointed in the GOP leadership for not getting more testimony before writing the bill and that if he had to vote today, he would likely vote no. He observed, \u201cQuite frankly it looks right now that Nancy Pelosi was much more efficient.\u201d Rep. Ron DeSantis (R-FL): DeSantis told Fox Business on Tuesday that the \u201cdamaging part of that CBO report was they predicted\u200a\u2014\u200aand I don\u2019t know if this is true but I think there\u2019s an argument that it is\u200a\u2014\u200a15 to 20 percent premium increases over the next several years over and above the Obamacare increases. Well, if that happens, then I think it\u2019s gonna be even more difficult for people.\u201d Rep. Mark Walker (R-NC): The chairman of the 170-plus member Republican Study Committee put out a statement noting that the CBO score \u201cdoes little to alleviate our conservative concerns for this Obamacare replacement bill.\u201d Rep. Rob Wittman (R-VA): Wittman announced his opposition to the Trumpcare legislation on Monday. \u201cAfter reviewing this legislation and receiving the Congressional Budget Office score today, it is clear that this bill is not consistent with the repeal and replace principles for which I stand,\u201d he explained, adding that as he does not think the proposal will do \u201cwhat is necessary for the short and long-term best interests of Virginians.\u201d This post will be updated as more members make statements. ", "child": "1087_1\t1087_2\t1087_3\t1087_4\t1087_5"}