{"name": "1189", "parent": "", "title": "Going Home", "sentences": [{"9709": "Going Home"}, {"f30d": "by Sarah Goldsmith"}, {"d10a": "Source"}, {"5e69": "The young man lay on his back looking up at the inky sky. Dots of milky white stars glittered here and there and the young man stared at them, trying to remember the names of the constellations his dad had taught him. Sleep threatened to overwhelm him and he felt his eyelids grow heavy. He blinked his eyes furiously, determined to stay awake and watch the sky. But it wasn\u2019t just the stars he was interested in and he didn\u2019t want to miss the spectacle above him."}, {"b506": "Every so often, the night sky would burst into life as a multitude of fireworks exploded, sending streams of glorious colours shooting across the darkness. He\u2019d never seen anything so wondrous before. The colours were like something from a picture book. Vibrant pinks, vivid reds, and luscious purples whizzed across the sky in every direction, dazzling him into stunned silence. Gold and silver droplets rained down with such intensity that he was sure he would feel them on his face. It was incredible."}, {"6757": "The young man had always loved fireworks. He\u2019d been fascinated by how they worked, how the colours were produced and how the different bangs and squeals were made. He loved the rockets best of all, waiting in anticipation as they soared high into the atmosphere before exploding with a shower of blinding colour and glimmering sparks."}, {"1a09": "He lay in the silence, waiting for the next round of fireworks. It was chilly on the ground, but he didn\u2019t feel like moving, not just yet. Surely there\u2019d be more to see. He soon became aware of someone at his side and he turned his head to see who was there. His brow furrowed in confusion as he tried to put a name to the friendly face hovering above his. And then he grinned as he remembered."}, {"d5d8": "\u201cHello, sarge,\u201d he said, confused as to why his voice sounded strange. He tried to clear his throat, but succeeded only in hurting his stomach with the movement."}, {"2a06": "\u201cStay still, lad,\u201d the sergeant said."}, {"c2e2": "\u201cPretty ain\u2019t they?\u201d the young man said."}, {"6d6b": "\u201cWhat\u2019s that, son?\u201d"}, {"b635": "The young man chuckled. \u201cThe fireworks of course! Look at \u2019em. I\u2019ve never seen nothing like it.\u201d"}, {"3762": "The sergeant watched the young man as he gazed at the sky with complete fascination."}, {"a5bc": "\u201cAye, son, they\u2019re beautiful.\u201d"}, {"c544": "The young man smiled as the heavens erupted again. He heard other voices behind him and tried to get up to see who was there, but he felt rooted to the ground. There was something heavy on his lap."}, {"d4b4": "\u201cIs something on my legs, sarge?\u201d"}, {"4ddb": "\u201cJust a blanket, lad. It\u2019s a cold night.\u201d"}, {"cc6c": "The young man nodded and smiled his thanks. He wasn\u2019t used to the sergeant being so kind, but guessed the gorgeous fireworks must have inspired some feeling of warmth in him. He lay still, listening to the voices behind him. He couldn\u2019t quite make out what they said but he liked the sound of their gently whispered words. It reminded him of home and the lazy days he\u2019d spent by the river trying to catch a trout or two for his mum, listening to the wind as it rustled through the bulrushes."}, {"e5ca": "Thinking of home made him remember when his mum and dad had taken him to see the fireworks on bonfire nights. They were such happy times."}, {"901f": "\u201cI love fireworks, don\u2019t you sarge? Never thought we\u2019d get them out here, though. I\u2019ll have to tell my mum in my letter home. She\u2019ll never believe me when I tell her.\u201d"}, {"f5e2": "\u201cThat\u2019s a good idea, lad. Your mother will be pleased.\u201d"}, {"82ba": "\u201cWe used to go to the park every bonfire night. The fireworks were ever so good, but nothing as grand as these. Cor! Look at that one!\u201d he said, his face breaking into a glorious grin as he tried to raise himself up in his elbows."}, {"3731": "The young man suddenly felt very cold and a peculiar spasm of pain made its way through his body."}, {"506b": "\u201cSarge? I feel a bit funny,\u201d he said, turning his pale face to the older man."}, {"ec5d": "\u201cStay still, lad. Just look at the fireworks. Pretty things, aren\u2019t they?\u201d"}, {"b8ab": "The young man\u2019s face relaxed as he turned back to the sky."}, {"ddcd": "\u201cI can\u2019t wait to go home, sarge. Do you think it\u2019ll be much longer? It feels like ages since we\u2019ve been here.\u201d"}, {"6d21": "\u201cNay, lad. It won\u2019t be long now. You\u2019ll soon be home.\u201d"}, {"2dcb": "\u201cGood. Oh, don\u2019t get me wrong, sarge. I\u2019m glad to be doing my bit, but I don\u2019t half miss my mum.\u201d"}, {"54b8": "The sergeant swallowed his tears as he saw the young man\u2019s face contort in pain again. He took the young man\u2019s hand in his and held it very tightly."}, {"013f": "\u201cIt won\u2019t be long now, son.\u201d"}, {"2e75": "The young man\u2019s eyes raked the air around him, squinting in confusion, before settling on a spot just in front of him."}, {"b1be": "\u201cMum? What are you doing here? Have you come to see the fireworks?\u201d the young man said, as his face broke into a beautiful smile."}, {"5540": "The sergeant looked behind him to the men huddled together as they prayed for their fallen comrade."}, {"8ee2": "\u201cLook, mum. Look at the colours,\u201d the young man said, as his eyes closed for the final time."}, {"6dc8": "The sergeant stared up at the sky. The flares and flashes from the guns and artillery bathed the night sky in an eerie red glow."}, {"f763": "Tears fell down the sergeant\u2019s face as he looked down at the young man who still wore a happy smile upon his face. They\u2019d tried to move the young soldier back to their trenches after he\u2019d been hit by the shrapnel from an exploded shell, but the pain was too great. His pals refused to leave him to die alone and so they\u2019d stayed there with him out on No Man\u2019s Land. His war was over now."}, {"d9e7": "\u201cThat\u2019s right, son. You\u2019re home now.\u201d"}], "content": "Going Home by Sarah Goldsmith Source The young man lay on his back looking up at the inky sky. Dots of milky white stars glittered here and there and the young man stared at them, trying to remember the names of the constellations his dad had taught him. Sleep threatened to overwhelm him and he felt his eyelids grow heavy. He blinked his eyes furiously, determined to stay awake and watch the sky. But it wasn\u2019t just the stars he was interested in and he didn\u2019t want to miss the spectacle above him. Every so often, the night sky would burst into life as a multitude of fireworks exploded, sending streams of glorious colours shooting across the darkness. He\u2019d never seen anything so wondrous before. The colours were like something from a picture book. Vibrant pinks, vivid reds, and luscious purples whizzed across the sky in every direction, dazzling him into stunned silence. Gold and silver droplets rained down with such intensity that he was sure he would feel them on his face. It was incredible. The young man had always loved fireworks. He\u2019d been fascinated by how they worked, how the colours were produced and how the different bangs and squeals were made. He loved the rockets best of all, waiting in anticipation as they soared high into the atmosphere before exploding with a shower of blinding colour and glimmering sparks. He lay in the silence, waiting for the next round of fireworks. It was chilly on the ground, but he didn\u2019t feel like moving, not just yet. Surely there\u2019d be more to see. He soon became aware of someone at his side and he turned his head to see who was there. His brow furrowed in confusion as he tried to put a name to the friendly face hovering above his. And then he grinned as he remembered. \u201cHello, sarge,\u201d he said, confused as to why his voice sounded strange. He tried to clear his throat, but succeeded only in hurting his stomach with the movement. \u201cStay still, lad,\u201d the sergeant said. \u201cPretty ain\u2019t they?\u201d the young man said. \u201cWhat\u2019s that, son?\u201d The young man chuckled. \u201cThe fireworks of course! Look at \u2019em. I\u2019ve never seen nothing like it.\u201d The sergeant watched the young man as he gazed at the sky with complete fascination. \u201cAye, son, they\u2019re beautiful.\u201d The young man smiled as the heavens erupted again. He heard other voices behind him and tried to get up to see who was there, but he felt rooted to the ground. There was something heavy on his lap. \u201cIs something on my legs, sarge?\u201d \u201cJust a blanket, lad. It\u2019s a cold night.\u201d The young man nodded and smiled his thanks. He wasn\u2019t used to the sergeant being so kind, but guessed the gorgeous fireworks must have inspired some feeling of warmth in him. He lay still, listening to the voices behind him. He couldn\u2019t quite make out what they said but he liked the sound of their gently whispered words. It reminded him of home and the lazy days he\u2019d spent by the river trying to catch a trout or two for his mum, listening to the wind as it rustled through the bulrushes. Thinking of home made him remember when his mum and dad had taken him to see the fireworks on bonfire nights. They were such happy times. \u201cI love fireworks, don\u2019t you sarge? Never thought we\u2019d get them out here, though. I\u2019ll have to tell my mum in my letter home. She\u2019ll never believe me when I tell her.\u201d \u201cThat\u2019s a good idea, lad. Your mother will be pleased.\u201d \u201cWe used to go to the park every bonfire night. The fireworks were ever so good, but nothing as grand as these. Cor! Look at that one!\u201d he said, his face breaking into a glorious grin as he tried to raise himself up in his elbows. The young man suddenly felt very cold and a peculiar spasm of pain made its way through his body. \u201cSarge? I feel a bit funny,\u201d he said, turning his pale face to the older man. \u201cStay still, lad. Just look at the fireworks. Pretty things, aren\u2019t they?\u201d The young man\u2019s face relaxed as he turned back to the sky. \u201cI can\u2019t wait to go home, sarge. Do you think it\u2019ll be much longer? It feels like ages since we\u2019ve been here.\u201d \u201cNay, lad. It won\u2019t be long now. You\u2019ll soon be home.\u201d \u201cGood. Oh, don\u2019t get me wrong, sarge. I\u2019m glad to be doing my bit, but I don\u2019t half miss my mum.\u201d The sergeant swallowed his tears as he saw the young man\u2019s face contort in pain again. He took the young man\u2019s hand in his and held it very tightly. \u201cIt won\u2019t be long now, son.\u201d The young man\u2019s eyes raked the air around him, squinting in confusion, before settling on a spot just in front of him. \u201cMum? What are you doing here? Have you come to see the fireworks?\u201d the young man said, as his face broke into a beautiful smile. The sergeant looked behind him to the men huddled together as they prayed for their fallen comrade. \u201cLook, mum. Look at the colours,\u201d the young man said, as his eyes closed for the final time. The sergeant stared up at the sky. The flares and flashes from the guns and artillery bathed the night sky in an eerie red glow. Tears fell down the sergeant\u2019s face as he looked down at the young man who still wore a happy smile upon his face. They\u2019d tried to move the young soldier back to their trenches after he\u2019d been hit by the shrapnel from an exploded shell, but the pain was too great. His pals refused to leave him to die alone and so they\u2019d stayed there with him out on No Man\u2019s Land. His war was over now. \u201cThat\u2019s right, son. You\u2019re home now.\u201d ", "child": "1189_1\t1189_2\t1189_3\t1189_4\t1189_5\t1189_6"}