{"name": "1301", "parent": "", "title": "Di\u00e1rio do Uncharted 4\u200a\u2014\u200aparte 4: quando seu marido volta para\u00a0casa?", "sentences": [{"13cb": "Di\u00e1rio do Uncharted 4\u200a\u2014\u200aparte 4: quando seu marido volta para\u00a0casa?"}, {"790c": "Tal qual o amante que n\u00e3o quer que a noite acabe e emulando a \u00fanica frase que Sam Drake sabe em portugu\u00eas, l\u00e1 fomos n\u00f3s sabendo que o fim de Uncharted 4 estava pr\u00f3ximo. E, como sempre, ele me enganou, empurrando o final para depois de mais algumas horinhas de jogo."}, {"188f": "Mas antes: 1) texto cheio de spoilers e 2) leia as outras partes (tamb\u00e9m com spoilers):"}, {"7eec": "Vamos l\u00e1."}, {"fa85": "Nessas horinhas a mais, teve um monte de tiroteio, um monte de escalada, uma umidade absurda em New Devon, cen\u00e1rios muito lindos que ningu\u00e9m vai ficar sabendo que existem porque a Elena n\u00e3o levou a c\u00e2mera dela\u200a\u2014\u200aessa foi uma quest\u00e3o que me pegou sem querer em v\u00e1rios momentos, fiquei pensando \u201cimagina se fosse no GTA como daria para fazer uma selfie maneira aqui\u201d, virei um monstro."}, {"a0ec": "Falando na Elena, ainda que eu ache ela meio chata, quando ela vira a parceira da vez do Nathan eu me sinto at\u00e9 mal em achar isso. A qu\u00edmica dos dois \u00e9 muito legal, ela \u00e9 bem badass e o pr\u00f3prio Nathan fala isso em alguns momentos (\u201cvai, deixa uma mulher dessa brava\u201d ou algo assim). Tem dois momentos espec\u00edficos que s\u00e3o bem marcantes, um quando eles est\u00e3o num banquete de piratas mortos, bem rom\u00e2ntico, e outro quando ela finge que morreu s\u00f3 para dar um susto nele, mas a gente tamb\u00e9m assusta e talvez eu tenha xingado o game em voz alta nessa hora mas depois tamb\u00e9m gargalhei em voz alta, ent\u00e3o a amizade continua a mesma."}, {"395a": "Tamb\u00e9m queria fazer uma men\u00e7\u00e3o honrosa para o retorno do Sully, sempre com a RPG na hora certa, e para o quanto o Sam \u00e9 um irm\u00e3o mais velho chato\u200a\u2014\u200ao personagem \u00e9 legal mas meu deus se meu irm\u00e3o fosse t\u00e3o manipulador e implicante assim eu acho que, bom, eu tamb\u00e9m iria atr\u00e1s dele porque \u00e9 isso que fam\u00edlia faz. Mas que d\u00e1 raiva, d\u00e1."}, {"7264": "O ponto alto \u00e9, sem d\u00favida, o ep\u00edlogo do final. Voc\u00ea joga Crash Bandicoot de novo e, no meu caso, n\u00e3o bate de novo o recorde da Elena. Mas, quando acabam as vidas, quem est\u00e1 jogando \u00e9 uma menina loirinha, a cara dela: \u00e9 a filha do Nathan e da Elena! E eles t\u00eam uma casa muit\u00edssimo maneira de frente para o mar! E um cachorro! E viajam o mundo! Realmente, Nathan Drake conseguiu ter tudo no final."}, {"2da1": "E o t\u00edtulo, A Thief\u2019s End, que me fez pensar em alguns momentos se significaria algo al\u00e9m do fim das aventuras dele\u200a\u2014\u200atalvez ele morreria? Talvez o Sam morreria? Talvez algu\u00e9m morreria?\u200a\u2014\u200asignifica apenas isso. \u00c9 bem improv\u00e1vel que tenhamos mais um Uncharted em um futuro t\u00e3o pr\u00f3ximo, mais ainda se quiser continuar a mesma hist\u00f3ria (n\u00e3o digo imposs\u00edvel porque j\u00e1 estamos a\u00ed com o 3o Homem-Aranha no cinema em 15 anos). Tamb\u00e9m n\u00e3o acho que teria tanta gra\u00e7a insistir no DNA com As Aventuras de Samuel Drake ou As Aventuras de Cassie Drake, a.k.a. Tomb Raider."}, {"b1d8": "Ent\u00e3o, talvez seja o caso de se conformar e lembrar que \u00e9 melhor dar um bel\u00edssimo final para uma franquia a virar Assassin\u2019s Creed."}, {"3050": "Quando o jogo terminou, eu, me recusando a abandonar o barco, fui dar aquela fu\u00e7ada nos extras e vi algumas das artes conceituais. Vale fazer o mesmo: aparecem alguns visuais que poderiam ter sido e alguns caminhos que o jogo n\u00e3o seguiu, como um passeio de bote em vez do jipe roubado da Shoreline e a batalha final acontecendo na prancha do navio (n\u00e3o sei como chama, peguei a refer\u00eancia do Tchakabum mesmo) e n\u00e3o no por\u00e3o, o que seria um enorme clich\u00ea mas tamb\u00e9m seria bem legal."}, {"ac06": "\u00c9 isso, acabou, n\u00e3o vou me recuperar t\u00e3o rapidamente (#dramas) mas achei um bom final. E, se for muito dif\u00edcil, tamb\u00e9m tem a cole\u00e7\u00e3o remasterizada para PS4 para matar a saudade. \u2764"}, {"8863": "B\u00f4nus: t\u00f4 gastando muito tempo tentando embedar esse v\u00eddeo, ent\u00e3o fica o link e a recomenda\u00e7\u00e3o \u201cassista que \u00e9 foda\u201d."}, {"46ba": "Quer mais di\u00e1rios de games? To pensando em fazer de Fallout 4 ou de The Division. Conta pra mim, aqui nos coment\u00e1rios ou no Twitter, qual voc\u00ea acha mais maneiro\u00a0:)"}, {"9687": "Obs: The Division t\u00f4 instalando agora, no Fallout j\u00e1 matei um casal porque n\u00e3o queria fazer o que eles me mandaram, ent\u00e3o fica a\u00ed a pr\u00e9via."}], "content": "Di\u00e1rio do Uncharted 4\u200a\u2014\u200aparte 4: quando seu marido volta para\u00a0casa? Tal qual o amante que n\u00e3o quer que a noite acabe e emulando a \u00fanica frase que Sam Drake sabe em portugu\u00eas, l\u00e1 fomos n\u00f3s sabendo que o fim de Uncharted 4 estava pr\u00f3ximo. E, como sempre, ele me enganou, empurrando o final para depois de mais algumas horinhas de jogo. Mas antes: 1) texto cheio de spoilers e 2) leia as outras partes (tamb\u00e9m com spoilers): Vamos l\u00e1. Nessas horinhas a mais, teve um monte de tiroteio, um monte de escalada, uma umidade absurda em New Devon, cen\u00e1rios muito lindos que ningu\u00e9m vai ficar sabendo que existem porque a Elena n\u00e3o levou a c\u00e2mera dela\u200a\u2014\u200aessa foi uma quest\u00e3o que me pegou sem querer em v\u00e1rios momentos, fiquei pensando \u201cimagina se fosse no GTA como daria para fazer uma selfie maneira aqui\u201d, virei um monstro. Falando na Elena, ainda que eu ache ela meio chata, quando ela vira a parceira da vez do Nathan eu me sinto at\u00e9 mal em achar isso. A qu\u00edmica dos dois \u00e9 muito legal, ela \u00e9 bem badass e o pr\u00f3prio Nathan fala isso em alguns momentos (\u201cvai, deixa uma mulher dessa brava\u201d ou algo assim). Tem dois momentos espec\u00edficos que s\u00e3o bem marcantes, um quando eles est\u00e3o num banquete de piratas mortos, bem rom\u00e2ntico, e outro quando ela finge que morreu s\u00f3 para dar um susto nele, mas a gente tamb\u00e9m assusta e talvez eu tenha xingado o game em voz alta nessa hora mas depois tamb\u00e9m gargalhei em voz alta, ent\u00e3o a amizade continua a mesma. Tamb\u00e9m queria fazer uma men\u00e7\u00e3o honrosa para o retorno do Sully, sempre com a RPG na hora certa, e para o quanto o Sam \u00e9 um irm\u00e3o mais velho chato\u200a\u2014\u200ao personagem \u00e9 legal mas meu deus se meu irm\u00e3o fosse t\u00e3o manipulador e implicante assim eu acho que, bom, eu tamb\u00e9m iria atr\u00e1s dele porque \u00e9 isso que fam\u00edlia faz. Mas que d\u00e1 raiva, d\u00e1. O ponto alto \u00e9, sem d\u00favida, o ep\u00edlogo do final. Voc\u00ea joga Crash Bandicoot de novo e, no meu caso, n\u00e3o bate de novo o recorde da Elena. Mas, quando acabam as vidas, quem est\u00e1 jogando \u00e9 uma menina loirinha, a cara dela: \u00e9 a filha do Nathan e da Elena! E eles t\u00eam uma casa muit\u00edssimo maneira de frente para o mar! E um cachorro! E viajam o mundo! Realmente, Nathan Drake conseguiu ter tudo no final. E o t\u00edtulo, A Thief\u2019s End, que me fez pensar em alguns momentos se significaria algo al\u00e9m do fim das aventuras dele\u200a\u2014\u200atalvez ele morreria? Talvez o Sam morreria? Talvez algu\u00e9m morreria?\u200a\u2014\u200asignifica apenas isso. \u00c9 bem improv\u00e1vel que tenhamos mais um Uncharted em um futuro t\u00e3o pr\u00f3ximo, mais ainda se quiser continuar a mesma hist\u00f3ria (n\u00e3o digo imposs\u00edvel porque j\u00e1 estamos a\u00ed com o 3o Homem-Aranha no cinema em 15 anos). Tamb\u00e9m n\u00e3o acho que teria tanta gra\u00e7a insistir no DNA com As Aventuras de Samuel Drake ou As Aventuras de Cassie Drake, a.k.a. Tomb Raider. Ent\u00e3o, talvez seja o caso de se conformar e lembrar que \u00e9 melhor dar um bel\u00edssimo final para uma franquia a virar Assassin\u2019s Creed. Quando o jogo terminou, eu, me recusando a abandonar o barco, fui dar aquela fu\u00e7ada nos extras e vi algumas das artes conceituais. Vale fazer o mesmo: aparecem alguns visuais que poderiam ter sido e alguns caminhos que o jogo n\u00e3o seguiu, como um passeio de bote em vez do jipe roubado da Shoreline e a batalha final acontecendo na prancha do navio (n\u00e3o sei como chama, peguei a refer\u00eancia do Tchakabum mesmo) e n\u00e3o no por\u00e3o, o que seria um enorme clich\u00ea mas tamb\u00e9m seria bem legal. \u00c9 isso, acabou, n\u00e3o vou me recuperar t\u00e3o rapidamente (#dramas) mas achei um bom final. E, se for muito dif\u00edcil, tamb\u00e9m tem a cole\u00e7\u00e3o remasterizada para PS4 para matar a saudade. \u2764 B\u00f4nus: t\u00f4 gastando muito tempo tentando embedar esse v\u00eddeo, ent\u00e3o fica o link e a recomenda\u00e7\u00e3o \u201cassista que \u00e9 foda\u201d. Quer mais di\u00e1rios de games? To pensando em fazer de Fallout 4 ou de The Division. Conta pra mim, aqui nos coment\u00e1rios ou no Twitter, qual voc\u00ea acha mais maneiro\u00a0:) Obs: The Division t\u00f4 instalando agora, no Fallout j\u00e1 matei um casal porque n\u00e3o queria fazer o que eles me mandaram, ent\u00e3o fica a\u00ed a pr\u00e9via. ", "child": "1301_1\t1301_2\t1301_31301_1\t1301_2\t1301_31301_1\t1301_2\t1301_3"}