{"name": "1337", "parent": "", "title": "How Elon Musk Learns Faster And Better Than Everyone\u00a0Else", "sentences": [{"09d6": "How Elon Musk Learns Faster And Better Than Everyone\u00a0Else"}, {"9694": "How is it even possible that Elon Musk could build four multibillion companies by his mid-40s\u200a\u2014\u200ain four separate fields (software, energy, transportation, and aerospace)?"}, {"1b2a": "To explain Musk\u2019s success, others have pointed to his heroic work ethic (he regularly works 85-hour weeks), his ability to set reality-distorting visions for the future, and his incredible resilience."}, {"38b0": "But all of these felt unsatisfactory to me. Plenty of people have these traits. I wanted to know what he did differently."}, {"dadb": "As I kept reading dozens of articles, videos, and books about Musk, I noticed a huge piece of the puzzle was missing. Conventional wisdom says that in order to become world-class, we should only focus on one field. Musk breaks that rule. His expertise ranges from rocket science, engineering, physics, and artificial intelligence to solar power and energy."}, {"cca8": "In a previous article, I call people like Elon Musk \u201cexpert-generalists\u201d (a term coined by Orit Gadiesh, chairman of Bain & Company). Expert-generalists study widely in many different fields, understand deeper principles that connect those fields, and then apply the principles to their core specialty."}, {"4bd9": "Based on my review of Musk\u2019s life and the academic literature related to learning and expertise, I\u2019m convinced that we should ALL learn across multiple fields in order to increase our odds of breakthrough success."}, {"4c61": "The jack of all trades myth"}, {"8f85": "If you\u2019re someone who loves learning in different areas, you\u2019re probably familiar with this well-intentioned advice:"}, {"5fa3": "\u201cGrow up. Focus on just one field.\u201d"}, {"8de8": "\u201cJack of all trades. Master of none.\u201d\u00a0The implicit assumption is that if you study in multiple areas, you\u2019ll only learn at a surface level, never gain mastery."}, {"3c28": "The success of expert-generalists throughout time shows that this is wrong.Learning across multiple fields provides an information advantage (and therefore an innovation advantage) because most people focus on just one field."}, {"743a": "For example, if you\u2019re in the tech industry and everyone else is just reading tech publications, but you also know a lot about biology, you have the ability to come up with ideas that almost no one else could. Vice-versa. If you\u2019re in biology, but you you also understand artificial intelligence, you have an information advantage over everyone else who stays siloed."}, {"9027": "Despite this basic insight, few people actually learn beyond their industry."}, {"f986": "Each new field we learn that is unfamiliar to others in our field gives us the ability to make combinations that they can\u2019t. This is the expert-generalist advantage."}, {"8958": "One fascinating study echoes this insight. It examined how the top 59 opera composers of the 20th century mastered their craft. Counter to the conventional narrative that success of top performers can solely be explained by deliberate practice and specialization, the researcher Dean Keith Simonton found the exact opposite: \u201cThe compositions of the most successful operatic composers tended to represent a mix of genres\u2026composers were able to avoid the inflexibility of too much expertise(overtraining) by cross-training,\u201d summarizes UPENN researcher Scott Barry Kaufman in a Scientific American article."}, {"8cb7": "Musk\u2019s \u201clearning transfer\u201d superpower"}, {"33ee": "Starting from his early teenage years, Musk would read through two books per day in various disciplines according to his brother, Kimbal Musk. To put that context, if you read one book a month, Musk would read 60 times as many books as you."}, {"1068": "At first, Musk\u2019s reading spanned science fiction, philosophy, religion, programming, and biographies of scientists, engineers, and entrepreneurs.As he got older, his reading and career interests spread to physics, engineering, product design, business, technology, and energy. This thirst for knowledge allowed him to get exposed to a variety of subjects he had never necessarily learned about in school."}, {"15c0": "Elon Musk is also good at a very specific type of learning that most others aren\u2019t even aware of\u200a\u2014\u200alearning transfer."}, {"4aa3": "Learning transfer is taking what we learn in one context and applying it to another. It can be taking a kernel of what we learn in school or in a book and applying it to the \u201creal world.\u201d It can also be taking what we learn in one industry and applying it to another."}, {"fc6b": "This is where Musk shines. Several of his interviews show that he has a unique two-step process for fostering learning transfer."}, {"1d91": "Side note: Want to take your learning routine to the next level? I created a free learning how to learn webinar you might like."}, {"f6aa": "First, he deconstructs knowledge into fundamental principles"}, {"1f75": "Musk\u2019s answer on a Reddit AMA describes how he does that:"}, {"65e1": "It is important to view knowledge as sort of a semantic tree\u200a\u2014\u200amake sure you understand the fundamental principles, i.e. the trunk and big branches, before you get into the leaves/details or there is nothing for them to hang onto."}, {"0550": "Research suggests that turning your knowledge into deeper, abstract principles facilitates learning transfer. Research also suggests that one technique is particularly powerful for helping people intuit underlying principles. This technique is called, \u201ccontrasting cases.\u201d"}, {"f2b1": "Here\u2019s how it works: Let\u2019s say you want to deconstruct the letter \u201cA\u201d and understand the deeper principle of what makes an \u201cA\u201d an A. Let\u2019s further say that you have two approaches you could use to do this:"}, {"1a32": "Which approach do you think would work better?"}, {"d76b": "Approach #1. Each different A in Approach #1 gives more insight into what stays the same and what differs between each A. Each A in Approach #2 gives us no insight."}, {"3648": "By looking at lots of diverse cases when we learn anything, we begin tointuit what is essential and even craft our own unique combinations."}, {"0439": "What does this mean in our day-to-day life? When we\u2019re jumping into a new field, we shouldn\u2019t just take one approach or best practice. We shouldexplore lots of different approaches, deconstruct each one, and thencompare and contrast them. This will help us uncover underlying principles."}, {"07cb": "Next, he reconstructs the fundamental principles in new fields"}, {"be8d": "Step two of Musk\u2019s learning transfer process involves reconstructing the foundational principles he\u2019s learned in artificial intelligence, technology, physics, and engineering into separate fields:"}, {"54d2": "Keith Holyoak, a UCLA professor of psychology and one of the world\u2019s leading thinkers on analogical reasoning, recommends people ask themselves the following two questions in order to hone their skills: \u201cWhatdoes this remind me of?\u201d and \u201cWhy does it remind me of it?\u201d"}, {"a68a": "By constantly looking at objects in your environment and material you read and asking yourself these two questions, you build the muscles in your brain that help you make connections across traditional boundaries."}, {"6d35": "Bottom line: It\u2019s not magic. It\u2019s just the right learning process"}, {"df46": "Now, we can begin to understand how Musk has become a world-classexpert-generalist:"}, {"7172": "At the deepest level, what we can learn from Elon Musk\u2019s story is that weshouldn\u2019t accept the dogma that specialization is the best or only path toward career success and impact. Legendary expert-generalist Buckminster Fuller summarizes a shift in thinking we should all consider. He shared it decades ago, but it\u2019s just as relevant today:"}, {"6aa7": "\u201cWe are in an age that assumes that the narrowing trends of specialization to be logical, natural, and desirable\u2026 In the meantime, humanity has been deprived of comprehensive understanding. Specialization has bred feelings of isolation, futility, and confusion in individuals. It has also resulted in the individual\u2019s leaving responsibility for thinking and social action to others.Specialization breeds biases that ultimately aggregate as international and ideological discord, which in turn leads to war.\u201d"}, {"9d9a": "If we put in the time and learn core concepts across fields and always relate those concepts back to our life and the world, transferring between areas becomes much easier and faster."}, {"369f": "As we build up a reservoir of \u201cfirst principles\u201d and associate those principles with different fields, we suddenly gain the superpower of being able to go into a new field we\u2019ve never learned before, and quickly make unique contributions."}, {"9dcd": "Understanding Elon\u2019s learning superpowers helps us gain some insight into how he could go into an industry that has been around for more than 100 years and change the whole basis of how the field competes."}, {"02ce": "Elon Musk is one of a kind, but his abilities aren\u2019t magical."}, {"c2d2": "Want to take to learn like Musk? I created a free learning how to learn webinar you might like. It\u2019s based on the learning best practices of the world\u2019s top entrepreneurs."}, {"6229": "\u2013 Michael Simmons is a serial entrepreneur and writes at MichaelDSimmons.com, and Ian Chew is a director at Empact."}], "content": "How Elon Musk Learns Faster And Better Than Everyone\u00a0Else How is it even possible that Elon Musk could build four multibillion companies by his mid-40s\u200a\u2014\u200ain four separate fields (software, energy, transportation, and aerospace)? To explain Musk\u2019s success, others have pointed to his heroic work ethic (he regularly works 85-hour weeks), his ability to set reality-distorting visions for the future, and his incredible resilience. But all of these felt unsatisfactory to me. Plenty of people have these traits. I wanted to know what he did differently. As I kept reading dozens of articles, videos, and books about Musk, I noticed a huge piece of the puzzle was missing. Conventional wisdom says that in order to become world-class, we should only focus on one field. Musk breaks that rule. His expertise ranges from rocket science, engineering, physics, and artificial intelligence to solar power and energy. In a previous article, I call people like Elon Musk \u201cexpert-generalists\u201d (a term coined by Orit Gadiesh, chairman of Bain & Company). Expert-generalists study widely in many different fields, understand deeper principles that connect those fields, and then apply the principles to their core specialty. Based on my review of Musk\u2019s life and the academic literature related to learning and expertise, I\u2019m convinced that we should ALL learn across multiple fields in order to increase our odds of breakthrough success. The jack of all trades myth If you\u2019re someone who loves learning in different areas, you\u2019re probably familiar with this well-intentioned advice: \u201cGrow up. Focus on just one field.\u201d \u201cJack of all trades. Master of none.\u201d\u00a0The implicit assumption is that if you study in multiple areas, you\u2019ll only learn at a surface level, never gain mastery. The success of expert-generalists throughout time shows that this is wrong.Learning across multiple fields provides an information advantage (and therefore an innovation advantage) because most people focus on just one field. For example, if you\u2019re in the tech industry and everyone else is just reading tech publications, but you also know a lot about biology, you have the ability to come up with ideas that almost no one else could. Vice-versa. If you\u2019re in biology, but you you also understand artificial intelligence, you have an information advantage over everyone else who stays siloed. Despite this basic insight, few people actually learn beyond their industry. Each new field we learn that is unfamiliar to others in our field gives us the ability to make combinations that they can\u2019t. This is the expert-generalist advantage. One fascinating study echoes this insight. It examined how the top 59 opera composers of the 20th century mastered their craft. Counter to the conventional narrative that success of top performers can solely be explained by deliberate practice and specialization, the researcher Dean Keith Simonton found the exact opposite: \u201cThe compositions of the most successful operatic composers tended to represent a mix of genres\u2026composers were able to avoid the inflexibility of too much expertise(overtraining) by cross-training,\u201d summarizes UPENN researcher Scott Barry Kaufman in a Scientific American article. Musk\u2019s \u201clearning transfer\u201d superpower Starting from his early teenage years, Musk would read through two books per day in various disciplines according to his brother, Kimbal Musk. To put that context, if you read one book a month, Musk would read 60 times as many books as you. At first, Musk\u2019s reading spanned science fiction, philosophy, religion, programming, and biographies of scientists, engineers, and entrepreneurs.As he got older, his reading and career interests spread to physics, engineering, product design, business, technology, and energy. This thirst for knowledge allowed him to get exposed to a variety of subjects he had never necessarily learned about in school. Elon Musk is also good at a very specific type of learning that most others aren\u2019t even aware of\u200a\u2014\u200alearning transfer. Learning transfer is taking what we learn in one context and applying it to another. It can be taking a kernel of what we learn in school or in a book and applying it to the \u201creal world.\u201d It can also be taking what we learn in one industry and applying it to another. This is where Musk shines. Several of his interviews show that he has a unique two-step process for fostering learning transfer. Side note: Want to take your learning routine to the next level? I created a free learning how to learn webinar you might like. First, he deconstructs knowledge into fundamental principles Musk\u2019s answer on a Reddit AMA describes how he does that: It is important to view knowledge as sort of a semantic tree\u200a\u2014\u200amake sure you understand the fundamental principles, i.e. the trunk and big branches, before you get into the leaves/details or there is nothing for them to hang onto. Research suggests that turning your knowledge into deeper, abstract principles facilitates learning transfer. Research also suggests that one technique is particularly powerful for helping people intuit underlying principles. This technique is called, \u201ccontrasting cases.\u201d Here\u2019s how it works: Let\u2019s say you want to deconstruct the letter \u201cA\u201d and understand the deeper principle of what makes an \u201cA\u201d an A. Let\u2019s further say that you have two approaches you could use to do this: Which approach do you think would work better? Approach #1. Each different A in Approach #1 gives more insight into what stays the same and what differs between each A. Each A in Approach #2 gives us no insight. By looking at lots of diverse cases when we learn anything, we begin tointuit what is essential and even craft our own unique combinations. What does this mean in our day-to-day life? When we\u2019re jumping into a new field, we shouldn\u2019t just take one approach or best practice. We shouldexplore lots of different approaches, deconstruct each one, and thencompare and contrast them. This will help us uncover underlying principles. Next, he reconstructs the fundamental principles in new fields Step two of Musk\u2019s learning transfer process involves reconstructing the foundational principles he\u2019s learned in artificial intelligence, technology, physics, and engineering into separate fields: Keith Holyoak, a UCLA professor of psychology and one of the world\u2019s leading thinkers on analogical reasoning, recommends people ask themselves the following two questions in order to hone their skills: \u201cWhatdoes this remind me of?\u201d and \u201cWhy does it remind me of it?\u201d By constantly looking at objects in your environment and material you read and asking yourself these two questions, you build the muscles in your brain that help you make connections across traditional boundaries. Bottom line: It\u2019s not magic. It\u2019s just the right learning process Now, we can begin to understand how Musk has become a world-classexpert-generalist: At the deepest level, what we can learn from Elon Musk\u2019s story is that weshouldn\u2019t accept the dogma that specialization is the best or only path toward career success and impact. Legendary expert-generalist Buckminster Fuller summarizes a shift in thinking we should all consider. He shared it decades ago, but it\u2019s just as relevant today: \u201cWe are in an age that assumes that the narrowing trends of specialization to be logical, natural, and desirable\u2026 In the meantime, humanity has been deprived of comprehensive understanding. Specialization has bred feelings of isolation, futility, and confusion in individuals. It has also resulted in the individual\u2019s leaving responsibility for thinking and social action to others.Specialization breeds biases that ultimately aggregate as international and ideological discord, which in turn leads to war.\u201d If we put in the time and learn core concepts across fields and always relate those concepts back to our life and the world, transferring between areas becomes much easier and faster. As we build up a reservoir of \u201cfirst principles\u201d and associate those principles with different fields, we suddenly gain the superpower of being able to go into a new field we\u2019ve never learned before, and quickly make unique contributions. Understanding Elon\u2019s learning superpowers helps us gain some insight into how he could go into an industry that has been around for more than 100 years and change the whole basis of how the field competes. Elon Musk is one of a kind, but his abilities aren\u2019t magical. Want to take to learn like Musk? I created a free learning how to learn webinar you might like. It\u2019s based on the learning best practices of the world\u2019s top entrepreneurs. \u2013 Michael Simmons is a serial entrepreneur and writes at MichaelDSimmons.com, and Ian Chew is a director at Empact. ", "child": "1337_1\t1337_2\t1337_3"}