{"name": "1350", "parent": "", "title": "Steer Your Focus Through the Power of Questions", "sentences": [{"b000": "Steer Your Focus Through the Power of Questions"}, {"ba9a": "\u201cThe quality of our questions determine the quality of our life.\u201d Tony Robbins"}, {"7be8": "As humans, we walk through every day shackled to our thoughts and to our feelings. We overthink the past, glance at the present, and create anxiety about the future. Our inner dialogue is so passive at times that events and others tell us what to feel and experience. When we stop ourselves at any one time throughout the day, we will begin to notice that our thoughts are actually just questions we ask:"}, {"d038": "\u201cWhy did I do that?\u201d"}, {"3392": "\u201cWhy do I feel like crap?\u201d"}, {"5bad": "\u201cWhy don\u2019t I have any energy right now?\u201d"}, {"c1c4": "\u201cHow could she do that to me?\u201d"}, {"7eed": "\u201cWhy do I have to do this project that doesn\u2019t matter to me?\u201d"}, {"b7fb": "\u201cWhy don\u2019t I have enough money for that trip?\u201d"}, {"0091": "\u201cHow did I let myself get so fat?\u201d"}, {"9413": "\u201cWhere did I go wrong?\u201d"}, {"db04": "We need to realize, that what goes through our mind all day is a recurring dialogue of asking and answering questions. What questions we ask ourselves will determine how we feel, what actions we take, and how we interpret all the events that occur in our lives. It\u2019s time that we create a powerful line of questioning and stop allowing negative questions guide our path."}, {"4e24": "Our Default Line of Questioning"}, {"f9c9": "In terms of our waistlines, if you default to eat what the average American eats, you will become overweight or obese. I think we can all agree, this isn\u2019t the ideal state to exist in. The same can be said with our default line of questioning."}, {"6837": "The ideals and expectations we have for ourselves lead us to cross examine our souls with extreme levels of judgement."}, {"6a08": "We are taught to stay inside picture perfect boxes and conform to the way society has been constructed. Popular marketing has taught us that we need to look a certain way, earn a certain amount of money, or have a certain type of relationship."}, {"c7ce": "We ask ourselves:"}, {"0fc5": "\u201cWhy don\u2019t I look like that?\u201d"}, {"b22b": "\u201cHow can I drive that kind of car?\u201d"}, {"6b45": "\u201cWhy doesn\u2019t my relationship have that kind of passion?\u201d"}, {"055e": "When you ask yourself poor questions, you are bound to get poor answers. Poor answers result in a poor life."}, {"269a": "Our default line of questioning tends to lead us to dig up all the negatives about ourselves and others. When we find these answers too often, they will remain and grab a stronger hold of our identities."}, {"b29d": "We must intentionally create positive questions that we contemplate every day. This makes me think of the Stoics walking around and contemplating the meaning of life:"}, {"ef68": "\u201cWe should every night call ourselves to an account;"}, {"e2ab": "What infirmity have I mastered today?"}, {"1a34": "What passions opposed? What temptation resisted? What virtue acquired? Our vices will abort of themselves if they be brought every day to the shrift.\u201d"}, {"76c0": "\u2015 Seneca"}, {"3afd": "5 Powerful Questions to Start\u00a0With"}, {"c7d3": "It is said many times over that you can\u2019t be stressed and grateful at the same time. Use this saying to your advantage and create more gratefulness in your life through the constant asking of this question."}, {"1cef": "2. What am I excited about in my life right now?"}, {"50c8": "There has to be something! What get\u2019s your juices flowing? Your engines revving? You floating on air? Focus on that and feel the positive energy run through you."}, {"e37c": "3. How did I serve today?"}, {"75dc": "We can only be of use in this world if we choose to serve others. Ask this question to hold yourself accountable to serving others every day."}, {"df5d": "4. How can I enjoy the process of this?"}, {"3ec0": "Maybe you\u2019re in the middle of a tough relationship, building a business, or some other extremely hard time; ask this question to help guide yourself through with good energy. There are always actions you can take to make it easier and more fulfilling. Maybe it\u2019s making sure you get a good workout in or connecting with a particular person."}, {"d1d5": "5. What can I learn from this?"}, {"2b6a": "In every situation, there is an opportunity to learn a lesson. We must be willing to open our eyes to the teachers and classrooms we walk through every day. What can you learn from your workout, from your road rage, or being late to dinner?"}, {"07f8": "Don\u2019t Dwell on the Question, Answer Then\u00a0ACT!"}, {"96b5": "\u201cThe best time to plant a tree was 20 years ago. But the second best time is today.\u201d Chinese Proverb"}, {"df93": "There is a point in asking all these beautiful questions that we become paralyzed by the weight of the good things we can do. Some people call this paralysis by analysis."}, {"de3d": "Just build the house\u2026Go\u00a0DO!"}, {"196f": "At some point, you need to turn this great energy we create and turn it into actions. The sooner we can translate this, the better."}, {"139e": "If, for example, you just got a poor review from your manager and you ask yourself, \u201cWhat can I learn from this?\u201d You shouldn\u2019t let this question consume your every thought for a week; think about it for awhile, but then take an action to better your standing. Plan your next week of work and grab that accountability partner you\u2019ve been meaning to partner with."}, {"95bf": "You can only plan and analyze so much; The real power lies in the DOING."}, {"ac2e": "\u201cNever has there been a map, however carefully executed to detail and scale, which carried its owner over even one inch of ground.\u201d\u200a\u2014\u200aOg Mandino"}, {"69db": "One Question Can Change Your\u00a0Life"}, {"b280": "In his famous commencement speech, Steve Jobs revealed a question that he asked himself every morning for over 30 years:"}, {"d579": "\u201cIf today were the last day of my life, would I want to do what I\u2019m about to do today?\u201d"}, {"0374": "He follows with, \u201cWhenever the answer has been \u2018no\u2019 for too many days in a row, I know I need to change something.\u201d"}, {"1822": "This question guided the leader of Apple, Pixar, and NeXT for his entire professional and personal life. It gave him context about how short life really is and how trivial it can be in the end if you\u2019re too serious about it."}, {"0dc4": "Our questions determine our thoughts and our thoughts become things."}, {"539b": "We must be intentional about the questions we ask ourselves, what powerful question can you focus on today? Ask and you shall receive. Make sure you\u2019re asking the right questions."}, {"a088": "Bonus Questions:"}, {"e684": "\u201cWhat\u2019s good about this situation?\u201d"}, {"3bc7": "\u201cHow can I use this?\u201d"}, {"0709": "Call To\u00a0Action"}, {"fb52": "Like this post? Find any value in it? If so, I would appreciate you hitting the GREEN HEART so that more people can take action from asking better questions."}, {"99ff": "Visit Project Avocado to get a FREE report on the #1 habit for healthy transformations. Jerry Seinfeld makes an appearance\u2026"}], "content": "Steer Your Focus Through the Power of Questions \u201cThe quality of our questions determine the quality of our life.\u201d Tony Robbins As humans, we walk through every day shackled to our thoughts and to our feelings. We overthink the past, glance at the present, and create anxiety about the future. Our inner dialogue is so passive at times that events and others tell us what to feel and experience. When we stop ourselves at any one time throughout the day, we will begin to notice that our thoughts are actually just questions we ask: \u201cWhy did I do that?\u201d \u201cWhy do I feel like crap?\u201d \u201cWhy don\u2019t I have any energy right now?\u201d \u201cHow could she do that to me?\u201d \u201cWhy do I have to do this project that doesn\u2019t matter to me?\u201d \u201cWhy don\u2019t I have enough money for that trip?\u201d \u201cHow did I let myself get so fat?\u201d \u201cWhere did I go wrong?\u201d We need to realize, that what goes through our mind all day is a recurring dialogue of asking and answering questions. What questions we ask ourselves will determine how we feel, what actions we take, and how we interpret all the events that occur in our lives. It\u2019s time that we create a powerful line of questioning and stop allowing negative questions guide our path. Our Default Line of Questioning In terms of our waistlines, if you default to eat what the average American eats, you will become overweight or obese. I think we can all agree, this isn\u2019t the ideal state to exist in. The same can be said with our default line of questioning. The ideals and expectations we have for ourselves lead us to cross examine our souls with extreme levels of judgement. We are taught to stay inside picture perfect boxes and conform to the way society has been constructed. Popular marketing has taught us that we need to look a certain way, earn a certain amount of money, or have a certain type of relationship. We ask ourselves: \u201cWhy don\u2019t I look like that?\u201d \u201cHow can I drive that kind of car?\u201d \u201cWhy doesn\u2019t my relationship have that kind of passion?\u201d When you ask yourself poor questions, you are bound to get poor answers. Poor answers result in a poor life. Our default line of questioning tends to lead us to dig up all the negatives about ourselves and others. When we find these answers too often, they will remain and grab a stronger hold of our identities. We must intentionally create positive questions that we contemplate every day. This makes me think of the Stoics walking around and contemplating the meaning of life: \u201cWe should every night call ourselves to an account; What infirmity have I mastered today? What passions opposed? What temptation resisted? What virtue acquired? Our vices will abort of themselves if they be brought every day to the shrift.\u201d \u2015 Seneca 5 Powerful Questions to Start\u00a0With It is said many times over that you can\u2019t be stressed and grateful at the same time. Use this saying to your advantage and create more gratefulness in your life through the constant asking of this question. 2. What am I excited about in my life right now? There has to be something! What get\u2019s your juices flowing? Your engines revving? You floating on air? Focus on that and feel the positive energy run through you. 3. How did I serve today? We can only be of use in this world if we choose to serve others. Ask this question to hold yourself accountable to serving others every day. 4. How can I enjoy the process of this? Maybe you\u2019re in the middle of a tough relationship, building a business, or some other extremely hard time; ask this question to help guide yourself through with good energy. There are always actions you can take to make it easier and more fulfilling. Maybe it\u2019s making sure you get a good workout in or connecting with a particular person. 5. What can I learn from this? In every situation, there is an opportunity to learn a lesson. We must be willing to open our eyes to the teachers and classrooms we walk through every day. What can you learn from your workout, from your road rage, or being late to dinner? Don\u2019t Dwell on the Question, Answer Then\u00a0ACT! \u201cThe best time to plant a tree was 20 years ago. But the second best time is today.\u201d Chinese Proverb There is a point in asking all these beautiful questions that we become paralyzed by the weight of the good things we can do. Some people call this paralysis by analysis. Just build the house\u2026Go\u00a0DO! At some point, you need to turn this great energy we create and turn it into actions. The sooner we can translate this, the better. If, for example, you just got a poor review from your manager and you ask yourself, \u201cWhat can I learn from this?\u201d You shouldn\u2019t let this question consume your every thought for a week; think about it for awhile, but then take an action to better your standing. Plan your next week of work and grab that accountability partner you\u2019ve been meaning to partner with. You can only plan and analyze so much; The real power lies in the DOING. \u201cNever has there been a map, however carefully executed to detail and scale, which carried its owner over even one inch of ground.\u201d\u200a\u2014\u200aOg Mandino One Question Can Change Your\u00a0Life In his famous commencement speech, Steve Jobs revealed a question that he asked himself every morning for over 30 years: \u201cIf today were the last day of my life, would I want to do what I\u2019m about to do today?\u201d He follows with, \u201cWhenever the answer has been \u2018no\u2019 for too many days in a row, I know I need to change something.\u201d This question guided the leader of Apple, Pixar, and NeXT for his entire professional and personal life. It gave him context about how short life really is and how trivial it can be in the end if you\u2019re too serious about it. Our questions determine our thoughts and our thoughts become things. We must be intentional about the questions we ask ourselves, what powerful question can you focus on today? Ask and you shall receive. Make sure you\u2019re asking the right questions. Bonus Questions: \u201cWhat\u2019s good about this situation?\u201d \u201cHow can I use this?\u201d Call To\u00a0Action Like this post? Find any value in it? If so, I would appreciate you hitting the GREEN HEART so that more people can take action from asking better questions. Visit Project Avocado to get a FREE report on the #1 habit for healthy transformations. Jerry Seinfeld makes an appearance\u2026 ", "child": "1350_1\t1350_2\t1350_3"}