{"name": "1448", "parent": "", "title": "Document, Don\u2019t Create: Creating Content That Builds Your Personal\u00a0Brand", "sentences": [{"dafb": "Document, Don\u2019t Create: Creating Content That Builds Your Personal\u00a0Brand"}, {"af43": "If you want people to start listening to you, you have to show up. What I mean by this is there are a lot of you out there who aren\u2019t producing enough articles or videos or pieces of content that you should be produced to build your influence. Too many \u201ccontent creators\u201d think that they only have one at bat\u200a\u2014\u200athey have to make the one, most beautifully created video or image or rant on Facebook."}, {"e3af": "But what they don\u2019t realize is that their hunger to make the perfect piece of content is what\u2019s actually crippling them."}, {"3cc8": "It\u2019s true that if you want to be seen or heard on social media, you have to put out valuable content on a regular basis. You should be doing a YouTube vlog or podcast or some sort of long-form audio/video series at least once a week. You should be posting on Instagram and/or Snapchat stories at least 6\u20137 times a day."}, {"09f5": "Now you\u2019re probably thinking: \u201cWhoa, that\u2019s a lot. How do I create 6\u20137 meaningful things a day?\u201d"}, {"5be5": "I\u2019ll give you the biggest tip when it comes to content creation: Document. Don\u2019t create."}, {"4209": "In very simple terms, \u201cdocumenting\u201d versus \u201ccreating\u201d is what The Real World and the Kardashians is to Star Wars and Friends. And don\u2019t get confused\u200a\u2014\u200ajust because you\u2019re \u201cdocumenting\u201d doesn\u2019t mean you\u2019re not creating content. It\u2019s just a version of creating that is predicated more on practicality instead of having to think of stories or fantasy\u200a\u2014\u200asomething that\u2019s very hard for most people (including myself)."}, {"61a5": "Think about it: you can ponder about the strategy behind every post and fabricate yourself into this \u201cinfluential person\u201d\u2026 or you can just be yourself."}, {"6431": "Creating this influential persona might seem especially hard if you\u2019re just someone starting to climb the ladder. And I get it\u200a\u2014\u200afor some of you there\u2019s a lot of pressure in that. You think that some 30 or 40 or 50-year old is going to listen to your rant video with cynicism and think \u201cwhat does this kid know?\u201d"}, {"12c6": "But, one of the biggest mistakes people make when creating content for their personal brand is trying to oversell themselves because they think that\u2019s what\u2019s going to get people\u2019s attention. Whether you\u2019re a business coach or motivational speaker or artist, I think it\u2019s much more fruitful to talk about your process than about the actual advice you \u201cthink\u201d you should be giving them."}, {"3165": "Documenting your journey versus creating an image of yourself is the difference between saying \u201cYou should\u2026\u201d versus \u201cmy intuition says\u2026\u201d. Get it? It changes everything. I believe that the people who are willing to discuss their journeys instead of trying to front themselves as the \u201cnext big thing\u201d are going to win."}, {"fae5": "So, when I say to put out those 6\u20137 meaningful pieces of content a day, just pick up your smartphone, open Facebook Live, and just start talking about the things most important to you. Because in the end, the creative (or how \u201cbeautiful\u201d someone thinks your content is) is going to be subjective. What\u2019s not subjective is the fact that you need to start putting yourself out there and keep swinging."}, {"fa10": "Starting is the most important part and the biggest hurdle that most people are facing. They\u2019re pondering and strategizing instead of making. They\u2019re debating what\u2019s going to happen when they haven\u2019t even looked at what\u2019s in front of them."}, {"f38c": "So do me a favor and start documenting."}, {"bfda": "\u201cOkay, I started Gary. Now what?\u201d you ask? Keep doing it for another five years and then come back to me before you ask again."}, {"8f21": "I\u2019ll give you the biggest tip when it comes to content creation: Document. Don\u2019t\u00a0create."}, {"5e1c": "Thanks for reading!\u00a0:) If you enjoyed it, hit that heart button\u00a0below."}, {"6150": "The idea of \u201cdocumenting\u201d instead of \u201ccreating\u201d is an absolute monster of a concept that I believe will benefit you as it has already started benefiting a lot of people. If you\u2019re looking for more advice, check out this video where I explain it to a young\u00a0man:"}, {"299f": "FYI: this article originally appeared on my website."}], "content": "Document, Don\u2019t Create: Creating Content That Builds Your Personal\u00a0Brand If you want people to start listening to you, you have to show up. What I mean by this is there are a lot of you out there who aren\u2019t producing enough articles or videos or pieces of content that you should be produced to build your influence. Too many \u201ccontent creators\u201d think that they only have one at bat\u200a\u2014\u200athey have to make the one, most beautifully created video or image or rant on Facebook. But what they don\u2019t realize is that their hunger to make the perfect piece of content is what\u2019s actually crippling them. It\u2019s true that if you want to be seen or heard on social media, you have to put out valuable content on a regular basis. You should be doing a YouTube vlog or podcast or some sort of long-form audio/video series at least once a week. You should be posting on Instagram and/or Snapchat stories at least 6\u20137 times a day. Now you\u2019re probably thinking: \u201cWhoa, that\u2019s a lot. How do I create 6\u20137 meaningful things a day?\u201d I\u2019ll give you the biggest tip when it comes to content creation: Document. Don\u2019t create. In very simple terms, \u201cdocumenting\u201d versus \u201ccreating\u201d is what The Real World and the Kardashians is to Star Wars and Friends. And don\u2019t get confused\u200a\u2014\u200ajust because you\u2019re \u201cdocumenting\u201d doesn\u2019t mean you\u2019re not creating content. It\u2019s just a version of creating that is predicated more on practicality instead of having to think of stories or fantasy\u200a\u2014\u200asomething that\u2019s very hard for most people (including myself). Think about it: you can ponder about the strategy behind every post and fabricate yourself into this \u201cinfluential person\u201d\u2026 or you can just be yourself. Creating this influential persona might seem especially hard if you\u2019re just someone starting to climb the ladder. And I get it\u200a\u2014\u200afor some of you there\u2019s a lot of pressure in that. You think that some 30 or 40 or 50-year old is going to listen to your rant video with cynicism and think \u201cwhat does this kid know?\u201d But, one of the biggest mistakes people make when creating content for their personal brand is trying to oversell themselves because they think that\u2019s what\u2019s going to get people\u2019s attention. Whether you\u2019re a business coach or motivational speaker or artist, I think it\u2019s much more fruitful to talk about your process than about the actual advice you \u201cthink\u201d you should be giving them. Documenting your journey versus creating an image of yourself is the difference between saying \u201cYou should\u2026\u201d versus \u201cmy intuition says\u2026\u201d. Get it? It changes everything. I believe that the people who are willing to discuss their journeys instead of trying to front themselves as the \u201cnext big thing\u201d are going to win. So, when I say to put out those 6\u20137 meaningful pieces of content a day, just pick up your smartphone, open Facebook Live, and just start talking about the things most important to you. Because in the end, the creative (or how \u201cbeautiful\u201d someone thinks your content is) is going to be subjective. What\u2019s not subjective is the fact that you need to start putting yourself out there and keep swinging. Starting is the most important part and the biggest hurdle that most people are facing. They\u2019re pondering and strategizing instead of making. They\u2019re debating what\u2019s going to happen when they haven\u2019t even looked at what\u2019s in front of them. So do me a favor and start documenting. \u201cOkay, I started Gary. Now what?\u201d you ask? Keep doing it for another five years and then come back to me before you ask again. I\u2019ll give you the biggest tip when it comes to content creation: Document. Don\u2019t\u00a0create. Thanks for reading!\u00a0:) If you enjoyed it, hit that heart button\u00a0below. The idea of \u201cdocumenting\u201d instead of \u201ccreating\u201d is an absolute monster of a concept that I believe will benefit you as it has already started benefiting a lot of people. If you\u2019re looking for more advice, check out this video where I explain it to a young\u00a0man: FYI: this article originally appeared on my website. ", "child": "1448_1\t1448_2\t1448_3\t1448_4\t1448_5\t1448_6\t1448_7\t1448_8\t1448_9\t1448_10\t1448_11\t1448_12\t1448_13\t1448_14\t1448_15\t1448_16\t1448_17\t1448_18\t1448_19\t1448_20\t1448_21\t1448_22\t1448_23\t1448_24\t1448_25"}