{"name": "1481", "parent": "", "title": "Bottom Navigation Interface", "sentences": [{"6abf": "Bottom Navigation Interface"}, {"f40a": "Large smartphones don\u2019t surprise anyone anymore. They have a lot of advantages, so the jumbo phone trend is likely to continue. But bigger isn\u2019t always better: a large display doesn\u2019t pack more content. The actual size and number of functionalities is the same for high and low res displays."}, {"6b47": "Steven Hoober\u2019s 2013 mobile device research found that a whopping 49% of smartphone users rely on one hand, 36% take the cradled approach, and 15% use both hands."}, {"d898": "In 2017, not much has changed. Since seamless design is so much more than good looks, one-handed and one-thumbed interactions are becoming the norm. In the first place, it\u2019s more comfortable. Second, it\u2019s not always convenient to use both hands. But here\u2019s the rub: one-handed usage limits how far your thumb can easily reach."}, {"2bcb": "Image Source: uxmatters"}, {"a4da": "This is why it\u2019s best to place an app\u2019s frequently-used actions at the bottom of the screen."}, {"61a6": "Since top developers started paying more attention to how users interact with their devices, apps that assume one-handed usage are everywhere. The good news is that in striving to improve their products, large corporations also perfect user experience."}, {"9818": "The user\u2019s voice is invaluable, and the most popular services gather and analyze tons of information about their users, resulting in upgrades and product optimization. Typically, these changes involve usability, though updates aren\u2019t always visually apparent. While interacting with the device, you\u2019ll pick up on improvements and appreciate how your experience has become a lot more natural and effortless."}, {"dd77": "Feedback-inspired product revamps are becoming more and more common on both iOS and Android platforms, and not just with big companies, but startups, too. Nowadays, every new startup has a definite edge: they can launch an app designed for one-handed usage right off the bat."}, {"c597": "Flipboard and Ada are excellent examples."}, {"a23f": "Flipboard is a personalized magazine which aggregates content from news feeds and social media networks, enabling you to discover and share the stories, videos, and photos you love."}, {"4d28": "Image Source: cuberto.com"}, {"5f55": "The screenshots indicate how Flipboard\u2019s core functionality is arranged. What\u2019s different is the absence of a nav bar at the top, which is usually typical of iOS. It\u2019s shifted to the bottom of the screen, into the thumb zone.Notice that the user profile button is in the hard-to-reach red zone, so Flipboard enables users to swipe right to open their profiles."}, {"e1b9": "Image Source: cuberto.com"}, {"01f0": "The search icon appears in the center of the display without shifting the keyboard, so it stays in the yellow zone, requiring the thumb to stretch a bit."}, {"edce": "Image Source: cuberto.com"}, {"0373": "Ada\u2019s dev masters created a completely innovative navigation design. Ada is a health app which asks all the right questions and presents personalized information to improve well-being."}, {"4032": "The revolutionary interface is super simple. It\u2019s a flipped mirror image of a basic interface structure. Everything that\u2019s usually at the top is conveniently at the bottom, in the green zone."}, {"de7b": "The start screen looks like this:"}, {"2f1d": "Image Source: cuberto.com"}, {"060d": "The hamburger menu is outdated because it hides app features off-screen, so Ada duplicates it with a more natural left swipe."}, {"7773": "Image Source: cuberto.com"}, {"4463": "Menu list is placed lower and nobody\u2019s intimidated by the negative space because it\u2019s obviously deliberate.\u00a0Ada\u2019s subviews apply the thumb zone rubric, too."}, {"2786": "Image Source: cuberto.com"}, {"d410": "Last year, we developed a concept for a calling app which applied one-hand navigation principles. The method feels especially intuitive for call or message apps since we tend to use one hand for dialing and texting, anyway. The design didn\u2019t take off from the concept stage because the client was wary of a total functionality overhaul which could alienate users who\u2019d had grown accustomed to the interface structure."}, {"cf40": "Image Source:\u00a0cuberto"}, {"46e1": "We\u2019d like to single out Facebook Paper. A company with an immense following and a hugely popular application releases something innovative and intuitive. From a UX perspective, it was a bold experiment and it\u2019s unfortunate that it was shut down. The app was released in 2014 and there are plenty of detailed, high-quality reviews, like the one below."}, {"3d2f": "Conclusion"}, {"c90b": "First and foremost, app developers have to consider users and target audiences. These are the cornerstones of any future app\u2019s UX. The more simple, streamlined, and convenient your app, the higher its chances of reaching a wider audience. Keeping up with trends is a must\u200a\u2014\u200awhat\u2019s fresh today might grow stale by tomorrow."}, {"6952": "Cuberto sets the trend in creative websites and mobile apps. We dare what others don\u2019t. info@cuberto.com"}, {"8df6": "Follow us on Dribbble and Behance"}], "content": "Bottom Navigation Interface Large smartphones don\u2019t surprise anyone anymore. They have a lot of advantages, so the jumbo phone trend is likely to continue. But bigger isn\u2019t always better: a large display doesn\u2019t pack more content. The actual size and number of functionalities is the same for high and low res displays. Steven Hoober\u2019s 2013 mobile device research found that a whopping 49% of smartphone users rely on one hand, 36% take the cradled approach, and 15% use both hands. In 2017, not much has changed. Since seamless design is so much more than good looks, one-handed and one-thumbed interactions are becoming the norm. In the first place, it\u2019s more comfortable. Second, it\u2019s not always convenient to use both hands. But here\u2019s the rub: one-handed usage limits how far your thumb can easily reach. Image Source: uxmatters This is why it\u2019s best to place an app\u2019s frequently-used actions at the bottom of the screen. Since top developers started paying more attention to how users interact with their devices, apps that assume one-handed usage are everywhere. The good news is that in striving to improve their products, large corporations also perfect user experience. The user\u2019s voice is invaluable, and the most popular services gather and analyze tons of information about their users, resulting in upgrades and product optimization. Typically, these changes involve usability, though updates aren\u2019t always visually apparent. While interacting with the device, you\u2019ll pick up on improvements and appreciate how your experience has become a lot more natural and effortless. Feedback-inspired product revamps are becoming more and more common on both iOS and Android platforms, and not just with big companies, but startups, too. Nowadays, every new startup has a definite edge: they can launch an app designed for one-handed usage right off the bat. Flipboard and Ada are excellent examples. Flipboard is a personalized magazine which aggregates content from news feeds and social media networks, enabling you to discover and share the stories, videos, and photos you love. Image Source: cuberto.com The screenshots indicate how Flipboard\u2019s core functionality is arranged. What\u2019s different is the absence of a nav bar at the top, which is usually typical of iOS. It\u2019s shifted to the bottom of the screen, into the thumb zone.Notice that the user profile button is in the hard-to-reach red zone, so Flipboard enables users to swipe right to open their profiles. Image Source: cuberto.com The search icon appears in the center of the display without shifting the keyboard, so it stays in the yellow zone, requiring the thumb to stretch a bit. Image Source: cuberto.com Ada\u2019s dev masters created a completely innovative navigation design. Ada is a health app which asks all the right questions and presents personalized information to improve well-being. The revolutionary interface is super simple. It\u2019s a flipped mirror image of a basic interface structure. Everything that\u2019s usually at the top is conveniently at the bottom, in the green zone. The start screen looks like this: Image Source: cuberto.com The hamburger menu is outdated because it hides app features off-screen, so Ada duplicates it with a more natural left swipe. Image Source: cuberto.com Menu list is placed lower and nobody\u2019s intimidated by the negative space because it\u2019s obviously deliberate.\u00a0Ada\u2019s subviews apply the thumb zone rubric, too. Image Source: cuberto.com Last year, we developed a concept for a calling app which applied one-hand navigation principles. The method feels especially intuitive for call or message apps since we tend to use one hand for dialing and texting, anyway. The design didn\u2019t take off from the concept stage because the client was wary of a total functionality overhaul which could alienate users who\u2019d had grown accustomed to the interface structure. Image Source:\u00a0cuberto We\u2019d like to single out Facebook Paper. A company with an immense following and a hugely popular application releases something innovative and intuitive. From a UX perspective, it was a bold experiment and it\u2019s unfortunate that it was shut down. The app was released in 2014 and there are plenty of detailed, high-quality reviews, like the one below. Conclusion First and foremost, app developers have to consider users and target audiences. These are the cornerstones of any future app\u2019s UX. The more simple, streamlined, and convenient your app, the higher its chances of reaching a wider audience. Keeping up with trends is a must\u200a\u2014\u200awhat\u2019s fresh today might grow stale by tomorrow. Cuberto sets the trend in creative websites and mobile apps. We dare what others don\u2019t. info@cuberto.com Follow us on Dribbble and Behance ", "child": "1481_1\t1481_21481_1\t1481_2"}