{"name": "1604", "parent": "", "title": "Healthy boundaries for\u00a0harmony", "sentences": [{"858b": "Healthy boundaries for\u00a0harmony"}, {"1ae4": "\u201cOne more show, Dad.\u201d"}, {"9de5": "(She\u2019s petitioning pretty hard, but it\u2019s cute, so I\u2019ll let it go.)"}, {"26bf": "\u201cOkay, Rory\u2026 Fine.\u201d"}, {"0f7e": "(Show finishes.)"}, {"583e": "\u201cOne more show, Dad.\u201d"}, {"35ff": "(Hesitating) \u201cOkay, fine\u2026\u201d"}, {"1df3": "(Show finishes.)"}, {"b58e": "\u201cJust one more show, okay, Dad?\u201d"}, {"0c95": "(Getting really damn frustrated, but there\u2019s JUST enough time if she watches one more show for us not to be late. Hesitating a lot\u2026)"}, {"c782": "\u201cFine, Rory, but that\u2019s IT, OKAY?\u201d"}, {"bd99": "\u201cOkay\u2026\u201d"}, {"cc30": "(Show finishes.)"}, {"1770": "\u201cJust one\u2026\u201d"}, {"3db7": "(Interrupting her) \u201cNo, Rory, that\u2019s it. We have to leave right now.\u201d"}, {"3344": "\u201cBut I have to change my dress.\u201d"}, {"cf65": "\u201cOkay, hurry.\u201d"}, {"0060": "\u201cBut I have to get my waaaater.\u201d"}, {"86f4": "\u201cHere\u2026 Here\u2019s your water. Let\u2019s go.\u201d"}, {"cf79": "\u201cBut you said I could have a cookie.\u201d"}, {"115b": "This is what I do. It\u2019s what I\u2019ve always done. I let people slide because I hate confrontation. I let them push the envelope waaaaay over to the other end of the table."}, {"049b": "Then, when things go awry, all of that tension escalates into a huge fireball of anger. Because then, I\u2019m not just mad at the situation. I\u2019m shaming myself for being such a pushover. I\u2019m pissed at them for putting me in the position of having to say yes to their ridiculous demands. And all of the other layers of complexity that have been stacked on top of said situation due to my passivity."}, {"4862": "(If you\u2019re not more self-aware after raising kids, I have to ask where you\u2019ve been the whole time.)"}, {"c1af": "Draw healthy, calm, reasonable boundaries. Yes, with your kids, but also with your boss, your roommate, your mother-in-law, your husband, and yourself."}, {"2bd1": "Notice I didn\u2019t say firm, rigid, unrealistic boundaries. Doing this will set you up for a life of disappointment."}, {"6dbc": "Determine your \u2018do not cross\u2019 line in advance. Leave room for some leeway (yes, life happens). And hold to it. If you have to hold the line, you\u2019re better off doing it before the anger builds. You\u2019ll be able to do so in a calm, assertive way."}, {"05ea": "Jonas writes short daily stories and preachments on the daily here in Higher Thoughts. Get one to enjoy with your coffee every morning by subscribing below."}], "content": "Healthy boundaries for\u00a0harmony \u201cOne more show, Dad.\u201d (She\u2019s petitioning pretty hard, but it\u2019s cute, so I\u2019ll let it go.) \u201cOkay, Rory\u2026 Fine.\u201d (Show finishes.) \u201cOne more show, Dad.\u201d (Hesitating) \u201cOkay, fine\u2026\u201d (Show finishes.) \u201cJust one more show, okay, Dad?\u201d (Getting really damn frustrated, but there\u2019s JUST enough time if she watches one more show for us not to be late. Hesitating a lot\u2026) \u201cFine, Rory, but that\u2019s IT, OKAY?\u201d \u201cOkay\u2026\u201d (Show finishes.) \u201cJust one\u2026\u201d (Interrupting her) \u201cNo, Rory, that\u2019s it. We have to leave right now.\u201d \u201cBut I have to change my dress.\u201d \u201cOkay, hurry.\u201d \u201cBut I have to get my waaaater.\u201d \u201cHere\u2026 Here\u2019s your water. Let\u2019s go.\u201d \u201cBut you said I could have a cookie.\u201d This is what I do. It\u2019s what I\u2019ve always done. I let people slide because I hate confrontation. I let them push the envelope waaaaay over to the other end of the table. Then, when things go awry, all of that tension escalates into a huge fireball of anger. Because then, I\u2019m not just mad at the situation. I\u2019m shaming myself for being such a pushover. I\u2019m pissed at them for putting me in the position of having to say yes to their ridiculous demands. And all of the other layers of complexity that have been stacked on top of said situation due to my passivity. (If you\u2019re not more self-aware after raising kids, I have to ask where you\u2019ve been the whole time.) Draw healthy, calm, reasonable boundaries. Yes, with your kids, but also with your boss, your roommate, your mother-in-law, your husband, and yourself. Notice I didn\u2019t say firm, rigid, unrealistic boundaries. Doing this will set you up for a life of disappointment. Determine your \u2018do not cross\u2019 line in advance. Leave room for some leeway (yes, life happens). And hold to it. If you have to hold the line, you\u2019re better off doing it before the anger builds. You\u2019ll be able to do so in a calm, assertive way. Jonas writes short daily stories and preachments on the daily here in Higher Thoughts. Get one to enjoy with your coffee every morning by subscribing below. ", "child": "1604_1\t1604_2\t1604_3\t1604_4\t1604_5\t1604_6\t1604_7\t1604_8\t1604_9\t1604_101604_1\t1604_2\t1604_3\t1604_4\t1604_5\t1604_6\t1604_7\t1604_8\t1604_9\t1604_10"}