{"name": "1669", "parent": "", "title": "Urban Meyer Wants to Take the Inexperienced Buckeyes to the\u00a0Edge", "sentences": [{"b039": "Urban Meyer Wants to Take the Inexperienced Buckeyes to the\u00a0Edge"}, {"1cd5": "But what happens once the young team gets\u00a0there?"}, {"c5f9": "\u201cIt\u2019s not that kind of an edge.\u201d"}, {"eb46": "Tim Kight, founder and president of the leadership consulting firm Focus 3, is talking about the sessions he\u2019s been leading at Ohio State over the past four years. He\u2019s been explaining his \u201cE+R=O\u201d formula\u200a\u2014\u200aevent plus response equals outcome\u200a\u2014\u200aand how it can be applied to any walk of life."}, {"0bc1": "Kight, a former athlete himself, met Buckeyes coach Urban Meyer at a fundraiser at the coach\u2019s house in 2013. The two fell to talking and Meyer was enthralled by Kight\u2019s philosophy."}, {"e67c": "Though \u201cE+R=O\u201d fits neatly on a wristband, it may not exactly resonate with 18- to 22-year-olds, so Meyer has taken to coining two-word catchphrases to encapsulate the idea. This year, he\u2019s calling it \u201cThe Edge,\u201d the latest in a line of mantras almost as long as his r\u00e9sum\u00e9 entry for the school. In 2014, it was \u201cThe Chase.\u201d In 2015, \u201cThe Grind.\u201d"}, {"c570": "And while talk of edges can lead to mental images of cliffs\u200a\u2014\u200aplaces where you can enjoy the view\u00a0\u2026 but need to watch your footing\u200a\u2014\u200ain Columbus it means something else."}, {"60ce": "\u201cIt\u2019s not the edge and then a precipice,\u201d Kight tells The Ringer. \u201cIt\u2019s a barrier.\u201d"}, {"e883": "He explains \u201cThe Edge\u201d like this: Picture a chalkboard. On the left side, there\u2019s a circle. On the right side, there\u2019s another circle. Connecting the two is a horizontal line. The circle on the left represents the present. The circle on the right, the future."}, {"b5d2": "The line is the journey you must take from the left circle to the right, from your current skill set to a potential future, improved one. And on that journey, there will be obstacles you must overcome. That\u2019s \u201cThe Edge.\u201d"}, {"a93f": "\u201cIt\u2019s a barrier. A challenge,\u201d Kight says. \u201cWhen you get to that spot, you have to make a decision. What am I gonna do?\u201d"}, {"06bf": "A version of that question has been posed to Ohio State for months now. The Buckeyes return fewer starters (six, fewest in the nation) than they lost early to the NFL draft (nine). In fact, you could start a pretty good team with just the 12 OSU players who were drafted (including Joey Bosa, Ezekiel Elliott, Eli Apple, Taylor Decker, and Darron Lee)."}, {"5220": "Meyer\u2019s rebuilding Buckeyes are down 16 starters from the 12\u20131, no. 4\u2013ranked campaign of 2015. Is this the year they teeter and fall out of championship contention?"}, {"52e9": "Building a championship-caliber college program is a bit like walking a tightrope: Balance is everything."}, {"3f5f": "If you lean too much in one direction\u200a\u2014\u200aovervaluing the present at the expense of the future\u200a\u2014\u200ayou\u2019re liable to fall. You have to put one foot in front of the other and keep your eyes on the horizon even while every fiber in your body is screaming at you to look down."}, {"292c": "Meyer\u2019s been talking a lot lately about his team being out of balance. \u201cThe issue would be if it was a non-talented young team,\u201d he said at Big Ten media days in Chicago in July. \u201cAnd that\u2019s not the case at all. So it\u2019s a very young team, but talented.\u201d"}, {"a5a8": "The Buckeyes lost more than 70 percent of their offensive yards from last season. They boast only one QB with game experience. And they count a whopping 44 players on the roster who have never played in a college game before."}, {"aa5f": "Faced with that much turnover ahead of a new season, many coaches would be practicing media spin moves to rival those of their new ball carriers, lowering expectations in preparation for a year of rebuilding. The Ohio State doesn\u2019t really afford Meyer that option, though, and he\u2019ll have to make do with the starters he has."}, {"58c2": "It helps OSU\u2019s 2016 chances that three of the six returning starters are stud QB J.T. Barrett (career 45\u201314 TD-INT ratio and 67 total touchdowns in 23 career games), linebacker Raekwon McMillan (first on the team and fourth in the Big 10 in tackles as a sophomore), and center Pat Elflein (29 career starts and a First-Team All\u2013Big Ten selection the last two years). That gives the team a veteran player at three key positions."}, {"5631": "Meyer and Co. also had another banner year on the recruiting trail, reeling in 17 four-star recruits and one five-star recruit\u200a\u2014\u200aboth leading or tied for the lead in the Big Ten this year. According to 247sports, the Buckeyes landed the no. 4 class in the country. That\u2019s after finishing no. 7 in 2015, no. 3 in 2014, and no. 2 in 2013."}, {"10c4": "The latest haul is highlighted by consensus top-10 recruit Nick Bosa (Joey\u2019s younger brother), linebacker Keandre Jones, receiver Austin Mack, and offensive lineman Michael Jordan. All four are among those expected to contribute as freshmen."}, {"697a": "College Football\u2019s Future Phenoms Have ArrivedTop-ranked recruit Rashan Gary isn\u2019t the only freshman primed to break outtheringer.com"}, {"6f29": "Meyer has said his goal is to play every freshman on the roster, but that is much easier said than done. There\u2019s a lot to cram in the short window before kickoff on the first Saturday in September."}, {"c79c": "\u201cHow do you stay healthy yet put them in gamelike situations as much as possible during training camp,\u201d Meyer asked rhetorically at Big Ten media days. \u201cThat\u2019s what is keeping me awake a little bit right now.\u00a0\u2026 [How] do you let them experience third-down-and-6 at full speed, full reps and still have a healthy team by the time you get to September 3?\u201d"}, {"d691": "And while Meyer and his staff can devise all sorts of ways to simulate game situations, as the clich\u00e9 goes there\u2019s really no substitute for the real thing. The only way to know how a young player will react on the big stage is to throw him a costume, shove him into the spotlight, and hope he doesn\u2019t forget his lines."}, {"0beb": "\u201cIf we see some guys step up like we did in \u201914 [when OSU won the national title]\u200a\u2014\u200aand last year\u200a\u2014\u200athen we have a chance to be special,\u201d Meyer said after the first day of fall practice."}, {"f985": "The question left unasked there, of course, is this: What happens if this time no one steps up?"}, {"123a": "Some schools would temper expectations after a talent drain the likes of OSU\u2019s this offseason. The Buckeyes aren\u2019t willing (or able) to go there."}, {"727d": "Barrett, now the unquestioned starter at quarterback after an injury-shortened 2014 and timeshare-marred 2015, dismissed talk of reduced expectations out of hand at Big Ten media days."}, {"08d6": "\u201cThere\u2019s a certain standard at Ohio State,\u201d the junior signal-caller told reporters, \u201cand it shouldn\u2019t change for anybody. I don\u2019t care how many people you lost."}, {"f01d": "\u201cYou want us to tell the fans, \u2018Hey, we lost some guys, so yeah, I don\u2019t know about that Big Ten championship\u200a\u2014\u200asorry?\u2019 Buckeye Nation would look at you crazy: \u2018What are you talking about? Come on.\u2019\u201d"}, {"5dfb": "The Buckeyes are ranked no. 6 in the preseason AP poll, higher than any other team in the conference, showing that not only are observers unwilling to count Meyer and Co. out, but many still expect them to be title contenders."}, {"dc4b": "\u201cWe have a lot of momentum here at Ohio State right now,\u201d Meyer said during camp. \u201cWe can\u2019t lose it just because we lost some great players.\u201d"}, {"77a3": "So the Buckeyes will lean heavily on their few veteran players and hope redshirt freshman Mike Weber (the top-ranked recruit out of Michigan in 2015) can follow in Ezekiel Elliott\u2019s footsteps at running back, Nick Bosa can one-up big brother Joey, and Jordan can not only become the second true freshman to start on the O-line under Meyer but also thrive in the role."}, {"c77d": "They\u2019ll find out quickly what they have in Columbus, because after opening with Bowling Green and Tulsa at home, the Buckeyes travel to Oklahoma for a Week 3 matchup with Baker Mayfield\u2019s third-ranked Sooners."}, {"f6cb": "Call that the first real opportunity to encounter \u201cThe Edge.\u201d"}, {"cdd0": "\u201cOne of the things in this sport, talent is a commodity,\u201d Kight, the leadership consultant, said. \u201cOnce you have recruited kids and they come on campus, the differentiating factor isn\u2019t talent\u200a\u2014\u200abecause everyone\u2019s got talent.\u201d"}, {"8200": "The OSU brass believes that what will separate the Buckeyes from the pack is belief in the process they\u2019ve adopted."}, {"ff6e": "\u201cWe\u2019ve had a bunch of great players roll through [Columbus], and they had one thing in common: It wasn\u2019t height, weight, vertical jump or 40-yard dash time, it was when it got really hard they got really good,\u201d Meyer said. \u201cThere are other guys we had that just didn\u2019t materialize and it wasn\u2019t because of vertical jump and speed and whatever. It was because when it got hard they didn\u2019t like it.\u201d"}, {"ce65": "Last season, just one loss (by three points against Michigan State) was enough to keep Ohio State out of the College Football Playoff. And that was before the talent exodus of 2016. Despite the roster turnover, the goals in Columbus haven\u2019t changed. But no one can say with any certainty that the Buckeyes will be in title contention come Thanksgiving, because no one knows for sure what OSU\u2019s untested players will do when they reach the edge."}, {"119f": "An earlier version of this post misidentified the location of the Buckeyes\u2019 2015 loss. The game occurred at Ohio State, not Michigan State."}], "content": "Urban Meyer Wants to Take the Inexperienced Buckeyes to the\u00a0Edge But what happens once the young team gets\u00a0there? \u201cIt\u2019s not that kind of an edge.\u201d Tim Kight, founder and president of the leadership consulting firm Focus 3, is talking about the sessions he\u2019s been leading at Ohio State over the past four years. He\u2019s been explaining his \u201cE+R=O\u201d formula\u200a\u2014\u200aevent plus response equals outcome\u200a\u2014\u200aand how it can be applied to any walk of life. Kight, a former athlete himself, met Buckeyes coach Urban Meyer at a fundraiser at the coach\u2019s house in 2013. The two fell to talking and Meyer was enthralled by Kight\u2019s philosophy. Though \u201cE+R=O\u201d fits neatly on a wristband, it may not exactly resonate with 18- to 22-year-olds, so Meyer has taken to coining two-word catchphrases to encapsulate the idea. This year, he\u2019s calling it \u201cThe Edge,\u201d the latest in a line of mantras almost as long as his r\u00e9sum\u00e9 entry for the school. In 2014, it was \u201cThe Chase.\u201d In 2015, \u201cThe Grind.\u201d And while talk of edges can lead to mental images of cliffs\u200a\u2014\u200aplaces where you can enjoy the view\u00a0\u2026 but need to watch your footing\u200a\u2014\u200ain Columbus it means something else. \u201cIt\u2019s not the edge and then a precipice,\u201d Kight tells The Ringer. \u201cIt\u2019s a barrier.\u201d He explains \u201cThe Edge\u201d like this: Picture a chalkboard. On the left side, there\u2019s a circle. On the right side, there\u2019s another circle. Connecting the two is a horizontal line. The circle on the left represents the present. The circle on the right, the future. The line is the journey you must take from the left circle to the right, from your current skill set to a potential future, improved one. And on that journey, there will be obstacles you must overcome. That\u2019s \u201cThe Edge.\u201d \u201cIt\u2019s a barrier. A challenge,\u201d Kight says. \u201cWhen you get to that spot, you have to make a decision. What am I gonna do?\u201d A version of that question has been posed to Ohio State for months now. The Buckeyes return fewer starters (six, fewest in the nation) than they lost early to the NFL draft (nine). In fact, you could start a pretty good team with just the 12 OSU players who were drafted (including Joey Bosa, Ezekiel Elliott, Eli Apple, Taylor Decker, and Darron Lee). Meyer\u2019s rebuilding Buckeyes are down 16 starters from the 12\u20131, no. 4\u2013ranked campaign of 2015. Is this the year they teeter and fall out of championship contention? Building a championship-caliber college program is a bit like walking a tightrope: Balance is everything. If you lean too much in one direction\u200a\u2014\u200aovervaluing the present at the expense of the future\u200a\u2014\u200ayou\u2019re liable to fall. You have to put one foot in front of the other and keep your eyes on the horizon even while every fiber in your body is screaming at you to look down. Meyer\u2019s been talking a lot lately about his team being out of balance. \u201cThe issue would be if it was a non-talented young team,\u201d he said at Big Ten media days in Chicago in July. \u201cAnd that\u2019s not the case at all. So it\u2019s a very young team, but talented.\u201d The Buckeyes lost more than 70 percent of their offensive yards from last season. They boast only one QB with game experience. And they count a whopping 44 players on the roster who have never played in a college game before. Faced with that much turnover ahead of a new season, many coaches would be practicing media spin moves to rival those of their new ball carriers, lowering expectations in preparation for a year of rebuilding. The Ohio State doesn\u2019t really afford Meyer that option, though, and he\u2019ll have to make do with the starters he has. It helps OSU\u2019s 2016 chances that three of the six returning starters are stud QB J.T. Barrett (career 45\u201314 TD-INT ratio and 67 total touchdowns in 23 career games), linebacker Raekwon McMillan (first on the team and fourth in the Big 10 in tackles as a sophomore), and center Pat Elflein (29 career starts and a First-Team All\u2013Big Ten selection the last two years). That gives the team a veteran player at three key positions. Meyer and Co. also had another banner year on the recruiting trail, reeling in 17 four-star recruits and one five-star recruit\u200a\u2014\u200aboth leading or tied for the lead in the Big Ten this year. According to 247sports, the Buckeyes landed the no. 4 class in the country. That\u2019s after finishing no. 7 in 2015, no. 3 in 2014, and no. 2 in 2013. The latest haul is highlighted by consensus top-10 recruit Nick Bosa (Joey\u2019s younger brother), linebacker Keandre Jones, receiver Austin Mack, and offensive lineman Michael Jordan. All four are among those expected to contribute as freshmen. College Football\u2019s Future Phenoms Have ArrivedTop-ranked recruit Rashan Gary isn\u2019t the only freshman primed to break outtheringer.com Meyer has said his goal is to play every freshman on the roster, but that is much easier said than done. There\u2019s a lot to cram in the short window before kickoff on the first Saturday in September. \u201cHow do you stay healthy yet put them in gamelike situations as much as possible during training camp,\u201d Meyer asked rhetorically at Big Ten media days. \u201cThat\u2019s what is keeping me awake a little bit right now.\u00a0\u2026 [How] do you let them experience third-down-and-6 at full speed, full reps and still have a healthy team by the time you get to September 3?\u201d And while Meyer and his staff can devise all sorts of ways to simulate game situations, as the clich\u00e9 goes there\u2019s really no substitute for the real thing. The only way to know how a young player will react on the big stage is to throw him a costume, shove him into the spotlight, and hope he doesn\u2019t forget his lines. \u201cIf we see some guys step up like we did in \u201914 [when OSU won the national title]\u200a\u2014\u200aand last year\u200a\u2014\u200athen we have a chance to be special,\u201d Meyer said after the first day of fall practice. The question left unasked there, of course, is this: What happens if this time no one steps up? Some schools would temper expectations after a talent drain the likes of OSU\u2019s this offseason. The Buckeyes aren\u2019t willing (or able) to go there. Barrett, now the unquestioned starter at quarterback after an injury-shortened 2014 and timeshare-marred 2015, dismissed talk of reduced expectations out of hand at Big Ten media days. \u201cThere\u2019s a certain standard at Ohio State,\u201d the junior signal-caller told reporters, \u201cand it shouldn\u2019t change for anybody. I don\u2019t care how many people you lost. \u201cYou want us to tell the fans, \u2018Hey, we lost some guys, so yeah, I don\u2019t know about that Big Ten championship\u200a\u2014\u200asorry?\u2019 Buckeye Nation would look at you crazy: \u2018What are you talking about? Come on.\u2019\u201d The Buckeyes are ranked no. 6 in the preseason AP poll, higher than any other team in the conference, showing that not only are observers unwilling to count Meyer and Co. out, but many still expect them to be title contenders. \u201cWe have a lot of momentum here at Ohio State right now,\u201d Meyer said during camp. \u201cWe can\u2019t lose it just because we lost some great players.\u201d So the Buckeyes will lean heavily on their few veteran players and hope redshirt freshman Mike Weber (the top-ranked recruit out of Michigan in 2015) can follow in Ezekiel Elliott\u2019s footsteps at running back, Nick Bosa can one-up big brother Joey, and Jordan can not only become the second true freshman to start on the O-line under Meyer but also thrive in the role. They\u2019ll find out quickly what they have in Columbus, because after opening with Bowling Green and Tulsa at home, the Buckeyes travel to Oklahoma for a Week 3 matchup with Baker Mayfield\u2019s third-ranked Sooners. Call that the first real opportunity to encounter \u201cThe Edge.\u201d \u201cOne of the things in this sport, talent is a commodity,\u201d Kight, the leadership consultant, said. \u201cOnce you have recruited kids and they come on campus, the differentiating factor isn\u2019t talent\u200a\u2014\u200abecause everyone\u2019s got talent.\u201d The OSU brass believes that what will separate the Buckeyes from the pack is belief in the process they\u2019ve adopted. \u201cWe\u2019ve had a bunch of great players roll through [Columbus], and they had one thing in common: It wasn\u2019t height, weight, vertical jump or 40-yard dash time, it was when it got really hard they got really good,\u201d Meyer said. \u201cThere are other guys we had that just didn\u2019t materialize and it wasn\u2019t because of vertical jump and speed and whatever. It was because when it got hard they didn\u2019t like it.\u201d Last season, just one loss (by three points against Michigan State) was enough to keep Ohio State out of the College Football Playoff. And that was before the talent exodus of 2016. Despite the roster turnover, the goals in Columbus haven\u2019t changed. But no one can say with any certainty that the Buckeyes will be in title contention come Thanksgiving, because no one knows for sure what OSU\u2019s untested players will do when they reach the edge. An earlier version of this post misidentified the location of the Buckeyes\u2019 2015 loss. The game occurred at Ohio State, not Michigan State. ", "child": "1669_1\t1669_2"}