{"name": "1976", "parent": "", "title": "Defining your company values in\u00a0emoji", "sentences": [{"7840": "Defining your company values in\u00a0emoji"}, {"7f75": "The buried lede: We\u2019re hiring!"}, {"5560": "Company values are defined in the earliest days through the beliefs, words, and actions of the team. As a company matures, its culture and way of doing things becomes less malleable. \u201cYou can\u2019t teach an old dog new tricks,\u201d they say."}, {"2df3": "In early 2015, more than year after Product Hunt\u2019s founding, we set out to articulate our values. While already established, we lacked a common definition to communicate to new teammates and the public."}, {"8746": "Our process"}, {"c961": "Inspired by this article on Slack\u2019s company values, our awesome COO, Corley, led the process."}, {"8c8b": "We asked everyone on the team to come up with five words (and an associated image or GIF\u2026 because that\u2019s more fun) that represents our culture and way of doing things."}, {"6c49": "Together, each person shared their pick and meaning behind each word. As expected, there was a lot of overlap in suggestions as we grouped common words together. After narrowing down the list, we came to five words with (in true Product Hunt fashion) an associated emoji:"}, {"459f": "\ud83d\udcaf Bold\u200a\u2014\u200aEvery day, people launch their new side hustle or startup on Product Hunt. We encourage experimentation and bold ideas, both in the community and our own team."}, {"b5e4": "\ud83d\udc95 Empathy\u200a\u2014\u200aWe\u2019re proud of the community we\u2019ve assembled to date; a group of people that demonstrate respect and empathy, because they know how vulnerable makers are when introducing their baby (aka product) to the world."}, {"e98d": "\u26a1 Curious\u200a\u2014\u200aMakers often build things out of curiosity. That\u2019s how Product Hunt started. People visit the site with interest, curious to discover things that didn\u2019t exist yesterday."}, {"1e20": "\ud83d\ude39 Kittenish\u200a\u2014\u200aProduct Hunt could be so sterile and boring, a acronym-heavy conversation about CAC and TAM. From the beginning, we wanted it to be a place to have fun. The Google Glass-wearing cat wasn\u2019t an accident."}, {"e183": "\ud83d\udc8e Authentic\u200a\u2014\u200aLastly, authenticity is an important characteristic of the community. Product Hunt is one of the few places on the internet where makers and consumers can directly connect in an unfiltered way. We dissuade off-putting marketing speak and encourage people to talk like they do with a friend."}, {"0334": "The point of it\u00a0all"}, {"0a5a": "These words are not just hand waving. We use these to help guide:"}, {"5364": "If you haven\u2019t established company values, I\u2019d encourage you to give it a try and let us know how it goes."}, {"b41f": "Psst! We\u2019re\u00a0hiring."}, {"0873": "If you\u2019d like to be a part of the Product Hunt team, let us know!"}, {"6a8e": "We\u2019re looking for a Full-Stack Engineer and Product Designer to work with us in San Francisco or remotely (we hire talented people, no matter where they\u2019re from \ud83d\udc4b\ud83c\udffc)."}, {"5463": "Apply here."}], "content": "Defining your company values in\u00a0emoji The buried lede: We\u2019re hiring! Company values are defined in the earliest days through the beliefs, words, and actions of the team. As a company matures, its culture and way of doing things becomes less malleable. \u201cYou can\u2019t teach an old dog new tricks,\u201d they say. In early 2015, more than year after Product Hunt\u2019s founding, we set out to articulate our values. While already established, we lacked a common definition to communicate to new teammates and the public. Our process Inspired by this article on Slack\u2019s company values, our awesome COO, Corley, led the process. We asked everyone on the team to come up with five words (and an associated image or GIF\u2026 because that\u2019s more fun) that represents our culture and way of doing things. Together, each person shared their pick and meaning behind each word. As expected, there was a lot of overlap in suggestions as we grouped common words together. After narrowing down the list, we came to five words with (in true Product Hunt fashion) an associated emoji: \ud83d\udcaf Bold\u200a\u2014\u200aEvery day, people launch their new side hustle or startup on Product Hunt. We encourage experimentation and bold ideas, both in the community and our own team. \ud83d\udc95 Empathy\u200a\u2014\u200aWe\u2019re proud of the community we\u2019ve assembled to date; a group of people that demonstrate respect and empathy, because they know how vulnerable makers are when introducing their baby (aka product) to the world. \u26a1 Curious\u200a\u2014\u200aMakers often build things out of curiosity. That\u2019s how Product Hunt started. People visit the site with interest, curious to discover things that didn\u2019t exist yesterday. \ud83d\ude39 Kittenish\u200a\u2014\u200aProduct Hunt could be so sterile and boring, a acronym-heavy conversation about CAC and TAM. From the beginning, we wanted it to be a place to have fun. The Google Glass-wearing cat wasn\u2019t an accident. \ud83d\udc8e Authentic\u200a\u2014\u200aLastly, authenticity is an important characteristic of the community. Product Hunt is one of the few places on the internet where makers and consumers can directly connect in an unfiltered way. We dissuade off-putting marketing speak and encourage people to talk like they do with a friend. The point of it\u00a0all These words are not just hand waving. We use these to help guide: If you haven\u2019t established company values, I\u2019d encourage you to give it a try and let us know how it goes. Psst! We\u2019re\u00a0hiring. If you\u2019d like to be a part of the Product Hunt team, let us know! We\u2019re looking for a Full-Stack Engineer and Product Designer to work with us in San Francisco or remotely (we hire talented people, no matter where they\u2019re from \ud83d\udc4b\ud83c\udffc). Apply here. ", "child": "1976_1\t1976_2"}