{"name": "204", "parent": "", "title": "How Successful People Make A Ding In The\u00a0Universe", "sentences": [{"65ee": "How Successful People Make A Ding In The\u00a0Universe"}, {"3883": "Steve and Woz,\u00a01975"}, {"97a9": "There are certain common traits of people who put dings in the universe."}, {"19ec": "1. They\u2019re not good at everything."}, {"550b": "\u201cPlay to your strengths.\u201d"}, {"a9a4": "\u201cI haven\u2019t got any,\u201d said Harry, before he could stop himself."}, {"f697": "\u201cExcuse me,\u201d growled Moody, \u201cyou\u2019ve got strengths if I say you\u2019ve got them. Think now. What are you best at?\u201d\u00a0\u2015 J.K. Rowling, Harry Potter and the Goblet of Fire"}, {"ef5d": "When Atari hired Steve Jobs and Steve Wozniak to develop a video game in 1976, Wozniak had to build the actual product. Jobs didn\u2019t know how."}, {"afcf": "Woz recalls, \u201cThe game (Breakout) was not software in those days. It was hardware. A 6-man month job done in 4 days and nights with no sleep.\u201d Woz was the digital designer, and Steve Jobs was the businessman. Jobs could barely code or program. He knew just enough to know who should be on his technical team."}, {"8493": "They rely on the strengths on others, because they\u2019re not good at everything."}, {"3c31": "2. They make the world go from\u00a0this:"}, {"bc9a": "to this."}, {"9e20": "(In their\u00a0heads.)"}, {"9d6d": "They know they can\u2019t do it all, so they pick and say no to everything else."}, {"2be0": "3. They seek the truth, no matter\u00a0what."}, {"5fea": "The truth has value to people who want to crush it at anything, no matter what, even if it\u2019s ego-bruising."}, {"9411": "They don\u2019t turn away. They invite the truth in, because no matter how ugly it is, it sheds light on what they need to do."}, {"d76c": "They set up every situation so that the truth has the best chance to come out and lay the foundation for all of their decisions."}, {"f045": "\u201cThe upside of painful knowledge is so much greater than the downside of blissful ignorance.\u201d\u200a\u2014\u200aSheryl Sandberg, Lean In: Women, Work, and the Will To Lead"}, {"c3a5": "4. They\u2019re hyper-realistic."}, {"e181": "People who make dings in the universe know their probabilities better than anyone."}, {"dee0": "Tesla Motors should never have existed. The last American auto company created was 111 years ago, called Ford."}, {"2b78": "When Musk met Eberhard for the first time in 2004, they agreed that their most realistic business plan was to create a vastly superior car, rather than an electric car that sucked a little less."}, {"f0d8": "So they chose the sports car market, a small-size niche of the broader auto market, to attack first. Musk and Eberhard realized beforehand that forcing their way into the more saturated economy car market would be a losing game."}, {"5c83": "Wildly successful people assess their risks in detail before leaping. They handicap their potential failure points, and lay out their plans. They break down whatever\u2019s hazy until it\u2019s nuts and bolts. They make sure their strategy is as viable as possible, strategically and financially, from the get-go."}, {"a0a6": "Then they do it anyway."}, {"f8e9": "\u201cWhen something is important enough, you do it even if the odds are not in your favor.\u201d\u200a\u2014\u200aElon Musk"}, {"6a6b": "5. They see time as their most limited resource, never\u00a0money."}, {"816b": "\u201cTime abides long enough for those who make use of it.\u201d\u200a\u2014\u200aLeonardo da Vinci"}, {"7668": "Everything starts here. They know they can use time to make more money, but they can\u2019t use money to buy more time."}, {"dbc9": "People start out with different chips. Some are born rich while others are born poor. Some have Ivy League degrees and others start their careers as high school dropouts. But time is the great equalizer of life. Everyone has the same number of minutes per day."}, {"499f": "Therefore, people who make dings in our world know that they must carve out their time and dedicate it to realize great success at anything. It does not matter what their focus is."}, {"b8ca": "Time is their most valuable resource."}, {"1a66": "Harland David Sanders, founder of Kentucky Fried Chicken, once said, \u201cA tax man told me five years ago if I died, the government would get $900,000 in taxes. I told him if the good Lord let me live three years more I\u2019d give away Uncle Sam\u2019s share and $900,000 more. I never had any desire to be the richest man in the cemetery.\u201d"}, {"f8d8": "6. They\u2019ll listen, but rarely\u00a0agree."}, {"ffa2": "When he was 22 years old, Walt Disney was told that he \u201clacked imagination and had no good ideas,\u201d by one of his first bosses."}, {"e25a": "Then he was fired from at the Kansas City Star."}, {"6b54": "He tried to get MGM studios to distribute Mickey Mouse several years later, MGM said that the idea would never work because a giant mouse on the screen would terrify women. He and his brother decided to move to California and start Disney Brothers\u2019 Studio, where they created the terrifying mouse."}, {"4208": "They try to listen to feedback learn every step of the way, but they don\u2019t always agree. They\u2019re often contrarians."}, {"3042": "\u201cDon\u2019t let people talk you into what they think is you.\u201d\u200a\u2014\u200aOprah Winfrey"}, {"ddc8": "7. They build A-teams or no teams at\u00a0all."}, {"8a94": "They\u2019re obsessed with finding the right people. They know that people are everything."}, {"0df3": "Their teams have:"}, {"2798": "Even though the current bias in society is to believe that people are interchangeable and expendable, extremely successful people know this isn\u2019t true. Companies rise and fall based on the people who run them. Their team matters, so they\u2019re super choosy."}, {"c300": "They hire a team who feels the same way about who they hire. Thus, great company cultures are built."}, {"47a9": "\u201cIt\u2019s better to hang out with people better than you. Pick out associates whose behavior is better than yours and you\u2019ll drift in that direction.\u201d\u200a\u2014\u200aWarren Buffett"}, {"8c36": "8. They\u2019re obsessed with improvement."}, {"d125": "\u201cGenius is 1% inspiration and 99% perspiration.\u201d\u200a\u2014\u200aThomas Edison"}, {"f607": "It\u2019s simple. As Gary Vaynerchuk says, \u201c1 is greater than 0.\u201d"}, {"daf6": "They know that great achievements happen through a thousand small steps, compounded over time."}, {"e658": "They want to achieve overnight success, just like everyone else. But getting overwhelmed with unrealistic expectations is not an option."}, {"447b": "They do what it takes to improve 1% a day."}, {"8ae3": "9. They don\u2019t ask for permission."}, {"b07b": "\u201cThe time is always right to do what is right.\u201d\u200a\u2014\u200aMartin Luther King Jr."}, {"7299": "J.K. Rowling didn\u2019t feel she needed magic to accomplish anything. While struggling to support her daughter on welfare, Rowling wrote Harry Potter and the Sorcerer\u2019s Stone and sold it for $4,000. She explains: \u2018I was as poor as it\u2019s possible to be in this country. I was a single parent.\u201d"}, {"267a": "Sometimes she found herself inspired, but short on paper so she wrote on anything she could find. When she wanted to work out the names of the Hogwarts houses, she scribbled them on the back of an empty vomit bag in an airplane."}, {"57bd": "She\u2019s now richer than the Queen of England."}, {"d1df": "They don\u2019t let their resources hold them back. They find a way, and they sure as hell don\u2019t ask for permission."}, {"9981": "\u201cAnything\u2019s possible if you\u2019ve got enough nerve.\u201d\u200a\u2014\u200aJ. K. Rowling"}, {"36fe": "10. They don\u2019t let \u201cprocess\u201d become a substitute for thinking."}, {"7e61": "\u201cI don\u2019t believe in process. In fact, when I interview a potential employee and he or she says that \u2018it\u2019s all about the process,\u2019 I see that as a bad sign. The problem is that at a lot of big companies, process becomes a substitute for thinking. You\u2019re encouraged to behave like a little gear in a complex machine. Frankly, it allows you to keep people who aren\u2019t that smart, who aren\u2019t that creative.\u201d\u200a\u2014\u200aElon Musk"}, {"66cb": "They remember that nothing\u2019s a substitute for creativity."}, {"5282": "Einstein believed that the greatest scientists were artists as well. His insight didn\u2019t come from logic or mathematics, but inspiration. He played music when he got stuck. He never traveled anywhere without his violin, \u201cLina.\u201d"}, {"8517": "In order to be massively successful, they need to keep their thinking fresh. They never let process get in the way."}, {"c9c4": "11. They\u2019re willing to be unpopular."}, {"c442": "\u201cFirst they ignore you, then they laugh at you, then they fight you, then you win.\u201d\u200a\u2014\u200aMahatma GandhiThey view unpopular thinking as required for all progress."}, {"e2d1": "No one wants to be a martyr. It\u2019s just that thinking about a problem like everyone else will probably not going to lead to any breakthroughs."}, {"8ba2": "They know that popular thinking produces average results. They don\u2019t let popular opinion hold them back."}, {"01d4": "Martin Luther King Jr.,\u00a01958"}, {"c4b2": "12. They never stop learning."}, {"b160": "\u201cYou can\u2019t learn in school what the world is going to do next year.\u201d\u200a\u2014\u200aHenry FordThey may have graduated from school a long time ago, but their learning continues forever."}, {"0005": "This is why people who make dings in the universe tend to be voracious readers."}, {"8c66": "When Warren Buffett was once asked about the key to his success, he pointed to a stack of books and said, \u201cRead 500 pages like this every day. That\u2019s how knowledge works. It builds up, like compound interest. All of you can do it, but I guarantee not many of you will do it.\u201d"}, {"a7c3": "He actually used to read 600\u20131000 pages a day in his youth. Mark Zuckerberg read a book every two weeks through 2015. Oprah Winfrey is always reading. When asked how he learned how to build rockets, Elon Musk replied, \u201cI read books.\u201d"}, {"af43": "They invest in themselves through learning. It\u2019s self-empowering. It never stops."}, {"41b5": "Hit the \u2764 button if you liked this article! You\u2019ll help others find it."}, {"2fe0": "Sign up for my free weekly newsletter (packed with thoughts I don\u2019t share anywhere else) at janehwangbo.com."}], "content": "How Successful People Make A Ding In The\u00a0Universe Steve and Woz,\u00a01975 There are certain common traits of people who put dings in the universe. 1. They\u2019re not good at everything. \u201cPlay to your strengths.\u201d \u201cI haven\u2019t got any,\u201d said Harry, before he could stop himself. \u201cExcuse me,\u201d growled Moody, \u201cyou\u2019ve got strengths if I say you\u2019ve got them. Think now. What are you best at?\u201d\u00a0\u2015 J.K. Rowling, Harry Potter and the Goblet of Fire When Atari hired Steve Jobs and Steve Wozniak to develop a video game in 1976, Wozniak had to build the actual product. Jobs didn\u2019t know how. Woz recalls, \u201cThe game (Breakout) was not software in those days. It was hardware. A 6-man month job done in 4 days and nights with no sleep.\u201d Woz was the digital designer, and Steve Jobs was the businessman. Jobs could barely code or program. He knew just enough to know who should be on his technical team. They rely on the strengths on others, because they\u2019re not good at everything. 2. They make the world go from\u00a0this: to this. (In their\u00a0heads.) They know they can\u2019t do it all, so they pick and say no to everything else. 3. They seek the truth, no matter\u00a0what. The truth has value to people who want to crush it at anything, no matter what, even if it\u2019s ego-bruising. They don\u2019t turn away. They invite the truth in, because no matter how ugly it is, it sheds light on what they need to do. They set up every situation so that the truth has the best chance to come out and lay the foundation for all of their decisions. \u201cThe upside of painful knowledge is so much greater than the downside of blissful ignorance.\u201d\u200a\u2014\u200aSheryl Sandberg, Lean In: Women, Work, and the Will To Lead 4. They\u2019re hyper-realistic. People who make dings in the universe know their probabilities better than anyone. Tesla Motors should never have existed. The last American auto company created was 111 years ago, called Ford. When Musk met Eberhard for the first time in 2004, they agreed that their most realistic business plan was to create a vastly superior car, rather than an electric car that sucked a little less. So they chose the sports car market, a small-size niche of the broader auto market, to attack first. Musk and Eberhard realized beforehand that forcing their way into the more saturated economy car market would be a losing game. Wildly successful people assess their risks in detail before leaping. They handicap their potential failure points, and lay out their plans. They break down whatever\u2019s hazy until it\u2019s nuts and bolts. They make sure their strategy is as viable as possible, strategically and financially, from the get-go. Then they do it anyway. \u201cWhen something is important enough, you do it even if the odds are not in your favor.\u201d\u200a\u2014\u200aElon Musk 5. They see time as their most limited resource, never\u00a0money. \u201cTime abides long enough for those who make use of it.\u201d\u200a\u2014\u200aLeonardo da Vinci Everything starts here. They know they can use time to make more money, but they can\u2019t use money to buy more time. People start out with different chips. Some are born rich while others are born poor. Some have Ivy League degrees and others start their careers as high school dropouts. But time is the great equalizer of life. Everyone has the same number of minutes per day. Therefore, people who make dings in our world know that they must carve out their time and dedicate it to realize great success at anything. It does not matter what their focus is. Time is their most valuable resource. Harland David Sanders, founder of Kentucky Fried Chicken, once said, \u201cA tax man told me five years ago if I died, the government would get $900,000 in taxes. I told him if the good Lord let me live three years more I\u2019d give away Uncle Sam\u2019s share and $900,000 more. I never had any desire to be the richest man in the cemetery.\u201d 6. They\u2019ll listen, but rarely\u00a0agree. When he was 22 years old, Walt Disney was told that he \u201clacked imagination and had no good ideas,\u201d by one of his first bosses. Then he was fired from at the Kansas City Star. He tried to get MGM studios to distribute Mickey Mouse several years later, MGM said that the idea would never work because a giant mouse on the screen would terrify women. He and his brother decided to move to California and start Disney Brothers\u2019 Studio, where they created the terrifying mouse. They try to listen to feedback learn every step of the way, but they don\u2019t always agree. They\u2019re often contrarians. \u201cDon\u2019t let people talk you into what they think is you.\u201d\u200a\u2014\u200aOprah Winfrey 7. They build A-teams or no teams at\u00a0all. They\u2019re obsessed with finding the right people. They know that people are everything. Their teams have: Even though the current bias in society is to believe that people are interchangeable and expendable, extremely successful people know this isn\u2019t true. Companies rise and fall based on the people who run them. Their team matters, so they\u2019re super choosy. They hire a team who feels the same way about who they hire. Thus, great company cultures are built. \u201cIt\u2019s better to hang out with people better than you. Pick out associates whose behavior is better than yours and you\u2019ll drift in that direction.\u201d\u200a\u2014\u200aWarren Buffett 8. They\u2019re obsessed with improvement. \u201cGenius is 1% inspiration and 99% perspiration.\u201d\u200a\u2014\u200aThomas Edison It\u2019s simple. As Gary Vaynerchuk says, \u201c1 is greater than 0.\u201d They know that great achievements happen through a thousand small steps, compounded over time. They want to achieve overnight success, just like everyone else. But getting overwhelmed with unrealistic expectations is not an option. They do what it takes to improve 1% a day. 9. They don\u2019t ask for permission. \u201cThe time is always right to do what is right.\u201d\u200a\u2014\u200aMartin Luther King Jr. J.K. Rowling didn\u2019t feel she needed magic to accomplish anything. While struggling to support her daughter on welfare, Rowling wrote Harry Potter and the Sorcerer\u2019s Stone and sold it for $4,000. She explains: \u2018I was as poor as it\u2019s possible to be in this country. I was a single parent.\u201d Sometimes she found herself inspired, but short on paper so she wrote on anything she could find. When she wanted to work out the names of the Hogwarts houses, she scribbled them on the back of an empty vomit bag in an airplane. She\u2019s now richer than the Queen of England. They don\u2019t let their resources hold them back. They find a way, and they sure as hell don\u2019t ask for permission. \u201cAnything\u2019s possible if you\u2019ve got enough nerve.\u201d\u200a\u2014\u200aJ. K. Rowling 10. They don\u2019t let \u201cprocess\u201d become a substitute for thinking. \u201cI don\u2019t believe in process. In fact, when I interview a potential employee and he or she says that \u2018it\u2019s all about the process,\u2019 I see that as a bad sign. The problem is that at a lot of big companies, process becomes a substitute for thinking. You\u2019re encouraged to behave like a little gear in a complex machine. Frankly, it allows you to keep people who aren\u2019t that smart, who aren\u2019t that creative.\u201d\u200a\u2014\u200aElon Musk They remember that nothing\u2019s a substitute for creativity. Einstein believed that the greatest scientists were artists as well. His insight didn\u2019t come from logic or mathematics, but inspiration. He played music when he got stuck. He never traveled anywhere without his violin, \u201cLina.\u201d In order to be massively successful, they need to keep their thinking fresh. They never let process get in the way. 11. They\u2019re willing to be unpopular. \u201cFirst they ignore you, then they laugh at you, then they fight you, then you win.\u201d\u200a\u2014\u200aMahatma GandhiThey view unpopular thinking as required for all progress. No one wants to be a martyr. It\u2019s just that thinking about a problem like everyone else will probably not going to lead to any breakthroughs. They know that popular thinking produces average results. They don\u2019t let popular opinion hold them back. Martin Luther King Jr.,\u00a01958 12. They never stop learning. \u201cYou can\u2019t learn in school what the world is going to do next year.\u201d\u200a\u2014\u200aHenry FordThey may have graduated from school a long time ago, but their learning continues forever. This is why people who make dings in the universe tend to be voracious readers. When Warren Buffett was once asked about the key to his success, he pointed to a stack of books and said, \u201cRead 500 pages like this every day. That\u2019s how knowledge works. It builds up, like compound interest. All of you can do it, but I guarantee not many of you will do it.\u201d He actually used to read 600\u20131000 pages a day in his youth. Mark Zuckerberg read a book every two weeks through 2015. Oprah Winfrey is always reading. When asked how he learned how to build rockets, Elon Musk replied, \u201cI read books.\u201d They invest in themselves through learning. It\u2019s self-empowering. It never stops. Hit the \u2764 button if you liked this article! You\u2019ll help others find it. Sign up for my free weekly newsletter (packed with thoughts I don\u2019t share anywhere else) at janehwangbo.com. ", "child": "204_1\t204_2\t204_3\t204_4\t204_5\t204_6\t204_7\t204_8\t204_9\t204_10\t204_11\t204_12\t204_13\t204_14\t204_15\t204_16\t204_17\t204_18\t204_19\t204_20\t204_21\t204_22\t204_23\t204_24204_1\t204_2\t204_3\t204_4\t204_5\t204_6\t204_7\t204_8\t204_9\t204_10\t204_11\t204_12\t204_13\t204_14\t204_15\t204_16\t204_17\t204_18\t204_19\t204_20\t204_21\t204_22\t204_23\t204_24204_1\t204_2\t204_3\t204_4\t204_5\t204_6\t204_7\t204_8\t204_9\t204_10\t204_11\t204_12\t204_13\t204_14\t204_15\t204_16\t204_17\t204_18\t204_19\t204_20\t204_21\t204_22\t204_23\t204_24204_1\t204_2\t204_3\t204_4\t204_5\t204_6\t204_7\t204_8\t204_9\t204_10\t204_11\t204_12\t204_13\t204_14\t204_15\t204_16\t204_17\t204_18\t204_19\t204_20\t204_21\t204_22\t204_23\t204_24204_1\t204_2\t204_3\t204_4\t204_5\t204_6\t204_7\t204_8\t204_9\t204_10\t204_11\t204_12\t204_13\t204_14\t204_15\t204_16\t204_17\t204_18\t204_19\t204_20\t204_21\t204_22\t204_23\t204_24204_1\t204_2\t204_3\t204_4\t204_5\t204_6\t204_7\t204_8\t204_9\t204_10\t204_11\t204_12\t204_13\t204_14\t204_15\t204_16\t204_17\t204_18\t204_19\t204_20\t204_21\t204_22\t204_23\t204_24204_1\t204_2\t204_3\t204_4\t204_5\t204_6\t204_7\t204_8\t204_9\t204_10\t204_11\t204_12\t204_13\t204_14\t204_15\t204_16\t204_17\t204_18\t204_19\t204_20\t204_21\t204_22\t204_23\t204_24204_1\t204_2\t204_3\t204_4\t204_5\t204_6\t204_7\t204_8\t204_9\t204_10\t204_11\t204_12\t204_13\t204_14\t204_15\t204_16\t204_17\t204_18\t204_19\t204_20\t204_21\t204_22\t204_23\t204_24204_1\t204_2\t204_3\t204_4\t204_5\t204_6\t204_7\t204_8\t204_9\t204_10\t204_11\t204_12\t204_13\t204_14\t204_15\t204_16\t204_17\t204_18\t204_19\t204_20\t204_21\t204_22\t204_23\t204_24204_1\t204_2\t204_3\t204_4\t204_5\t204_6\t204_7\t204_8\t204_9\t204_10\t204_11\t204_12\t204_13\t204_14\t204_15\t204_16\t204_17\t204_18\t204_19\t204_20\t204_21\t204_22\t204_23\t204_24204_1\t204_2\t204_3\t204_4\t204_5\t204_6\t204_7\t204_8\t204_9\t204_10\t204_11\t204_12\t204_13\t204_14\t204_15\t204_16\t204_17\t204_18\t204_19\t204_20\t204_21\t204_22\t204_23\t204_24204_1\t204_2\t204_3\t204_4\t204_5\t204_6\t204_7\t204_8\t204_9\t204_10\t204_11\t204_12\t204_13\t204_14\t204_15\t204_16\t204_17\t204_18\t204_19\t204_20\t204_21\t204_22\t204_23\t204_24"}