{"name": "2093", "parent": "", "title": "Dicas para se tornar um desenvolvedor melhor", "sentences": [{"606e": "Dicas para se tornar um desenvolvedor melhor"}, {"bc32": "O artigo da vez tamb\u00e9m n\u00e3o \u00e9 nada t\u00e9cnico (mas tamb\u00e9m n\u00e3o \u00e9 pol\u00eamico como o anterior haha), mas sim um punhado de coisas que eu gostaria que algu\u00e9m tivesse me dito quando comecei a aprender a desenvolver, ent\u00e3o espero que as dicas aqui reunidas sirvam pelo menos para repensar algumas coisas."}, {"3680": "Dessa vez, trago o novo clipe da dupla brit\u00e2nica Royal Blood. Depois de um aclamado primeiro \u00e1lbum (o hom\u00f4nimo Royal Blood, de 2014) a dupla promete n\u00e3o decepcionar:"}, {"bc05": "O mais louco de ouvir Royal Blood \u00e9 pensar que tudo isso que est\u00e1 acontecendo sai de apenas uma bateria e um baixo (sim, um baixo!), o que nos traz toda a nostalgia de ver a The White Stripes de Jack e Meg White tocar. Resta aguardar o lan\u00e7amento do \u00e1lbum completo, mas podemos esperar uma linha bem parecida com o \u00e1lbum debutante."}, {"35fc": "Participe da comunidade"}, {"bd0a": "Ser um desenvolvedor ativo na comunidade s\u00f3 te traz ventura. V\u00e1 \u00e0 todos eventos poss\u00edveis, participe de meetups e palestras e tudo mais que voc\u00ea puder. Se voc\u00ea mora numa cidade pequena ou n\u00e3o tem tanto tempo quanto gostaria (al\u00f4 al\u00f4 faculdade), voc\u00ea pode ser ativo remotamente por meio de grupos do Facebook, Github ou Slack. A comunidade de desenvolvimento \u00e9 repleta de gente interessada em compartilhar conhecimento e discutir sobre desenvolvimento, o que nos leva a\u2026"}, {"fda5": "Contribua"}, {"4a18": "As melhores maneiras de aprender algo de verdade s\u00e3o:"}, {"f324": "E felizmente no mundo do desenvolvimento temos as duas possibilidades. Voc\u00ea pode repassar conhecimento de diversas formas: desde ministrar palestras, escrever artigos e preparar cursos online at\u00e9 adotar um pupilo."}, {"c023": "Maneiras de colocar a m\u00e3o na massa tamb\u00e9m n\u00e3o faltam: muitos projetos open source para se contribuir ou at\u00e9 mesmo novas ideias esperando para serem colocadas em pr\u00e1tica. Trabalho volunt\u00e1rio tamb\u00e9m \u00e9 um op\u00e7\u00e3o muito vi\u00e1vel, principalmente para quem est\u00e1 come\u00e7ando agora e precisa montar portif\u00f3lio."}, {"fb77": "Aprenda ingl\u00eas"}, {"64d8": "Sinto que essa aqui \u00e9 chover no molhado, mas esse \u00e9 um ponto important\u00edssimo que quem deixa passar batido sente muita falta no futuro. Muito do conte\u00fado (principalmente sobre as ferramentas mais vanguardistas) dispon\u00edvel na internet est\u00e1 em ingl\u00eas, portanto dominar minimamente o idioma amplia suas possibilidades de aprendizado."}, {"3a72": "Isso sem falar que \u00e9 quase unanimidade que toda contribui\u00e7\u00e3o \u00e0 projetos colaborativos precisam ser em ingl\u00eas (desde documenta\u00e7\u00f5es, nomes de m\u00e9todos e vari\u00e1veis at\u00e9 mensagens de commit)."}, {"ac8c": "Aprender ingl\u00eas te possibilita conseguir melhores oportunidades de trabalho (internacionais ou n\u00e3o), ent\u00e3o n\u00e3o deixe esse aprendizado em segundo plano."}, {"4287": "B\u00f4nus: Quer juntar a dica 2 e 3? Comece a traduzir artigos em ingl\u00eas! Voc\u00ea estar\u00e1 ajudando a comunidade e treinando o idioma! S\u00f3 n\u00e3o esquece de pedir permiss\u00e3o para os autores\u00a0:p"}, {"ba70": "Respeita as mina (e os mano\u00a0tamb\u00e9m)"}, {"6487": "Devemos cultivar uma comunidade inclusiva onde ningu\u00e9m tenha medo de se expressar e aprender. Voc\u00ea pode contribuir com programas inclusivos ou pelo menos n\u00e3o seja babaca."}, {"f092": "N\u00e3o tente ser melhor que ningu\u00e9m al\u00e9m de voc\u00ea\u00a0mesmo."}, {"1a3e": "N\u00e3o se apegue \u00e0 libs (ou frameworks ou whatever)"}, {"5702": "Uma verdade inexor\u00e1vel sobre o ecossistema de desenvolvimento: as libs v\u00eam e v\u00e3o, e cada vez mais seu ciclo de vida est\u00e1 mais curto."}, {"6cd0": "\u00c9 muito legal estar antenado nas \u00faltimas novidades (e s\u00e9rio, voc\u00ea deve continuar fazendo isso), mas se apegar \u00e0s libs ao inv\u00e9s de ser fluente em linguagem nativa pode ser um belo tiro no p\u00e9. Ningu\u00e9m deveria aprender Bootstrap ou at\u00e9 mesmo um pr\u00e9 processador antes de CSS nativo, por exemplo."}, {"b514": "\u00c9 important\u00edssimo manter a mente aberta e conhecer de tudo um pouco, afinal, as novas ferramentas que surgem t\u00eam como objetivo solucionar problemas j\u00e1 conhecidos, e geralmente se apoiam em algo do passado."}, {"d3b4": "Estude, estude\u00a0muito"}, {"f14b": "Mais uma verdade absoluta do mundo dos devs: voc\u00ea nunca vai saber tudo. Voc\u00ea precisa estudar e aprender o tempo inteiro, e o mais legal \u00e9 que voc\u00ea n\u00e3o precisa necessariamente de um curso superior pra isso. Voc\u00ea tem acesso \u00e0 conte\u00fado de todo o tipo: artigos, v\u00eddeo-aulas, podcasts, f\u00f3runs e chats\u2026 Aproveite todo esse poder e n\u00e3o fique parado, sen\u00e3o voc\u00ea vai ficar pra tr\u00e1s."}, {"4a16": "O ciclo do desenvolvedor:\u00a0Estude. Pratique. Repasse. Repita."}, {"7736": "Mas n\u00e3o se prenda somente \u00e0 parte\u00a0t\u00e9cnica"}, {"f70e": "Temos o costume de nos prender a aprender novas tecnologias e ficarmos tecnicamente fodas, mas esquecemos que existem outras compet\u00eancias t\u00e3o importantes quanto qualidade t\u00e9cnica para um desenvolvedor."}, {"9c5e": "N\u00e3o adianta nada voc\u00ea ser foda em JS mas n\u00e3o conseguir contribuir em time ou n\u00e3o saber mensurar seus prazos. Aprenda t\u00e9cnicas de gerenciamento de tempo e de projetos, estude um pouco sobre design, idiomas, sobre orat\u00f3ria e express\u00e3o corporal e outras disciplinaridades. Voc\u00ea n\u00e3o deve se alienar ao resto do mundo e se focar somente em tecnologia."}, {"7b87": "Por hoje, \u00e9 isso! Espero que essas dicas te sirvam de alguma forma, eu gostaria de t\u00ea-las ouvido quando comecei nessa vida de front ender."}, {"ff46": "Se tiver qualquer d\u00favida ou observa\u00e7\u00e3o, manda ali nos coment\u00e1rios e bora bater um papo. E\u2026 vamos codar! =D"}], "content": "Dicas para se tornar um desenvolvedor melhor O artigo da vez tamb\u00e9m n\u00e3o \u00e9 nada t\u00e9cnico (mas tamb\u00e9m n\u00e3o \u00e9 pol\u00eamico como o anterior haha), mas sim um punhado de coisas que eu gostaria que algu\u00e9m tivesse me dito quando comecei a aprender a desenvolver, ent\u00e3o espero que as dicas aqui reunidas sirvam pelo menos para repensar algumas coisas. Dessa vez, trago o novo clipe da dupla brit\u00e2nica Royal Blood. Depois de um aclamado primeiro \u00e1lbum (o hom\u00f4nimo Royal Blood, de 2014) a dupla promete n\u00e3o decepcionar: O mais louco de ouvir Royal Blood \u00e9 pensar que tudo isso que est\u00e1 acontecendo sai de apenas uma bateria e um baixo (sim, um baixo!), o que nos traz toda a nostalgia de ver a The White Stripes de Jack e Meg White tocar. Resta aguardar o lan\u00e7amento do \u00e1lbum completo, mas podemos esperar uma linha bem parecida com o \u00e1lbum debutante. Participe da comunidade Ser um desenvolvedor ativo na comunidade s\u00f3 te traz ventura. V\u00e1 \u00e0 todos eventos poss\u00edveis, participe de meetups e palestras e tudo mais que voc\u00ea puder. Se voc\u00ea mora numa cidade pequena ou n\u00e3o tem tanto tempo quanto gostaria (al\u00f4 al\u00f4 faculdade), voc\u00ea pode ser ativo remotamente por meio de grupos do Facebook, Github ou Slack. A comunidade de desenvolvimento \u00e9 repleta de gente interessada em compartilhar conhecimento e discutir sobre desenvolvimento, o que nos leva a\u2026 Contribua As melhores maneiras de aprender algo de verdade s\u00e3o: E felizmente no mundo do desenvolvimento temos as duas possibilidades. Voc\u00ea pode repassar conhecimento de diversas formas: desde ministrar palestras, escrever artigos e preparar cursos online at\u00e9 adotar um pupilo. Maneiras de colocar a m\u00e3o na massa tamb\u00e9m n\u00e3o faltam: muitos projetos open source para se contribuir ou at\u00e9 mesmo novas ideias esperando para serem colocadas em pr\u00e1tica. Trabalho volunt\u00e1rio tamb\u00e9m \u00e9 um op\u00e7\u00e3o muito vi\u00e1vel, principalmente para quem est\u00e1 come\u00e7ando agora e precisa montar portif\u00f3lio. Aprenda ingl\u00eas Sinto que essa aqui \u00e9 chover no molhado, mas esse \u00e9 um ponto important\u00edssimo que quem deixa passar batido sente muita falta no futuro. Muito do conte\u00fado (principalmente sobre as ferramentas mais vanguardistas) dispon\u00edvel na internet est\u00e1 em ingl\u00eas, portanto dominar minimamente o idioma amplia suas possibilidades de aprendizado. Isso sem falar que \u00e9 quase unanimidade que toda contribui\u00e7\u00e3o \u00e0 projetos colaborativos precisam ser em ingl\u00eas (desde documenta\u00e7\u00f5es, nomes de m\u00e9todos e vari\u00e1veis at\u00e9 mensagens de commit). Aprender ingl\u00eas te possibilita conseguir melhores oportunidades de trabalho (internacionais ou n\u00e3o), ent\u00e3o n\u00e3o deixe esse aprendizado em segundo plano. B\u00f4nus: Quer juntar a dica 2 e 3? Comece a traduzir artigos em ingl\u00eas! Voc\u00ea estar\u00e1 ajudando a comunidade e treinando o idioma! S\u00f3 n\u00e3o esquece de pedir permiss\u00e3o para os autores\u00a0:p Respeita as mina (e os mano\u00a0tamb\u00e9m) Devemos cultivar uma comunidade inclusiva onde ningu\u00e9m tenha medo de se expressar e aprender. Voc\u00ea pode contribuir com programas inclusivos ou pelo menos n\u00e3o seja babaca. N\u00e3o tente ser melhor que ningu\u00e9m al\u00e9m de voc\u00ea\u00a0mesmo. N\u00e3o se apegue \u00e0 libs (ou frameworks ou whatever) Uma verdade inexor\u00e1vel sobre o ecossistema de desenvolvimento: as libs v\u00eam e v\u00e3o, e cada vez mais seu ciclo de vida est\u00e1 mais curto. \u00c9 muito legal estar antenado nas \u00faltimas novidades (e s\u00e9rio, voc\u00ea deve continuar fazendo isso), mas se apegar \u00e0s libs ao inv\u00e9s de ser fluente em linguagem nativa pode ser um belo tiro no p\u00e9. Ningu\u00e9m deveria aprender Bootstrap ou at\u00e9 mesmo um pr\u00e9 processador antes de CSS nativo, por exemplo. \u00c9 important\u00edssimo manter a mente aberta e conhecer de tudo um pouco, afinal, as novas ferramentas que surgem t\u00eam como objetivo solucionar problemas j\u00e1 conhecidos, e geralmente se apoiam em algo do passado. Estude, estude\u00a0muito Mais uma verdade absoluta do mundo dos devs: voc\u00ea nunca vai saber tudo. Voc\u00ea precisa estudar e aprender o tempo inteiro, e o mais legal \u00e9 que voc\u00ea n\u00e3o precisa necessariamente de um curso superior pra isso. Voc\u00ea tem acesso \u00e0 conte\u00fado de todo o tipo: artigos, v\u00eddeo-aulas, podcasts, f\u00f3runs e chats\u2026 Aproveite todo esse poder e n\u00e3o fique parado, sen\u00e3o voc\u00ea vai ficar pra tr\u00e1s. O ciclo do desenvolvedor:\u00a0Estude. Pratique. Repasse. Repita. Mas n\u00e3o se prenda somente \u00e0 parte\u00a0t\u00e9cnica Temos o costume de nos prender a aprender novas tecnologias e ficarmos tecnicamente fodas, mas esquecemos que existem outras compet\u00eancias t\u00e3o importantes quanto qualidade t\u00e9cnica para um desenvolvedor. N\u00e3o adianta nada voc\u00ea ser foda em JS mas n\u00e3o conseguir contribuir em time ou n\u00e3o saber mensurar seus prazos. Aprenda t\u00e9cnicas de gerenciamento de tempo e de projetos, estude um pouco sobre design, idiomas, sobre orat\u00f3ria e express\u00e3o corporal e outras disciplinaridades. Voc\u00ea n\u00e3o deve se alienar ao resto do mundo e se focar somente em tecnologia. Por hoje, \u00e9 isso! Espero que essas dicas te sirvam de alguma forma, eu gostaria de t\u00ea-las ouvido quando comecei nessa vida de front ender. Se tiver qualquer d\u00favida ou observa\u00e7\u00e3o, manda ali nos coment\u00e1rios e bora bater um papo. E\u2026 vamos codar! =D ", "child": "2093_1\t2093_22093_1\t2093_22093_1\t2093_22093_1\t2093_2"}