{"name": "210", "parent": "", "title": "30 Things About Life I Wish I Had Known 10 Years\u00a0Ago", "sentences": [{"f2cf": "30 Things About Life I Wish I Had Known 10 Years\u00a0Ago"}, {"4bf5": "Last week I turned 30. Unlike most people, I do like getting older. 10 years ago, I was a complete idiot."}, {"08d6": "Now, a decade later, I still know nothing, but I do feel more in control of my life. I thank that personal growth to an idea I stole from Socrates, the person who was once named the wisest man on earth by the Oracle of Delphi."}, {"2057": "When Socrates heard that the oracle had made such a comment, he believed that the statement was wrong. Socrates said:"}, {"5804": "\u201cI know one thing: that I know nothing.\u201d"}, {"08fb": "How can the smartest man on earth know nothing? I heard this paradoxical wisdom for the first time from my school teacher when I was 14 or 15. That humility made such an impact on me that I used Socrates\u2019s quote as my learning strategy."}, {"46d7": "What you will find below is a list of the most important things I learned from others. We might learn things quickly, but we often forget things at the same rate\u200a\u2014\u200aand sometimes we need to remind ourselves of the things we\u2019ve learned."}, {"3040": "Here are 30 of those reminders that others taught me."}, {"5f35": "You might know a lot. But like Socrates, you and I know nothing at all. So we have to keep learning."}, {"4b6c": "Thanks for reading! This article was originally published on dariusforoux.com."}], "content": "30 Things About Life I Wish I Had Known 10 Years\u00a0Ago Last week I turned 30. Unlike most people, I do like getting older. 10 years ago, I was a complete idiot. Now, a decade later, I still know nothing, but I do feel more in control of my life. I thank that personal growth to an idea I stole from Socrates, the person who was once named the wisest man on earth by the Oracle of Delphi. When Socrates heard that the oracle had made such a comment, he believed that the statement was wrong. Socrates said: \u201cI know one thing: that I know nothing.\u201d How can the smartest man on earth know nothing? I heard this paradoxical wisdom for the first time from my school teacher when I was 14 or 15. That humility made such an impact on me that I used Socrates\u2019s quote as my learning strategy. What you will find below is a list of the most important things I learned from others. We might learn things quickly, but we often forget things at the same rate\u200a\u2014\u200aand sometimes we need to remind ourselves of the things we\u2019ve learned. Here are 30 of those reminders that others taught me. You might know a lot. But like Socrates, you and I know nothing at all. So we have to keep learning. Thanks for reading! This article was originally published on dariusforoux.com. ", "child": "210_1\t210_2\t210_3\t210_4\t210_5\t210_6\t210_7\t210_8\t210_9\t210_10\t210_11\t210_12\t210_13\t210_14\t210_15\t210_16\t210_17\t210_18\t210_19\t210_20\t210_21\t210_22\t210_23\t210_24\t210_25210_1\t210_2\t210_3\t210_4\t210_5\t210_6\t210_7\t210_8\t210_9\t210_10\t210_11\t210_12\t210_13\t210_14\t210_15\t210_16\t210_17\t210_18\t210_19\t210_20\t210_21\t210_22\t210_23\t210_24\t210_25"}