{"name": "2256", "parent": "", "title": "Saga: Eixo", "sentences": [{"b5ae": "Ol\u00e1 pessoal, ap\u00f3s ler Fabulosos Vingadores e trazer a resenha para voc\u00eas no come\u00e7o deste ano (link aqui), venho trazer a saga que \u00e9 uma continua\u00e7\u00e3o direta da HQ!"}, {"4ccb": "NOTA: Esta resenha cont\u00e9m SPOILERS!"}, {"d9b2": "Tudo come\u00e7a ap\u00f3s o Massacre ter sido acordado pelo Magneto. (Tanto que a leitura das edi\u00e7\u00f5es de Fabulosos Vingadores e Magneto s\u00e3o obrigat\u00f3rias!). Em um ato de desespero os Vingadores se reunem para atacar, juntamente com os X-men pois a treta estava s\u00e9ria!"}, {"f6dd": "No meio da luta os Vingadores se encontram praticamente derrotados por causa de uma sacada MUITO FODA! (Parab\u00e9ns mesmo ao Rick Remender)\u00c9 quando o Magneto tem uma ideia desesperadora de reunir um time para enfrentar o Massacre."}, {"da2c": "Como mesmo com este time as coisas n\u00e3o andam dando, eles tem uma ideia de utilizar um feiti\u00e7o que inverteria o Eixo da consciencia do Massacre, de forma que o professor Xavier assuma a consciencia do corpo. O tiro acaba saindo pela culatra e todos envolvidos possuem suas personalidades invertidas!"}, {"3823": "Ent\u00e3o come\u00e7a uma parte muito legal onde os X-men resolvem lutar pela domina\u00e7\u00e3o mutante na terra matando todos que passarem pela frente! J\u00e1 os Vingadores come\u00e7am a tomar medidas dr\u00e1sticas para lidar com tudo, acusando e aprisionando todos os outros personagens do time que n\u00e3o concordavam com as \u201cnovas ideias\u201d."}, {"3fdc": "Eis que surge ent\u00e3o um novo time de Her\u00f3is para salvar os mundo: os vil\u00f5es com consci\u00eancias de her\u00f3is!"}, {"3c7b": "O pau quebra solto entre os tr\u00eas times: Vingadores, X-men e Vil\u00f5es Her\u00f3is."}, {"3a6e": "At\u00e9 que o Dr. Destino SALVA a porra toda!! O grande her\u00f3i da hist\u00f3ria!"}, {"3b82": "E nosso velhinho Steve Rogers acaba salvando o Caveira Vermelha (temporariamente bonzinho por causa da invers\u00e3o de consci\u00eancia)"}, {"e910": "No final das contas, a hist\u00f3ria termina com a Feiticeira Escarlate e o Dr. Destino invertendo novamente o eixo e trazendo quase todas as coisas para o normal\u2026. e isso mesmo\u2026 QUASE.. rsrs Alguns personagens n\u00e3o voltam\u2026 eis que n\u00f3s temos a origem do Superior Homem de Ferro e o Dentes-de-Sabre bonzinho."}, {"6c7a": "Um Tie-in especial \u00e9 para os \u201cVingadores do Destino\u201d que eu gostei bastante! \u263aBem que o Agente Americano poderia assumir o posto do Capit\u00e3o Am\u00e9rica!"}, {"ec8d": "Recomendo esta\u00a0Saga?"}, {"4ced": "SIM!"}, {"596a": "Trata-se de uma saga divertida: cheia de lutas, sacadas e cenas legais! \u201cAh Filipe\u2026 mas alguns personagens foram descaracterizados\u2026 mimimimi\u2026\u201d Nem todas as sagas precisam respeitar a coes\u00e3o do universo Marvel, tanto que este material n\u00e3o respeita mesmo! No final \u00e9 um puta material legal e fechadinho se voc\u00ea ignorar a obrigatoriedade de coes\u00e3o. Para pensar, porque Reino do Amanh\u00e3 (uma hist\u00f3ria alternativa) pode viajar na maionese e o Eixo n\u00e3o pode? Por que tinha o Alex Ross envolvido? Enfim, esta \u00e9 a minha humilde opini\u00e3o, recomendo fortemente a todos que leiam este material! \u263a Grande abra\u00e7o e feliz p\u00e1scoa a todos!"}], "content": "Ol\u00e1 pessoal, ap\u00f3s ler Fabulosos Vingadores e trazer a resenha para voc\u00eas no come\u00e7o deste ano (link aqui), venho trazer a saga que \u00e9 uma continua\u00e7\u00e3o direta da HQ! NOTA: Esta resenha cont\u00e9m SPOILERS! Tudo come\u00e7a ap\u00f3s o Massacre ter sido acordado pelo Magneto. (Tanto que a leitura das edi\u00e7\u00f5es de Fabulosos Vingadores e Magneto s\u00e3o obrigat\u00f3rias!). Em um ato de desespero os Vingadores se reunem para atacar, juntamente com os X-men pois a treta estava s\u00e9ria! No meio da luta os Vingadores se encontram praticamente derrotados por causa de uma sacada MUITO FODA! (Parab\u00e9ns mesmo ao Rick Remender)\u00c9 quando o Magneto tem uma ideia desesperadora de reunir um time para enfrentar o Massacre. Como mesmo com este time as coisas n\u00e3o andam dando, eles tem uma ideia de utilizar um feiti\u00e7o que inverteria o Eixo da consciencia do Massacre, de forma que o professor Xavier assuma a consciencia do corpo. O tiro acaba saindo pela culatra e todos envolvidos possuem suas personalidades invertidas! Ent\u00e3o come\u00e7a uma parte muito legal onde os X-men resolvem lutar pela domina\u00e7\u00e3o mutante na terra matando todos que passarem pela frente! J\u00e1 os Vingadores come\u00e7am a tomar medidas dr\u00e1sticas para lidar com tudo, acusando e aprisionando todos os outros personagens do time que n\u00e3o concordavam com as \u201cnovas ideias\u201d. Eis que surge ent\u00e3o um novo time de Her\u00f3is para salvar os mundo: os vil\u00f5es com consci\u00eancias de her\u00f3is! O pau quebra solto entre os tr\u00eas times: Vingadores, X-men e Vil\u00f5es Her\u00f3is. At\u00e9 que o Dr. Destino SALVA a porra toda!! O grande her\u00f3i da hist\u00f3ria! E nosso velhinho Steve Rogers acaba salvando o Caveira Vermelha (temporariamente bonzinho por causa da invers\u00e3o de consci\u00eancia) No final das contas, a hist\u00f3ria termina com a Feiticeira Escarlate e o Dr. Destino invertendo novamente o eixo e trazendo quase todas as coisas para o normal\u2026. e isso mesmo\u2026 QUASE.. rsrs Alguns personagens n\u00e3o voltam\u2026 eis que n\u00f3s temos a origem do Superior Homem de Ferro e o Dentes-de-Sabre bonzinho. Um Tie-in especial \u00e9 para os \u201cVingadores do Destino\u201d que eu gostei bastante! \u263aBem que o Agente Americano poderia assumir o posto do Capit\u00e3o Am\u00e9rica! Recomendo esta\u00a0Saga? SIM! Trata-se de uma saga divertida: cheia de lutas, sacadas e cenas legais! \u201cAh Filipe\u2026 mas alguns personagens foram descaracterizados\u2026 mimimimi\u2026\u201d Nem todas as sagas precisam respeitar a coes\u00e3o do universo Marvel, tanto que este material n\u00e3o respeita mesmo! No final \u00e9 um puta material legal e fechadinho se voc\u00ea ignorar a obrigatoriedade de coes\u00e3o. Para pensar, porque Reino do Amanh\u00e3 (uma hist\u00f3ria alternativa) pode viajar na maionese e o Eixo n\u00e3o pode? Por que tinha o Alex Ross envolvido? Enfim, esta \u00e9 a minha humilde opini\u00e3o, recomendo fortemente a todos que leiam este material! \u263a Grande abra\u00e7o e feliz p\u00e1scoa a todos! ", "child": "2256_1"}