{"name": "2259", "parent": "", "title": "Autores contra blogueiros, a pol\u00eamica liter\u00e1ria do\u00a0dia", "sentences": [{"becf": "Autores contra blogueiros, a pol\u00eamica liter\u00e1ria do\u00a0dia"}, {"8f87": "Parei de resenhar livros para editoras porque nem rel\u00f3gio trabalha de gra\u00e7a."}, {"54a8": "N\u00e3o estou sendo ingrata\u200a\u2014\u200aantes dos vinte, ganhar livros e falar sobre eles era muito bacana, fora a oportunidade de escolh\u00ea-los, receb\u00ea-los em casa e o crescimento liter\u00e1rio inevit\u00e1vel que tive. Al\u00e9m, claro, das pessoas interessantes que trabalham no meio e se tornaram minhas amigas."}, {"918b": "Depois, por\u00e9m, notei que o marketing gratuito beneficia muito mais apenas um lado que n\u00e3o \u00e9 o mais fraco da corda. As responsabilidades chegam, voc\u00ea ganha outras ocupa\u00e7\u00f5es e muitas editoras estabelecem prazos. Quando n\u00e3o soube mais lidar, sa\u00ed dessa. E, como leio \u201ccada vez mais lentamente\u201d, quero pelo menos ler o que j\u00e1 tenho na estante, quero repetir leituras, quero me viciar em um mesmo autor por longo per\u00edodo."}, {"011e": "Fora que me angustiava o fato de que muitos blogs liter\u00e1rios prestigiados pelo elevado n\u00famero de visitas n\u00e3o apresentavam resenhas consistentes. N\u00e3o eram convincentes, mas eram autom\u00e1ticos\u200a\u2014\u200amontavam equipes de cinco colaboradores e todos pareciam escrever a mesm\u00edssima coisa. Copiavam o enredo da pr\u00f3pria editora, davam sete linhas do pr\u00f3prio parecer e, no final, uma \u201cnota\u201d, umas \u201cestrelas\u201d. Amigo, teu blog n\u00e3o \u00e9 a Folha de S. Paulo."}, {"2a4c": "E blogs menores, mas com resenhas fant\u00e1sticas, n\u00e3o recebiam a devida visualiza\u00e7\u00e3o, muitas vezes nem por parte dessas editoras. Editoras grandes divulgam \u201cgrandes\u201d blogueiros."}, {"d946": "O \u00e1pice, para mim, foi quando uma ~certa editora~ avisou que n\u00e3o entregaria mais os livros, enviaria a vers\u00e3o digital por e-mail. Foi muita canalhice, pois os blogueiros, quando se inscreveram, n\u00e3o foram avisados e muitos questionaram, \u00f3bvio: \u201cganharemos tamb\u00e9m o leitor digital?\u201d."}, {"d565": "Estou vendo que a \u201cpol\u00eamica liter\u00e1ria do dia\u201d \u00e9 a ~guerra~(antiga, at\u00e9) entre autores e blogueiros que cobram para escrever resenhas. Os autores est\u00e3o indignados porque \u201c\u00e9 muito dif\u00edcil ser autor nesse pa\u00eds, portanto, absurdo demais esses adolescentes que n\u00e3o tem ensino superior exigindo dinheiro em troca de umas poucas linhas sobre o meu trabalho\u201d."}, {"929b": "Voc\u00eas t\u00eam no\u00e7\u00e3o da vergonha que passam quando dizem isso, meus queridos?"}, {"9af4": "A vida n\u00e3o t\u00e1 f\u00e1cil pra ningu\u00e9m. Se voc\u00ea escolhe sobreviver de escrita, sabe disso. Sabe que ser\u00e1 criticado, sabe que as pessoas n\u00e3o t\u00eam a menor obriga\u00e7\u00e3o de lidar com a literatura na base da ~camaradagem~, da compaix\u00e3o pelo autor-nacional-fodido-que-n\u00e3o-tem-onde-cair-morto."}, {"ccc9": "Eu mesma n\u00e3o aceito mais resenhar livros de autores que entram em contato comigo porque, me desculpem, quero dedicar o meu tempo \u00e0s leituras que me interessam. E se eu gosto de romances de \u00e9poca, mas o seu livro trata de alien\u00edgenas que vistam a Terra no ano 4000, adivinha qual caminho escolherei?"}, {"2606": "Leitura \u00e9 prazer, mas quando a pessoa se disp\u00f5e a resenhar a sua obra, torna-se obriga\u00e7\u00e3o, portanto, ela merece receber pelo tempo que se dedica a ler o teu livro. Acho engra\u00e7ado quando o autor aparece todo humilde pedindo aten\u00e7\u00e3o do blogueiro liter\u00e1rio, mas na primeira oportunidade, ao receber a tabela de valores, exp\u00f5e o mesmo em grupos, na timeline e diz que \u201cs\u00f3 existe gente interesseira\u201d."}, {"3579": "O blogueiro liter\u00e1rio n\u00e3o t\u00e1 nem a\u00ed pra se voc\u00ea tem que comprar o seu pr\u00f3prio livro da editora;"}, {"79ab": "O blogueiro liter\u00e1rio n\u00e3o se interessa por quanto voc\u00ea vai gastar nesse envio pelos Correios;"}, {"49ca": "O blogueiro liter\u00e1rio tamb\u00e9m paga contas sozinho ou ajuda no sustento familiar."}, {"ae26": "Respeite o blogueiro liter\u00e1rio, afinal \u00e9 voc\u00ea quem est\u00e1 pedindo a divulga\u00e7\u00e3o dele. \u00c9 um trabalho como qualquer outro e, se voc\u00ea desdenha, devia ter vergonha."}], "content": "Autores contra blogueiros, a pol\u00eamica liter\u00e1ria do\u00a0dia Parei de resenhar livros para editoras porque nem rel\u00f3gio trabalha de gra\u00e7a. N\u00e3o estou sendo ingrata\u200a\u2014\u200aantes dos vinte, ganhar livros e falar sobre eles era muito bacana, fora a oportunidade de escolh\u00ea-los, receb\u00ea-los em casa e o crescimento liter\u00e1rio inevit\u00e1vel que tive. Al\u00e9m, claro, das pessoas interessantes que trabalham no meio e se tornaram minhas amigas. Depois, por\u00e9m, notei que o marketing gratuito beneficia muito mais apenas um lado que n\u00e3o \u00e9 o mais fraco da corda. As responsabilidades chegam, voc\u00ea ganha outras ocupa\u00e7\u00f5es e muitas editoras estabelecem prazos. Quando n\u00e3o soube mais lidar, sa\u00ed dessa. E, como leio \u201ccada vez mais lentamente\u201d, quero pelo menos ler o que j\u00e1 tenho na estante, quero repetir leituras, quero me viciar em um mesmo autor por longo per\u00edodo. Fora que me angustiava o fato de que muitos blogs liter\u00e1rios prestigiados pelo elevado n\u00famero de visitas n\u00e3o apresentavam resenhas consistentes. N\u00e3o eram convincentes, mas eram autom\u00e1ticos\u200a\u2014\u200amontavam equipes de cinco colaboradores e todos pareciam escrever a mesm\u00edssima coisa. Copiavam o enredo da pr\u00f3pria editora, davam sete linhas do pr\u00f3prio parecer e, no final, uma \u201cnota\u201d, umas \u201cestrelas\u201d. Amigo, teu blog n\u00e3o \u00e9 a Folha de S. Paulo. E blogs menores, mas com resenhas fant\u00e1sticas, n\u00e3o recebiam a devida visualiza\u00e7\u00e3o, muitas vezes nem por parte dessas editoras. Editoras grandes divulgam \u201cgrandes\u201d blogueiros. O \u00e1pice, para mim, foi quando uma ~certa editora~ avisou que n\u00e3o entregaria mais os livros, enviaria a vers\u00e3o digital por e-mail. Foi muita canalhice, pois os blogueiros, quando se inscreveram, n\u00e3o foram avisados e muitos questionaram, \u00f3bvio: \u201cganharemos tamb\u00e9m o leitor digital?\u201d. Estou vendo que a \u201cpol\u00eamica liter\u00e1ria do dia\u201d \u00e9 a ~guerra~(antiga, at\u00e9) entre autores e blogueiros que cobram para escrever resenhas. Os autores est\u00e3o indignados porque \u201c\u00e9 muito dif\u00edcil ser autor nesse pa\u00eds, portanto, absurdo demais esses adolescentes que n\u00e3o tem ensino superior exigindo dinheiro em troca de umas poucas linhas sobre o meu trabalho\u201d. Voc\u00eas t\u00eam no\u00e7\u00e3o da vergonha que passam quando dizem isso, meus queridos? A vida n\u00e3o t\u00e1 f\u00e1cil pra ningu\u00e9m. Se voc\u00ea escolhe sobreviver de escrita, sabe disso. Sabe que ser\u00e1 criticado, sabe que as pessoas n\u00e3o t\u00eam a menor obriga\u00e7\u00e3o de lidar com a literatura na base da ~camaradagem~, da compaix\u00e3o pelo autor-nacional-fodido-que-n\u00e3o-tem-onde-cair-morto. Eu mesma n\u00e3o aceito mais resenhar livros de autores que entram em contato comigo porque, me desculpem, quero dedicar o meu tempo \u00e0s leituras que me interessam. E se eu gosto de romances de \u00e9poca, mas o seu livro trata de alien\u00edgenas que vistam a Terra no ano 4000, adivinha qual caminho escolherei? Leitura \u00e9 prazer, mas quando a pessoa se disp\u00f5e a resenhar a sua obra, torna-se obriga\u00e7\u00e3o, portanto, ela merece receber pelo tempo que se dedica a ler o teu livro. Acho engra\u00e7ado quando o autor aparece todo humilde pedindo aten\u00e7\u00e3o do blogueiro liter\u00e1rio, mas na primeira oportunidade, ao receber a tabela de valores, exp\u00f5e o mesmo em grupos, na timeline e diz que \u201cs\u00f3 existe gente interesseira\u201d. O blogueiro liter\u00e1rio n\u00e3o t\u00e1 nem a\u00ed pra se voc\u00ea tem que comprar o seu pr\u00f3prio livro da editora; O blogueiro liter\u00e1rio n\u00e3o se interessa por quanto voc\u00ea vai gastar nesse envio pelos Correios; O blogueiro liter\u00e1rio tamb\u00e9m paga contas sozinho ou ajuda no sustento familiar. Respeite o blogueiro liter\u00e1rio, afinal \u00e9 voc\u00ea quem est\u00e1 pedindo a divulga\u00e7\u00e3o dele. \u00c9 um trabalho como qualquer outro e, se voc\u00ea desdenha, devia ter vergonha. ", "child": "2259_1\t2259_2\t2259_3\t2259_4\t2259_5\t2259_6\t2259_7\t2259_8\t2259_9"}