{"name": "2274", "parent": "", "title": "The Geek & The Weeb #3: Doctor Strange, cambiar algo para dejarlo\u00a0igual.", "sentences": [{"2e24": "The Geek & The Weeb #3: Doctor Strange, cambiar algo para dejarlo\u00a0igual."}, {"5236": "Pel\u00edcula de Marvel media = Villano de mierda + Humor forzado + Gui\u00f3n con lagunas + Subtramas irrelevantes"}, {"42f5": "Doctor Strange = Todo lo anterior + Hechicer\u00eda"}, {"06e2": "Quiz\u00e1 est\u00e9 exagerando, mejor desarrollemos esto."}, {"b7fd": "Doctor Strange carece de una buena base, sus c\u00f3mics son una copia para ni\u00f1os de The Sandman y si quieres leer algo de \u00e9l o empiezas por el principio o al final lo acabas dejando por no entender una mierda con tanto aparato m\u00e1gico y tecnicismo esot\u00e9rico pero, como ya comenta Obbd98 en su Internet Odyssey, el c\u00f3mic y el cine son dos medios distintos que no deben ser tratados por igual, as\u00ed que olvidemos el c\u00f3mic y centr\u00e9monos en la pel\u00edcula."}, {"282a": "Doctor Strange sigue la historia de un talentoso neurocirujano, el Doctor Stephen Strange, quien, despu\u00e9s de un tr\u00e1gico accidente de coche, deja su ego a un lado y aprende los secretos de un mundo escondido de misticismo y dimensiones alternativas. En el Greenwich Village de Nueva York, Doctor Strange debe actuar como un intermediario entre el mundo real y lo que hay m\u00e1s all\u00e1, utilizando una amplia gama de capacidades metaf\u00edsicas y artefactos para proteger el Universo Cinematogr\u00e1fico de Marvel"}, {"3ef3": "No s\u00e9 ni por qu\u00e9 me molesto en poner la sinopsis si todo el mundo la conoce (Gracias Disney por tu campa\u00f1a masiva de publicidad)."}, {"0048": "Como es tradici\u00f3n en Marvel, la cinta empieza con un flashback \u00bfSirve para algo? M\u00e1s bien poco, lo ocurrido en este se nos repetir\u00e1 a lo largo de la cinta, no es m\u00e1s que un contexto para ense\u00f1arnos las distintas dimensiones de la pel\u00edcula y que flipemos un poco mucho con el CGI, pues as\u00ed m\u00e1s o menos es toda la pel\u00edcula."}, {"ab4e": "Imagen reci\u00e9n hecha de los cines FullHD de C\u00e1diz, mentira puta es de\u00a0Google"}, {"047e": "\u00bfY que tal con los personajes?"}, {"d970": "La evoluci\u00f3n de Doctor Strange interpretado por Benedict Cumberbatch(Sherlock) est\u00e1 forzad\u00edsima, la primera vez que descubre todo el misticismo s\u00f3lo se lo cuestiona con una frase \u201c\u00bfEl t\u00e9 no llevar\u00e1 LSD?\u201d(La \u00e9poca del MK-Ultra ya acab\u00f3 Sr.Marvel) a lo que La Anciana (maestra de todos los brujos) responde con un no, con un puto monos\u00edlabo elimina el materialismo pensamiento del Doctor sin pens\u00e1rselo de nuevo, es cierto que La Anciana le hace un conjuro o algo para que de un viaje por el cosmos y las dimensiones pero estamos hablando de una persona puramente material, un m\u00ednimo de duda por favor y ya no hablemos de su entrenamiento, en 5 min pasa de ser un negado en las artes m\u00edsticas a ser el fucking pro SOLO PORQUE EL GUION ASI LO QUIERE."}, {"87f4": "El villano de la cinta es una basura unidimensional, no exploran sus aspiraciones m\u00e1s all\u00e1 de 3 o 4 di\u00e1logos, el resto de la cinta s\u00f3lo sirve para las escenas de acci\u00f3n tanto \u00e9l como sus seguidores que estos ni siquiera hablan, es una l\u00e1stima desperdiciar a Mads Mikkelsen (Hannibal TV) de esta forma (No quiero ni hablar del \u201cverdadero villano\u201d al nivel de Galactus de los 4 fant\u00e1sticos 2)"}, {"8265": "Ya que digo desperdicio de actuaci\u00f3n, para desperdicio el papel de Rachel McAdam (Spotlight) su papel es de la subtrama amorosa e irrelevante, en serio no entiendo la man\u00eda que tienen con meter una trama amorosa si no me vas a contar nada, solo hace una cosa relevante que bien podr\u00eda haberlo hecho cualquiera, mejor haberla dejado como una amiga del trabajo."}, {"4911": "Tilda Swinton (Las Cr\u00f3nicas de Narnia) y Chiwetel Ejiofor (12 a\u00f1os de esclavitud) haciendo de La Anciana y el otro brujo negrata quiz\u00e1 sea la relaci\u00f3n que mas merezca la pena aunque no se explora una mierda hubiera sido interesante haberla visto mas profundizada."}, {"cb90": "Me quedo con el papel de Benedict Wong (Marco polo) un bibliotecario que no pretende ser m\u00e1s de lo que es con escenas muy divertidas."}, {"15a9": "Like Iron\u00a0Man"}, {"91d9": "Entonces el\u00a0guion\u2026"}, {"0d16": "No hay mucho que decir, cae en los t\u00edpicos errores de las pel\u00edculas de marvel adem\u00e1s que si me dices que lo ha escrito Christoper Nolan me lo creo a medias, no voy a nombrar a los verdaderos guionistas porque a excepci\u00f3n del snob de Scott Derrickson (El exorcismo de Emily Rose) quien tambi\u00e9n es el director de la cinta, a los otros dos no los conoce ni su madre."}, {"840b": "El gui\u00f3n es lo que es, una mierda que se apresura por terminar lo que est\u00e1 haciendo sin importar que deje por el camino, ve al tiempo como un enemigo, por este motivo el final estan poca cosa."}, {"5dde": "\u00bfHumor forzado\u00a0again?"}, {"24c3": "Si pero no, no llega al nivel de gilipollez de Ultr\u00f3n en Los Vengadores 2 o lo que co\u00f1o fuera el Mandar\u00edn de Iron Man 3, tampoco digo que sea tan divertida como Guardianes de la Galaxia o Ant-man pero quitando alguna que otra metedura de pata, con los chistes de Doctor Strange te r\u00edes."}, {"b19a": "\u00bfAlgo m\u00e1s? Espero que\u00a0no"}, {"ac7a": "Lo siento pero si, estoy harto de las putas escenas post-cr\u00e9ditos, apenas 1 minuto de informaci\u00f3n solo para confirmar lo que ya sabemos antes de ir al cine, la puta secuela, y sin contar que no era 1 sino 2 jodidas escenas, claro que podr\u00eda haberme ido y no verlas pero luego quedo de impaciente y de hater con la gente que la vi, estos fanboys."}, {"d3e5": "Adem\u00e1s de la man\u00eda de \u201cunir\u201d las pel\u00edculas para crear un universo, lo que hacen es liar m\u00e1s al espectador, ya en Los Vengadores 2 se notaba que a Joss Whedon le costaba manejar a tanto personaje en la pantalla no me quiero imaginar en Los Vengadores 3 y 4 con tanto superheroe suelto."}, {"7063": "Vivan los mandalas\u00a0a\u00e9reos"}, {"3d23": "\u00bfMe vas a decir algo bueno de la pel\u00edcula o vas a seguir de\u00a0hater?"}, {"6628": "Si claro, las escenas de acci\u00f3n est\u00e1n muy logradas, la actuaci\u00f3n del Doctor es de sobresaliente, las ropas que llevan los actores est\u00e1n geniales y se ven muy reales y el CGI es una gozada para que enga\u00f1arnos."}, {"165f": "Termina ya por\u00a0favor"}, {"080c": "Conclusi\u00f3n: Doctor Strange es m\u00e1s de lo mismo, podr\u00edan haber puesto empe\u00f1o en pulir algunos fallos, tampoco hace falta que todas las cintas de Marvel sean Capit\u00e1n Am\u00e9rica: El Soldado de Invierno, disfrutas vi\u00e9ndola si no le prestas demasiada atenci\u00f3n, si quieres pasar un rato entretenido no dudes en ir a verla."}], "content": "The Geek & The Weeb #3: Doctor Strange, cambiar algo para dejarlo\u00a0igual. Pel\u00edcula de Marvel media = Villano de mierda + Humor forzado + Gui\u00f3n con lagunas + Subtramas irrelevantes Doctor Strange = Todo lo anterior + Hechicer\u00eda Quiz\u00e1 est\u00e9 exagerando, mejor desarrollemos esto. Doctor Strange carece de una buena base, sus c\u00f3mics son una copia para ni\u00f1os de The Sandman y si quieres leer algo de \u00e9l o empiezas por el principio o al final lo acabas dejando por no entender una mierda con tanto aparato m\u00e1gico y tecnicismo esot\u00e9rico pero, como ya comenta Obbd98 en su Internet Odyssey, el c\u00f3mic y el cine son dos medios distintos que no deben ser tratados por igual, as\u00ed que olvidemos el c\u00f3mic y centr\u00e9monos en la pel\u00edcula. Doctor Strange sigue la historia de un talentoso neurocirujano, el Doctor Stephen Strange, quien, despu\u00e9s de un tr\u00e1gico accidente de coche, deja su ego a un lado y aprende los secretos de un mundo escondido de misticismo y dimensiones alternativas. En el Greenwich Village de Nueva York, Doctor Strange debe actuar como un intermediario entre el mundo real y lo que hay m\u00e1s all\u00e1, utilizando una amplia gama de capacidades metaf\u00edsicas y artefactos para proteger el Universo Cinematogr\u00e1fico de Marvel No s\u00e9 ni por qu\u00e9 me molesto en poner la sinopsis si todo el mundo la conoce (Gracias Disney por tu campa\u00f1a masiva de publicidad). Como es tradici\u00f3n en Marvel, la cinta empieza con un flashback \u00bfSirve para algo? M\u00e1s bien poco, lo ocurrido en este se nos repetir\u00e1 a lo largo de la cinta, no es m\u00e1s que un contexto para ense\u00f1arnos las distintas dimensiones de la pel\u00edcula y que flipemos un poco mucho con el CGI, pues as\u00ed m\u00e1s o menos es toda la pel\u00edcula. Imagen reci\u00e9n hecha de los cines FullHD de C\u00e1diz, mentira puta es de\u00a0Google \u00bfY que tal con los personajes? La evoluci\u00f3n de Doctor Strange interpretado por Benedict Cumberbatch(Sherlock) est\u00e1 forzad\u00edsima, la primera vez que descubre todo el misticismo s\u00f3lo se lo cuestiona con una frase \u201c\u00bfEl t\u00e9 no llevar\u00e1 LSD?\u201d(La \u00e9poca del MK-Ultra ya acab\u00f3 Sr.Marvel) a lo que La Anciana (maestra de todos los brujos) responde con un no, con un puto monos\u00edlabo elimina el materialismo pensamiento del Doctor sin pens\u00e1rselo de nuevo, es cierto que La Anciana le hace un conjuro o algo para que de un viaje por el cosmos y las dimensiones pero estamos hablando de una persona puramente material, un m\u00ednimo de duda por favor y ya no hablemos de su entrenamiento, en 5 min pasa de ser un negado en las artes m\u00edsticas a ser el fucking pro SOLO PORQUE EL GUION ASI LO QUIERE. El villano de la cinta es una basura unidimensional, no exploran sus aspiraciones m\u00e1s all\u00e1 de 3 o 4 di\u00e1logos, el resto de la cinta s\u00f3lo sirve para las escenas de acci\u00f3n tanto \u00e9l como sus seguidores que estos ni siquiera hablan, es una l\u00e1stima desperdiciar a Mads Mikkelsen (Hannibal TV) de esta forma (No quiero ni hablar del \u201cverdadero villano\u201d al nivel de Galactus de los 4 fant\u00e1sticos 2) Ya que digo desperdicio de actuaci\u00f3n, para desperdicio el papel de Rachel McAdam (Spotlight) su papel es de la subtrama amorosa e irrelevante, en serio no entiendo la man\u00eda que tienen con meter una trama amorosa si no me vas a contar nada, solo hace una cosa relevante que bien podr\u00eda haberlo hecho cualquiera, mejor haberla dejado como una amiga del trabajo. Tilda Swinton (Las Cr\u00f3nicas de Narnia) y Chiwetel Ejiofor (12 a\u00f1os de esclavitud) haciendo de La Anciana y el otro brujo negrata quiz\u00e1 sea la relaci\u00f3n que mas merezca la pena aunque no se explora una mierda hubiera sido interesante haberla visto mas profundizada. Me quedo con el papel de Benedict Wong (Marco polo) un bibliotecario que no pretende ser m\u00e1s de lo que es con escenas muy divertidas. Like Iron\u00a0Man Entonces el\u00a0guion\u2026 No hay mucho que decir, cae en los t\u00edpicos errores de las pel\u00edculas de marvel adem\u00e1s que si me dices que lo ha escrito Christoper Nolan me lo creo a medias, no voy a nombrar a los verdaderos guionistas porque a excepci\u00f3n del snob de Scott Derrickson (El exorcismo de Emily Rose) quien tambi\u00e9n es el director de la cinta, a los otros dos no los conoce ni su madre. El gui\u00f3n es lo que es, una mierda que se apresura por terminar lo que est\u00e1 haciendo sin importar que deje por el camino, ve al tiempo como un enemigo, por este motivo el final estan poca cosa. \u00bfHumor forzado\u00a0again? Si pero no, no llega al nivel de gilipollez de Ultr\u00f3n en Los Vengadores 2 o lo que co\u00f1o fuera el Mandar\u00edn de Iron Man 3, tampoco digo que sea tan divertida como Guardianes de la Galaxia o Ant-man pero quitando alguna que otra metedura de pata, con los chistes de Doctor Strange te r\u00edes. \u00bfAlgo m\u00e1s? Espero que\u00a0no Lo siento pero si, estoy harto de las putas escenas post-cr\u00e9ditos, apenas 1 minuto de informaci\u00f3n solo para confirmar lo que ya sabemos antes de ir al cine, la puta secuela, y sin contar que no era 1 sino 2 jodidas escenas, claro que podr\u00eda haberme ido y no verlas pero luego quedo de impaciente y de hater con la gente que la vi, estos fanboys. Adem\u00e1s de la man\u00eda de \u201cunir\u201d las pel\u00edculas para crear un universo, lo que hacen es liar m\u00e1s al espectador, ya en Los Vengadores 2 se notaba que a Joss Whedon le costaba manejar a tanto personaje en la pantalla no me quiero imaginar en Los Vengadores 3 y 4 con tanto superheroe suelto. Vivan los mandalas\u00a0a\u00e9reos \u00bfMe vas a decir algo bueno de la pel\u00edcula o vas a seguir de\u00a0hater? Si claro, las escenas de acci\u00f3n est\u00e1n muy logradas, la actuaci\u00f3n del Doctor es de sobresaliente, las ropas que llevan los actores est\u00e1n geniales y se ven muy reales y el CGI es una gozada para que enga\u00f1arnos. Termina ya por\u00a0favor Conclusi\u00f3n: Doctor Strange es m\u00e1s de lo mismo, podr\u00edan haber puesto empe\u00f1o en pulir algunos fallos, tampoco hace falta que todas las cintas de Marvel sean Capit\u00e1n Am\u00e9rica: El Soldado de Invierno, disfrutas vi\u00e9ndola si no le prestas demasiada atenci\u00f3n, si quieres pasar un rato entretenido no dudes en ir a verla. ", "child": "2274_1\t2274_2"}