{"name": "2357", "parent": "", "title": "What Would Steve Jobs Do to Your Whiteboard?", "sentences": [{"edf1": "What Would Steve Jobs Do to Your Whiteboard?"}, {"743b": "Out of everything you have to do right now, reading this is your #1 priority."}, {"954e": "Our behavior defines our priority. By definition, yours is reading this. That\u2019s not to say you aren\u2019t distracted by all of your other priorities, but right now you\u2019re choosing this as your number one."}, {"a46f": "The word \u201cpriority\u201d came into the English language in the 1400s. It was singular. It meant the very first or prior thing. It stayed singular for the next 500 years. Only in the 1900s did we pluralize the term and start talking about \u201cpriorities.\u201d -Greg McKeown, \u201cEssentialism\u201d"}, {"c827": "Somehow we went 500 years knowing that there could only be one most important thing. Then, magically, we discovered we could have multiple most important things."}, {"94ca": "Or are we just kidding ourselves?"}, {"05a5": "\u201cWe can only do\u00a0three.\u201d"}, {"1403": "Steve Jobs changed the world in part because he chose to focus on a very small number of most important things."}, {"8c82": "Walter Isaacson\u2019s biography of the Apple founder is full of stories of Jobs\u2019 technique, often referred to as \u201cslash and burn.\u201d"}, {"304c": "Jobs hosted an annual retreat for the top 100 leaders of the company. He would stand at a whiteboard and list out the company\u2019s top 10 priorities. As the group fought to get their ideas on the list, Jobs would deem which were worthy of inclusion on the board, and write them down."}, {"e0ea": "Once the agonizing work had been done to get the list to 10, Jobs would cross off the bottom seven. \u201cWe can only do three.\u201d"}, {"fca3": "By deciding what our priority is, we\u2019re also deciding what it isn\u2019t. That\u2019s hard."}, {"f256": "What are we so busy\u00a0doing?"}, {"3757": "Before my wife and I had children, I remember telling a coworker how busy we were. She laughed and gave me a patronizing \u201cyou\u2019re too dumb to even know what you just said\u201d look."}, {"5bdf": "She had two young children at the time, and explained true business as \u201cwhen there\u2019s something you absolutely, positively have to get done before going to bed, and you fall asleep on your way to doing it.\u201d"}, {"0795": "Yes. That\u2019s busy."}, {"ddaa": "While we\u2019ve been convincing ourselves that it\u2019s somehow possible to have multiple priorities, we\u2019ve also been convincing ourselves that extreme business equals productivity."}, {"b4bf": "\u201cBusy\u201d has almost replaced \u201cfine\u201d as the standard response to the hallway question \u201cHow are you?\u201d"}, {"78ce": "This happens a\u00a0lot:"}, {"6bd6": "Person: \u201cHow\u2019s it going?\u201dMe: \u201cCrazy busy. You?\u201dPerson: \u201cYep. I hear you.\u201dMe: \u201cIt\u2019s a good thing, right?\u201dPerson: \u201cJob security.\u201d"}, {"79ce": "This is ridiculous. What am I so busy with? My priority? Usually not. Usually it\u2019s managing all of those things distracting me from my priority. Email. Meetings. Text messages. IMs."}, {"422d": "Other people\u2019s priorities. Not mine."}, {"fb4d": "I\u2019m not getting work done. I\u2019m just processing messages."}, {"4718": "If I listed the 100 things I find myself doing on one of those Steve Jobs whiteboards, he\u2019d cross 97 of them off the list."}, {"be17": "What\u2019s stopping me from doing the same thing?"}, {"1032": "If you\u2019d like some guidance on incorporating the concepts from this post in your life or work, I\u2019d love to help. Find me at Christopher Sowers\u200a\u2014\u200aCoach Profile on Coach.me. You can use the promo code CHRIS11873WEEK for a free week of online coaching."}], "content": "What Would Steve Jobs Do to Your Whiteboard? Out of everything you have to do right now, reading this is your #1 priority. Our behavior defines our priority. By definition, yours is reading this. That\u2019s not to say you aren\u2019t distracted by all of your other priorities, but right now you\u2019re choosing this as your number one. The word \u201cpriority\u201d came into the English language in the 1400s. It was singular. It meant the very first or prior thing. It stayed singular for the next 500 years. Only in the 1900s did we pluralize the term and start talking about \u201cpriorities.\u201d -Greg McKeown, \u201cEssentialism\u201d Somehow we went 500 years knowing that there could only be one most important thing. Then, magically, we discovered we could have multiple most important things. Or are we just kidding ourselves? \u201cWe can only do\u00a0three.\u201d Steve Jobs changed the world in part because he chose to focus on a very small number of most important things. Walter Isaacson\u2019s biography of the Apple founder is full of stories of Jobs\u2019 technique, often referred to as \u201cslash and burn.\u201d Jobs hosted an annual retreat for the top 100 leaders of the company. He would stand at a whiteboard and list out the company\u2019s top 10 priorities. As the group fought to get their ideas on the list, Jobs would deem which were worthy of inclusion on the board, and write them down. Once the agonizing work had been done to get the list to 10, Jobs would cross off the bottom seven. \u201cWe can only do three.\u201d By deciding what our priority is, we\u2019re also deciding what it isn\u2019t. That\u2019s hard. What are we so busy\u00a0doing? Before my wife and I had children, I remember telling a coworker how busy we were. She laughed and gave me a patronizing \u201cyou\u2019re too dumb to even know what you just said\u201d look. She had two young children at the time, and explained true business as \u201cwhen there\u2019s something you absolutely, positively have to get done before going to bed, and you fall asleep on your way to doing it.\u201d Yes. That\u2019s busy. While we\u2019ve been convincing ourselves that it\u2019s somehow possible to have multiple priorities, we\u2019ve also been convincing ourselves that extreme business equals productivity. \u201cBusy\u201d has almost replaced \u201cfine\u201d as the standard response to the hallway question \u201cHow are you?\u201d This happens a\u00a0lot: Person: \u201cHow\u2019s it going?\u201dMe: \u201cCrazy busy. You?\u201dPerson: \u201cYep. I hear you.\u201dMe: \u201cIt\u2019s a good thing, right?\u201dPerson: \u201cJob security.\u201d This is ridiculous. What am I so busy with? My priority? Usually not. Usually it\u2019s managing all of those things distracting me from my priority. Email. Meetings. Text messages. IMs. Other people\u2019s priorities. Not mine. I\u2019m not getting work done. I\u2019m just processing messages. If I listed the 100 things I find myself doing on one of those Steve Jobs whiteboards, he\u2019d cross 97 of them off the list. What\u2019s stopping me from doing the same thing? If you\u2019d like some guidance on incorporating the concepts from this post in your life or work, I\u2019d love to help. Find me at Christopher Sowers\u200a\u2014\u200aCoach Profile on Coach.me. You can use the promo code CHRIS11873WEEK for a free week of online coaching. ", "child": "2357_1\t2357_2\t2357_3\t2357_4\t2357_5\t2357_6\t2357_7\t2357_82357_1\t2357_2\t2357_3\t2357_4\t2357_5\t2357_6\t2357_7\t2357_82357_1\t2357_2\t2357_3\t2357_4\t2357_5\t2357_6\t2357_7\t2357_82357_1\t2357_2\t2357_3\t2357_4\t2357_5\t2357_6\t2357_7\t2357_8"}