{"name": "2358", "parent": "", "title": "The Surprising Trait of Great Leaders\u200a\u2014\u200aand how to develop\u00a0it.", "sentences": [{"9107": "The Surprising Trait of Great Leaders\u200a\u2014\u200aand how to develop\u00a0it."}, {"1387": "\u201cI don\u2019t know.\u201d"}, {"6ed8": "I was standing in front of more than 200 owners at my first annual meeting as General Manager. It felt like I\u2019d been at the microphone for hours on every subject imaginable\u200a\u2014\u200aoperations, capital projects, insurance, fund balances, team development, specific fees and allocations, and so on. It was their main chance to get questions answered, and they deserved full accountability and transparency."}, {"c92b": "I don\u2019t recall the topic, but I do remember what it felt like to say those three words. I\u2019d been dreading it all morning, reaching into the far corners of my mind and our supporting material. It could no longer be avoided. The words of my mentor echoed silently between my ears."}, {"d55c": "Just admit what you don\u2019t know."}, {"799e": "So I did. And\u00a0\u2026 nothing happened. There was no lightning strike or angry mob. The owner nodded, and I followed up that we would research it and be back in touch. That was it."}, {"e657": "Aside from releasing mountains of anxiety and expectations, I learned a powerful lesson that day\u200a\u2014\u200ato be respected and trusted, I had to be vulnerable."}, {"00fb": "I had to be open about my weaknesses and knowledge gaps. In order to have confidence in what I did share, they had to know I could admit when we were venturing into an unknown."}, {"a708": "If we plot vulnerability on a spectrum, there\u2019s certainly a sweet spot for leaders. Pitfalls exist at either extreme."}, {"90a8": "To the far left are leaders that will not allow any chinks in their armor. They\u2019re either unaware that they have any deficiencies, or unwilling to admit them."}, {"2eec": "To the far right are leaders that draw attention to every obstacle or challenge in their path. They want to be sure everyone is fully aware of the stress or workload they\u2019re carrying."}, {"2580": "We\u2019ll want to avoid either of those approaches, and focus on behaviors that move us closer to the right balance."}, {"9d92": "Here are some examples to consider:"}, {"b651": "When tasked with a new project by your manager, do you:"}, {"f3f1": "When confronted with a funding shortfall, do you:"}, {"6690": "In each set, the third option navigates with appropriate vulnerability."}, {"1165": "The key factors to consider are:"}, {"4739": "It takes practice, and we\u2019re likely to misstep from time to time. That\u2019s a part of the leadership journey. The key is to be intentional and learn from each experience."}, {"014f": "Have you ever been vulnerable with your team in a tough situation? Was that a difficult choice to make?"}, {"5515": "\u2014 \u2014"}, {"4401": "I believe that leadership is a choice to be a contagious force for the positive, and I\u2019m committed to helping leaders live and serve at their best. If that sounds interesting to you, let\u2019s connect."}, {"fadd": "\u2014 \u2014"}, {"8890": "image credit: flickr/Infusionsoft"}], "content": "The Surprising Trait of Great Leaders\u200a\u2014\u200aand how to develop\u00a0it. \u201cI don\u2019t know.\u201d I was standing in front of more than 200 owners at my first annual meeting as General Manager. It felt like I\u2019d been at the microphone for hours on every subject imaginable\u200a\u2014\u200aoperations, capital projects, insurance, fund balances, team development, specific fees and allocations, and so on. It was their main chance to get questions answered, and they deserved full accountability and transparency. I don\u2019t recall the topic, but I do remember what it felt like to say those three words. I\u2019d been dreading it all morning, reaching into the far corners of my mind and our supporting material. It could no longer be avoided. The words of my mentor echoed silently between my ears. Just admit what you don\u2019t know. So I did. And\u00a0\u2026 nothing happened. There was no lightning strike or angry mob. The owner nodded, and I followed up that we would research it and be back in touch. That was it. Aside from releasing mountains of anxiety and expectations, I learned a powerful lesson that day\u200a\u2014\u200ato be respected and trusted, I had to be vulnerable. I had to be open about my weaknesses and knowledge gaps. In order to have confidence in what I did share, they had to know I could admit when we were venturing into an unknown. If we plot vulnerability on a spectrum, there\u2019s certainly a sweet spot for leaders. Pitfalls exist at either extreme. To the far left are leaders that will not allow any chinks in their armor. They\u2019re either unaware that they have any deficiencies, or unwilling to admit them. To the far right are leaders that draw attention to every obstacle or challenge in their path. They want to be sure everyone is fully aware of the stress or workload they\u2019re carrying. We\u2019ll want to avoid either of those approaches, and focus on behaviors that move us closer to the right balance. Here are some examples to consider: When tasked with a new project by your manager, do you: When confronted with a funding shortfall, do you: In each set, the third option navigates with appropriate vulnerability. The key factors to consider are: It takes practice, and we\u2019re likely to misstep from time to time. That\u2019s a part of the leadership journey. The key is to be intentional and learn from each experience. Have you ever been vulnerable with your team in a tough situation? Was that a difficult choice to make? \u2014 \u2014 I believe that leadership is a choice to be a contagious force for the positive, and I\u2019m committed to helping leaders live and serve at their best. If that sounds interesting to you, let\u2019s connect. \u2014 \u2014 image credit: flickr/Infusionsoft ", "child": "2358_1\t2358_22358_1\t2358_22358_1\t2358_2"}