{"name": "2366", "parent": "", "title": "T\u2019es solo founder, tu rentres pas\u00a0!", "sentences": [{"266f": "T\u2019es solo founder, tu rentres pas\u00a0!"}, {"2c5b": "T\u2019es solo founder, tu rentres pas\u00a0!"}, {"59db": "L\u2019\u00e9cosyst\u00e8me startup est maintenant tr\u00e8s d\u00e9velopp\u00e9 en France et on trouve tous types de structures pour aider et accompagner les entrepreneurs\u00a0: incubateurs, acc\u00e9l\u00e9rateurs, associations de business angels, VCs, BPI France, etc. M\u00eame si toutes ces structures n\u2019ont pas le m\u00eame r\u00f4le, toutes ont un leitmotiv, sans expliquer pourquoi\u00a0:"}, {"7dcd": "Nous n\u2019acceptons pas les solo founders\u00a0!"}, {"e021": "Pour quelle(s) raison(s)\u00a0?"}, {"9bf0": "Si tu te fais \u00e9craser par un bus demain, le projet est mort."}, {"9230": "Certes, c\u2019est compliqu\u00e9 de relancer un projet une fois que le cr\u00e9ateur n\u2019est plus l\u00e0. Mais dans le cas d\u2019un projet mont\u00e9 par une \u201c\u00e9quipe compl\u00e9mentaire\u201d, est-ce que cet argument n\u2019est pas \u00e9galement valable si le CTO arrive \u00e0 dispara\u00eetre\u00a0?"}, {"c728": "Tout seul on va plus vite, en \u00e9quipe on va plus loin."}, {"a393": "\u00c0 petite phrase bateau ridicule, r\u00e9ponse par petite phrase bateau ridicule\u00a0: \u201cvaut mieux \u00eatre seul que mal accompagn\u00e9\u201d. Plus s\u00e9rieusement, ces petites phrases que tous les acteurs de l\u2019\u00e9cosyst\u00e8me s\u2019amusent \u00e0 sortir comme si c\u2019\u00e9tait des citations de Platon ou Freud n\u2019apportent absolument rien et n\u2019ont aucun fondement."}, {"86f6": "Une seule personne ne peut pas (savoir) tout faire."}, {"1675": "Alors sur ce point, je suis d\u2019accord \u00e0 100%. Et avant tout, c\u2019est le temps qui vient \u00e0 manquer. Mais est-ce qu\u2019avoir un associ\u00e9 business developer ou bien un salari\u00e9 int\u00e9ress\u00e9 comme il se doit ne revient pas \u00e0 peu pr\u00e8s \u00e0 la m\u00eame chose\u00a0?"}, {"40b5": "\u00catre solo founder n\u2019est pas un\u00a0choix"}, {"faf3": "Sans les paraphraser, quand elles misent sur un projet \u201cc\u2019est avant tout pour l\u2019\u00e9quipe qui doit \u00eatre compos\u00e9e de profils qui s\u2019entendent bien et qui sont compl\u00e9mentaires\u201d. Ce qui est assez amusant quand ces structures font leur classement des raisons qui font qu\u2019une startup \u00e9choue, c\u2019est qu\u2019elles concluent que tr\u00e8s souvent c\u2019est d\u00fb \u00e0 l\u2019\u00e9quipe. Tiens tiens\u2026"}, {"0ceb": "Elles voient souvent le fait d\u2019\u00eatre solo founder comme un choix de l\u2019entrepreneur. Or non \u00e7a n\u2019en n\u2019est pas un. Si on essaie d\u2019analyser comment des personnes arrivent \u00e0 s\u2019associer, on en arrive \u00e0 deux situations\u00a0: les associ\u00e9s ont fait leurs \u00e9tudes ensemble et ont d\u00e9cid\u00e9 de monter une bo\u00eete en sortant de l\u2019\u00e9cole OU ils ont travaill\u00e9 dans une entreprise et ont une envie de tout quitter pour monter leur bo\u00eete. Pour me contredire on peut citer le cas d\u2019OpenClassrooms (ex. Site du Z\u00e9ro). La fa\u00e7on dont s\u2019est cr\u00e9\u00e9e l\u2019association entre Mathieu Nebra et Pierre Dubuc est tout \u00e0 fait admirable. Mais quelle est la probabilit\u00e9 que cela arrive\u00a0?"}, {"e9ca": "Trouve un associ\u00e9 et\u00a0reviens"}, {"c6f8": "Le principal conseil que l\u2019on entend alors pour trouver un associ\u00e9\u00a0:"}, {"ec08": "Faites du networking"}, {"6236": "Ce conseil vu, lu et revu est loin de la r\u00e9alit\u00e9. Apr\u00e8s plusieurs ann\u00e9es pass\u00e9es \u00e0 Paris, \u00e0 participer \u00e0 divers \u00e9v\u00e9nements, je n\u2019ai jamais rencontr\u00e9 quelqu\u2019un de s\u00e9rieux qui cherche un projet auquel s\u2019associer. Chacun des participants arrive avec son propre projet et cherche un associ\u00e9, souvent technique d\u2019ailleurs. En conclusion, aller \u00e0 ces \u00e9v\u00e9nements c\u2019est aller sur un march\u00e9 vendre quelque chose o\u00f9 il n\u2019y a que des vendeurs et aucun acheteur."}, {"ab9d": "Je comprends pas, trouver un associ\u00e9 d\u00e9veloppeur c\u2019est dur, mais toi tu cherches un associ\u00e9 business, c\u2019est facile \u00e0 trouver\u00a0!"}, {"b7eb": "Th\u00e9oriquement, en effet, ce constat est correct. Dans la r\u00e9alit\u00e9, c\u2019est un peu diff\u00e9rent. J\u2019ai eu l\u2019occasion de discuter et partager avec de potentiels futurs associ\u00e9s et \u00e0 chaque fois \u00e7a a \u00e9t\u00e9 la d\u00e9ception\u00a0: entre celui qui veut directement plus de 50% \u201cparce que sa m\u00e8re connait des investisseurs qui sont int\u00e9ress\u00e9s\u201d et l\u2019autre, qui au bout de plusieurs s\u00e9ances de travail en commun, me montre les mockups de son projet \u201cde r\u00e9seau social r\u00e9volutionnaire\u201d, qu\u2019il veut qu\u2019on monte ensemble parce qu\u2019il cherche un bon d\u00e9veloppeur, la d\u00e9ception a toujours \u00e9t\u00e9 au rendez-vous\u00a0!"}, {"e08e": "Il y a plein de sites et applications mobiles sp\u00e9cialis\u00e9es maintenant"}, {"1e4b": "Toutes test\u00e9es, toutes d\u00e9sapprouv\u00e9es. Certaines vendent la promesse de trouver un associ\u00e9 \u00e0 la suite d\u2019un questionnaire interminable quand d\u2019autres sont devenues le repaire d\u2019agences web offshore."}, {"bdf9": "Que faire donc\u00a0?"}, {"5581": "Trouver un associ\u00e9 co\u00fbte que co\u00fbte ou continuer seul, ce qui signifie sans associ\u00e9 ET sans accompagnement\u00a0? Comment faire changer cette esp\u00e8ce de v\u00e9rit\u00e9 g\u00e9n\u00e9rale qui consiste \u00e0 dire qu\u2019un solo founder est ind\u00e9niablement vou\u00e9 \u00e0 l\u2019\u00e9chec\u00a0?"}, {"68e5": "\u00c0 vos r\u00e9ponses\u00a0:)"}], "content": "T\u2019es solo founder, tu rentres pas\u00a0! T\u2019es solo founder, tu rentres pas\u00a0! L\u2019\u00e9cosyst\u00e8me startup est maintenant tr\u00e8s d\u00e9velopp\u00e9 en France et on trouve tous types de structures pour aider et accompagner les entrepreneurs\u00a0: incubateurs, acc\u00e9l\u00e9rateurs, associations de business angels, VCs, BPI France, etc. M\u00eame si toutes ces structures n\u2019ont pas le m\u00eame r\u00f4le, toutes ont un leitmotiv, sans expliquer pourquoi\u00a0: Nous n\u2019acceptons pas les solo founders\u00a0! Pour quelle(s) raison(s)\u00a0? Si tu te fais \u00e9craser par un bus demain, le projet est mort. Certes, c\u2019est compliqu\u00e9 de relancer un projet une fois que le cr\u00e9ateur n\u2019est plus l\u00e0. Mais dans le cas d\u2019un projet mont\u00e9 par une \u201c\u00e9quipe compl\u00e9mentaire\u201d, est-ce que cet argument n\u2019est pas \u00e9galement valable si le CTO arrive \u00e0 dispara\u00eetre\u00a0? Tout seul on va plus vite, en \u00e9quipe on va plus loin. \u00c0 petite phrase bateau ridicule, r\u00e9ponse par petite phrase bateau ridicule\u00a0: \u201cvaut mieux \u00eatre seul que mal accompagn\u00e9\u201d. Plus s\u00e9rieusement, ces petites phrases que tous les acteurs de l\u2019\u00e9cosyst\u00e8me s\u2019amusent \u00e0 sortir comme si c\u2019\u00e9tait des citations de Platon ou Freud n\u2019apportent absolument rien et n\u2019ont aucun fondement. Une seule personne ne peut pas (savoir) tout faire. Alors sur ce point, je suis d\u2019accord \u00e0 100%. Et avant tout, c\u2019est le temps qui vient \u00e0 manquer. Mais est-ce qu\u2019avoir un associ\u00e9 business developer ou bien un salari\u00e9 int\u00e9ress\u00e9 comme il se doit ne revient pas \u00e0 peu pr\u00e8s \u00e0 la m\u00eame chose\u00a0? \u00catre solo founder n\u2019est pas un\u00a0choix Sans les paraphraser, quand elles misent sur un projet \u201cc\u2019est avant tout pour l\u2019\u00e9quipe qui doit \u00eatre compos\u00e9e de profils qui s\u2019entendent bien et qui sont compl\u00e9mentaires\u201d. Ce qui est assez amusant quand ces structures font leur classement des raisons qui font qu\u2019une startup \u00e9choue, c\u2019est qu\u2019elles concluent que tr\u00e8s souvent c\u2019est d\u00fb \u00e0 l\u2019\u00e9quipe. Tiens tiens\u2026 Elles voient souvent le fait d\u2019\u00eatre solo founder comme un choix de l\u2019entrepreneur. Or non \u00e7a n\u2019en n\u2019est pas un. Si on essaie d\u2019analyser comment des personnes arrivent \u00e0 s\u2019associer, on en arrive \u00e0 deux situations\u00a0: les associ\u00e9s ont fait leurs \u00e9tudes ensemble et ont d\u00e9cid\u00e9 de monter une bo\u00eete en sortant de l\u2019\u00e9cole OU ils ont travaill\u00e9 dans une entreprise et ont une envie de tout quitter pour monter leur bo\u00eete. Pour me contredire on peut citer le cas d\u2019OpenClassrooms (ex. Site du Z\u00e9ro). La fa\u00e7on dont s\u2019est cr\u00e9\u00e9e l\u2019association entre Mathieu Nebra et Pierre Dubuc est tout \u00e0 fait admirable. Mais quelle est la probabilit\u00e9 que cela arrive\u00a0? Trouve un associ\u00e9 et\u00a0reviens Le principal conseil que l\u2019on entend alors pour trouver un associ\u00e9\u00a0: Faites du networking Ce conseil vu, lu et revu est loin de la r\u00e9alit\u00e9. Apr\u00e8s plusieurs ann\u00e9es pass\u00e9es \u00e0 Paris, \u00e0 participer \u00e0 divers \u00e9v\u00e9nements, je n\u2019ai jamais rencontr\u00e9 quelqu\u2019un de s\u00e9rieux qui cherche un projet auquel s\u2019associer. Chacun des participants arrive avec son propre projet et cherche un associ\u00e9, souvent technique d\u2019ailleurs. En conclusion, aller \u00e0 ces \u00e9v\u00e9nements c\u2019est aller sur un march\u00e9 vendre quelque chose o\u00f9 il n\u2019y a que des vendeurs et aucun acheteur. Je comprends pas, trouver un associ\u00e9 d\u00e9veloppeur c\u2019est dur, mais toi tu cherches un associ\u00e9 business, c\u2019est facile \u00e0 trouver\u00a0! Th\u00e9oriquement, en effet, ce constat est correct. Dans la r\u00e9alit\u00e9, c\u2019est un peu diff\u00e9rent. J\u2019ai eu l\u2019occasion de discuter et partager avec de potentiels futurs associ\u00e9s et \u00e0 chaque fois \u00e7a a \u00e9t\u00e9 la d\u00e9ception\u00a0: entre celui qui veut directement plus de 50% \u201cparce que sa m\u00e8re connait des investisseurs qui sont int\u00e9ress\u00e9s\u201d et l\u2019autre, qui au bout de plusieurs s\u00e9ances de travail en commun, me montre les mockups de son projet \u201cde r\u00e9seau social r\u00e9volutionnaire\u201d, qu\u2019il veut qu\u2019on monte ensemble parce qu\u2019il cherche un bon d\u00e9veloppeur, la d\u00e9ception a toujours \u00e9t\u00e9 au rendez-vous\u00a0! Il y a plein de sites et applications mobiles sp\u00e9cialis\u00e9es maintenant Toutes test\u00e9es, toutes d\u00e9sapprouv\u00e9es. Certaines vendent la promesse de trouver un associ\u00e9 \u00e0 la suite d\u2019un questionnaire interminable quand d\u2019autres sont devenues le repaire d\u2019agences web offshore. Que faire donc\u00a0? Trouver un associ\u00e9 co\u00fbte que co\u00fbte ou continuer seul, ce qui signifie sans associ\u00e9 ET sans accompagnement\u00a0? Comment faire changer cette esp\u00e8ce de v\u00e9rit\u00e9 g\u00e9n\u00e9rale qui consiste \u00e0 dire qu\u2019un solo founder est ind\u00e9niablement vou\u00e9 \u00e0 l\u2019\u00e9chec\u00a0? \u00c0 vos r\u00e9ponses\u00a0:) ", "child": "2366_1\t2366_2\t2366_3\t2366_4\t2366_5"}