{"name": "2393", "parent": "", "title": "Invest in Lines, Not\u00a0Dots", "sentences": [{"f102": "Invest in Lines, Not\u00a0Dots"}, {"72c8": "Everyone seems to be in such a rush to get shacked up these days."}, {"443e": "In normal times investors will look for \u201ctraction\u201d before investing. We want to make sure we\u2019re in love. This sometimes frustrates entrepreneurs who just want to \u201cget back to running the business.\u201d But if you understand it you\u2019ll see that it is perfectly rational and it should also influence how you form relationships with investors. And remember, if we get married you\u2019re stuck with us, too."}, {"4ed6": "The first time I meet you, you are a single data point. A dot. I have no reference point from which to judge whether you were higher on the y-axis 3 months ago or lower. Because I have no observation points from the past, I have no sense for where you will be in the future. Thus, it is very hard to make a commitment to fund you."}, {"8013": "For this reason I tell entrepreneurs the following: Meet your potential investors early. Tell them you\u2019re not raising money yet but that you will be in the next 6 months or so. Tell them you really like them so you want them to have an early view (which is what all investor\u2019s want). When you\u2019re with them lower the bar by telling them, \u201cwe haven\u2019t shipped product yet, we have lots of decisions still to make, but we\u2019d like to show you our prototype\u201d or obviously if you\u2019re more advanced show what you have and what your roadmap looks like."}, {"4fda": "Most importantly tell them what you plan to achieve by the next time you see them. Hopefully by then you\u2019ve made good progress. You\u2019ll be able to give them an update on key hires, pilot customers, key tech innovations\u200a\u2014\u200awhatever. Keep these interactions low-key and short. Quick coffees, whatever. Swing by their offices to make it easy for them to say yes and promise not to take up more than 30 minutes for the update (and stick to it)."}, {"0ee9": "I spoke about this more in depth in these two posts: 4 things I look for in an investment & how to manage VC relationships. And don\u2019t allocate two months of each year to \u201chardcore funding activities\u201d but allocate a regular amount of time each month to it like any other job function. Like it or not\u200a\u2014\u200afinance is a major job function in any company\u200a\u2014\u200astartup or public company."}, {"1249": "The thing is, by the time I get to know you I start to see patterns. Note that \u201cperformance\u201d on my chart is a loose term for my definition of perceived progress that can take the form of product, customer adoption, employees, investors, press or whatever. It is basically a perception that you are making progress in your business and not standing still."}, {"12c1": "All of these meetings don\u2019t actually require you to prove that you\u2019re \u201ckilling it\u201d over night. It\u2019s a chance for us to build a relationship and for the investor to see how you think and how you respond to adversity. How can you prove tenacity, resiliency or ability to pivot in a single data point? I funded Ad.ly having seen Sean Rad perform over a 1-year period at Orgoo, which didn\u2019t succeed. I didn\u2019t invest in Orgoo but by the time he launched Ad.ly I knew his capabilities and knew I wanted to work with him."}, {"9388": "I had 15 meetings or more with Evan Rifkin over a 2-year period of time long before I invested in Burstly. In fact, long before he had even founded Burstly. I knew he was one of the most talented entrepreneurs in LA and he has exceeded my expectations since I invested. Presumably during this interactions Evan also decided I wasn\u2019t a Dick so the meetings cut both ways."}, {"9998": "I spent the past week in New York. The profile of one of the hottest companies I met was as per the graph below."}, {"1315": "The deal is moving a bit too fast for me and is becoming frenzied with interest. But I really think this company has a good shot at becoming a monster. It\u2019s a killer CEO, great product, market ripe for disruption, experienced product team and great CMO who has relevant experience from her former life. I\u2019ve been watching from the sidelines for 6 months and waiting to meet the team. Given a few more data points I would have liked to have invested but given the market speed it looks unlikely."}, {"239f": "So here\u2019s the thing:"}, {"4453": "And we all know how Vegas weddings turn out."}], "content": "Invest in Lines, Not\u00a0Dots Everyone seems to be in such a rush to get shacked up these days. In normal times investors will look for \u201ctraction\u201d before investing. We want to make sure we\u2019re in love. This sometimes frustrates entrepreneurs who just want to \u201cget back to running the business.\u201d But if you understand it you\u2019ll see that it is perfectly rational and it should also influence how you form relationships with investors. And remember, if we get married you\u2019re stuck with us, too. The first time I meet you, you are a single data point. A dot. I have no reference point from which to judge whether you were higher on the y-axis 3 months ago or lower. Because I have no observation points from the past, I have no sense for where you will be in the future. Thus, it is very hard to make a commitment to fund you. For this reason I tell entrepreneurs the following: Meet your potential investors early. Tell them you\u2019re not raising money yet but that you will be in the next 6 months or so. Tell them you really like them so you want them to have an early view (which is what all investor\u2019s want). When you\u2019re with them lower the bar by telling them, \u201cwe haven\u2019t shipped product yet, we have lots of decisions still to make, but we\u2019d like to show you our prototype\u201d or obviously if you\u2019re more advanced show what you have and what your roadmap looks like. Most importantly tell them what you plan to achieve by the next time you see them. Hopefully by then you\u2019ve made good progress. You\u2019ll be able to give them an update on key hires, pilot customers, key tech innovations\u200a\u2014\u200awhatever. Keep these interactions low-key and short. Quick coffees, whatever. Swing by their offices to make it easy for them to say yes and promise not to take up more than 30 minutes for the update (and stick to it). I spoke about this more in depth in these two posts: 4 things I look for in an investment & how to manage VC relationships. And don\u2019t allocate two months of each year to \u201chardcore funding activities\u201d but allocate a regular amount of time each month to it like any other job function. Like it or not\u200a\u2014\u200afinance is a major job function in any company\u200a\u2014\u200astartup or public company. The thing is, by the time I get to know you I start to see patterns. Note that \u201cperformance\u201d on my chart is a loose term for my definition of perceived progress that can take the form of product, customer adoption, employees, investors, press or whatever. It is basically a perception that you are making progress in your business and not standing still. All of these meetings don\u2019t actually require you to prove that you\u2019re \u201ckilling it\u201d over night. It\u2019s a chance for us to build a relationship and for the investor to see how you think and how you respond to adversity. How can you prove tenacity, resiliency or ability to pivot in a single data point? I funded Ad.ly having seen Sean Rad perform over a 1-year period at Orgoo, which didn\u2019t succeed. I didn\u2019t invest in Orgoo but by the time he launched Ad.ly I knew his capabilities and knew I wanted to work with him. I had 15 meetings or more with Evan Rifkin over a 2-year period of time long before I invested in Burstly. In fact, long before he had even founded Burstly. I knew he was one of the most talented entrepreneurs in LA and he has exceeded my expectations since I invested. Presumably during this interactions Evan also decided I wasn\u2019t a Dick so the meetings cut both ways. I spent the past week in New York. The profile of one of the hottest companies I met was as per the graph below. The deal is moving a bit too fast for me and is becoming frenzied with interest. But I really think this company has a good shot at becoming a monster. It\u2019s a killer CEO, great product, market ripe for disruption, experienced product team and great CMO who has relevant experience from her former life. I\u2019ve been watching from the sidelines for 6 months and waiting to meet the team. Given a few more data points I would have liked to have invested but given the market speed it looks unlikely. So here\u2019s the thing: And we all know how Vegas weddings turn out. ", "child": "2393_1\t2393_2\t2393_3\t2393_4"}