{"name": "2456", "parent": "", "title": "Lots of people are saying that Instagram just officially \u2018killed Snapchat\u2019 Here\u2019s why they\u2019re\u00a0wrong.", "sentences": [{"9a8e": "Lots of people are saying that Instagram just officially \u2018killed Snapchat\u2019 Here\u2019s why they\u2019re\u00a0wrong."}, {"8def": "Last week, Facebook announced that Instagram Stories had reached 200 million daily active users (DAUs)."}, {"2aaf": "People were quick to pounce on that significant number and declare that finally, Mark Zuckerberg had \u2018killed\u2019 Snapchat and Facebook and Instagram were winning some imaginary war. Many tweeted things like, \u201cRIP Snap,\u201d \u201cIs Snapchat already dead?,\u201d \u201cSnapchat is dead fam. Instagram stories came and ended her,\u201d \u201cInstagram just destroyed Snapchat.\u201d"}, {"dedd": "But to compare Instagram Stories\u2019 200M DAUs with Snapchat\u2019s total 161M daily active users is to equate apples with oranges. And, despite the fact that Instagram has made an effort to copy nearly all of Snapchat\u2019s signature features, treating the two apps as similar platforms to begin with is a fruitless exercise."}, {"b96c": "First, it\u2019s worth noting that Instagram Stories is not its own app. It\u2019s a feature bolted onto a pre-existing app that has already amassed more than 400M daily active users."}, {"3a0c": "Second, when Instagram talks about Instagram Stories \u201cdaily active users\u201d, the company seems to mean \u201canyone who checks Instagram Stories on a daily basis.\u201d"}, {"b91d": "Instagram Stories"}, {"77c9": "Facebook won\u2019t explicitly confirm what goes into calculating this metric, but it seems to be that if Beyonce blasts out an Instagram story to her nearly 100M Instagram followers and you happen to click it while scrolling through your feed, you are counted Instagram Stories daily active user."}, {"b36e": "Facebook has previously faced criticism over lowering the threshold of what is considered engagement. On the company\u2019s flagship app a view only counts as three seconds and in September it was revealed that the company had \u201csignificantly inflated average video view times for years.\u201d"}, {"dc3e": "Sure, Snapchat similarly defines a daily active users as a person who opens the app once in a 24-hour-period, but consider the fact that the average snapchatter spends around half an hour on the app per day and 60% of users create content. Instagram is primarily used for browsing and the average user spends just 15 minutes per day within the app. It\u2019s highly unlikely that all 15 of those minutes are spent engaging with Instagram Stories."}, {"4530": "Assuming that Instagram has grown from the 400M DAUs it had in February, that means that under half of Instagram\u2019s total daily user base engages with a feature that has been shoved into their feeds and promoted aggressively within the platform. This is far from an achievement\u200a\u2014\u200ait\u2019s unsurprising."}, {"b62b": "And this is the challenge for Instagram: the company has also yet to prove that users are using Instagram specifically for stories. Snapchat has cultivated a fertile niche in consumer behavior as an addictive, essential destination, while, right now, Instagram Stories is just one more feature haphazardly incorporated into a fragmented app."}, {"cff1": "Shots from an older version of\u00a0Snapchat"}, {"accc": "Tech observers are desperate to pit the two companies against each other, but part of the reason it\u2019s hard to even have a productive discussion about Instagram vs Snapchat, is that Snapchat breaks the mold of what so many consider a \u201csocial media company.\u201d"}, {"d3ac": "Instagram, like Twitter and other social platforms, is built on a broadcast model of one-to-many communication. It encourages public posting by default and incentivizes high follower counts and likes. This is great for users looking to gain mass exposure, like brands and influencers, but it doesn\u2019t stoke a high level of private and intentional communication with your closest friends."}, {"f348": "On Snapchat, there is no incentive to get followers or build an overly curated persona. It\u2019s almost closer to a messaging platform than any of the public-facing social networks it\u2019s often compared to. But to equate Snapchat to WhatsApp, WeChat, or even Facebook Messenger is also off. None of those apps are focused on photo and video consumption and sharing (Though naturally, Facebook Messenger now has Stories)."}, {"6e46": "Ultimately, social products aren\u2019t just defined by the features they offer, they are also shaped by the learned user behaviors and norms that evolve within them."}, {"455c": "\u201cWhat happens when you drop a feature like Stories into a community that doesn\u2019t have that well developed set of norms? Some different set of norms will develop,\u201d Parker Thompson an early stage investor and partner at Angelist recently told me \u201cYour mom, for instance, when she sees your Instagram story, she\u2019s not a Snapchat user so she doesn\u2019t have that context and the experience and the way she treats the feature is just not going to be the same.\u201d"}, {"5fc3": "Instagram Stories"}, {"853c": "Many people say that Instagram Stories offer a more enjoyable experience because \u201cmore people see your story.\u201d But they are thinking of Stories within the context of the learned behaviors shaped by Instagram and other social networks that have pre-conditioned them to equate more views with \u201csuccess\u201d on a platform."}, {"9ee5": "Snapchat, on the other hand, is focused on facilitating deeper communication between a smaller group of friends, which is why it garners much more engagement. It\u2019s a communication platform, not a broadcast platform. Snapchat did recently introduce a search function for public Stories, allowing users to discover content from people they don\u2019t follow, but the snaps that are surfaced are stripped of usernames or Snap handles. There is still no internal discovery mechanism for finding interest-based user accounts on Snapchat."}, {"9aa7": "And while it\u2019s true that Instagram might have shaved off some would-be Snapchat users, it\u2019s unclear if many of these people would have ever joined the platform to begin with."}, {"8b59": "\u201cInstagram is still a place for users to show off their day in images and has built an aesthetic around smartphone photography. What brings many users back to Snapchat is\u2026 the messaging they do with friends,\u201d says Noah Mallin Head of Social, North America for MEC."}, {"5757": "Snapchat video\u00a0chatting"}, {"9e7f": "All this isn\u2019t to say that Snapchat doesn\u2019t have problems. Snap is a publicly traded company now and as it grows it will have to deliver value to its shareholders. As the company noted in its S-1, the majority of its users are concentrated among top advertising markets, which bodes well for the company if it can offer innovative ad products and move out of advertisers\u2019 \u201cexperimental bucket\u201d."}, {"073e": "\u201cTo me, Snapchat has always been ahead of the curve. I fondly call it the \u2018Snapchat effect.\u2019 They lead and others follow,\u201d Gemma Craven Senior Vice President and Director of Social & Mobile at McCann told me recently. \u201cSnap called itself a camera company and now Facebook is talking about the camera being the most important part of any device, you see it all over.\u201d"}, {"b914": "\u201cI am confident that they are going to be able to monetize successfully,\u201d she added. To her, Snap will likely end up going after TV dollars by offering more premium content in Snapchat Discover, something Instagram will have difficulty doing."}, {"f5f2": "Silicon Valley loves the spectacle of a no-holds-barred clash of tech titans, and comparing Snapchat to Instagram is certainly entertaining. But, rather than focusing on irrelevant metrics, people should think critically about the different ways people use these platforms to connect with others."}, {"9358": "Snapchat is not just another social network. It represents a radical shift in the way we communicate. It has established new norms and broken the mold of what we think of as social media\u200a\u2014\u200aand that is something that Instagram will most likely never be able to replicate."}], "content": "Lots of people are saying that Instagram just officially \u2018killed Snapchat\u2019 Here\u2019s why they\u2019re\u00a0wrong. Last week, Facebook announced that Instagram Stories had reached 200 million daily active users (DAUs). People were quick to pounce on that significant number and declare that finally, Mark Zuckerberg had \u2018killed\u2019 Snapchat and Facebook and Instagram were winning some imaginary war. Many tweeted things like, \u201cRIP Snap,\u201d \u201cIs Snapchat already dead?,\u201d \u201cSnapchat is dead fam. Instagram stories came and ended her,\u201d \u201cInstagram just destroyed Snapchat.\u201d But to compare Instagram Stories\u2019 200M DAUs with Snapchat\u2019s total 161M daily active users is to equate apples with oranges. And, despite the fact that Instagram has made an effort to copy nearly all of Snapchat\u2019s signature features, treating the two apps as similar platforms to begin with is a fruitless exercise. First, it\u2019s worth noting that Instagram Stories is not its own app. It\u2019s a feature bolted onto a pre-existing app that has already amassed more than 400M daily active users. Second, when Instagram talks about Instagram Stories \u201cdaily active users\u201d, the company seems to mean \u201canyone who checks Instagram Stories on a daily basis.\u201d Instagram Stories Facebook won\u2019t explicitly confirm what goes into calculating this metric, but it seems to be that if Beyonce blasts out an Instagram story to her nearly 100M Instagram followers and you happen to click it while scrolling through your feed, you are counted Instagram Stories daily active user. Facebook has previously faced criticism over lowering the threshold of what is considered engagement. On the company\u2019s flagship app a view only counts as three seconds and in September it was revealed that the company had \u201csignificantly inflated average video view times for years.\u201d Sure, Snapchat similarly defines a daily active users as a person who opens the app once in a 24-hour-period, but consider the fact that the average snapchatter spends around half an hour on the app per day and 60% of users create content. Instagram is primarily used for browsing and the average user spends just 15 minutes per day within the app. It\u2019s highly unlikely that all 15 of those minutes are spent engaging with Instagram Stories. Assuming that Instagram has grown from the 400M DAUs it had in February, that means that under half of Instagram\u2019s total daily user base engages with a feature that has been shoved into their feeds and promoted aggressively within the platform. This is far from an achievement\u200a\u2014\u200ait\u2019s unsurprising. And this is the challenge for Instagram: the company has also yet to prove that users are using Instagram specifically for stories. Snapchat has cultivated a fertile niche in consumer behavior as an addictive, essential destination, while, right now, Instagram Stories is just one more feature haphazardly incorporated into a fragmented app. Shots from an older version of\u00a0Snapchat Tech observers are desperate to pit the two companies against each other, but part of the reason it\u2019s hard to even have a productive discussion about Instagram vs Snapchat, is that Snapchat breaks the mold of what so many consider a \u201csocial media company.\u201d Instagram, like Twitter and other social platforms, is built on a broadcast model of one-to-many communication. It encourages public posting by default and incentivizes high follower counts and likes. This is great for users looking to gain mass exposure, like brands and influencers, but it doesn\u2019t stoke a high level of private and intentional communication with your closest friends. On Snapchat, there is no incentive to get followers or build an overly curated persona. It\u2019s almost closer to a messaging platform than any of the public-facing social networks it\u2019s often compared to. But to equate Snapchat to WhatsApp, WeChat, or even Facebook Messenger is also off. None of those apps are focused on photo and video consumption and sharing (Though naturally, Facebook Messenger now has Stories). Ultimately, social products aren\u2019t just defined by the features they offer, they are also shaped by the learned user behaviors and norms that evolve within them. \u201cWhat happens when you drop a feature like Stories into a community that doesn\u2019t have that well developed set of norms? Some different set of norms will develop,\u201d Parker Thompson an early stage investor and partner at Angelist recently told me \u201cYour mom, for instance, when she sees your Instagram story, she\u2019s not a Snapchat user so she doesn\u2019t have that context and the experience and the way she treats the feature is just not going to be the same.\u201d Instagram Stories Many people say that Instagram Stories offer a more enjoyable experience because \u201cmore people see your story.\u201d But they are thinking of Stories within the context of the learned behaviors shaped by Instagram and other social networks that have pre-conditioned them to equate more views with \u201csuccess\u201d on a platform. Snapchat, on the other hand, is focused on facilitating deeper communication between a smaller group of friends, which is why it garners much more engagement. It\u2019s a communication platform, not a broadcast platform. Snapchat did recently introduce a search function for public Stories, allowing users to discover content from people they don\u2019t follow, but the snaps that are surfaced are stripped of usernames or Snap handles. There is still no internal discovery mechanism for finding interest-based user accounts on Snapchat. And while it\u2019s true that Instagram might have shaved off some would-be Snapchat users, it\u2019s unclear if many of these people would have ever joined the platform to begin with. \u201cInstagram is still a place for users to show off their day in images and has built an aesthetic around smartphone photography. What brings many users back to Snapchat is\u2026 the messaging they do with friends,\u201d says Noah Mallin Head of Social, North America for MEC. Snapchat video\u00a0chatting All this isn\u2019t to say that Snapchat doesn\u2019t have problems. Snap is a publicly traded company now and as it grows it will have to deliver value to its shareholders. As the company noted in its S-1, the majority of its users are concentrated among top advertising markets, which bodes well for the company if it can offer innovative ad products and move out of advertisers\u2019 \u201cexperimental bucket\u201d. \u201cTo me, Snapchat has always been ahead of the curve. I fondly call it the \u2018Snapchat effect.\u2019 They lead and others follow,\u201d Gemma Craven Senior Vice President and Director of Social & Mobile at McCann told me recently. \u201cSnap called itself a camera company and now Facebook is talking about the camera being the most important part of any device, you see it all over.\u201d \u201cI am confident that they are going to be able to monetize successfully,\u201d she added. To her, Snap will likely end up going after TV dollars by offering more premium content in Snapchat Discover, something Instagram will have difficulty doing. Silicon Valley loves the spectacle of a no-holds-barred clash of tech titans, and comparing Snapchat to Instagram is certainly entertaining. But, rather than focusing on irrelevant metrics, people should think critically about the different ways people use these platforms to connect with others. Snapchat is not just another social network. It represents a radical shift in the way we communicate. It has established new norms and broken the mold of what we think of as social media\u200a\u2014\u200aand that is something that Instagram will most likely never be able to replicate. ", "child": "2456_1\t2456_2\t2456_3\t2456_4\t2456_5\t2456_6\t2456_7\t2456_8\t2456_9\t2456_10\t2456_11\t2456_12\t2456_13\t2456_14\t2456_15\t2456_16"}