{"name": "276", "parent": "", "title": "Digital Identity Today is Broken\u200a\u2014\u200aBut We Can Fix\u00a0It", "sentences": [{"ec4f": "Digital Identity Today is Broken\u200a\u2014\u200aBut We Can Fix\u00a0It"}, {"3ca5": "Six Companies Defining the Future of\u00a0Identity"}, {"2243": "The ways we create and manage our identities in our increasingly digital world are broken. We have separate credentials for nearly every service we interact with, but often reuse the same simple passwords, leaving ourselves vulnerable. Our credentials and sensitive data are then stored in databases with thousands or millions of other users, creating attractive targets for hacking and theft."}, {"a0a2": "We experience all of the problems of fragmented, siloed identity systems\u200a\u2014\u200ayet reap none of its promised benefits, such as increased privacy or diffused risk. In the cases where we do have relatively secure, integrated identities to which we attach lots of personal information, these identities are in reality owned by massive companies, like Google or Facebook, who can revoke our access at any time."}, {"9124": "There are better paths to follow. It is possible to create a future where our identities are more secure, easier to use, and under our control. Here are six companies laying the groundwork for that future:"}, {"ead9": "Averon"}, {"69d3": "You know how when we create accounts for certain apps or services\u200a\u2014\u200aespecially sensitive ones relating to money\u200a\u2014\u200awe\u2019re asked to enter our phone number? Then, they send us an SMS with a string of numbers (a one-time passcode) that we enter to confirm that\u2019s really our phone number? That\u2019s called \u201c2-Factor Authentication\u201d. It\u2019s good from a security standpoint but it can also lead to frustration or just giving up altogether."}, {"6451": "Enter Averon. They\u2019ve done integrations with all the mobile phone networks in the US, so the whole verification process can be done automatically and instantly in the background, without any action required from the user. As a straight replacement for traditional SMS-based one-time passwords, it\u2019s already a no-brainer. Should they manage to deliver this paradigm in some adjacent areas, it\u2019s really going to blow folks away."}, {"ebf2": "Blockstack"}, {"4bdc": "Blockstack empowers users to create and manage our own identities from our own devices. In fact, Blockstack\u2019s vision goes far beyond just identity: they\u2019re trying to re-invent the Web itself around decentralized applications, putting us back in control of our data and providing better security, privacy, and reliability for our digital activities."}, {"2c54": "Leave aside any philosophical or ideological ideals around why people should be able to own and control their digital identities; user-owned identity is a desirable model for many businesses\u200a\u2014\u200aespecially in the financial and healthcare industries\u200a\u2014\u200awhere possession of personally identifiable information (PII) can become a liability rather than an asset."}, {"7b0c": "Think about all the hacks we\u2019re seeing of various large companies and government agencies every other week. Blockstack enables a future where data thefts are both less attractive to hackers and also less damaging to companies and their customers, because sensitive data is stored under the control of each individual rather than in centralized repositories."}, {"39ab": "Civic"}, {"e230": "Social Security Numbers are horrifically insecure, acting as both username and password in many settings, and being collected and stored by nearly every employer, financial institution, telecom company, or healthcare provider with which we interact. Our SSNs are virtually guaranteed to be stolen at some point. So what can we do about it? Insert Civic."}, {"6bcc": "Civic\u2019s initial product is an identity theft protection service, similar to LifeLock or ProtectMyID but at a much lower cost (the basic plans is free, a more full-featured standard plan is only a few dollars per month). Civic also takes this a step further, building out a fraud prevention network, where partners like banks or telecoms check with Civic before putting in a request to one of the credit reporting bureaus. Civic then pushes an alert to your phone, giving you a chance to approve valid requests or proactively block fraudulent ones\u200a\u2014\u200ait\u2019s like adding two-factor authentication to your SSN."}, {"1830": "Like Blockstack, Civic also has a bigger vision that includes letting users independently interact with various services using a verified digital identity registered on a blockchain."}, {"0e3b": "DataCoup"}, {"8cfa": "Every website we visit, video we watch, and purchase we make is being tracked by a variety of companies who then sell our digital profiles to a variety of advertisers. Even our internet service providers (ISPs), through whom all our data flows, have been cleared to sell our web browsing history without our consent. What is most concerning isn\u2019t necessarily that this data is being collected, but that it\u2019s being done without our permission, without our control over who it\u2019s shared with, and without our receiving anything in return."}, {"8757": "DataCoup is trying to put us back in control of our data, letting us collect it from the social and financial apps we already use, then allowing us to sell access to it as part of an anonymized data set. We get more control and compensation; advertisers and researchers get more complete profiles to work with. The transparent, consensual, and mutually-beneficial exchange of personal data is a welcome alternative to the unilateral privacy-violating tracking done by creepy ad-tech companies."}, {"9f4d": "Enigma"}, {"06a9": "Enigma is like a B2B version of DataCoup, using advanced cryptographic techniques. Instead of selling access to anonymized data sets, Enigma makes it possible to allow certain analyses to be run directly on encrypted data, without worrying that the data might then be stolen or passed along to other parties without the owner\u2019s consent."}, {"1387": "Founded by MIT alums and built on technology developed in the MIT Media Lab, Enigma does something called secure multi-party computation and does it an order of magnitude more efficiently than previous approaches. This makes it possible for Company A to allow Company B to conduct certain types of analysis on Company A\u2019s data, without Company B ever having unencrypted access to the data itself. Data privacy: delivered."}, {"d5ab": "Tierion"}, {"05bf": "It\u2019s hard to say we really control our own identities if the data associated with them can\u2019t be trusted. Tierion provides tools to link identity attestations and other data to a blockchain, so that their integrity can be proven without the involvement of a third party."}, {"66d2": "How does this work? At a high level, Tierion lets companies make a single entry on a public blockchain to \u201cnotarize\u201d as many pieces of data as they want, then generate receipts that can be given to users or auditors to let them verify the existence and integrity of any specific data point."}, {"46dc": "While most businesses are going to want to use Tierion\u2019s API to get up and running quickly and painlessly, everything is built on top of an open standard called ChainPoint, largely designed by Tierion\u2019s founders. That means that you don\u2019t have to worry about vendor lock-in or Tierion going out of business, because anyone will still be able to independently create and validate proofs adhering to this standard."}, {"d7aa": "*****"}, {"0d3b": "We believe these companies are among those leading the way toward a positive and inspiring future for identity. To propel innovation in this space even faster, we\u2019ve invited all of them to participate in Mosaic, a digital identity lab we\u2019re launching out of IDEO CoLab."}, {"6a45": "By working together, we\u2019re going to help them apply their products and technologies to some of the thorniest identity issues raised by leading designers, technologists, and corporate innovators, who we\u2019ll be announcing in the coming weeks. If you\u2019d like to join us on this journey and build with these companies, get in touch."}, {"ecf4": "Together, we\u2019re going to move towards building more usable, secure, and human-centered identity systems. Watch this space."}], "content": "Digital Identity Today is Broken\u200a\u2014\u200aBut We Can Fix\u00a0It Six Companies Defining the Future of\u00a0Identity The ways we create and manage our identities in our increasingly digital world are broken. We have separate credentials for nearly every service we interact with, but often reuse the same simple passwords, leaving ourselves vulnerable. Our credentials and sensitive data are then stored in databases with thousands or millions of other users, creating attractive targets for hacking and theft. We experience all of the problems of fragmented, siloed identity systems\u200a\u2014\u200ayet reap none of its promised benefits, such as increased privacy or diffused risk. In the cases where we do have relatively secure, integrated identities to which we attach lots of personal information, these identities are in reality owned by massive companies, like Google or Facebook, who can revoke our access at any time. There are better paths to follow. It is possible to create a future where our identities are more secure, easier to use, and under our control. Here are six companies laying the groundwork for that future: Averon You know how when we create accounts for certain apps or services\u200a\u2014\u200aespecially sensitive ones relating to money\u200a\u2014\u200awe\u2019re asked to enter our phone number? Then, they send us an SMS with a string of numbers (a one-time passcode) that we enter to confirm that\u2019s really our phone number? That\u2019s called \u201c2-Factor Authentication\u201d. It\u2019s good from a security standpoint but it can also lead to frustration or just giving up altogether. Enter Averon. They\u2019ve done integrations with all the mobile phone networks in the US, so the whole verification process can be done automatically and instantly in the background, without any action required from the user. As a straight replacement for traditional SMS-based one-time passwords, it\u2019s already a no-brainer. Should they manage to deliver this paradigm in some adjacent areas, it\u2019s really going to blow folks away. Blockstack Blockstack empowers users to create and manage our own identities from our own devices. In fact, Blockstack\u2019s vision goes far beyond just identity: they\u2019re trying to re-invent the Web itself around decentralized applications, putting us back in control of our data and providing better security, privacy, and reliability for our digital activities. Leave aside any philosophical or ideological ideals around why people should be able to own and control their digital identities; user-owned identity is a desirable model for many businesses\u200a\u2014\u200aespecially in the financial and healthcare industries\u200a\u2014\u200awhere possession of personally identifiable information (PII) can become a liability rather than an asset. Think about all the hacks we\u2019re seeing of various large companies and government agencies every other week. Blockstack enables a future where data thefts are both less attractive to hackers and also less damaging to companies and their customers, because sensitive data is stored under the control of each individual rather than in centralized repositories. Civic Social Security Numbers are horrifically insecure, acting as both username and password in many settings, and being collected and stored by nearly every employer, financial institution, telecom company, or healthcare provider with which we interact. Our SSNs are virtually guaranteed to be stolen at some point. So what can we do about it? Insert Civic. Civic\u2019s initial product is an identity theft protection service, similar to LifeLock or ProtectMyID but at a much lower cost (the basic plans is free, a more full-featured standard plan is only a few dollars per month). Civic also takes this a step further, building out a fraud prevention network, where partners like banks or telecoms check with Civic before putting in a request to one of the credit reporting bureaus. Civic then pushes an alert to your phone, giving you a chance to approve valid requests or proactively block fraudulent ones\u200a\u2014\u200ait\u2019s like adding two-factor authentication to your SSN. Like Blockstack, Civic also has a bigger vision that includes letting users independently interact with various services using a verified digital identity registered on a blockchain. DataCoup Every website we visit, video we watch, and purchase we make is being tracked by a variety of companies who then sell our digital profiles to a variety of advertisers. Even our internet service providers (ISPs), through whom all our data flows, have been cleared to sell our web browsing history without our consent. What is most concerning isn\u2019t necessarily that this data is being collected, but that it\u2019s being done without our permission, without our control over who it\u2019s shared with, and without our receiving anything in return. DataCoup is trying to put us back in control of our data, letting us collect it from the social and financial apps we already use, then allowing us to sell access to it as part of an anonymized data set. We get more control and compensation; advertisers and researchers get more complete profiles to work with. The transparent, consensual, and mutually-beneficial exchange of personal data is a welcome alternative to the unilateral privacy-violating tracking done by creepy ad-tech companies. Enigma Enigma is like a B2B version of DataCoup, using advanced cryptographic techniques. Instead of selling access to anonymized data sets, Enigma makes it possible to allow certain analyses to be run directly on encrypted data, without worrying that the data might then be stolen or passed along to other parties without the owner\u2019s consent. Founded by MIT alums and built on technology developed in the MIT Media Lab, Enigma does something called secure multi-party computation and does it an order of magnitude more efficiently than previous approaches. This makes it possible for Company A to allow Company B to conduct certain types of analysis on Company A\u2019s data, without Company B ever having unencrypted access to the data itself. Data privacy: delivered. Tierion It\u2019s hard to say we really control our own identities if the data associated with them can\u2019t be trusted. Tierion provides tools to link identity attestations and other data to a blockchain, so that their integrity can be proven without the involvement of a third party. How does this work? At a high level, Tierion lets companies make a single entry on a public blockchain to \u201cnotarize\u201d as many pieces of data as they want, then generate receipts that can be given to users or auditors to let them verify the existence and integrity of any specific data point. While most businesses are going to want to use Tierion\u2019s API to get up and running quickly and painlessly, everything is built on top of an open standard called ChainPoint, largely designed by Tierion\u2019s founders. That means that you don\u2019t have to worry about vendor lock-in or Tierion going out of business, because anyone will still be able to independently create and validate proofs adhering to this standard. ***** We believe these companies are among those leading the way toward a positive and inspiring future for identity. To propel innovation in this space even faster, we\u2019ve invited all of them to participate in Mosaic, a digital identity lab we\u2019re launching out of IDEO CoLab. By working together, we\u2019re going to help them apply their products and technologies to some of the thorniest identity issues raised by leading designers, technologists, and corporate innovators, who we\u2019ll be announcing in the coming weeks. If you\u2019d like to join us on this journey and build with these companies, get in touch. Together, we\u2019re going to move towards building more usable, secure, and human-centered identity systems. Watch this space. ", "child": "276_1\t276_2"}