{"name": "440", "parent": "", "title": "Climate change would swamp Trump\u2019s border\u00a0wall", "sentences": [{"c6cc": "Climate change would swamp Trump\u2019s border\u00a0wall"}, {"030c": "Warming-fueled monster deluges keep flooding our 1,254-mile Rio Grande border with\u00a0Mexico."}, {"e0b4": "Candidate Donald Trump vowed time and again to build a massive border wall between Mexico and the United States. He has reiterated this pledge as president, despite unanswered questions regarding who would pay the billions of dollars estimated for construction."}, {"aea0": "Fulfilling that already challenging promise will be a whole lot harder thanks to climate change."}, {"af97": "The problem is that the vast majority of that border runs straight down the middle of 1,254 snaking miles of the Rio Grande River\u200a\u2014\u200aand ever-worsening, climate change-fueled floods greatly complicate any plausible design."}, {"69f2": "And that\u2019s on top of siting problems so significant Trump\u2019s Interior Secretary Ryan Zinke actually seemed to suggest the wall would be built on Mexico\u2019s side of the river when he told ranchers last week, \u201cWe\u2019re not going to put it on our side and cede the river to Mexico.\u201d"}, {"f75f": "Extreme weather and climate change make both the siting and design challenges unimaginably greater."}, {"9fba": "Consider the devastating Texas flooding in May 2015. More than 35 trillion gallons of water deluged the state. The National Weather Service in Fort Worth tweeted that was enough \u201cto cover the entire state nearly 8 inches deep.\u201d"}, {"5b43": "Texas Gov. Greg Abbott (R) was forced to declare a state of disaster in 46 counties\u200a\u2014\u200ain his words, \u201cliterally from the Red River to the Rio Grande.\u201d"}, {"f738": "An October 2015 study concluded that \u201canthropogenic [human-caused] global warming contributed to the physical processes that caused the persistent precipitation in May 2015.\u201d"}, {"b7e2": "One of the basic predictions of climate science, confirmed by observations, is that the hotter it gets, the more water evaporates into the air, resulting in much more water available for deluges. Worse, in many places, the climate actually changes\u200a\u2014\u200ablocking patterns are created that cause storm fronts to stall\u200a\u2014\u200awhich can lead to truly epic deluges."}, {"1163": "The National Oceanic and Atmospheric Administration (NOAA) reported that in some areas, the May 2015 deluge was \u201cgreater than a 1-in-1000 year event.\u201d Extreme events are becoming much more common. As Craig Fugate, head of the U.S. Federal Emergency Management Agency (FEMA) under President Obama, said after the epic year of extreme weather in 2010, \u201cThe term \u2018100-year event\u2019 really lost its meaning this year.\u201d"}, {"eaf5": "How do you design a wall that could withstand these ever-worsening superstorms\u200a\u2014\u200aespecially when your administration denies the science of human-caused climate change in the first place and has issued orders not to plan for it?"}, {"8615": "And where exactly do you build a wall when floods along the Rio Grande can be so huge they can be seen from outer space\u200a\u2014\u200aas in the case of the monster floods of September 2008, captured by NASA\u2019s Terra satellite?"}, {"b5a8": "Rio Grande flooding September 22, 2008 (upper image), compared to normal conditions (lower image). Flooding can be seen from Presdio, Texas to Big Bend National Park (lower right). CREDIT:\u00a0NASA."}, {"bcf5": "Complicating the siting issue even further is the fact that, as the AP has noted, \u201ctreaties with Mexico prevent either country from constructing within the river\u2019s flood plain.\u201d"}, {"83d7": "Indeed, the 1970 \u201cTreaty to Resolve Pending Boundary Differences and Maintain the Rio Grande and Colorado River as the International Boundary\u201d states that the joint U.S.-Mexico International Boundary and Water Commission \u201cmust approve construction of works proposed in either country\u201d along those rivers. It explicitly prohibits the construction of projects \u201cwhich, in the judgment of the commission, may cause deflection or obstruction of the normal flow of the river or of its flood flows.\u201d"}, {"3099": "Ignoring that restriction would require Trump to blow up nearly 170 years of treaties with Mexico."}, {"69b7": "The real losers from Trump\u2019s border wall: ranchers, homeowners, and taxpayersThe Trump administration is already moving to take Americans\u2019 private property to build the wall Mexico isn\u2019t paying\u2026thinkprogress.org"}, {"f3e8": "But if you put the wall far enough inland so it isn\u2019t actually sitting in the floodplain\u200a\u2014\u200awhich, again, keeps expanding because of human-caused climate change\u200a\u2014\u200athen the government will have to seize even more massive amounts of land from the Texans who own it, while cutting them off even more from the river that they rely on."}, {"2aac": "And we all know how much Texans love the government seizing the property using eminent domain and underpaying them for it."}], "content": "Climate change would swamp Trump\u2019s border\u00a0wall Warming-fueled monster deluges keep flooding our 1,254-mile Rio Grande border with\u00a0Mexico. Candidate Donald Trump vowed time and again to build a massive border wall between Mexico and the United States. He has reiterated this pledge as president, despite unanswered questions regarding who would pay the billions of dollars estimated for construction. Fulfilling that already challenging promise will be a whole lot harder thanks to climate change. The problem is that the vast majority of that border runs straight down the middle of 1,254 snaking miles of the Rio Grande River\u200a\u2014\u200aand ever-worsening, climate change-fueled floods greatly complicate any plausible design. And that\u2019s on top of siting problems so significant Trump\u2019s Interior Secretary Ryan Zinke actually seemed to suggest the wall would be built on Mexico\u2019s side of the river when he told ranchers last week, \u201cWe\u2019re not going to put it on our side and cede the river to Mexico.\u201d Extreme weather and climate change make both the siting and design challenges unimaginably greater. Consider the devastating Texas flooding in May 2015. More than 35 trillion gallons of water deluged the state. The National Weather Service in Fort Worth tweeted that was enough \u201cto cover the entire state nearly 8 inches deep.\u201d Texas Gov. Greg Abbott (R) was forced to declare a state of disaster in 46 counties\u200a\u2014\u200ain his words, \u201cliterally from the Red River to the Rio Grande.\u201d An October 2015 study concluded that \u201canthropogenic [human-caused] global warming contributed to the physical processes that caused the persistent precipitation in May 2015.\u201d One of the basic predictions of climate science, confirmed by observations, is that the hotter it gets, the more water evaporates into the air, resulting in much more water available for deluges. Worse, in many places, the climate actually changes\u200a\u2014\u200ablocking patterns are created that cause storm fronts to stall\u200a\u2014\u200awhich can lead to truly epic deluges. The National Oceanic and Atmospheric Administration (NOAA) reported that in some areas, the May 2015 deluge was \u201cgreater than a 1-in-1000 year event.\u201d Extreme events are becoming much more common. As Craig Fugate, head of the U.S. Federal Emergency Management Agency (FEMA) under President Obama, said after the epic year of extreme weather in 2010, \u201cThe term \u2018100-year event\u2019 really lost its meaning this year.\u201d How do you design a wall that could withstand these ever-worsening superstorms\u200a\u2014\u200aespecially when your administration denies the science of human-caused climate change in the first place and has issued orders not to plan for it? And where exactly do you build a wall when floods along the Rio Grande can be so huge they can be seen from outer space\u200a\u2014\u200aas in the case of the monster floods of September 2008, captured by NASA\u2019s Terra satellite? Rio Grande flooding September 22, 2008 (upper image), compared to normal conditions (lower image). Flooding can be seen from Presdio, Texas to Big Bend National Park (lower right). CREDIT:\u00a0NASA. Complicating the siting issue even further is the fact that, as the AP has noted, \u201ctreaties with Mexico prevent either country from constructing within the river\u2019s flood plain.\u201d Indeed, the 1970 \u201cTreaty to Resolve Pending Boundary Differences and Maintain the Rio Grande and Colorado River as the International Boundary\u201d states that the joint U.S.-Mexico International Boundary and Water Commission \u201cmust approve construction of works proposed in either country\u201d along those rivers. It explicitly prohibits the construction of projects \u201cwhich, in the judgment of the commission, may cause deflection or obstruction of the normal flow of the river or of its flood flows.\u201d Ignoring that restriction would require Trump to blow up nearly 170 years of treaties with Mexico. The real losers from Trump\u2019s border wall: ranchers, homeowners, and taxpayersThe Trump administration is already moving to take Americans\u2019 private property to build the wall Mexico isn\u2019t paying\u2026thinkprogress.org But if you put the wall far enough inland so it isn\u2019t actually sitting in the floodplain\u200a\u2014\u200awhich, again, keeps expanding because of human-caused climate change\u200a\u2014\u200athen the government will have to seize even more massive amounts of land from the Texans who own it, while cutting them off even more from the river that they rely on. And we all know how much Texans love the government seizing the property using eminent domain and underpaying them for it. ", "child": "440_1\t440_2\t440_3\t440_4\t440_5\t440_6\t440_7\t440_8\t440_9\t440_10\t440_11"}