{"name": "612", "parent": "", "title": "Fraude", "sentences": [{"b1f7": "Fraude"}, {"1a38": "Rara vez me arrepiento de lo que escribo. A veces pienso, s\u00ed, que no escribir\u00eda tal o cual cosa de nuevo, pero comprendo que cada texto es producto de sus circunstancias. Mis circunstancias."}, {"a312": "A\u00fan as\u00ed, hay ciertos textos que me persiguen. Uno de ellos es este que escrib\u00ed en 2014. B\u00e1sicamente, narra una experiencia que tuve con un fraude en Facebook. Recib\u00ed un mensaje de una amiga de la universidad, con quien ten\u00eda tiempo de hablar, pidi\u00e9ndome dinero para una emergencia. Sin chistar, le deposit\u00e9. Fueron 300 pesos, nada oneroso en realidad."}, {"01f3": "M\u00e1s tarde, descubr\u00ed que el perfil hab\u00eda sido clonado y que me hab\u00edan estafado. Segu\u00ed mi l\u00f3gica y consegu\u00ed el nombre del defraudador (solo tuve que depositar diez pesos en su cuenta y leer el nombre en el recibo). Lo busqu\u00e9 por Facebook y, despu\u00e9s de un par de d\u00edas buscando, di con su paradero. Al final, terminamos conversando y \u00e9l me devolvi\u00f3 el dinero. Yo, ufano de mi haza\u00f1a, lo compart\u00ed al mundo en un blog que leen un mill\u00f3n de personas al mes."}, {"c7bf": "Grave error."}, {"a7b0": "Aunque mi intenci\u00f3n era exponer el modus operandi de mi estafador, el art\u00edculo es uno de los primero resultados en Google al buscar \u201cfraude Facebook\u201d. Eso hace que cada semana o dos, me llegue un mensaje privado en mis redes sociales pidi\u00e9ndome ayuda, desde gente que ha sido estafada comprando un tel\u00e9fono en Facebook hasta ropa de Forever 21. Debo haber recibido ya medio centenar en estos a\u00f1os."}, {"37fd": "(Hoy, claro est\u00e1, me lleg\u00f3 otro de esos mensajes.)"}, {"3d6e": "Lo que me frustra es que no hay mucho que yo pueda hacer, salvo recomendarles a las personas afectadas acudir a la Polic\u00eda Cibern\u00e9tica de su localidad y levantar una denuncia ante el Ministerio P\u00fablico."}, {"9896": "(Lo record\u00e9 tambi\u00e9n cuando le\u00ed c\u00f3mo defraudaron a la gente de Animal Pol\u00edtico cuando quiso comprar tamales en l\u00ednea para el D\u00eda de la Candelaria. Supongo que todos somos susceptibles de caer en el enga\u00f1o.)"}, {"d531": "No me gustar\u00eda borrar ese texto; tan solo, que hubiera mejores mecanismos para reportar un fraude en l\u00ednea, que hubiera m\u00e1s informaci\u00f3n disponible, que hubiera menos vivos dispuestos a fregarse al pr\u00f3jimo. Quisiera, tal vez, que me dejara de perseguir esa sensaci\u00f3n de s\u00edndrome de sobreviviente: porque por cada uno como yo, con un final relativamente feliz, no s\u00e9 \u2013no quiero pensar\u2013 cu\u00e1ntas historias terminan en agobio, en dinero esfumado y en un palmo de narices."}, {"0661": "Carajo."}], "content": "Fraude Rara vez me arrepiento de lo que escribo. A veces pienso, s\u00ed, que no escribir\u00eda tal o cual cosa de nuevo, pero comprendo que cada texto es producto de sus circunstancias. Mis circunstancias. A\u00fan as\u00ed, hay ciertos textos que me persiguen. Uno de ellos es este que escrib\u00ed en 2014. B\u00e1sicamente, narra una experiencia que tuve con un fraude en Facebook. Recib\u00ed un mensaje de una amiga de la universidad, con quien ten\u00eda tiempo de hablar, pidi\u00e9ndome dinero para una emergencia. Sin chistar, le deposit\u00e9. Fueron 300 pesos, nada oneroso en realidad. M\u00e1s tarde, descubr\u00ed que el perfil hab\u00eda sido clonado y que me hab\u00edan estafado. Segu\u00ed mi l\u00f3gica y consegu\u00ed el nombre del defraudador (solo tuve que depositar diez pesos en su cuenta y leer el nombre en el recibo). Lo busqu\u00e9 por Facebook y, despu\u00e9s de un par de d\u00edas buscando, di con su paradero. Al final, terminamos conversando y \u00e9l me devolvi\u00f3 el dinero. Yo, ufano de mi haza\u00f1a, lo compart\u00ed al mundo en un blog que leen un mill\u00f3n de personas al mes. Grave error. Aunque mi intenci\u00f3n era exponer el modus operandi de mi estafador, el art\u00edculo es uno de los primero resultados en Google al buscar \u201cfraude Facebook\u201d. Eso hace que cada semana o dos, me llegue un mensaje privado en mis redes sociales pidi\u00e9ndome ayuda, desde gente que ha sido estafada comprando un tel\u00e9fono en Facebook hasta ropa de Forever 21. Debo haber recibido ya medio centenar en estos a\u00f1os. (Hoy, claro est\u00e1, me lleg\u00f3 otro de esos mensajes.) Lo que me frustra es que no hay mucho que yo pueda hacer, salvo recomendarles a las personas afectadas acudir a la Polic\u00eda Cibern\u00e9tica de su localidad y levantar una denuncia ante el Ministerio P\u00fablico. (Lo record\u00e9 tambi\u00e9n cuando le\u00ed c\u00f3mo defraudaron a la gente de Animal Pol\u00edtico cuando quiso comprar tamales en l\u00ednea para el D\u00eda de la Candelaria. Supongo que todos somos susceptibles de caer en el enga\u00f1o.) No me gustar\u00eda borrar ese texto; tan solo, que hubiera mejores mecanismos para reportar un fraude en l\u00ednea, que hubiera m\u00e1s informaci\u00f3n disponible, que hubiera menos vivos dispuestos a fregarse al pr\u00f3jimo. Quisiera, tal vez, que me dejara de perseguir esa sensaci\u00f3n de s\u00edndrome de sobreviviente: porque por cada uno como yo, con un final relativamente feliz, no s\u00e9 \u2013no quiero pensar\u2013 cu\u00e1ntas historias terminan en agobio, en dinero esfumado y en un palmo de narices. Carajo. ", "child": "612_1"}