{"name": "680", "parent": "", "title": "Introducing UniYo\u00a0\ud83d\udc23", "sentences": [{"5e72": "Introducing UniYo\u00a0\ud83d\udc23"}, {"4a0a": "UniYo is an easy and intuitive messaging app for education. Our mission is to reinvent how campuses work."}, {"cd6f": "\ud83d\udc69\u200d\ud83d\udcbb\ud83d\udc68\u200d\ud83d\udcbb How do friends keep in touch today?Phone, Skype, Facebook groups, Messenger, WhatsApp, Snapchat, Instagram, YikYak, etc."}, {"708e": "\ud83d\udc69\ud83c\udffd With your mother?SMS (and it\u2019s way enough)."}, {"bd75": "\ud83d\udc75\ud83c\udffb Grandma?Letters (and it\u2019s cute!)."}, {"0ce3": "\ud83d\udc68\ud83c\udffb\ud83d\udc71\ud83c\udffb Colleagues?LinkedIn."}, {"7481": "\ud83d\udc69\u200d\ud83c\udf93\ud83d\udc69\u200d\ud83c\udfeb\ud83d\udc68\u200d\ud83c\udf93\ud83d\udc68\u200d\ud83c\udfeb But what about students, professors and admin staff on a same campus? EMAILS. Yes, emails! Emails to contact random students to study in groups; emails to ask a question to a professor; emails to get information from the administration (if by any chance you\u2019re able to find the \u201cContact\u201d button on the intranet website \ud83e\udd13)."}, {"4b80": "90% of students don\u2019t use emails as a primary means of communication, and close to 60% of them never actually open emails from the university."}, {"f180": "Emails are dead \ud83d\udca9. Let us introduce you to UniYo\u00a0\ud83d\udc4f."}, {"07ff": "We built UniYo to empower students and foster communities on campus. Education too often experienced as a competition. It should be collaborative and allow people to educate one another and\u00a0grow."}, {"973d": "- UniYo? What is it for?- Interact with everybody on campus in a fun and easy way!- Why is it better than email?- Well, it\u2019d be like asking why email is better than fax, or why fax is better than letters. Just try.- Ok, I\u2019ll try but once again: why is it better than email?- Emails are super not efficient, they are boring and you have to wait for a week before getting a reply. Proof: When you contact a friend, you could send him an email but you will always use a messaging app. Why should this be any different with a classmate or with your professor?- Alright. But why is it better than WhatsApp or Facebook Messenger?Because students and profs are not necessarily your friends. You don\u2019t want to chill out\u2026 you just want to chat!"}, {"a2c9": "Does this mean that communication on campus must be boring? Our answer is yo \u270c\ufe0f."}, {"7f64": "\u270a\ud83c\udfdb Help us turn campus communication into something easy, efficient and\u00a0fun."}, {"ad62": "You must sign up on UniYo right now. But signing up is not enough. You must invite all your classmates and your professors to join. UniYo will be efficient if each of you guys invite at least one friend to join. Otherwise you will not be allowed to say something like \u201cWell\u2026. UniYo could be fun if the whole campus was online\u201d \ud83d\udca6 \ud83d\udd2b"}, {"054a": "Communication with a classmate, a prof or your campus administration should be as easy as chatting with a\u00a0friend."}, {"bc45": "Do not forget: Be one of the first people to sign up and invite at least one friend to join because chatting alone is always embarrassing\u2026 \ud83d\ude33Tip: Share this article! \ud83d\ude1c"}, {"15d6": "\u2014"}, {"e403": "UniYo \ud83d\ude18"}], "content": "Introducing UniYo\u00a0\ud83d\udc23 UniYo is an easy and intuitive messaging app for education. Our mission is to reinvent how campuses work. \ud83d\udc69\u200d\ud83d\udcbb\ud83d\udc68\u200d\ud83d\udcbb How do friends keep in touch today?Phone, Skype, Facebook groups, Messenger, WhatsApp, Snapchat, Instagram, YikYak, etc. \ud83d\udc69\ud83c\udffd With your mother?SMS (and it\u2019s way enough). \ud83d\udc75\ud83c\udffb Grandma?Letters (and it\u2019s cute!). \ud83d\udc68\ud83c\udffb\ud83d\udc71\ud83c\udffb Colleagues?LinkedIn. \ud83d\udc69\u200d\ud83c\udf93\ud83d\udc69\u200d\ud83c\udfeb\ud83d\udc68\u200d\ud83c\udf93\ud83d\udc68\u200d\ud83c\udfeb But what about students, professors and admin staff on a same campus? EMAILS. Yes, emails! Emails to contact random students to study in groups; emails to ask a question to a professor; emails to get information from the administration (if by any chance you\u2019re able to find the \u201cContact\u201d button on the intranet website \ud83e\udd13). 90% of students don\u2019t use emails as a primary means of communication, and close to 60% of them never actually open emails from the university. Emails are dead \ud83d\udca9. Let us introduce you to UniYo\u00a0\ud83d\udc4f. We built UniYo to empower students and foster communities on campus. Education too often experienced as a competition. It should be collaborative and allow people to educate one another and\u00a0grow. - UniYo? What is it for?- Interact with everybody on campus in a fun and easy way!- Why is it better than email?- Well, it\u2019d be like asking why email is better than fax, or why fax is better than letters. Just try.- Ok, I\u2019ll try but once again: why is it better than email?- Emails are super not efficient, they are boring and you have to wait for a week before getting a reply. Proof: When you contact a friend, you could send him an email but you will always use a messaging app. Why should this be any different with a classmate or with your professor?- Alright. But why is it better than WhatsApp or Facebook Messenger?Because students and profs are not necessarily your friends. You don\u2019t want to chill out\u2026 you just want to chat! Does this mean that communication on campus must be boring? Our answer is yo \u270c\ufe0f. \u270a\ud83c\udfdb Help us turn campus communication into something easy, efficient and\u00a0fun. You must sign up on UniYo right now. But signing up is not enough. You must invite all your classmates and your professors to join. UniYo will be efficient if each of you guys invite at least one friend to join. Otherwise you will not be allowed to say something like \u201cWell\u2026. UniYo could be fun if the whole campus was online\u201d \ud83d\udca6 \ud83d\udd2b Communication with a classmate, a prof or your campus administration should be as easy as chatting with a\u00a0friend. Do not forget: Be one of the first people to sign up and invite at least one friend to join because chatting alone is always embarrassing\u2026 \ud83d\ude33Tip: Share this article! \ud83d\ude1c \u2014 UniYo \ud83d\ude18 ", "child": "680_1\t680_2\t680_3\t680_4\t680_5680_1\t680_2\t680_3\t680_4\t680_5"}