{"name": "684", "parent": "", "title": "What Bots Can Do, t", "sentences": [{"7269": "What Bots Can Do, that websites and apps\u00a0can\u2019t"}, {"e10e": "There\u2019s a backlash against bots. The hype of 2016 is gone with Facebook Messenger\u2019s move from chat to menus, Everlane rolling back to email and brands dropping bots as a marketing strategy."}, {"db6f": "2017 Bot\u00a0news"}, {"0c36": "At Kip, we\u2019re moving forward fearlessly. To combat naysayers, we have a radical proposition to all bot developers:"}, {"d07e": "Build something that *only* bots can doThat websites and apps\u00a0can\u2019t"}, {"c6a0": "Who Your Real Competitors Are"}, {"dc8c": "The truth is that your competitors aren\u2019t just other bot companies, but what your users prefer to use instead of your product. This could mean a website they already visit, an app they\u2019ve already installed or their own solution they\u2019ve already come up with."}, {"9bab": "EXAMPLE: you build a FB Messenger chatbot that helps users keep track of their exercise called Fitzien. When people chat to Fitzien they find out how many hours of exercise they\u2019ve done, how many calories burned and can create their own fitness plans. Sounds useful right?"}, {"aa2f": "EXCEPT THERE\u2019S ALREADY:1. Apps that do the same thing, like MyFitnessPal\u00a02. Online communities that recommend exercise plans, and also offer social support3. Gyms that offer personal trainers as part of their membership incentives4. Websites like Calorie Counter that DON\u2019T require specific platforms to access them i.e. Facebook5. People who prefer to write things in journals"}, {"18d1": "Competition costs"}, {"5c45": "A relatively simple use-case is now fraught with high acquisition costs. You have huge competition from different products that offer similar value as your bot, and you also have the challenge of educating average users on what a bot is, and how to use it."}, {"e0f8": "Your Unique Value as a\u00a0Bot"}, {"8070": "When we started developing for Kip Caf\u00e9 we faced a huge dilemma. How could we offer more convenience to a user who could use a website or app instead?"}, {"ba27": "To duplicate this in a bot conversation, you\u2019ll have to go through multiple steps like:"}, {"0c22": "\u2018Hi [user], how can I help you?\u2019\u2018What\u2019s your address?\u2019\u2018Would you like to do delivery or pickup?\u2019\u2018Is the delivery ASAP or scheduled later?\u2019\u00a0\u2018Would you like to start a new order or repeat previous order?\u2019\u2018What would you like to eat?\u2019\u2018What\u2019s your budget?\u2019\u2018How many stars rating?\u2019, etc."}, {"620a": "Compared to a website or an app, which just takes a single click\u2014 fill out your address, tap search and you\u2019ll instantly be shown a dazzling variety of food. Using a bot wasn\u2019t fun or exciting, it was a hassle."}, {"62ac": "Value Add Experiences"}, {"81f1": "The mantra: \u201cBuild Something Only Bots Can Do\u201d is a great pass/fail test for developing bots. Not only that, the value of your bot must be 20x greater than what is currently used for someone to change their habits."}, {"4ba8": "For instance, if you wanted to do a bot that delivers food, asking 16 questions before a user could pick food options was a surefire killer."}, {"2103": "This was a serious problem at Kip. We promised our customers that they could get lunch delivered with Kip, but doing it via conversation meant 16-steps of q&a and no one would do it."}, {"35cf": "In the end, we came up with a solution by re-focusing to our core mission of helping groups organize. We looked at what Kip could do, that neither an app, website or food delivery startup could."}, {"d430": "Group Search for Consensus Shopping"}, {"f48c": "If you break down food delivery, it consists of 2 experiences. The 1st is choosing a restaurant (search), the 2nd is ordering food from a menu (selection). As an individual, this is an easy process. You know what you like, what you feel that day and picking items off a menu is a piece of cake."}, {"1721": "What happens when it\u2019s a group?What happens when a team wants to order lunch?Who chooses the restaurant? Who sends out the menu?"}, {"b9a8": "So we flipped the idea of search and selection for groups."}, {"42d2": "Instead of searching for your favorite food, Kip searches for a restaurant that has *all* your entire team\u2019s favorite foods."}, {"c2e2": "Choices that suit a majority of\u00a0tastes"}, {"995d": "Maybe you have a colleague that\u2019s deathly allergic to peanuts, or a friend that\u2019s vegetarian. Or gluten-free. Or paleo-diet. Or it\u2019s been a long day and you just want some awesome diner breakfast food."}, {"a711": "No problem\u200a\u2014\u200aKip remembers your preferences, polls the team for their choices and automatically sends a personal menu to each person from the winning restaurant."}, {"d3d7": "Live: food\u00a0votes"}, {"6ec2": "The Pass/Fail Test:\u00a0Is this something only Kip can do?\u00a0Could this be done via an alternative method?"}, {"1400": "If it was done on an app:There would be no communication because apps are gated and cut off. The beauty of bots is that they can access multiple platforms easily across. If Person 1 is on Slack, Person 2 on Messenger and Person 3 only uses email, Kip can ping all 3 members simultaneously the way that an app can\u2019t."}, {"c39c": "If it was done on a website:It would take an extremely long time because websites are for individual viewing. When you create accounts on Seamless/Grubhub/DoorDash etc. it\u2019s meant to be managed by a single user."}, {"81d4": "Get your own personal menu instantly"}, {"17a3": "Instead of polling and sending menus simultaneously, someone would have to ask each person what they want to eat one-by-one, count results, then take screen-caps of the menu, paste it on chat and take orders one-by-one. It\u2019s waitressing."}, {"1e2c": "During testing for Caf\u00e9, we realized that we created something powerful and usable that could be applied across many industries. After much thought, we decided to patent the group search consensus engine."}, {"ecfd": "In the next post, we\u2019ll be going in more detail how consensus works, and how it can be used from group travel planning to choosing the right health insurance policies, so stay tuned!"}, {"3b2f": "Kip is an AI penguin that helps you collect orders and coordinate purchases for teams. Try Kip for Slack by tapping the button below:"}, {"278b": "Push this\u00a0button"}, {"0555": "If you enjoyed reading, please recommend \ud83d\udc9a or check out our other stories here!"}], "content": "What Bots Can Do, that websites and apps\u00a0can\u2019t There\u2019s a backlash against bots. The hype of 2016 is gone with Facebook Messenger\u2019s move from chat to menus, Everlane rolling back to email and brands dropping bots as a marketing strategy. 2017 Bot\u00a0news At Kip, we\u2019re moving forward fearlessly. To combat naysayers, we have a radical proposition to all bot developers: Build something that *only* bots can doThat websites and apps\u00a0can\u2019t Who Your Real Competitors Are The truth is that your competitors aren\u2019t just other bot companies, but what your users prefer to use instead of your product. This could mean a website they already visit, an app they\u2019ve already installed or their own solution they\u2019ve already come up with. EXAMPLE: you build a FB Messenger chatbot that helps users keep track of their exercise called Fitzien. When people chat to Fitzien they find out how many hours of exercise they\u2019ve done, how many calories burned and can create their own fitness plans. Sounds useful right? EXCEPT THERE\u2019S ALREADY:1. Apps that do the same thing, like MyFitnessPal\u00a02. Online communities that recommend exercise plans, and also offer social support3. Gyms that offer personal trainers as part of their membership incentives4. Websites like Calorie Counter that DON\u2019T require specific platforms to access them i.e. Facebook5. People who prefer to write things in journals Competition costs A relatively simple use-case is now fraught with high acquisition costs. You have huge competition from different products that offer similar value as your bot, and you also have the challenge of educating average users on what a bot is, and how to use it. Your Unique Value as a\u00a0Bot When we started developing for Kip Caf\u00e9 we faced a huge dilemma. How could we offer more convenience to a user who could use a website or app instead? To duplicate this in a bot conversation, you\u2019ll have to go through multiple steps like: \u2018Hi [user], how can I help you?\u2019\u2018What\u2019s your address?\u2019\u2018Would you like to do delivery or pickup?\u2019\u2018Is the delivery ASAP or scheduled later?\u2019\u00a0\u2018Would you like to start a new order or repeat previous order?\u2019\u2018What would you like to eat?\u2019\u2018What\u2019s your budget?\u2019\u2018How many stars rating?\u2019, etc. Compared to a website or an app, which just takes a single click\u2014 fill out your address, tap search and you\u2019ll instantly be shown a dazzling variety of food. Using a bot wasn\u2019t fun or exciting, it was a hassle. Value Add Experiences The mantra: \u201cBuild Something Only Bots Can Do\u201d is a great pass/fail test for developing bots. Not only that, the value of your bot must be 20x greater than what is currently used for someone to change their habits. For instance, if you wanted to do a bot that delivers food, asking 16 questions before a user could pick food options was a surefire killer. This was a serious problem at Kip. We promised our customers that they could get lunch delivered with Kip, but doing it via conversation meant 16-steps of q&a and no one would do it. In the end, we came up with a solution by re-focusing to our core mission of helping groups organize. We looked at what Kip could do, that neither an app, website or food delivery startup could. Group Search for Consensus Shopping If you break down food delivery, it consists of 2 experiences. The 1st is choosing a restaurant (search), the 2nd is ordering food from a menu (selection). As an individual, this is an easy process. You know what you like, what you feel that day and picking items off a menu is a piece of cake. What happens when it\u2019s a group?What happens when a team wants to order lunch?Who chooses the restaurant? Who sends out the menu? So we flipped the idea of search and selection for groups. Instead of searching for your favorite food, Kip searches for a restaurant that has *all* your entire team\u2019s favorite foods. Choices that suit a majority of\u00a0tastes Maybe you have a colleague that\u2019s deathly allergic to peanuts, or a friend that\u2019s vegetarian. Or gluten-free. Or paleo-diet. Or it\u2019s been a long day and you just want some awesome diner breakfast food. No problem\u200a\u2014\u200aKip remembers your preferences, polls the team for their choices and automatically sends a personal menu to each person from the winning restaurant. Live: food\u00a0votes The Pass/Fail Test:\u00a0Is this something only Kip can do?\u00a0Could this be done via an alternative method? If it was done on an app:There would be no communication because apps are gated and cut off. The beauty of bots is that they can access multiple platforms easily across. If Person 1 is on Slack, Person 2 on Messenger and Person 3 only uses email, Kip can ping all 3 members simultaneously the way that an app can\u2019t. If it was done on a website:It would take an extremely long time because websites are for individual viewing. When you create accounts on Seamless/Grubhub/DoorDash etc. it\u2019s meant to be managed by a single user. Get your own personal menu instantly Instead of polling and sending menus simultaneously, someone would have to ask each person what they want to eat one-by-one, count results, then take screen-caps of the menu, paste it on chat and take orders one-by-one. It\u2019s waitressing. During testing for Caf\u00e9, we realized that we created something powerful and usable that could be applied across many industries. After much thought, we decided to patent the group search consensus engine. In the next post, we\u2019ll be going in more detail how consensus works, and how it can be used from group travel planning to choosing the right health insurance policies, so stay tuned! Kip is an AI penguin that helps you collect orders and coordinate purchases for teams. Try Kip for Slack by tapping the button below: Push this\u00a0button If you enjoyed reading, please recommend \ud83d\udc9a or check out our other stories here! ", "child": "684_1\t684_2\t684_3\t684_4684_1\t684_2\t684_3\t684_4"}