{"name": "695", "parent": "", "title": "Trump Signs Deal With NBC For New TV Series: \u201cThe Real First Family of\u00a0D.C.\u201d", "sentences": [{"6dcf": "Truth In\u00a0Satire"}, {"8cf6": "Trump Signs Deal With NBC For New TV Series: \u201cThe Real First Family of\u00a0D.C.\u201d"}, {"fd2b": "President says having cameras in White House for reality TV show will not affect \u201cthe unbelievable job I\u2019m doing for our\u00a0country\u201d"}, {"6cde": "Among the many other things President Donald Trump has been focused on since his election, we now know that one of them was shopping around a reality TV show featuring his family\u2019s eventful new life in Washington, titled, The Real First Family of D.C."}, {"ae91": "That news came yesterday when the White House announced that the president had signed a deal with NBC to co-produce and star in the series that will begin airing Memorial Day weekend, according to network sources. The show\u2019s executive producer will be Mark Burnett, who worked with Mr. Trump in the past on The Apprentice, also an NBC program."}, {"d84a": "According to those who\u2019ve seen test footage of the show, one segment features Ivanka, Don Jr., and Eric turning viciously on half-sister, Tiffany. (Credit: ABC News/US\u00a0Weekly)"}, {"926a": "The official statement read: \u201cPresident Donald J. Trump and the First Family are thrilled to be part of a new production from NBC titled The Real First Family of D.C."}, {"4c23": "The President has no doubt that this will be the greatest show in the history of television\u200a\u2014\u200amuch bigger than The Apprentice, The Celebrity Apprentice and Roots combined. This new \u2018mega-hit in the making\u2019 fuses the gripping family drama of HBO\u2019s Game of Thrones with the sizzling political intrigue of the Netflix series, House of Cards.\u201d"}, {"27dd": "President Trump, clearly excited by the launch of the show, tweeted at 3am: \u201cWow. Big news! America\u2019s First Family coming to you in prime time starting in May! Must-see TV!\u201d"}, {"13a3": "Several production assistants working closely with Mark Burnett, revealed that the first episode will open with television news footage taken at last summer\u2019s Republican convention."}, {"fe19": "Asked later during a press conference how he planned to work the production demands of a television show into his already packed political schedule, Mr. Trump answered: \u201cLook, from the very first moment I announced my candidacy, I was hoping that an election victory would result in a television experience giving every American an incredible peek into the workings of their government. Talk about transparency! I\u2019m going to be the most transparent president ever, and The Real First Family of D.C., from Donald J. Trump Productions, is the proof.\u201d"}, {"171e": "The revelation that Mr. Trump has been positioning the reality show for sale to a television network for more than a year may help explain why Jared Kushner and Ivanka Trump moved their family from New York to Washington so quickly after the election. Taking prominent positions within the administration from day one guarantees them both plenty of camera time when shooting begins later this month."}, {"56dd": "Sources close to Steve Bannon say he fully expected to be a major cast member of the show and went to war with Jared Kushner when the dimpled son-in-law lobbied the president for more prominent roles for himself and wife\u00a0Ivanka."}, {"ed88": "One NBC television executive, who spoke off the record, added that Melania\u2019s decision to live in New York City was actually a plot device suggested by Mark Burnett to create the appearance of tension between the President and First Lady. Burnett felt strongly that planting the seeds of a potential messy divorce, played out on a national stage, was a proven way to hook viewers in the first season."}, {"06b5": "Mr. Trump also proposed adding a \u201chot young mistress or a horny White House intern\u201d to the plot line to give it more authenticity. Network sources would not say if a decision has been made on the president\u2019s proposal, but did confirm that Mr. Trump has added a casting couch to the Oval Office."}, {"270e": "The unprecedented news of a reality show taking place within the White House has raised alarm bells in the intelligence community. One longtime FBI special agent, speaking anonymously, noted that President Trump\u2019s well-documented love of television, along with his now confessed desire to turn his presidency into a major media event via reality TV, might shed light on his apparent willingness to collude with the Russians to win the election at any cost\u200a\u2014\u200aincluding criminal interference."}, {"8fbf": "In 2010, businessman Trump was quoted as saying, \u201cTelevision is the be-all and end-all of my life\u200a\u2014\u200aI\u2019d rather have a hit TV show than become the President of the United States.\u201d It\u2019s possible that with the launch of The Real First Family of D.C., he has figured out how to do both."}, {"c69f": "****"}, {"1aa5": "If you liked this post, please click the heart, comment, and/or follow me. I read every comment."}, {"25a5": "And click here for my most popular post, or at least one I liked writing a whole lot."}, {"e537": "\u2014 AI"}], "content": "Truth In\u00a0Satire Trump Signs Deal With NBC For New TV Series: \u201cThe Real First Family of\u00a0D.C.\u201d President says having cameras in White House for reality TV show will not affect \u201cthe unbelievable job I\u2019m doing for our\u00a0country\u201d Among the many other things President Donald Trump has been focused on since his election, we now know that one of them was shopping around a reality TV show featuring his family\u2019s eventful new life in Washington, titled, The Real First Family of D.C. That news came yesterday when the White House announced that the president had signed a deal with NBC to co-produce and star in the series that will begin airing Memorial Day weekend, according to network sources. The show\u2019s executive producer will be Mark Burnett, who worked with Mr. Trump in the past on The Apprentice, also an NBC program. According to those who\u2019ve seen test footage of the show, one segment features Ivanka, Don Jr., and Eric turning viciously on half-sister, Tiffany. (Credit: ABC News/US\u00a0Weekly) The official statement read: \u201cPresident Donald J. Trump and the First Family are thrilled to be part of a new production from NBC titled The Real First Family of D.C. The President has no doubt that this will be the greatest show in the history of television\u200a\u2014\u200amuch bigger than The Apprentice, The Celebrity Apprentice and Roots combined. This new \u2018mega-hit in the making\u2019 fuses the gripping family drama of HBO\u2019s Game of Thrones with the sizzling political intrigue of the Netflix series, House of Cards.\u201d President Trump, clearly excited by the launch of the show, tweeted at 3am: \u201cWow. Big news! America\u2019s First Family coming to you in prime time starting in May! Must-see TV!\u201d Several production assistants working closely with Mark Burnett, revealed that the first episode will open with television news footage taken at last summer\u2019s Republican convention. Asked later during a press conference how he planned to work the production demands of a television show into his already packed political schedule, Mr. Trump answered: \u201cLook, from the very first moment I announced my candidacy, I was hoping that an election victory would result in a television experience giving every American an incredible peek into the workings of their government. Talk about transparency! I\u2019m going to be the most transparent president ever, and The Real First Family of D.C., from Donald J. Trump Productions, is the proof.\u201d The revelation that Mr. Trump has been positioning the reality show for sale to a television network for more than a year may help explain why Jared Kushner and Ivanka Trump moved their family from New York to Washington so quickly after the election. Taking prominent positions within the administration from day one guarantees them both plenty of camera time when shooting begins later this month. Sources close to Steve Bannon say he fully expected to be a major cast member of the show and went to war with Jared Kushner when the dimpled son-in-law lobbied the president for more prominent roles for himself and wife\u00a0Ivanka. One NBC television executive, who spoke off the record, added that Melania\u2019s decision to live in New York City was actually a plot device suggested by Mark Burnett to create the appearance of tension between the President and First Lady. Burnett felt strongly that planting the seeds of a potential messy divorce, played out on a national stage, was a proven way to hook viewers in the first season. Mr. Trump also proposed adding a \u201chot young mistress or a horny White House intern\u201d to the plot line to give it more authenticity. Network sources would not say if a decision has been made on the president\u2019s proposal, but did confirm that Mr. Trump has added a casting couch to the Oval Office. The unprecedented news of a reality show taking place within the White House has raised alarm bells in the intelligence community. One longtime FBI special agent, speaking anonymously, noted that President Trump\u2019s well-documented love of television, along with his now confessed desire to turn his presidency into a major media event via reality TV, might shed light on his apparent willingness to collude with the Russians to win the election at any cost\u200a\u2014\u200aincluding criminal interference. In 2010, businessman Trump was quoted as saying, \u201cTelevision is the be-all and end-all of my life\u200a\u2014\u200aI\u2019d rather have a hit TV show than become the President of the United States.\u201d It\u2019s possible that with the launch of The Real First Family of D.C., he has figured out how to do both. **** If you liked this post, please click the heart, comment, and/or follow me. I read every comment. And click here for my most popular post, or at least one I liked writing a whole lot. \u2014 AI ", "child": "695_1\t695_2\t695_3\t695_4\t695_5\t695_6\t695_7\t695_8\t695_9\t695_10\t695_11\t695_12\t695_13\t695_14\t695_15\t695_16\t695_17\t695_18\t695_19\t695_20\t695_21\t695_22\t695_23\t695_24"}