{"name": "703", "parent": "", "title": "A short story on\u00a0success.", "sentences": [{"0675": "A short story on\u00a0success."}, {"21f5": "One day, a young guy was on an elevator. The elevator stopped at another floor, and another person then got on."}, {"c108": "That other person\u2026 was Richard Branson."}, {"2594": "But the young guy didn\u2019t recognize him."}, {"a540": "Branson said, \u201cHello.\u201d The young guy replied, \u201cI\u2019m sorry, but I think I\u2019m in the wrong elevator. Also, pleasure to meet you.\u201d Branson then looked right in the guy\u2019s eyes and said, \u201cNo\u2026 you are exactly where you need to be. My name is Richard Branson.\u201d"}, {"f86f": "And then the elevator let the two off\u2026 at the top floor."}, {"1e12": "Who\u2019s the young guy in this story? Here\u2019s the thing: it\u2019s not even a guy at all. In fact, he is the abstract concept\u2026 of YOUR POTENTIAL."}, {"21fa": "Just something to think about."}, {"e455": "For more \u201cinspiration,\u201d follow me on Medium and Twitter."}], "content": "A short story on\u00a0success. One day, a young guy was on an elevator. The elevator stopped at another floor, and another person then got on. That other person\u2026 was Richard Branson. But the young guy didn\u2019t recognize him. Branson said, \u201cHello.\u201d The young guy replied, \u201cI\u2019m sorry, but I think I\u2019m in the wrong elevator. Also, pleasure to meet you.\u201d Branson then looked right in the guy\u2019s eyes and said, \u201cNo\u2026 you are exactly where you need to be. My name is Richard Branson.\u201d And then the elevator let the two off\u2026 at the top floor. Who\u2019s the young guy in this story? Here\u2019s the thing: it\u2019s not even a guy at all. In fact, he is the abstract concept\u2026 of YOUR POTENTIAL. Just something to think about. For more \u201cinspiration,\u201d follow me on Medium and Twitter. ", "child": "703_1\t703_2\t703_3703_1\t703_2\t703_3"}