{"name": "720", "parent": "", "title": "Seus conceitos sobre crian\u00e7a foram atualizados", "sentences": [{"8007": "Seus conceitos sobre crian\u00e7a foram atualizados"}, {"b389": "N\u00f3s criamos a inf\u00e2ncia, e vamos destru\u00ed-la"}, {"cb2f": "No \u00faltimo fim de semana assisti a um filme da Disney, muito bonito, emocionante, e para crian\u00e7as: Pete\u2019s Dragon. Extremamente bem feito e competente na realiza\u00e7\u00e3o. E uma coisa me chamou a aten\u00e7\u00e3o: o filme n\u00e3o se passa em \u00e9poca atual, mas sim em algum ponto n\u00e3o especificado dos anos 80, pelo que mostram os telefones, carros, e roupas."}, {"5551": "Esse tipo de escolha vem acontecendo com alguma frequ\u00eancia. O caso recente mais famoso \u00e9 o do seriado da Netflix, Stranger Things."}, {"3d00": "Como sou uma crian\u00e7a dos anos 80, me sinto meio homenageado e repleto de nostalgia, mas suspeito que os motivos para que os diretores posicionem suas obras nesse per\u00edodo (ou at\u00e9 em \u00e9pocas mais remotas), sejam outros."}, {"cc18": "A inf\u00e2ncia, e especialmente a adolesc\u00eancia, nos moldes que conhecemos atualmente \u00e9 um fen\u00f4meno relativamente novo. At\u00e9 antes da segunda guerra mundial, o foco da sociedade estava nos adultos. Mais especialmente no homem adulto, provedor e figura principal da casa. A grande maioria da publicidade, m\u00eddia e entretenimento era focada naquele que pagava e decidia as contas das casa."}, {"af90": "\u201cMostre a ela que este \u00e9 um mundo de\u00a0homens\u201d"}, {"f3a4": "An\u00fancio da Coca. Sirene de f\u00e1brica. Homem. Mulher. Nenhuma\u00a0crian\u00e7a."}, {"efff": "No come\u00e7o do s\u00e9culo, filho era aquela coisa que o casal tinha 13, e se conseguisse chegar \u00e0 sua velhice com 8 vivos, voc\u00ea j\u00e1 podia se considerar um vencedor."}, {"56d1": "O resultado desse foco era que os jovens queriam deixar de s\u00ea-lo o quanto antes. Por isso quando voc\u00ea olha uma foto dos seus pais ou av\u00f3s em seus vinte e poucos anos, eles pareciam t\u00e3o mais velhos. As pessoas pulavam da inf\u00e2ncia para a era adulta em dois ou tr\u00eas anos, passando por uma adolesc\u00eancia cheia de regras. Meninos queriam ser homens logo, e casavam cedo afim de sair da casa dos pais, onde eram meros coadjuvantes e tinham que dividir a mesa com os outros 8 irm\u00e3os."}, {"c8e0": "Meninas ent\u00e3o, n\u00e3o tinham vez nem dentro, nem fora da casa. Aos 15, 16 anos muitas j\u00e1 estavam noivas ou sonhando com isso. Era a chance de brincar de casinha, usando a pr\u00f3pria casa como cobaia. Fora que, na sociedade da \u00e9poca, muitas coisas que os horm\u00f4nios pediam desesperadamente para serem consumadas s\u00f3 eram permitidas depois do casamento."}, {"1a45": "A entrada no mundo adulto era o passaporte para a liberdade."}, {"834b": "Mas ent\u00e3o veio a guerra."}, {"aa6b": "E n\u00e3o se esque\u00e7am: quando falamos de tend\u00eancia de comportamento e m\u00eddia, n\u00f3s aqui sempre olhamos para o que acontece nos Estados Unidos e na Europa, e aproveitamos (nem sempre da forma mais s\u00e1bia) aquilo que achamos bacana. E com hordas de homens de repente sumindo do mapa, coube \u00e0s mulheres assumirem as r\u00e9deas das casas e provar que conseguiam administrar sozinhas o trabalho e a fam\u00edlia."}, {"3c2b": "Os maridos voltaram (n\u00e3o todos), e no meio dos reencontros t\u00e3o ternos, das hist\u00f3rias de terror do conflito e da s\u00fabita realiza\u00e7\u00e3o da import\u00e2ncia do conv\u00edvio com os entes queridos, n\u00e3o era de surpreender que a m\u00eddia e a publicidade tenham se transformado os anos 50 num para\u00edso idealizado, com m\u00e3es que andavam de salto alto dentro de casa e faziam tortas para a prole, enquanto o marido cortava a grama e as crian\u00e7as brincavam de caub\u00f3i no quintal."}, {"e955": "O amor estava no ar, e isso foi chamado de baby-boom, pela quantidade massiva de crian\u00e7as geradas ap\u00f3s a volta dos maridos da guerra, e pelo otimismo com o futuro que marcou a \u00e9poca. Sem que se percebesse, o foco foi saindo do marido, e passou para a fam\u00edlia."}, {"1bdc": "Muitas fam\u00edlias e felicidade. Pouca crian\u00e7a na\u00a0foto."}, {"1f9b": "Nem tudo eram flores. Por tr\u00e1s da utopia Capriana existia uma sociedade ainda muito machista, onde as mulheres tinham pouca voz. Os anos 60 chegaram com a p\u00edlula, com o div\u00f3rcio e com a luta das minorias por espa\u00e7o. \u00c9poca conturbada, que culminou com, adivinhem, nova guerra."}, {"f7d8": "Por acaso ou n\u00e3o, no mesmo ano que a guerra do Vietn\u00e3 terminou, o filme que marca o in\u00edcio dos chamados blockbusters de ver\u00e3o, estreou. Tubar\u00e3o, de Steven Spielberg, levou milh\u00f5es de pessoas ao cinema, e mudou o marketing da ind\u00fastria. Mas o estrago realmente foi feito dois anos mais tarde, quando Star Wars, de George Lucas, chega \u00e0s telas."}, {"3c39": "Estreia de Tubar\u00e3o, em\u00a01975"}, {"384e": "At\u00e9 esse momento, os filmes eram lan\u00e7ados para a fam\u00edlia. A partir da\u00ed, eram focados totalmente nos jovens. E nunca mais vieram separados de uma parafern\u00e1lia sem precedentes. N\u00e3o bastava ver o filme. Era preciso ter os bonecos, as camisetas, os p\u00f4steres, as canecas, os chinelos, as almofadas, os tapetes de banheiro, e os jogos (que no in\u00edcio, vejam s\u00f3, eram de tabuleiro)."}, {"3f62": "O mundo nunca mais foi o mesmo."}, {"db53": "Tinha de tudo. Ainda tem. Muito\u00a0mais."}, {"986c": "O foco nos mais jovens provou ser a galinha dos ovos de ouro para os produtores. Um filme podia ir mal de bilheteria, e ainda assim lucrar com a venda de produtos. De l\u00e1 pra c\u00e1, \u00e9 f\u00e1cil entender e acompanhar o progresso dessa nova cultura em torno dos jovens."}, {"ab6e": "O ponto m\u00e1ximo desse modo de vida \u00e9 o agora, onde as crian\u00e7as e jovens s\u00e3o o ponto central da vida das fam\u00edlias. At\u00e9 mesmo novas subdivis\u00f5es biol\u00f3gicas foram criadas para abarcar esses seres que subitamente estavam sendo notados. Agora eles uma tinham uma pr\u00e9-adolesc\u00eancia para chamar de sua."}, {"a2aa": "Outro fato interessante: todos querem estender a juventude para al\u00e9m dos 30 anos. Vivendo como reis dentro de suas casas, era normal que a independ\u00eancia tenha deixado de ser um valor t\u00e3o importante. Ainda mais dentro de casas onde os pais se sentem cada vez mais culpados por n\u00e3o ter tempo para conseguir dar toda a aten\u00e7\u00e3o merecida a seus maravilhosos e \u00fanicos flocos de neve."}, {"1583": "O importante \u00e9 ser jovem, com a maior intensidade, e por quanto tempo for poss\u00edvel. E consumir. Consumir para existir."}, {"a75d": "O que nos leva ao primeiro par\u00e1grafo do texto. Porque o cinema e a m\u00eddia est\u00e3o voltando suas lentes para os anos 80 de novo?"}, {"f5b5": "Um dos trabalhos mais \u00e1rduos de um autor \u00e9 chamado suspens\u00e3o da descren\u00e7a. \u00c9 quando a pessoa entra num cinema, ou l\u00ea um quadrinho ou livro, e depois de 10 minutos de prepara\u00e7\u00e3o psicol\u00f3gica de terreno, acha normal um indiv\u00edduo se vestir de morcego para combater um crime, ou que exista uma fam\u00edlia de vampiros bonzinhos, que brilham sob o sol e que n\u00e3o chupam sangue humano. Quando o material n\u00e3o domina isso por completo, o espectador fica encontrando furos no material e achando tudo meio estranho."}, {"5082": "Por isso, em todo filme nacional, os policiais falam como malacos e s\u00e3o sempre moralmente d\u00fabios. Por mais que saibamos que existem policiais s\u00e9rios e cultos, nosso c\u00e9rebro n\u00e3o consegue enxergar um policial brasileiro da mesma forma que v\u00ea um americano. Soa falso."}, {"0c6a": "Da mesma forma, quando um diretor precisa passar conceitos de pureza e ingenuidade, uma crian\u00e7a contempor\u00e2nea n\u00e3o \u00e9 a melhor escolha. Ele pode at\u00e9 conseguir, mas arrisca n\u00e3o criar empatia entre o p\u00fablico e o personagem, e tem que confiar muito em seu talento."}, {"0ee2": "A molecada dos anos 2010 n\u00e3o se encaixa no padr\u00e3o mais relaxado e tranquilo que havia nos 80. Hoje elas n\u00e3o andam pela cidade em grupos, at\u00e9 porque os pais n\u00e3o permitem (consideremos as dificuldades de pensar em tramas passadas dentro de condom\u00ednios). N\u00e3o acreditam em fadas. N\u00e3o fazem pactos de amizade."}, {"98ec": "Um menino de 10 anos de hoje sabe a diferen\u00e7a entre uma Kalashnikov e uma AK-47, porque jogam Counter Strike ou algum similar, e isso n\u00e3o pega bem num filme com um drag\u00e3o digital. Uma menina brinca com bonecas que tem cole\u00e7\u00f5es de roupas criadas por estilistas, e replica fielmente os movimentos da Nikki Minaj."}, {"21d1": "Ambos os sexos usam roupas de grife e aparelhos eletr\u00f4nicos t\u00e3o bons quanto o dos seus pais. Se voc\u00ea acha que estou exagerando, consulte a pr\u00f3pria Disney, na sua outra linha de produtos. Produ\u00e7\u00f5es para \u201ctweens\u201d, que \u00e9 mais uma fase inventada pela publicidade, s\u00e3o pr\u00f3digas em inventar novos \u00eddolos pop e vender todo tipo de merchandising que um ser humano pode pensar."}, {"1e6b": "A cara dos \u201ctweens\u201d de\u00a0hoje."}, {"697f": "De repente as crian\u00e7as deixarem de ser influenciadas por adultos em roupas de palha\u00e7os, paquitas ou dinossauros fofinhos. Elas buscam valida\u00e7\u00e3o para seu comportamento em vloggers e youtubers que supostamente s\u00e3o \u201ccomo eles\u201d. \u00c9 claro que elas n\u00e3o t\u00eam maturidade para saber quem paga os influenciadores."}, {"55a9": "Eles n\u00e3o sonham mais em ser caub\u00f3is, astronautas ou princesas. Querem ser celebridades. Mas n\u00e3o fazem ideia do que os tornar\u00e1 c\u00e9lebres."}, {"b25b": "Enquanto isso, os filmes mais caros para a faixa et\u00e1ria tem coisas em comum. Veja: A Bela e a Fera, Cinderela, Mogli, e o j\u00e1 comentado Pete\u2019s Dragon. Todos s\u00e3o filmes com atores reais, e nenhum deles se passa no mundo atual. Como eu disse, n\u00e3o \u00e9 que seja imposs\u00edvel, \u00e9 apenas mais dif\u00edcil convencer as audi\u00eancias que crian\u00e7as atuais s\u00e3o seres puros e suport\u00e1veis."}, {"3b4d": "Ou seja, os jovens continuam a ser parte intr\u00ednseca das vidas dos adultos, mas o inverso n\u00e3o parece ser verdade. Mais do que nunca, tudo que um jovem menos quer ser na vida \u00e9 um adulto."}, {"0de4": "N\u00e3o \u00e9 \u00e0 toa que vivemos numa \u00e9poca em que tantos adultos s\u00e3o fissurados em brinquedos e temas pueris. Seja na forma de bonecos, carros, roupas ou conquistas amorosas, a vida juvenil (que n\u00e3o tem mais limite et\u00e1rio) parece seguir o padr\u00e3o de \u00e1lbum de figurinhas. Eu pego, eu coloco na cole\u00e7\u00e3o, eu parto pra pr\u00f3xima."}, {"cde8": "N\u00e3o preciso pontuar que a m\u00eddia e a vida vivem uma rela\u00e7\u00e3o simbi\u00f3tica e c\u00edclica. Uma alimenta e influencia a outra. O risco que estamos correndo \u00e9 consider\u00e1vel. Principalmente porque metade do mundo ainda vive um dilema muito mais complexo, que \u00e9 o de conquistar o direito de simplesmente EXISTIR."}, {"4802": "Felizes, puras e comprando muito."}, {"c3a6": "De tanto amor e prote\u00e7\u00e3o que dispensamos \u00e0 nossos rebentos, estamos criando uma gera\u00e7\u00e3o que n\u00e3o sabe lidar com os problemas mais elementares da vida. O que vai acontecer quando eles forem colocados frente a frente com os problemas mais complexos da hist\u00f3ria do planeta, como as grandes migra\u00e7\u00f5es, choques culturais, fome e colapso ambiental?"}, {"a067": "Como ser\u00e1 o mundo liderado por meninos e meninas cujo maior desafio era arrumar espa\u00e7o no arm\u00e1rio para caber tanto sapato, trocar de celular uma vez por ano ou conseguir A selfie perfeita?"}, {"5487": "Posso estar errado. Pode ser apenas mais um solu\u00e7o da hist\u00f3ria. E talvez a gera\u00e7\u00e3o Snapchat, que j\u00e1 tinha post no Instagram antes de deixar a maternidade, saiba lidar com isso como uma facilidade e simplicidade, que surpreenda aqueles que tem mentes mais agitadas."}, {"abc2": "Mas caramba, n\u00e3o est\u00e1 parecendo mesmo."}], "content": "Seus conceitos sobre crian\u00e7a foram atualizados N\u00f3s criamos a inf\u00e2ncia, e vamos destru\u00ed-la No \u00faltimo fim de semana assisti a um filme da Disney, muito bonito, emocionante, e para crian\u00e7as: Pete\u2019s Dragon. Extremamente bem feito e competente na realiza\u00e7\u00e3o. E uma coisa me chamou a aten\u00e7\u00e3o: o filme n\u00e3o se passa em \u00e9poca atual, mas sim em algum ponto n\u00e3o especificado dos anos 80, pelo que mostram os telefones, carros, e roupas. Esse tipo de escolha vem acontecendo com alguma frequ\u00eancia. O caso recente mais famoso \u00e9 o do seriado da Netflix, Stranger Things. Como sou uma crian\u00e7a dos anos 80, me sinto meio homenageado e repleto de nostalgia, mas suspeito que os motivos para que os diretores posicionem suas obras nesse per\u00edodo (ou at\u00e9 em \u00e9pocas mais remotas), sejam outros. A inf\u00e2ncia, e especialmente a adolesc\u00eancia, nos moldes que conhecemos atualmente \u00e9 um fen\u00f4meno relativamente novo. At\u00e9 antes da segunda guerra mundial, o foco da sociedade estava nos adultos. Mais especialmente no homem adulto, provedor e figura principal da casa. A grande maioria da publicidade, m\u00eddia e entretenimento era focada naquele que pagava e decidia as contas das casa. \u201cMostre a ela que este \u00e9 um mundo de\u00a0homens\u201d An\u00fancio da Coca. Sirene de f\u00e1brica. Homem. Mulher. Nenhuma\u00a0crian\u00e7a. No come\u00e7o do s\u00e9culo, filho era aquela coisa que o casal tinha 13, e se conseguisse chegar \u00e0 sua velhice com 8 vivos, voc\u00ea j\u00e1 podia se considerar um vencedor. O resultado desse foco era que os jovens queriam deixar de s\u00ea-lo o quanto antes. Por isso quando voc\u00ea olha uma foto dos seus pais ou av\u00f3s em seus vinte e poucos anos, eles pareciam t\u00e3o mais velhos. As pessoas pulavam da inf\u00e2ncia para a era adulta em dois ou tr\u00eas anos, passando por uma adolesc\u00eancia cheia de regras. Meninos queriam ser homens logo, e casavam cedo afim de sair da casa dos pais, onde eram meros coadjuvantes e tinham que dividir a mesa com os outros 8 irm\u00e3os. Meninas ent\u00e3o, n\u00e3o tinham vez nem dentro, nem fora da casa. Aos 15, 16 anos muitas j\u00e1 estavam noivas ou sonhando com isso. Era a chance de brincar de casinha, usando a pr\u00f3pria casa como cobaia. Fora que, na sociedade da \u00e9poca, muitas coisas que os horm\u00f4nios pediam desesperadamente para serem consumadas s\u00f3 eram permitidas depois do casamento. A entrada no mundo adulto era o passaporte para a liberdade. Mas ent\u00e3o veio a guerra. E n\u00e3o se esque\u00e7am: quando falamos de tend\u00eancia de comportamento e m\u00eddia, n\u00f3s aqui sempre olhamos para o que acontece nos Estados Unidos e na Europa, e aproveitamos (nem sempre da forma mais s\u00e1bia) aquilo que achamos bacana. E com hordas de homens de repente sumindo do mapa, coube \u00e0s mulheres assumirem as r\u00e9deas das casas e provar que conseguiam administrar sozinhas o trabalho e a fam\u00edlia. Os maridos voltaram (n\u00e3o todos), e no meio dos reencontros t\u00e3o ternos, das hist\u00f3rias de terror do conflito e da s\u00fabita realiza\u00e7\u00e3o da import\u00e2ncia do conv\u00edvio com os entes queridos, n\u00e3o era de surpreender que a m\u00eddia e a publicidade tenham se transformado os anos 50 num para\u00edso idealizado, com m\u00e3es que andavam de salto alto dentro de casa e faziam tortas para a prole, enquanto o marido cortava a grama e as crian\u00e7as brincavam de caub\u00f3i no quintal. O amor estava no ar, e isso foi chamado de baby-boom, pela quantidade massiva de crian\u00e7as geradas ap\u00f3s a volta dos maridos da guerra, e pelo otimismo com o futuro que marcou a \u00e9poca. Sem que se percebesse, o foco foi saindo do marido, e passou para a fam\u00edlia. Muitas fam\u00edlias e felicidade. Pouca crian\u00e7a na\u00a0foto. Nem tudo eram flores. Por tr\u00e1s da utopia Capriana existia uma sociedade ainda muito machista, onde as mulheres tinham pouca voz. Os anos 60 chegaram com a p\u00edlula, com o div\u00f3rcio e com a luta das minorias por espa\u00e7o. \u00c9poca conturbada, que culminou com, adivinhem, nova guerra. Por acaso ou n\u00e3o, no mesmo ano que a guerra do Vietn\u00e3 terminou, o filme que marca o in\u00edcio dos chamados blockbusters de ver\u00e3o, estreou. Tubar\u00e3o, de Steven Spielberg, levou milh\u00f5es de pessoas ao cinema, e mudou o marketing da ind\u00fastria. Mas o estrago realmente foi feito dois anos mais tarde, quando Star Wars, de George Lucas, chega \u00e0s telas. Estreia de Tubar\u00e3o, em\u00a01975 At\u00e9 esse momento, os filmes eram lan\u00e7ados para a fam\u00edlia. A partir da\u00ed, eram focados totalmente nos jovens. E nunca mais vieram separados de uma parafern\u00e1lia sem precedentes. N\u00e3o bastava ver o filme. Era preciso ter os bonecos, as camisetas, os p\u00f4steres, as canecas, os chinelos, as almofadas, os tapetes de banheiro, e os jogos (que no in\u00edcio, vejam s\u00f3, eram de tabuleiro). O mundo nunca mais foi o mesmo. Tinha de tudo. Ainda tem. Muito\u00a0mais. O foco nos mais jovens provou ser a galinha dos ovos de ouro para os produtores. Um filme podia ir mal de bilheteria, e ainda assim lucrar com a venda de produtos. De l\u00e1 pra c\u00e1, \u00e9 f\u00e1cil entender e acompanhar o progresso dessa nova cultura em torno dos jovens. O ponto m\u00e1ximo desse modo de vida \u00e9 o agora, onde as crian\u00e7as e jovens s\u00e3o o ponto central da vida das fam\u00edlias. At\u00e9 mesmo novas subdivis\u00f5es biol\u00f3gicas foram criadas para abarcar esses seres que subitamente estavam sendo notados. Agora eles uma tinham uma pr\u00e9-adolesc\u00eancia para chamar de sua. Outro fato interessante: todos querem estender a juventude para al\u00e9m dos 30 anos. Vivendo como reis dentro de suas casas, era normal que a independ\u00eancia tenha deixado de ser um valor t\u00e3o importante. Ainda mais dentro de casas onde os pais se sentem cada vez mais culpados por n\u00e3o ter tempo para conseguir dar toda a aten\u00e7\u00e3o merecida a seus maravilhosos e \u00fanicos flocos de neve. O importante \u00e9 ser jovem, com a maior intensidade, e por quanto tempo for poss\u00edvel. E consumir. Consumir para existir. O que nos leva ao primeiro par\u00e1grafo do texto. Porque o cinema e a m\u00eddia est\u00e3o voltando suas lentes para os anos 80 de novo? Um dos trabalhos mais \u00e1rduos de um autor \u00e9 chamado suspens\u00e3o da descren\u00e7a. \u00c9 quando a pessoa entra num cinema, ou l\u00ea um quadrinho ou livro, e depois de 10 minutos de prepara\u00e7\u00e3o psicol\u00f3gica de terreno, acha normal um indiv\u00edduo se vestir de morcego para combater um crime, ou que exista uma fam\u00edlia de vampiros bonzinhos, que brilham sob o sol e que n\u00e3o chupam sangue humano. Quando o material n\u00e3o domina isso por completo, o espectador fica encontrando furos no material e achando tudo meio estranho. Por isso, em todo filme nacional, os policiais falam como malacos e s\u00e3o sempre moralmente d\u00fabios. Por mais que saibamos que existem policiais s\u00e9rios e cultos, nosso c\u00e9rebro n\u00e3o consegue enxergar um policial brasileiro da mesma forma que v\u00ea um americano. Soa falso. Da mesma forma, quando um diretor precisa passar conceitos de pureza e ingenuidade, uma crian\u00e7a contempor\u00e2nea n\u00e3o \u00e9 a melhor escolha. Ele pode at\u00e9 conseguir, mas arrisca n\u00e3o criar empatia entre o p\u00fablico e o personagem, e tem que confiar muito em seu talento. A molecada dos anos 2010 n\u00e3o se encaixa no padr\u00e3o mais relaxado e tranquilo que havia nos 80. Hoje elas n\u00e3o andam pela cidade em grupos, at\u00e9 porque os pais n\u00e3o permitem (consideremos as dificuldades de pensar em tramas passadas dentro de condom\u00ednios). N\u00e3o acreditam em fadas. N\u00e3o fazem pactos de amizade. Um menino de 10 anos de hoje sabe a diferen\u00e7a entre uma Kalashnikov e uma AK-47, porque jogam Counter Strike ou algum similar, e isso n\u00e3o pega bem num filme com um drag\u00e3o digital. Uma menina brinca com bonecas que tem cole\u00e7\u00f5es de roupas criadas por estilistas, e replica fielmente os movimentos da Nikki Minaj. Ambos os sexos usam roupas de grife e aparelhos eletr\u00f4nicos t\u00e3o bons quanto o dos seus pais. Se voc\u00ea acha que estou exagerando, consulte a pr\u00f3pria Disney, na sua outra linha de produtos. Produ\u00e7\u00f5es para \u201ctweens\u201d, que \u00e9 mais uma fase inventada pela publicidade, s\u00e3o pr\u00f3digas em inventar novos \u00eddolos pop e vender todo tipo de merchandising que um ser humano pode pensar. A cara dos \u201ctweens\u201d de\u00a0hoje. De repente as crian\u00e7as deixarem de ser influenciadas por adultos em roupas de palha\u00e7os, paquitas ou dinossauros fofinhos. Elas buscam valida\u00e7\u00e3o para seu comportamento em vloggers e youtubers que supostamente s\u00e3o \u201ccomo eles\u201d. \u00c9 claro que elas n\u00e3o t\u00eam maturidade para saber quem paga os influenciadores. Eles n\u00e3o sonham mais em ser caub\u00f3is, astronautas ou princesas. Querem ser celebridades. Mas n\u00e3o fazem ideia do que os tornar\u00e1 c\u00e9lebres. Enquanto isso, os filmes mais caros para a faixa et\u00e1ria tem coisas em comum. Veja: A Bela e a Fera, Cinderela, Mogli, e o j\u00e1 comentado Pete\u2019s Dragon. Todos s\u00e3o filmes com atores reais, e nenhum deles se passa no mundo atual. Como eu disse, n\u00e3o \u00e9 que seja imposs\u00edvel, \u00e9 apenas mais dif\u00edcil convencer as audi\u00eancias que crian\u00e7as atuais s\u00e3o seres puros e suport\u00e1veis. Ou seja, os jovens continuam a ser parte intr\u00ednseca das vidas dos adultos, mas o inverso n\u00e3o parece ser verdade. Mais do que nunca, tudo que um jovem menos quer ser na vida \u00e9 um adulto. N\u00e3o \u00e9 \u00e0 toa que vivemos numa \u00e9poca em que tantos adultos s\u00e3o fissurados em brinquedos e temas pueris. Seja na forma de bonecos, carros, roupas ou conquistas amorosas, a vida juvenil (que n\u00e3o tem mais limite et\u00e1rio) parece seguir o padr\u00e3o de \u00e1lbum de figurinhas. Eu pego, eu coloco na cole\u00e7\u00e3o, eu parto pra pr\u00f3xima. N\u00e3o preciso pontuar que a m\u00eddia e a vida vivem uma rela\u00e7\u00e3o simbi\u00f3tica e c\u00edclica. Uma alimenta e influencia a outra. O risco que estamos correndo \u00e9 consider\u00e1vel. Principalmente porque metade do mundo ainda vive um dilema muito mais complexo, que \u00e9 o de conquistar o direito de simplesmente EXISTIR. Felizes, puras e comprando muito. De tanto amor e prote\u00e7\u00e3o que dispensamos \u00e0 nossos rebentos, estamos criando uma gera\u00e7\u00e3o que n\u00e3o sabe lidar com os problemas mais elementares da vida. O que vai acontecer quando eles forem colocados frente a frente com os problemas mais complexos da hist\u00f3ria do planeta, como as grandes migra\u00e7\u00f5es, choques culturais, fome e colapso ambiental? Como ser\u00e1 o mundo liderado por meninos e meninas cujo maior desafio era arrumar espa\u00e7o no arm\u00e1rio para caber tanto sapato, trocar de celular uma vez por ano ou conseguir A selfie perfeita? Posso estar errado. Pode ser apenas mais um solu\u00e7o da hist\u00f3ria. E talvez a gera\u00e7\u00e3o Snapchat, que j\u00e1 tinha post no Instagram antes de deixar a maternidade, saiba lidar com isso como uma facilidade e simplicidade, que surpreenda aqueles que tem mentes mais agitadas. Mas caramba, n\u00e3o est\u00e1 parecendo mesmo. ", "child": "720_1\t720_2\t720_3\t720_4"}