{"name": "825", "parent": "", "title": "The Power of\u00a0Defaults", "sentences": [{"36f4": "The Power of\u00a0Defaults"}, {"aad8": "by Nick\u00a0Babich"}, {"aa38": "Defaults are the values or settings that come out of the box. They might not seem like much, but defaults (and their designers) hold immense power\u200a\u2014\u200athey make decisions for users."}, {"b6a8": "In this article, we\u2019ll discuss how to use pre-populated input fields and default settings in apps for better user experience."}, {"ea7b": "Default Values in Form Input\u00a0Fields"}, {"5bd6": "Filling out a long form can sometimes be enough reason for the user to go somewhere else, where the process is easier. By providing good default values, you save the user from the hassle of selecting all the relevant choices."}, {"ee6d": "Default should be what the majority of your users will\u00a0want"}, {"181c": "Pre-populate fields with the value if you can determine it in advance, but be sure that a large portion of your user\u2019s (e.g. 95%) will select that value. People scan forms quickly online so don\u2019t assume they will take the time to parse through all the choices. They simply may blithely skip by something that already has a value."}, {"9025": "Good defaults design can be found on travel sites. Skyscanner pre-populates cabin class and travellers fields to what most other users typically select."}, {"7382": "Use smart\u00a0defaults"}, {"90f3": "Typing has high interaction cost; it is error-prone and time-consuming even with a full keyboard (and even more so on a touch screen). Try to minimize typing and prevent users from making errors\u200a\u2014\u200ause smart defaults. Here are a few examples of how smart defaults can help users both reduce mistakes and increase productivity:"}, {"cfc5": "If you\u2019re able to determine that user location is Melbourne, the country field should be pre-populated with value \u201cAustralia.\u201d"}, {"a193": "Try keeping the data entry to a\u00a0minimum"}, {"3c63": "Don\u2019t use defaults for input fields that require user attention"}, {"132b": "Do not use defaults for anything that requires user thought (e.g. signing up for newsletters or accepting terms of use)."}, {"fd78": "Make it easy for the user to change default\u00a0settings"}, {"1889": "Even if you make a good well-researched default, there is always a possibility that users want something else. Thus, it should be possible to change the default relatively easily."}, {"b469": "As was mentioned above, auto-detection of location can save users time. However, there are times when users need to select a different location (e.g. find a store that\u2019s not located nearby). Image credit:\u00a0Google"}, {"3160": "Default Settings in\u00a0Apps"}, {"697f": "You should strive to make you app work perfectly for the user out of the box. Use default settings when it is possible for the app to make qualified guesses regarding what the user might choose."}, {"ccad": "Helpful defaults"}, {"8e21": "Statistically speaking, users will rarely change the default settings in apps, even if customization options are available. Jared Spool in his article Do users change their settings? says that according to his observations:"}, {"a4a2": "Less than 5% of users change default\u00a0settings"}, {"a72b": "Another study Analyzing Facebook Privacy Settings: User Expectations vs. Reality found that Facebook users are confused about the privacy settings and usually assume they have more privacy by default than they really do. This means that:"}, {"5b9d": "Users assume you have their best interests in\u00a0mind"}, {"32a5": "Considering these two factors, you should make your app the most welcoming and useful with the default settings:"}, {"860c": "Settings can define preferred application behaviours"}, {"5fca": "You can use the default settings to instigate the actions you want the user to follow. Slack provides a good example of how to make users aware of the default settings and how to update them."}, {"a916": "Slack advice users to enable desktop notifications"}, {"1fb2": "Conclusion"}, {"b6e0": "People tend to stick to the defaults. Defaults are incredibly powerful tools for guiding users, speeding up system usage, and influencing responses with the power of suggestion."}, {"fe06": "Thank you!"}, {"5c66": "Follow UX Planet: Twitter | Facebook"}, {"bc5c": "Originally published at babich.biz"}], "content": "The Power of\u00a0Defaults by Nick\u00a0Babich Defaults are the values or settings that come out of the box. They might not seem like much, but defaults (and their designers) hold immense power\u200a\u2014\u200athey make decisions for users. In this article, we\u2019ll discuss how to use pre-populated input fields and default settings in apps for better user experience. Default Values in Form Input\u00a0Fields Filling out a long form can sometimes be enough reason for the user to go somewhere else, where the process is easier. By providing good default values, you save the user from the hassle of selecting all the relevant choices. Default should be what the majority of your users will\u00a0want Pre-populate fields with the value if you can determine it in advance, but be sure that a large portion of your user\u2019s (e.g. 95%) will select that value. People scan forms quickly online so don\u2019t assume they will take the time to parse through all the choices. They simply may blithely skip by something that already has a value. Good defaults design can be found on travel sites. Skyscanner pre-populates cabin class and travellers fields to what most other users typically select. Use smart\u00a0defaults Typing has high interaction cost; it is error-prone and time-consuming even with a full keyboard (and even more so on a touch screen). Try to minimize typing and prevent users from making errors\u200a\u2014\u200ause smart defaults. Here are a few examples of how smart defaults can help users both reduce mistakes and increase productivity: If you\u2019re able to determine that user location is Melbourne, the country field should be pre-populated with value \u201cAustralia.\u201d Try keeping the data entry to a\u00a0minimum Don\u2019t use defaults for input fields that require user attention Do not use defaults for anything that requires user thought (e.g. signing up for newsletters or accepting terms of use). Make it easy for the user to change default\u00a0settings Even if you make a good well-researched default, there is always a possibility that users want something else. Thus, it should be possible to change the default relatively easily. As was mentioned above, auto-detection of location can save users time. However, there are times when users need to select a different location (e.g. find a store that\u2019s not located nearby). Image credit:\u00a0Google Default Settings in\u00a0Apps You should strive to make you app work perfectly for the user out of the box. Use default settings when it is possible for the app to make qualified guesses regarding what the user might choose. Helpful defaults Statistically speaking, users will rarely change the default settings in apps, even if customization options are available. Jared Spool in his article Do users change their settings? says that according to his observations: Less than 5% of users change default\u00a0settings Another study Analyzing Facebook Privacy Settings: User Expectations vs. Reality found that Facebook users are confused about the privacy settings and usually assume they have more privacy by default than they really do. This means that: Users assume you have their best interests in\u00a0mind Considering these two factors, you should make your app the most welcoming and useful with the default settings: Settings can define preferred application behaviours You can use the default settings to instigate the actions you want the user to follow. Slack provides a good example of how to make users aware of the default settings and how to update them. Slack advice users to enable desktop notifications Conclusion People tend to stick to the defaults. Defaults are incredibly powerful tools for guiding users, speeding up system usage, and influencing responses with the power of suggestion. Thank you! Follow UX Planet: Twitter | Facebook Originally published at babich.biz ", "child": "825_1\t825_2\t825_3825_1\t825_2\t825_3"}