{"name": "924", "parent": "", "title": "The Startup Founder\u2019s Guide to Analytics", "sentences": [{"df9b": "The Startup Founder\u2019s Guide to Analytics"}, {"bf27": "You need analytics."}, {"c678": "I\u2019m very confident of that, because today, everyone needs analytics. Not just product, not just marketing, not just finance\u2026 sales, fulfillment, everyone at a startup needs analytics today. Analytics powers every decision, from the strategic to the tactical, from the board room to your line level employees."}, {"7325": "This post is about how to create the analytics competency at your organization. It\u2019s not about what metrics to track (there are plenty of good posts about that), it\u2019s about how to actually get your business to produce them. As it turns out, the implementation question\u200a\u2014\u200aHow do I build a business that produces actionable data?\u2014is much harder to answer."}, {"395b": "And the answer is changing fast. The analytics ecosystem is moving very quickly, and the options you have at your disposal have changed significantly in the past 24 months. This post reflects recommendations and experience with the data technology of 2017."}, {"728d": "First: Why should you listen to\u00a0me?"}, {"0001": "I\u2019ve spent the better part of two decades working in analytics. In that time, I\u2019ve seen plenty of things go well, but a lot more go poorly. I spent the early part of my career implementing legacy enterprise BI (ugh). I built Squarespace\u2019s first analytics competency from 2009\u20132010 and raised massive A round with the data. I was then COO of Argyle Social, a social media analytics startup, and subsequently VP Marketing at RJMetrics, a leading BI platform for startups."}, {"0edc": "Now I spend my days helping startup execs implement analytics as the CEO and Founder of Fishtown Analytics. At Fishtown, we start working with companies who have raised an A round and help them build their internal analytics competency as they grow. We\u2019ve been through the exact process I\u2019m going to describe in this article with over a dozen companies at this point, including Casper, SeatGeek, and Code Climate."}, {"cf9b": "I\u2019m going to walk you through, stage by stage, how your startup should be doing analytics. At each stage, my recommendations are going to answer to the question \u201cWhat\u2019s the absolute least I can get away with?\u201d We\u2019re not here to build castles in the sky; we need answers as cheaply as possible."}, {"05c8": "Let\u2019s do it."}, {"5997": "Founding Stage"}, {"d7ab": "(0 to 10 employees)"}, {"0509": "At this stage, you have no resources and no time. There are a million things you could be measuring, but you\u2019re so close to the details of your business that you\u2019re actually able to make fairly good instinctual decisions. The one thing you need to make sure you are measuring is your product, because it\u2019s your product metrics that will help you iterate quickly in this critical phase. Everything else can take a back seat."}, {"8d6f": "What to\u00a0do"}, {"7e22": "If you\u2019re not technical, you may need an engineer to help out with GA and event tracking. This entire exercise shouldn\u2019t take more than an hour or two, including reading the docs. It\u2019s worth it to take the time out of building for this."}, {"4e0a": "What not to\u00a0do"}, {"2966": "Everything that is not one of the things above. Do not let someone sell you a data warehouse, a BI platform, a big consulting project, or\u2026yeah, you get it. Stay focused. When you make a commitment to analytics, there is an ongoing cost. Data changes. Business logic changes. Once you start down this road, you can\u2019t really put the project on pause. Wait to make this investment until later."}, {"877c": "There will be many questions that you just can\u2019t answer yet. That\u2019s fine (for now)."}, {"a820": "Very Early\u00a0Stage"}, {"3b91": "(10 to 20 employees)"}, {"0e0f": "You\u2019re growing your team a bit. These people need data to do their jobs. They may or may not be data experts, and you need to make sure that they\u2019re doing the basic things right."}, {"26ad": "What to\u00a0do"}, {"d52d": "What not to\u00a0do"}, {"8656": "It\u2019s still too early for a data warehouse and for SQL-based analytics\u2014it just takes too much time. You need to spend all of your time doing, not analyzing, and the most straightforward way to do that is to use the built-in reporting capabilities of the various SaaS products you\u2019re using to run your business. You also shouldn\u2019t hire a full-time analyst yet. There are more important things to spend your limited funds on at this point."}, {"a274": "Early Stage"}, {"f049": "(20 to 50 employees)"}, {"eb13": "This is where things get interesting, and where the changes in the past two years really start to become apparent. Once you\u2019ve raised your A round and have 20+ employees you start to have new options."}, {"7f43": "These options are all driven by one thing: analytics tech is getting better, fast. Previously this type of infrastructure was reserved for much larger companies. Its benefits? More reliable metrics, more flexibility, and a better platform for future growth."}, {"6bb4": "This is the hardest and most critical phase: promising if you do it right, but pain-inducing if you do it wrong."}, {"5e58": "What to\u00a0do"}, {"8719": "What not to\u00a0do"}, {"56d5": "Mid-Stage"}, {"3005": "(50 to 150 employees)"}, {"4a52": "This stage is potentially the most challenging. You still have a relatively small team and few resources, but you\u2019re being asked to deliver increasingly sophisticated and diverse analytics to the business, and your work can directly impact the success or failure of the company as a whole. No pressure."}, {"4a93": "It\u2019s important to make forward progress here while making sure that you continue to lay the groundwork for future phases of your growth. The decisions you make in this phase can cause you to charge straight into a brick wall if you don\u2019t think hard about the future."}, {"10e3": "What to\u00a0do"}, {"ccfb": "What not to\u00a0do"}, {"e0e5": "It\u2019s easy to get carried away with yourself and begin investing in heavy-duty data infrastructure. Don\u2019t do this. At this stage, major infrastructure investments are still an expensive distraction. Here are some suggestions on how to stay agile:"}, {"101a": "Avoiding expensive boondoggles will keep you focused on solving real business problems."}, {"9edb": "Growth Stage"}, {"7581": "(150 to 500 employees)"}, {"cacc": "This stage is all about creating analytics processes that scale. You need to balance getting answers that you need today with implementing analytics practices that will scale as you continue growing your team."}, {"435e": "At 150 employees you\u2019ll probably only have a small team (3\u20136) full-time focused on analytics. By the time you have 500 employees you could easily have 30 or more. 3\u20136 analysts can operate in a fairly ad-hoc manner, exchanging knowledge (and code) informally. By the time you have 8+ analysts, this begins to break down very quickly."}, {"5d4b": "If you don\u2019t manage this transition well, you\u2019ll actually perform less well as your team grows: it will take you longer to produce meaningful insights, and your answers will be of lower quality. This is simply a function of non-linear complexity: you\u2019ll have more data being produced and more analysts working with it. In order to combat this, you need processes to keep them working together reliably."}, {"fe40": "What to\u00a0do"}, {"461f": "What not to\u00a0do"}, {"7750": "Don\u2019t accept excuses. Doing analytics right at this level is hard work, and it requires a talented and motivated team that is constantly innovating and improving. Code reviews take time and energy. Analysts aren\u2019t used to having to test their code. And documentation is painstaking. There will be resistance to doing things this way, especially among your long-term team members who remember the \u201cgood old days\u201d. But as complexity increases, you need to evolve your processes to adapt."}, {"29da": "These processes will actually make analytics easier, faster, and more reliable, but implementing them will feel like pulling teeth. If you\u2019re serious about scaling analytics, you\u2019ll push through."}, {"331a": "You\u2019re a\u00a0Pioneer"}, {"3d8e": "I\u2019ve come to each one of these recommendations after years of doing it myself within companies and now scaling the approach as a consultant. The opportunity to work with a range of similar clients has made it incredibly clear just how rare it is for companies to do this stuff well."}, {"0ecf": "If you take all of the recommendations in this post, you will literally be one of the highest-functioning analytics organizations in the world. Not a bad competitive advantage."}, {"b986": "Want to chat about your analytics? I\u2019m always happy to jump on a call and listen! Tweet me at @jthandy. Also, I\u2019d be honored if you\u2019d check out the newsletter I publish every week, The Data Science Roundup. Every week I curate the most useful data science articles from around the internet; arrives every Sunday morning with your coffee \u2615"}, {"3911": "Thanks for reading! \ud83d\ude01"}], "content": "The Startup Founder\u2019s Guide to Analytics You need analytics. I\u2019m very confident of that, because today, everyone needs analytics. Not just product, not just marketing, not just finance\u2026 sales, fulfillment, everyone at a startup needs analytics today. Analytics powers every decision, from the strategic to the tactical, from the board room to your line level employees. This post is about how to create the analytics competency at your organization. It\u2019s not about what metrics to track (there are plenty of good posts about that), it\u2019s about how to actually get your business to produce them. As it turns out, the implementation question\u200a\u2014\u200aHow do I build a business that produces actionable data?\u2014is much harder to answer. And the answer is changing fast. The analytics ecosystem is moving very quickly, and the options you have at your disposal have changed significantly in the past 24 months. This post reflects recommendations and experience with the data technology of 2017. First: Why should you listen to\u00a0me? I\u2019ve spent the better part of two decades working in analytics. In that time, I\u2019ve seen plenty of things go well, but a lot more go poorly. I spent the early part of my career implementing legacy enterprise BI (ugh). I built Squarespace\u2019s first analytics competency from 2009\u20132010 and raised massive A round with the data. I was then COO of Argyle Social, a social media analytics startup, and subsequently VP Marketing at RJMetrics, a leading BI platform for startups. Now I spend my days helping startup execs implement analytics as the CEO and Founder of Fishtown Analytics. At Fishtown, we start working with companies who have raised an A round and help them build their internal analytics competency as they grow. We\u2019ve been through the exact process I\u2019m going to describe in this article with over a dozen companies at this point, including Casper, SeatGeek, and Code Climate. I\u2019m going to walk you through, stage by stage, how your startup should be doing analytics. At each stage, my recommendations are going to answer to the question \u201cWhat\u2019s the absolute least I can get away with?\u201d We\u2019re not here to build castles in the sky; we need answers as cheaply as possible. Let\u2019s do it. Founding Stage (0 to 10 employees) At this stage, you have no resources and no time. There are a million things you could be measuring, but you\u2019re so close to the details of your business that you\u2019re actually able to make fairly good instinctual decisions. The one thing you need to make sure you are measuring is your product, because it\u2019s your product metrics that will help you iterate quickly in this critical phase. Everything else can take a back seat. What to\u00a0do If you\u2019re not technical, you may need an engineer to help out with GA and event tracking. This entire exercise shouldn\u2019t take more than an hour or two, including reading the docs. It\u2019s worth it to take the time out of building for this. What not to\u00a0do Everything that is not one of the things above. Do not let someone sell you a data warehouse, a BI platform, a big consulting project, or\u2026yeah, you get it. Stay focused. When you make a commitment to analytics, there is an ongoing cost. Data changes. Business logic changes. Once you start down this road, you can\u2019t really put the project on pause. Wait to make this investment until later. There will be many questions that you just can\u2019t answer yet. That\u2019s fine (for now). Very Early\u00a0Stage (10 to 20 employees) You\u2019re growing your team a bit. These people need data to do their jobs. They may or may not be data experts, and you need to make sure that they\u2019re doing the basic things right. What to\u00a0do What not to\u00a0do It\u2019s still too early for a data warehouse and for SQL-based analytics\u2014it just takes too much time. You need to spend all of your time doing, not analyzing, and the most straightforward way to do that is to use the built-in reporting capabilities of the various SaaS products you\u2019re using to run your business. You also shouldn\u2019t hire a full-time analyst yet. There are more important things to spend your limited funds on at this point. Early Stage (20 to 50 employees) This is where things get interesting, and where the changes in the past two years really start to become apparent. Once you\u2019ve raised your A round and have 20+ employees you start to have new options. These options are all driven by one thing: analytics tech is getting better, fast. Previously this type of infrastructure was reserved for much larger companies. Its benefits? More reliable metrics, more flexibility, and a better platform for future growth. This is the hardest and most critical phase: promising if you do it right, but pain-inducing if you do it wrong. What to\u00a0do What not to\u00a0do Mid-Stage (50 to 150 employees) This stage is potentially the most challenging. You still have a relatively small team and few resources, but you\u2019re being asked to deliver increasingly sophisticated and diverse analytics to the business, and your work can directly impact the success or failure of the company as a whole. No pressure. It\u2019s important to make forward progress here while making sure that you continue to lay the groundwork for future phases of your growth. The decisions you make in this phase can cause you to charge straight into a brick wall if you don\u2019t think hard about the future. What to\u00a0do What not to\u00a0do It\u2019s easy to get carried away with yourself and begin investing in heavy-duty data infrastructure. Don\u2019t do this. At this stage, major infrastructure investments are still an expensive distraction. Here are some suggestions on how to stay agile: Avoiding expensive boondoggles will keep you focused on solving real business problems. Growth Stage (150 to 500 employees) This stage is all about creating analytics processes that scale. You need to balance getting answers that you need today with implementing analytics practices that will scale as you continue growing your team. At 150 employees you\u2019ll probably only have a small team (3\u20136) full-time focused on analytics. By the time you have 500 employees you could easily have 30 or more. 3\u20136 analysts can operate in a fairly ad-hoc manner, exchanging knowledge (and code) informally. By the time you have 8+ analysts, this begins to break down very quickly. If you don\u2019t manage this transition well, you\u2019ll actually perform less well as your team grows: it will take you longer to produce meaningful insights, and your answers will be of lower quality. This is simply a function of non-linear complexity: you\u2019ll have more data being produced and more analysts working with it. In order to combat this, you need processes to keep them working together reliably. What to\u00a0do What not to\u00a0do Don\u2019t accept excuses. Doing analytics right at this level is hard work, and it requires a talented and motivated team that is constantly innovating and improving. Code reviews take time and energy. Analysts aren\u2019t used to having to test their code. And documentation is painstaking. There will be resistance to doing things this way, especially among your long-term team members who remember the \u201cgood old days\u201d. But as complexity increases, you need to evolve your processes to adapt. These processes will actually make analytics easier, faster, and more reliable, but implementing them will feel like pulling teeth. If you\u2019re serious about scaling analytics, you\u2019ll push through. You\u2019re a\u00a0Pioneer I\u2019ve come to each one of these recommendations after years of doing it myself within companies and now scaling the approach as a consultant. The opportunity to work with a range of similar clients has made it incredibly clear just how rare it is for companies to do this stuff well. If you take all of the recommendations in this post, you will literally be one of the highest-functioning analytics organizations in the world. Not a bad competitive advantage. Want to chat about your analytics? I\u2019m always happy to jump on a call and listen! Tweet me at @jthandy. Also, I\u2019d be honored if you\u2019d check out the newsletter I publish every week, The Data Science Roundup. Every week I curate the most useful data science articles from around the internet; arrives every Sunday morning with your coffee \u2615 Thanks for reading! \ud83d\ude01 ", "child": "924_1\t924_2\t924_3\t924_4\t924_5\t924_6\t924_7\t924_8\t924_9\t924_10\t924_11\t924_12\t924_13\t924_14\t924_15\t924_16\t924_17\t924_18\t924_19\t924_20\t924_21\t924_22\t924_23\t924_24924_1\t924_2\t924_3\t924_4\t924_5\t924_6\t924_7\t924_8\t924_9\t924_10\t924_11\t924_12\t924_13\t924_14\t924_15\t924_16\t924_17\t924_18\t924_19\t924_20\t924_21\t924_22\t924_23\t924_24"}