{"name": "980", "parent": "", "title": "Venda mais sem investir quase\u00a0nada", "sentences": [{"8708": "Venda mais sem investir quase\u00a0nada"}, {"1ca9": "Elevando o faturamento da sua empresa de uma maneira bem simples e funcional."}, {"f3d8": "Show me the\u00a0money!"}, {"d1ff": "Ontem em conversa com um grande amigo, consultor na \u00e1rea de laborat\u00f3rios de an\u00e1lises, est\u00e1vamos divagando sobre como as empresas podem elevar seus faturamentos sem muitos esfor\u00e7os. Chegamos nesse assunto devido ao fator crise, todo mundo esta reclamando dela, empresas e pessoas est\u00e3o completamente endividadas, por\u00e9m de uma maneira bem simples \u00e9 poss\u00edvel elevar o ticket m\u00e9dio das vendas do seu neg\u00f3cio."}, {"8e7b": "Ticket m\u00e9dio: A quantia que cada cliente em m\u00e9dia compra com\u00a0voc\u00ea."}, {"9b0f": "N\u00e3o importa o neg\u00f3cio, \u00e9 poss\u00edvel vender mais para o mesmo cliente. Acredite em mim, at\u00e9 em funer\u00e1rias \u00e9 poss\u00edvel adicionar mais alguns itens na venda. Na padaria isso \u00e9 poss\u00edvel, na farm\u00e1cia, na sua consultoria, no seu e-commerce, pizzaria, loja de carros, f\u00e1brica de sof\u00e1s. N\u00e3o importa o que voc\u00ea venda, da para vender mais. At\u00e9 prostitutas podem adicionar itens na venda, enfim, acho que voc\u00ea j\u00e1 compreendeu o que estou dizendo.\u00a0:D"}, {"fafd": "Mesmo sendo f\u00e1cil e simples, quase nunca ele \u00e9 praticado, s\u00e3o poucos os lugares que os colaboradores est\u00e3o preparados para isso. Muitas vezes o dono da empresa at\u00e9 tem vontade, mas com uma estrat\u00e9gia errada, ai os colaboradores n\u00e3o se sentem vendedores do neg\u00f3cio."}, {"770f": "Se voc\u00ea tem 100 colaboradores, sua empresa precisa ter 100 vendedores."}, {"01b7": "Como os e-commerce elevam o ticket m\u00e9dio das suas compras?"}, {"77e7": "Logo, se os e-commerces que n\u00e3o tem um contato H2H (Human to Human) com seus clientes conseguem elevar seu ticket m\u00e9dio. O que falta para sua \"lojinha f\u00edsica\" vendar mais?"}, {"72fd": "Agora pela manh\u00e3 fui at\u00e9 uma padaria pr\u00f3xima de casa, como fa\u00e7o todas as manh\u00e3s, por\u00e9m hoje resolvi prestar aten\u00e7\u00e3o em como eu seria atendido, logo vamos aprender com os erros dos outros."}, {"210e": "\u00c9 s\u00e9rio isso? Voc\u00ea n\u00e3o vai me oferecer nada? Eu comprei p\u00e3es, voc\u00ea poderia sugerir que eles ficam \u00f3timos com queijo, presunto ou qualquer outra coisa."}, {"0382": "Ela poderia ter me oferecido um p\u00e3o de queijo quentinho, um peda\u00e7o de bolo ou algo assim."}, {"b3a9": "2. Pagando a conta"}, {"6324": "A caixa simplesmente fez o trabalho dela, me cobrou. \u00c9 s\u00e9rio isso? Voc\u00ea n\u00e3o vai me oferecer um chicletes que esta em promo\u00e7\u00e3o, um chocolate que com mais 1 real eu poderia levar?"}, {"1cde": "Sabe o motivo disso acontecer? Pelo simples fato delas n\u00e3o serem vendedoras e S\u00d3 atendentes e caixa. Mas a responsabilidade disso n\u00e3o \u00e9 s\u00f3 delas, mas sim de quem contratou, treinou e mant\u00e9m elas fazendo apenas o seu trabalho."}, {"8756": "Com um pequeno treinamento de duas ou tr\u00eas horas \u00e9 poss\u00edvel resolver isso, explicando esses pontos para o seu time, como eles podem perceber demanda e realizar novas vendas, como eles ser\u00e3o remunerados se as metas coletivas de vendas forem atingidas."}, {"5382": "Eu poderia cobrar da sua empresa s\u00f3 para ir at\u00e9 ai, criar isso e explicar a mesma coisa para voc\u00eas, mas resolvi fazer de gra\u00e7a.\u00a0:D"}, {"5a96": "Viu como \u00e9 f\u00e1cil vender mais sem investir quase nada."}, {"789b": "Gostou? Clica no \u2764 ai\u00a0:D"}], "content": "Venda mais sem investir quase\u00a0nada Elevando o faturamento da sua empresa de uma maneira bem simples e funcional. Show me the\u00a0money! Ontem em conversa com um grande amigo, consultor na \u00e1rea de laborat\u00f3rios de an\u00e1lises, est\u00e1vamos divagando sobre como as empresas podem elevar seus faturamentos sem muitos esfor\u00e7os. Chegamos nesse assunto devido ao fator crise, todo mundo esta reclamando dela, empresas e pessoas est\u00e3o completamente endividadas, por\u00e9m de uma maneira bem simples \u00e9 poss\u00edvel elevar o ticket m\u00e9dio das vendas do seu neg\u00f3cio. Ticket m\u00e9dio: A quantia que cada cliente em m\u00e9dia compra com\u00a0voc\u00ea. N\u00e3o importa o neg\u00f3cio, \u00e9 poss\u00edvel vender mais para o mesmo cliente. Acredite em mim, at\u00e9 em funer\u00e1rias \u00e9 poss\u00edvel adicionar mais alguns itens na venda. Na padaria isso \u00e9 poss\u00edvel, na farm\u00e1cia, na sua consultoria, no seu e-commerce, pizzaria, loja de carros, f\u00e1brica de sof\u00e1s. N\u00e3o importa o que voc\u00ea venda, da para vender mais. At\u00e9 prostitutas podem adicionar itens na venda, enfim, acho que voc\u00ea j\u00e1 compreendeu o que estou dizendo.\u00a0:D Mesmo sendo f\u00e1cil e simples, quase nunca ele \u00e9 praticado, s\u00e3o poucos os lugares que os colaboradores est\u00e3o preparados para isso. Muitas vezes o dono da empresa at\u00e9 tem vontade, mas com uma estrat\u00e9gia errada, ai os colaboradores n\u00e3o se sentem vendedores do neg\u00f3cio. Se voc\u00ea tem 100 colaboradores, sua empresa precisa ter 100 vendedores. Como os e-commerce elevam o ticket m\u00e9dio das suas compras? Logo, se os e-commerces que n\u00e3o tem um contato H2H (Human to Human) com seus clientes conseguem elevar seu ticket m\u00e9dio. O que falta para sua \"lojinha f\u00edsica\" vendar mais? Agora pela manh\u00e3 fui at\u00e9 uma padaria pr\u00f3xima de casa, como fa\u00e7o todas as manh\u00e3s, por\u00e9m hoje resolvi prestar aten\u00e7\u00e3o em como eu seria atendido, logo vamos aprender com os erros dos outros. \u00c9 s\u00e9rio isso? Voc\u00ea n\u00e3o vai me oferecer nada? Eu comprei p\u00e3es, voc\u00ea poderia sugerir que eles ficam \u00f3timos com queijo, presunto ou qualquer outra coisa. Ela poderia ter me oferecido um p\u00e3o de queijo quentinho, um peda\u00e7o de bolo ou algo assim. 2. Pagando a conta A caixa simplesmente fez o trabalho dela, me cobrou. \u00c9 s\u00e9rio isso? Voc\u00ea n\u00e3o vai me oferecer um chicletes que esta em promo\u00e7\u00e3o, um chocolate que com mais 1 real eu poderia levar? Sabe o motivo disso acontecer? Pelo simples fato delas n\u00e3o serem vendedoras e S\u00d3 atendentes e caixa. Mas a responsabilidade disso n\u00e3o \u00e9 s\u00f3 delas, mas sim de quem contratou, treinou e mant\u00e9m elas fazendo apenas o seu trabalho. Com um pequeno treinamento de duas ou tr\u00eas horas \u00e9 poss\u00edvel resolver isso, explicando esses pontos para o seu time, como eles podem perceber demanda e realizar novas vendas, como eles ser\u00e3o remunerados se as metas coletivas de vendas forem atingidas. Eu poderia cobrar da sua empresa s\u00f3 para ir at\u00e9 ai, criar isso e explicar a mesma coisa para voc\u00eas, mas resolvi fazer de gra\u00e7a.\u00a0:D Viu como \u00e9 f\u00e1cil vender mais sem investir quase nada. Gostou? Clica no \u2764 ai\u00a0:D ", "child": "980_1\t980_2"}