{"parent": "", "title": "Trump Tweets: \u201cUncle Sam\u2026Sad! We Must Replace With New Donnie Warbucks\u00a0Logo\u201d", "author": "Allan Ishac", "sentences": [{"289e": "Truth In\u00a0Satire"}, {"3bf5": "Trump Tweets: \u201cUncle Sam\u2026Sad! We Must Replace With New Donnie Warbucks\u00a0Logo\u201d"}, {"edd2": "President apparently unaware that Tax March logo depicting him stealing taxpayer money is neither flattering nor favorable"}, {"1b75": "Massive tax day protests intended to pressure President Trump into releasing his tax returns were organized in 100 cities across the country on Saturday."}, {"c662": "A centerpiece of the marches was an altered image of the top-hatted \u201cMr. Monopoly\u201d character, depicting Donald Trump absconding with taxpayers\u2019 money."}, {"faa0": "But, apparently, the amusing image that was designed to taunt the president, had no such effect\u200a\u2014\u200abecause he mistakenly thought it was a compliment, developed as a tribute to his pro-business, ultra-capitalist policies."}, {"f71f": "President Trump hopes to replace this image of Uncle Sam, used as national symbol since the 1830\u2019s, with an image of himself stealing a bag of\u00a0money."}, {"fd71": "He was so confused, in fact, that he immediately signed an executive order instructing all government agencies to dump the iconic \u201cUncle Sam\u201d image and replace it with, what he called \u201cthe new, cool Donnie Warbucks logo.\u201d"}, {"1dc8": "In a Mar-A-Lago press briefing late Saturday afternoon, a beaming President Trump held up an image of the Mr. Monopoly character with his own face photoshopped in place, and proudly called it, \u201cthe new mascot for the United States.\u201d Of course, amused critics immediately started referring to it as \u201cthe new ass-cot of the United States.\u201d"}, {"82dc": "The famous Uncle Sam image that the president is hoping to force out of existence has been used extensively since the 1830\u2019s and is beloved by many Americans."}, {"6313": "This poster was used to rally Tax March protesters across the nation on Saturday."}, {"2671": "\u201cIt is highly unusual for a president to try to dispense with a venerated national symbol and iconic American image\u200a\u2014\u200aespecially one that was used to generate support for war bonds in both World Wars I and II,\u201d said Doris Kearns Goodwin, a well-known American historian and author. \u201cI can\u2019t imagine that the president\u2019s executive order is going to get a positive reception. And, frankly, I am not sure President Trump would be pushing for this change if he fully understood the implications of the image he seems to be championing.\u201d"}, {"2949": "U.S. Historian Doris Kearns Goodwin fears that Donald Trump does not realize he is being mocked, ridiculed, scorned, sneered at, and derided. (Credit: doriskearnsgoodwin.com)"}, {"ae9a": "Asked if the president was aware that the \u201cDonnie Warbucks\u201d illustration that he is pressuring government institutions to embrace is a sarcastic piece of art developed to ridicule him personally and deride him politically, White House Press Secretary Sean Spicer said, \u201cThe president knows exactly when he\u2019s being mocked and when he\u2019s being lauded, and in this case, it is clearly a patriotic salute to his business acumen and billionaire status. He loves it. Case closed!\u201d"}, {"c7d6": "Organizers at TaxMarch.org say they are eager to help the president parody himself and will be heavily promoting the \u201cDonnie Warbucks\u201d image across the country and around the world."}, {"780f": "****"}, {"1aa5": "If you liked this post, please click the heart, comment, and/or follow me. I read every comment."}, {"25a5": "And click here for my most popular post, or at least one I liked writing a whole lot."}, {"718f": "Thank you."}, {"2fde": "\u2013AI"}], "content": "Truth In\u00a0Satire Trump Tweets: \u201cUncle Sam\u2026Sad! We Must Replace With New Donnie Warbucks\u00a0Logo\u201d President apparently unaware that Tax March logo depicting him stealing taxpayer money is neither flattering nor favorable Massive tax day protests intended to pressure President Trump into releasing his tax returns were organized in 100 cities across the country on Saturday. A centerpiece of the marches was an altered image of the top-hatted \u201cMr. Monopoly\u201d character, depicting Donald Trump absconding with taxpayers\u2019 money. But, apparently, the amusing image that was designed to taunt the president, had no such effect\u200a\u2014\u200abecause he mistakenly thought it was a compliment, developed as a tribute to his pro-business, ultra-capitalist policies. President Trump hopes to replace this image of Uncle Sam, used as national symbol since the 1830\u2019s, with an image of himself stealing a bag of\u00a0money. He was so confused, in fact, that he immediately signed an executive order instructing all government agencies to dump the iconic \u201cUncle Sam\u201d image and replace it with, what he called \u201cthe new, cool Donnie Warbucks logo.\u201d In a Mar-A-Lago press briefing late Saturday afternoon, a beaming President Trump held up an image of the Mr. Monopoly character with his own face photoshopped in place, and proudly called it, \u201cthe new mascot for the United States.\u201d Of course, amused critics immediately started referring to it as \u201cthe new ass-cot of the United States.\u201d The famous Uncle Sam image that the president is hoping to force out of existence has been used extensively since the 1830\u2019s and is beloved by many Americans. This poster was used to rally Tax March protesters across the nation on Saturday. \u201cIt is highly unusual for a president to try to dispense with a venerated national symbol and iconic American image\u200a\u2014\u200aespecially one that was used to generate support for war bonds in both World Wars I and II,\u201d said Doris Kearns Goodwin, a well-known American historian and author. \u201cI can\u2019t imagine that the president\u2019s executive order is going to get a positive reception. And, frankly, I am not sure President Trump would be pushing for this change if he fully understood the implications of the image he seems to be championing.\u201d U.S. Historian Doris Kearns Goodwin fears that Donald Trump does not realize he is being mocked, ridiculed, scorned, sneered at, and derided. (Credit: doriskearnsgoodwin.com) Asked if the president was aware that the \u201cDonnie Warbucks\u201d illustration that he is pressuring government institutions to embrace is a sarcastic piece of art developed to ridicule him personally and deride him politically, White House Press Secretary Sean Spicer said, \u201cThe president knows exactly when he\u2019s being mocked and when he\u2019s being lauded, and in this case, it is clearly a patriotic salute to his business acumen and billionaire status. He loves it. Case closed!\u201d Organizers at TaxMarch.org say they are eager to help the president parody himself and will be heavily promoting the \u201cDonnie Warbucks\u201d image across the country and around the world. **** If you liked this post, please click the heart, comment, and/or follow me. I read every comment. And click here for my most popular post, or at least one I liked writing a whole lot. Thank you. \u2013AI ", "name": "310", "child": "310_1\t310_2\t310_3\t310_4\t310_5\t310_6\t310_7\t310_8\t310_9", "timestamp": "Apr 16"}