{"parent": "", "title": "Trump lines up staff to avoid international action on climate\u00a0change", "author": "Samantha Page", "sentences": [{"e04d": "Trump lines up staff to avoid international action on climate\u00a0change"}, {"f8e6": "Welcome, Steven\u00a0Groves."}, {"0c29": "Steven Groves testifying for Congress. CREDIT: Via\u00a0YouTube"}, {"8496": "The upcoming Trump administration is apparently making climate a pillar of its State Department plans."}, {"f223": "That is, President-elect Donald Trump continues to send strong signals that leaving the Paris climate agreement\u200a\u2014\u200athe international community\u2019s agreement to strive to keep climate change to less than 2\u00baC (3.6\u00baF) and avoid the most catastrophic disruption to our climate\u200a\u2014\u200ais a top priority."}, {"ae5d": "On Monday, the Heritage Foundation\u2019s Steven Groves was added to the State Department transition team. Groves has repeatedly called for leaving the Paris agreement, most recently publishing an article for the Daily Signal, Heritage\u2019s blog, titled, \u201cThe Pathway Out of Paris.\u201d"}, {"ab2e": "Under Sec. John Kerry, the State Department led the creation of the historic Paris climate agreement, which went into effect earlier this month. The Paris agreement is wildly popular with U.S. voters, 71 percent of whom support U.S. involvement in the 200-nation agreement."}, {"33e1": "As Joe Romm has written for ThinkProgress\u200a\u2014\u200aand as the New York Times\u2019 Thomas Friedman has concurred\u200a\u2014\u200aexiting Paris is a really bad idea. It\u2019s expected that other countries would likely punish the United States, almost certainly by treating it as an international pariah, but also potentially through financial measures, such as a carbon tax."}, {"2b8f": "Not only would leaving the agreement mean backing out of an incredibly popular and urgent agreement, for decades, the United States was the world\u2019s largest historic greenhouse gas emitter. In other words: The United States is on the hook for much of the world\u2019s excess carbon dioxide\u200a\u2014\u200aand if Trump backs out of this deal, it wouldn\u2019t be hard for other countries to pin the blame for sea levels rise squarely on his custom-tailored lapels."}, {"500f": "Of course, Groves doesn\u2019t see it that way."}, {"c627": "Groves argues that \u201cthe cost of allowing third-world poverty to persist\u200a\u2014\u200aand the role that energy development can play in alleviating that poverty\u200a\u2014\u200ais far clearer, more threatening, and more easily solvable than the vague and unsubstantiated risks posed by carbon emissions.\u201d But he simultaneously argues against U.S. financial support to developing nations under the Paris agreement\u200a\u2014\u200aeven though much of that support would go toward developing renewable energy resources."}, {"9584": "The United Nations estimates that \u201cpoorer countries\u201d will have to invest hundreds of billions of dollars in climate mitigation by 2050."}, {"76e4": "It\u2019s not clear how much weight Groves will have during the State Department transition\u200a\u2014\u200ahis appointment to the team came several days after the first tranche of \u201clanding team\u201d members were appointed\u200a\u2014\u200abut it is certainly a sign that Trump intends to make good on his promises to leave the Paris agreement."}, {"1b47": "Other members of the team, so far, are Erin Walsh (retired from Goldman Sachs), Alexander Gray (previously with Trump for America, Inc.), Jackie Wolcott (U.S. Commission on International Religious Freedom), Ashley Bell (Republican National Committee), Charles Glazer (Fieldpoint Private), and Christopher Burnham (Cambridge Global Capital, LLC)."}], "content": "Trump lines up staff to avoid international action on climate\u00a0change Welcome, Steven\u00a0Groves. Steven Groves testifying for Congress. CREDIT: Via\u00a0YouTube The upcoming Trump administration is apparently making climate a pillar of its State Department plans. That is, President-elect Donald Trump continues to send strong signals that leaving the Paris climate agreement\u200a\u2014\u200athe international community\u2019s agreement to strive to keep climate change to less than 2\u00baC (3.6\u00baF) and avoid the most catastrophic disruption to our climate\u200a\u2014\u200ais a top priority. On Monday, the Heritage Foundation\u2019s Steven Groves was added to the State Department transition team. Groves has repeatedly called for leaving the Paris agreement, most recently publishing an article for the Daily Signal, Heritage\u2019s blog, titled, \u201cThe Pathway Out of Paris.\u201d Under Sec. John Kerry, the State Department led the creation of the historic Paris climate agreement, which went into effect earlier this month. The Paris agreement is wildly popular with U.S. voters, 71 percent of whom support U.S. involvement in the 200-nation agreement. As Joe Romm has written for ThinkProgress\u200a\u2014\u200aand as the New York Times\u2019 Thomas Friedman has concurred\u200a\u2014\u200aexiting Paris is a really bad idea. It\u2019s expected that other countries would likely punish the United States, almost certainly by treating it as an international pariah, but also potentially through financial measures, such as a carbon tax. Not only would leaving the agreement mean backing out of an incredibly popular and urgent agreement, for decades, the United States was the world\u2019s largest historic greenhouse gas emitter. In other words: The United States is on the hook for much of the world\u2019s excess carbon dioxide\u200a\u2014\u200aand if Trump backs out of this deal, it wouldn\u2019t be hard for other countries to pin the blame for sea levels rise squarely on his custom-tailored lapels. Of course, Groves doesn\u2019t see it that way. Groves argues that \u201cthe cost of allowing third-world poverty to persist\u200a\u2014\u200aand the role that energy development can play in alleviating that poverty\u200a\u2014\u200ais far clearer, more threatening, and more easily solvable than the vague and unsubstantiated risks posed by carbon emissions.\u201d But he simultaneously argues against U.S. financial support to developing nations under the Paris agreement\u200a\u2014\u200aeven though much of that support would go toward developing renewable energy resources. The United Nations estimates that \u201cpoorer countries\u201d will have to invest hundreds of billions of dollars in climate mitigation by 2050. It\u2019s not clear how much weight Groves will have during the State Department transition\u200a\u2014\u200ahis appointment to the team came several days after the first tranche of \u201clanding team\u201d members were appointed\u200a\u2014\u200abut it is certainly a sign that Trump intends to make good on his promises to leave the Paris agreement. Other members of the team, so far, are Erin Walsh (retired from Goldman Sachs), Alexander Gray (previously with Trump for America, Inc.), Jackie Wolcott (U.S. Commission on International Religious Freedom), Ashley Bell (Republican National Committee), Charles Glazer (Fieldpoint Private), and Christopher Burnham (Cambridge Global Capital, LLC). ", "name": "417", "child": "417_1\t417_2\t417_3\t417_4\t417_5\t417_6\t417_7\t417_8", "timestamp": "Nov 22, 2016"}