{"parent": "", "title": "China\u2019s top climate negotiator slams Trump\u2019s promise to pull U.S. out of Paris climate\u00a0deal", "author": "Alejandro D\u00e1vila Fragoso", "sentences": [{"2bb9": "China\u2019s top climate negotiator slams Trump\u2019s promise to pull U.S. out of Paris climate\u00a0deal"}, {"25fc": "\u201cA wise political leader should take policy stances that conform with global\u00a0trends.\u201d"}, {"6b2a": "Republican presidential candidate Donald Trump speaks during a campaign rally in Delaware, Ohio. CREDIT: AP/ Evan\u00a0Vucci"}, {"9ebe": "China\u2019s top climate negotiator criticized Donald Trump\u2019s promise to pull the United States out of the landmark Paris climate agreement, noting a \u201cwise\u201d political leader should enact policy that matches global trends."}, {"a5eb": "In what\u2019s been described as a rare commentary on foreign elections, Xie Zhenhua, China\u2019s special representative for climate change, told reporters U.S. progress will be jeopardized if it moves away from the historic climate agreement set to kick in Friday."}, {"11d3": "In May, Trump promised to cancel the Paris climate agreement during his first speech on energy policies, as he vowed to push for more drilling and fewer regulations. But China, now a leader in renewable energy that\u2019s aggressively cutting greenhouse gas pollution, seems at odds with Trump\u2019s take on the Paris agreement."}, {"99d8": "\u201cI believe a wise political leader should take policy stances that conform with global trends,\u201d Xie said according to Reuters after being asked how China might work with a Trump administration on climate change."}, {"feea": "China\u2019s top climate change negotiator, Xie Zhenhua. CREDIT: AP/Vincent Thian"}, {"e26b": "China traditionally avoids commenting on foreign elections, but this presidential election has drawn strong reactions from leaders around the world, and prompted some Chinese officials to express their animosity towards the Republican presidential candidate more than once."}, {"6e70": "That comes as China, the world\u2019s top greenhouse gass polluter, is increasingly concerned about pollution, external affairs, and its influence on the outside world. For his part, Trump has attacked China repeatedly throughout the course of his campaign."}, {"cf41": "Trump has famously said China created the concept of global warming to harm U.S. manufacturing. And while he\u2019s claimed to \u201clove China and the Chinese people,\u201d he\u2019s repeatedly accused China of taking U.S. jobs and cheating in trade deals and monetary policy."}, {"53bd": "Trump has called global warming an expensive hoax multiple times. Just last December he told a rally: \u201cObama\u2019s talking about all of this with the global warming and\u2026 a lot of it\u2019s a hoax. It\u2019s a hoax. I mean, it\u2019s a money-making industry, okay? It\u2019s a hoax, a lot of it.\u201d"}, {"ba06": "For months Trump has also said he opposes environmental regulations, arguing they are a burden to industry, and is adamantly opposed to the Environmental Protection Agency (EPA). In fact, he is likely to tap Myron Ebell, called \u201cone of America\u2019s most prominent climate change skeptics\u201d to lead his EPA transition."}, {"4c15": "The Republican nominee has also promised to do away with the Clean Power Plan\u200a\u2014\u200aa sweeping proposal that would cut carbon emissions from the power sector and is considered the main tool for the United States, which is the world\u2019s second largest greenhouse gas polluter, to meet the Paris agreement."}, {"b5a9": "The dismantling of Obama\u2019s climate legacy by a President Donald TrumpTrump has promised to roll back President Obama\u2019s landmark environmental regulations. Could he do it?thinkprogress.org"}, {"0ba3": "However, Trump may not be able to just pull the United States out of the Paris agreement, experts told ThinkProgress, noting it might take him more than four years to do that. Still, having a climate denier as president might weaken the country\u2019s position in global climate negotiations, as other nations are increasingly focused on taking action to address climate change."}, {"dc87": "\u201cIf they (United States) resist this trend, I don\u2019t think they\u2019ll win the support of their people, and their country\u2019s economic and social progress will also be affected,\u201d Xie said Tuesday."}, {"fa16": "The United States has vowed to cut between 26 to 28 percent of its 2005 emissions by 2025, Climate Central reported. Democratic presidential nominee Hillary Clinton has said she plans to continue Barack Obama\u2019s climate plans."}, {"6970": "Shortly after the U.S. election, the next round of U.N. climate talks will take place place in Marrakech, Morocco\u200a\u2014\u200aa critical time for countries to figure out how to meet their commitments under the Paris agreement, which aims to limit warming to 1.5\u00b0C above pre-industrial levels. Scientists say that limit might help the planet avoid the most catastrophic effects of climate change, which include extreme weather events and overwhelming sea-level rise."}], "content": "China\u2019s top climate negotiator slams Trump\u2019s promise to pull U.S. out of Paris climate\u00a0deal \u201cA wise political leader should take policy stances that conform with global\u00a0trends.\u201d Republican presidential candidate Donald Trump speaks during a campaign rally in Delaware, Ohio. CREDIT: AP/ Evan\u00a0Vucci China\u2019s top climate negotiator criticized Donald Trump\u2019s promise to pull the United States out of the landmark Paris climate agreement, noting a \u201cwise\u201d political leader should enact policy that matches global trends. In what\u2019s been described as a rare commentary on foreign elections, Xie Zhenhua, China\u2019s special representative for climate change, told reporters U.S. progress will be jeopardized if it moves away from the historic climate agreement set to kick in Friday. In May, Trump promised to cancel the Paris climate agreement during his first speech on energy policies, as he vowed to push for more drilling and fewer regulations. But China, now a leader in renewable energy that\u2019s aggressively cutting greenhouse gas pollution, seems at odds with Trump\u2019s take on the Paris agreement. \u201cI believe a wise political leader should take policy stances that conform with global trends,\u201d Xie said according to Reuters after being asked how China might work with a Trump administration on climate change. China\u2019s top climate change negotiator, Xie Zhenhua. CREDIT: AP/Vincent Thian China traditionally avoids commenting on foreign elections, but this presidential election has drawn strong reactions from leaders around the world, and prompted some Chinese officials to express their animosity towards the Republican presidential candidate more than once. That comes as China, the world\u2019s top greenhouse gass polluter, is increasingly concerned about pollution, external affairs, and its influence on the outside world. For his part, Trump has attacked China repeatedly throughout the course of his campaign. Trump has famously said China created the concept of global warming to harm U.S. manufacturing. And while he\u2019s claimed to \u201clove China and the Chinese people,\u201d he\u2019s repeatedly accused China of taking U.S. jobs and cheating in trade deals and monetary policy. Trump has called global warming an expensive hoax multiple times. Just last December he told a rally: \u201cObama\u2019s talking about all of this with the global warming and\u2026 a lot of it\u2019s a hoax. It\u2019s a hoax. I mean, it\u2019s a money-making industry, okay? It\u2019s a hoax, a lot of it.\u201d For months Trump has also said he opposes environmental regulations, arguing they are a burden to industry, and is adamantly opposed to the Environmental Protection Agency (EPA). In fact, he is likely to tap Myron Ebell, called \u201cone of America\u2019s most prominent climate change skeptics\u201d to lead his EPA transition. The Republican nominee has also promised to do away with the Clean Power Plan\u200a\u2014\u200aa sweeping proposal that would cut carbon emissions from the power sector and is considered the main tool for the United States, which is the world\u2019s second largest greenhouse gas polluter, to meet the Paris agreement. The dismantling of Obama\u2019s climate legacy by a President Donald TrumpTrump has promised to roll back President Obama\u2019s landmark environmental regulations. Could he do it?thinkprogress.org However, Trump may not be able to just pull the United States out of the Paris agreement, experts told ThinkProgress, noting it might take him more than four years to do that. Still, having a climate denier as president might weaken the country\u2019s position in global climate negotiations, as other nations are increasingly focused on taking action to address climate change. \u201cIf they (United States) resist this trend, I don\u2019t think they\u2019ll win the support of their people, and their country\u2019s economic and social progress will also be affected,\u201d Xie said Tuesday. The United States has vowed to cut between 26 to 28 percent of its 2005 emissions by 2025, Climate Central reported. Democratic presidential nominee Hillary Clinton has said she plans to continue Barack Obama\u2019s climate plans. Shortly after the U.S. election, the next round of U.N. climate talks will take place place in Marrakech, Morocco\u200a\u2014\u200aa critical time for countries to figure out how to meet their commitments under the Paris agreement, which aims to limit warming to 1.5\u00b0C above pre-industrial levels. Scientists say that limit might help the planet avoid the most catastrophic effects of climate change, which include extreme weather events and overwhelming sea-level rise. ", "name": "420", "child": "420_1\t420_2\t420_3\t420_4", "timestamp": "Nov 1, 2016"}