{"parent": "", "title": "Pourquoi j\u2019ai arr\u00eat\u00e9 d\u2019utiliser AMP", "author": "Nicolas Furno", "sentences": [{"3a86": "Pourquoi j\u2019ai arr\u00eat\u00e9 d\u2019utiliser AMP"}, {"bdd0": "Tout le monde ne parle plus que de \u00e7a et il faut reconna\u00eetre que Google a r\u00e9ussi son coup. Les pages web se convertissent en pages AMP un petit peu partout, tous les sites h\u00e9berg\u00e9s par WordPress.com y ont droit automatiquement, tous les CMS s\u2019y mettent et vous avez s\u00fbrement crois\u00e9 dans les r\u00e9sultats de recherche l\u2019ic\u00f4ne en forme d\u2019\u00e9clair qui signale leur pr\u00e9sence."}, {"18e4": "Si vous n\u2019avez jamais cliqu\u00e9 sur ces liens, vous ne savez peut-\u00eatre pas ce qui se cache derri\u00e8re ces trois lettres. Ces articles se chargent instantan\u00e9ment, ou presque, \u00e0 la fois parce qu\u2019ils sont l\u00e9gers et parce qu\u2019ils sont h\u00e9berg\u00e9s par Google."}, {"d9cf": "\u00c0 l\u2019origine, l\u2019id\u00e9e est plut\u00f4t bonne\u00a0: inciter les cr\u00e9ateurs du site \u00e0 all\u00e9ger leurs pages web pour les visiteurs mobiles. Le projet d\u00e9finit une s\u00e9rie de r\u00e8gles et restreint le d\u00e9veloppement web \u00e0 quelques \u00e9l\u00e9ments uniquement. Impossible d\u2019avoir du contenu interactif et du JavaScript en pagaille, on revient \u00e0 l\u2019essence du web\u00a0: du texte, des images et un peu de style, pour faire simple."}, {"1c56": "Le projet AMP est open-source, mais Google est son instigateur et son principal moteur. L\u2019objectif \u00e9tant d\u2019offrir un web mobile plus rapide, le g\u00e9ant de la recherche a ajout\u00e9 une petite fonction qui fait toute la diff\u00e9rence\u00a0: les pages AMP sont stock\u00e9es sur son serveur, pour \u00eatre livr\u00e9es plus rapidement. Google agit comme un cache pour la version optimis\u00e9e, ce qui signifie que le visiteur n\u2019utilise plus votre serveur."}, {"a993": "C\u2019est le m\u00eame principe que les Instant Articles de Facebook, ou bien les articles diffus\u00e9s par Apple News. Chaque service a son syst\u00e8me complet et ferm\u00e9, mais l\u00e0 o\u00f9 le r\u00e9seau social et le cr\u00e9ateur de l\u2019iPhone r\u00e9servent leurs syst\u00e8mes de lecture \u00e0 une app tierce, AMP est disponible directement dans le plus gros moteur de recherche au monde et dans le m\u00eame navigateur web de base. Et cela change totalement la visibilit\u00e9 de ce service et son r\u00f4le pour les cr\u00e9ateurs de contenus."}, {"5120": "Je l\u2019ai vu \u00e0 l\u2019\u00e9chelle de mon blog, l\u2019\u00e9crasante majorit\u00e9 des requ\u00eates mobiles \u00e9taient d\u00e9sormais vers des pages AMP et non vers mon serveur. Google a commenc\u00e9 \u00e0 pousser ces pages optimis\u00e9es et en cache sur son serveur et il est difficile d\u00e9sormais de passer \u00e0 c\u00f4t\u00e9. Ce qui n\u2019a pas plu \u00e0 tout le monde\u00a0: il ne faut pas longtemps pour trouver des m\u00e9contents, des utilisateurs qui essaient de ne plus voir ces liens et des cr\u00e9ateurs de contenus qui ne veulent plus du cache de Google."}, {"1bcc": "Le sujet devient vite technique, mais on peut r\u00e9sumer le c\u0153ur du probl\u00e8me \u00e0 l\u2019URL, l\u2019adresse de la page web qui est affich\u00e9e dans le navigateur. Une fois que la page est stock\u00e9e sur les serveurs de Google, elle change d\u2019adresse et ressemble \u00e0 \u00e7a\u00a0:"}, {"782f": "https://www.google.fr/amp/s/voiretmanger.fr/alice-pays-merveilles-geronimi-jackson-luske/amp/"}, {"feed": "L\u2019URL originale est toujours l\u00e0, mais elle n\u2019est plus directement accessible. Et la plupart des internautes ne vont pas faire attention et r\u00e9cup\u00e9rer cette adresse pour la partager, au lieu de prendre l\u2019originale. Le probl\u00e8me \u00e9tant que c\u2019est le cache de Google qui est alors r\u00e9f\u00e9renc\u00e9, pas le serveur qui h\u00e9berge le site. En cas de changement dans l\u2019article, il faut compter sur le bon vouloir de l\u2019entreprise pour que le contenu associ\u00e9 \u00e0 cette URL soit aussi mis \u00e0 jour."}, {"190d": "Google a fini par r\u00e9agir face aux critiques en ajoutant un bouton en haut qui affiche alors l\u2019adresse originale. Disons-le, ce n\u2019est pas une solution efficace, personne ne va savoir comment trouver l\u2019URL et comment la partager. D\u2019autres solutions sont pr\u00e9vues pour faciliter le partage du lien original, mais ce n\u2019est pas encore au point. En attendant, tout le monde se trompe de lien, m\u00eame les PDG des plus grandes entreprises."}, {"fa46": "Google a ajout\u00e9 un moyen d\u2019afficher le lien original d\u2019une page AMP, mais c\u2019est plut\u00f4t bien masqu\u00e9. M\u00eame cette capture d\u2019\u00e9cran ne suffit pas \u00e0 comprendre le principe\u00a0: il faut en fait cliquer sur l\u2019ic\u00f4ne en forme de pilule, en haut \u00e0\u00a0droite."}, {"1b57": "Impossible de quitter AMP\u00a0?"}, {"551c": "Mon blog \u00e9tant un loisir personnel, je m\u2019en fiche assez si mes lecteurs n\u2019atteignent pas mon serveur et s\u2019ils lisent mes articles sur ceux de Google. \u00c0 dire vrai, c\u2019est m\u00eame probablement une meilleure chose, les serveurs de Google \u00e9tant bien plus rapides que le mien. Et puis l\u2019entreprise met en avant les pages AMP dans ses r\u00e9sultats de recherche, une carotte importante pour les sites, mais qui ne le touche pas, puisque je ne gagne rien gr\u00e2ce \u00e0 la publicit\u00e9."}, {"6de9": "Je me suis lass\u00e9 d\u2019AMP et de son style assez \u00e9loign\u00e9 de celui de mon blog. Cela, je pouvais le changer, mais Google impose aussi ces barres qui occupent inutilement l\u2019\u00e9cran et nuisent \u00e0 la qualit\u00e9 de lecture. La pr\u00e9sentation de chaque article est tr\u00e8s diff\u00e9rente, les m\u00e9tadonn\u00e9es affich\u00e9es \u00e0 la fin sont beaucoup moins nombreuses et importantes. Certes, rien ne m\u2019emp\u00eachait d\u2019ajouter moi-m\u00eame ces \u00e9l\u00e9ments aux pages AMP, mais j\u2019ai fini par r\u00e9aliser que c\u2019\u00e9tait beaucoup de travail alors que j\u2019avais d\u00e9j\u00e0 un site optimis\u00e9 pour le mobile et bien assez rapide, au moins depuis l\u2019Europe."}, {"5497": "Fort de ce constat, j\u2019ai voulu couper totalement AMP pour revenir \u00e0 de simples liens vers mes articles. C\u2019est alors que je me suis aper\u00e7u que Google n\u2019avait pas pr\u00e9vu ce cas de figure. Il n\u2019y a aucun moyen de dire au g\u00e9ant de la recherche que les liens vers une publication doivent s\u2019afficher directement sur le site, et non plus via ses serveurs. Cela n\u2019a pas \u00e9t\u00e9 pr\u00e9vu, et ce n\u2019est pas un oubli, non, c\u2019est une mani\u00e8re tr\u00e8s pernicieuse pour Google d\u2019enfermer les cr\u00e9ateurs de site dans son syst\u00e8me. Pour preuve, les r\u00e9ponses officielles \u00e9voquent toujours de futures am\u00e9liorations \u00e0 AMP, au lieu de proposer une solution."}, {"8cd1": "Sur mon serveur, il m\u2019a fallu 30 secondes pour couper le module AMP et vider mon cache, supprimant de fait toutes les versions optimis\u00e9es. Il m\u2019a fallu une minute ou deux pour r\u00e9aliser que je devais ajouter une redirection des liens AMP vers les liens orignaux, et encore quelques minutes pour la mettre en place. Mais disons que j\u2019ai retir\u00e9 AMP tr\u00e8s rapidement\u2026 pour m\u2019apercevoir que Google affichait toujours les versions optimis\u00e9es. V\u00e9rifications faites, il n\u2019est absolument pas possible de g\u00e9rer le cache AMP de Google."}, {"2a18": "Concr\u00e8tement, vous ne pouvez pas ajouter de page au cache, vous ne pouvez pas demander une mise \u00e0 jour du contenu et surtout, vous ne pouvez pas demander de suppression d\u2019un contenu. Pour \u00eatre exact, il y a bien une solution officielle, mais elle est fastidieuse (il faut traiter chaque URL manuellement) et d\u2019apr\u00e8s mon exp\u00e9rience rapide, elle ne fonctionne m\u00eame pas. J\u2019ai demand\u00e9 \u00e0 supprimer des liens AMP, mais une semaine apr\u00e8s, ils \u00e9taient toujours index\u00e9s par Google."}, {"32c3": "Pire, Google pr\u00e9f\u00e8re afficher une erreur comme celle-ci, plut\u00f4t que d\u2019afficher le site original, o\u00f9 le contenu est disponible. C\u2019est un chantage assez honteux pour obliger les propri\u00e9taires de sites \u00e0 faire marche arri\u00e8re et \u00e0 r\u00e9activer AMP."}, {"3065": "Google pr\u00e9f\u00e8re afficher une erreur, plut\u00f4t que de renvoyer vers l\u2019article original. C\u2019est du chantage, pour forcer les cr\u00e9ateurs de contenu \u00e0 r\u00e9activer AMP par peur de perdre du\u00a0trafic."}, {"5f4d": "Le probl\u00e8me, c\u2019est que Google ne laisse pas le choix. \u00c0 partir du moment o\u00f9 on utilise AMP, on accepte que son contenu soit mis en cache sur les serveurs de l\u2019entreprise. De ce c\u00f4t\u00e9, c\u2019est automatique, par contre Google ne s\u2019engage pas \u00e0 vider son cache \u00e0 votre demande, ce qui est tout de m\u00eame g\u00eanant."}, {"276e": "\u00c0 ce stade, je n\u2019avais qu\u2019une envie\u00a0: fuir. N\u2019ayant pas peur de perdre des visites, j\u2019ai choisi la voie la plus radicale. Je n\u2019ai pas r\u00e9activ\u00e9 AMP, j\u2019ai laiss\u00e9 la redirection 301 de tous les liens AMP vers les articles originaux et j\u2019ai patient\u00e9. Il en faut, de la patience\u00a0: j\u2019ai tout coup\u00e9 le 18 mars, Google indexait encore environ 270 liens AMP trois semaines plus tard. Soit, en gros, un peu plus du quart de ce qui \u00e9tait m\u00e9moris\u00e9 par le moteur de recherche auparavant."}, {"7b5b": "La bonne nouvelle, c\u2019est que Google finit par suivre les redirections et par retirer les pages AMP de son index pour mon site. La mauvaise nouvelle, c\u2019est qu\u2019il faudra sans doute autour d\u2019un mois pour les 1000 articles de mon blog. Qu\u2019en sera-t-il pour les plus gros sites\u00a0?"}, {"33ee": "Je n\u2019en reviens toujours pas que Google s\u2019en sorte aussi facilement avec ce blocage des contenus AMP. Le moteur de recherche abuse clairement de sa position de force et c\u2019est \u00e0 mes yeux un argument fort pour ne pas utiliser son syst\u00e8me et se tenir compl\u00e8tement \u00e0 l\u2019\u00e9cart du projet. Pour ma part, c\u2019est d\u00e9cid\u00e9, je ne touche plus \u00e0 AMP\u00a0!"}, {"d388": "Quid des Instant Articles\u00a0?"}, {"b332": "Apr\u00e8s cette mauvaise exp\u00e9rience, je me suis pos\u00e9 la question\u00a0: est-ce que je ne devrais pas couper aussi les Instant Articles de Facebook\u00a0? Apr\u00e8s tout, le style est aussi diff\u00e9rent de mon blog, et je ne peux pas afficher du tout certaines informations propos\u00e9es sur le site."}, {"032d": "Pourquoi mes articles de blog sont sur Instant ArticlesJe l\u2019\u00e9crivais d\u00e9j\u00e0 lors de leur premi\u00e8re pr\u00e9sentation, il y a pr\u00e8s d\u2019un an\u00a0: les Instant Articles de Facebook m\u2019int\u2026medium.com"}, {"9e8f": "N\u00e9anmoins, le r\u00e9seau social a eu une tr\u00e8s bonne id\u00e9e\u00a0: un bouton global qui permet de couper totalement les Instant Articles \u00e0 n\u2019importe quel moment. C\u2019est rassurant je trouve, et m\u00eame si j\u2019h\u00e9site \u00e0 revenir \u00e0 mon seul site aussi sur Facebook, cette option m\u2019incite \u00e0 prolonger l\u2019exp\u00e9rience. Le fait que ce soit uniquement r\u00e9serv\u00e9 aux apps iOS et Android me rassure aussi, je trouve que c\u2019est moins g\u00eanant que dans un navigateur web. Et Facebook transmet la bonne adresse en cas de partage, un excellent point \u00e9galement."}, {"a386": "Mon objectif au fond reste le m\u00eame\u00a0: toujours garder la main sur le contenu que je publie. AMP a franchi la ligne jaune en m\u2019emp\u00eachant de repasser rapidement sur mon blog quand je l\u2019ai souhait\u00e9 et je ne veux plus en entendre parler. Pour le moment, Instant Articles reste du bon c\u00f4t\u00e9, mais je dois reconna\u00eetre que je suis moins enthousiaste qu\u2019\u00e0 une \u00e9poque vis \u00e0 vis de ces plateformes de lecture."}, {"2012": "M\u00eame si le confort apport\u00e9 par l\u2019instantan\u00e9it\u00e9 est un \u00e9l\u00e9ment important, garder le contr\u00f4le complet sur l\u2019exp\u00e9rience de lecture devient de plus en plus essentiel \u00e0 mes yeux. Sur mon blog, h\u00e9berg\u00e9 sur mon serveur, je fais ce que je veux. Sur ces services tiers, je c\u00e8de une grandepartie de mon contr\u00f4le et je commence vraiment \u00e0 me demander si ce n\u2019est pas un mauvais calcul\u2026"}, {"dc5b": "Que pensez-vous des articles AMP, en tant que lecteur ou \u00e9diteur\u00a0? Croyez-vous que j\u2019ai fait le bon ou le mauvais choix\u00a0? N\u2019h\u00e9sitez pas \u00e0 t\u00e9moigner en commentaires ou sur Twitter\u00a0!"}], "content": "Pourquoi j\u2019ai arr\u00eat\u00e9 d\u2019utiliser AMP Tout le monde ne parle plus que de \u00e7a et il faut reconna\u00eetre que Google a r\u00e9ussi son coup. Les pages web se convertissent en pages AMP un petit peu partout, tous les sites h\u00e9berg\u00e9s par WordPress.com y ont droit automatiquement, tous les CMS s\u2019y mettent et vous avez s\u00fbrement crois\u00e9 dans les r\u00e9sultats de recherche l\u2019ic\u00f4ne en forme d\u2019\u00e9clair qui signale leur pr\u00e9sence. Si vous n\u2019avez jamais cliqu\u00e9 sur ces liens, vous ne savez peut-\u00eatre pas ce qui se cache derri\u00e8re ces trois lettres. Ces articles se chargent instantan\u00e9ment, ou presque, \u00e0 la fois parce qu\u2019ils sont l\u00e9gers et parce qu\u2019ils sont h\u00e9berg\u00e9s par Google. \u00c0 l\u2019origine, l\u2019id\u00e9e est plut\u00f4t bonne\u00a0: inciter les cr\u00e9ateurs du site \u00e0 all\u00e9ger leurs pages web pour les visiteurs mobiles. Le projet d\u00e9finit une s\u00e9rie de r\u00e8gles et restreint le d\u00e9veloppement web \u00e0 quelques \u00e9l\u00e9ments uniquement. Impossible d\u2019avoir du contenu interactif et du JavaScript en pagaille, on revient \u00e0 l\u2019essence du web\u00a0: du texte, des images et un peu de style, pour faire simple. Le projet AMP est open-source, mais Google est son instigateur et son principal moteur. L\u2019objectif \u00e9tant d\u2019offrir un web mobile plus rapide, le g\u00e9ant de la recherche a ajout\u00e9 une petite fonction qui fait toute la diff\u00e9rence\u00a0: les pages AMP sont stock\u00e9es sur son serveur, pour \u00eatre livr\u00e9es plus rapidement. Google agit comme un cache pour la version optimis\u00e9e, ce qui signifie que le visiteur n\u2019utilise plus votre serveur. C\u2019est le m\u00eame principe que les Instant Articles de Facebook, ou bien les articles diffus\u00e9s par Apple News. Chaque service a son syst\u00e8me complet et ferm\u00e9, mais l\u00e0 o\u00f9 le r\u00e9seau social et le cr\u00e9ateur de l\u2019iPhone r\u00e9servent leurs syst\u00e8mes de lecture \u00e0 une app tierce, AMP est disponible directement dans le plus gros moteur de recherche au monde et dans le m\u00eame navigateur web de base. Et cela change totalement la visibilit\u00e9 de ce service et son r\u00f4le pour les cr\u00e9ateurs de contenus. Je l\u2019ai vu \u00e0 l\u2019\u00e9chelle de mon blog, l\u2019\u00e9crasante majorit\u00e9 des requ\u00eates mobiles \u00e9taient d\u00e9sormais vers des pages AMP et non vers mon serveur. Google a commenc\u00e9 \u00e0 pousser ces pages optimis\u00e9es et en cache sur son serveur et il est difficile d\u00e9sormais de passer \u00e0 c\u00f4t\u00e9. Ce qui n\u2019a pas plu \u00e0 tout le monde\u00a0: il ne faut pas longtemps pour trouver des m\u00e9contents, des utilisateurs qui essaient de ne plus voir ces liens et des cr\u00e9ateurs de contenus qui ne veulent plus du cache de Google. Le sujet devient vite technique, mais on peut r\u00e9sumer le c\u0153ur du probl\u00e8me \u00e0 l\u2019URL, l\u2019adresse de la page web qui est affich\u00e9e dans le navigateur. Une fois que la page est stock\u00e9e sur les serveurs de Google, elle change d\u2019adresse et ressemble \u00e0 \u00e7a\u00a0: https://www.google.fr/amp/s/voiretmanger.fr/alice-pays-merveilles-geronimi-jackson-luske/amp/ L\u2019URL originale est toujours l\u00e0, mais elle n\u2019est plus directement accessible. Et la plupart des internautes ne vont pas faire attention et r\u00e9cup\u00e9rer cette adresse pour la partager, au lieu de prendre l\u2019originale. Le probl\u00e8me \u00e9tant que c\u2019est le cache de Google qui est alors r\u00e9f\u00e9renc\u00e9, pas le serveur qui h\u00e9berge le site. En cas de changement dans l\u2019article, il faut compter sur le bon vouloir de l\u2019entreprise pour que le contenu associ\u00e9 \u00e0 cette URL soit aussi mis \u00e0 jour. Google a fini par r\u00e9agir face aux critiques en ajoutant un bouton en haut qui affiche alors l\u2019adresse originale. Disons-le, ce n\u2019est pas une solution efficace, personne ne va savoir comment trouver l\u2019URL et comment la partager. D\u2019autres solutions sont pr\u00e9vues pour faciliter le partage du lien original, mais ce n\u2019est pas encore au point. En attendant, tout le monde se trompe de lien, m\u00eame les PDG des plus grandes entreprises. Google a ajout\u00e9 un moyen d\u2019afficher le lien original d\u2019une page AMP, mais c\u2019est plut\u00f4t bien masqu\u00e9. M\u00eame cette capture d\u2019\u00e9cran ne suffit pas \u00e0 comprendre le principe\u00a0: il faut en fait cliquer sur l\u2019ic\u00f4ne en forme de pilule, en haut \u00e0\u00a0droite. Impossible de quitter AMP\u00a0? Mon blog \u00e9tant un loisir personnel, je m\u2019en fiche assez si mes lecteurs n\u2019atteignent pas mon serveur et s\u2019ils lisent mes articles sur ceux de Google. \u00c0 dire vrai, c\u2019est m\u00eame probablement une meilleure chose, les serveurs de Google \u00e9tant bien plus rapides que le mien. Et puis l\u2019entreprise met en avant les pages AMP dans ses r\u00e9sultats de recherche, une carotte importante pour les sites, mais qui ne le touche pas, puisque je ne gagne rien gr\u00e2ce \u00e0 la publicit\u00e9. Je me suis lass\u00e9 d\u2019AMP et de son style assez \u00e9loign\u00e9 de celui de mon blog. Cela, je pouvais le changer, mais Google impose aussi ces barres qui occupent inutilement l\u2019\u00e9cran et nuisent \u00e0 la qualit\u00e9 de lecture. La pr\u00e9sentation de chaque article est tr\u00e8s diff\u00e9rente, les m\u00e9tadonn\u00e9es affich\u00e9es \u00e0 la fin sont beaucoup moins nombreuses et importantes. Certes, rien ne m\u2019emp\u00eachait d\u2019ajouter moi-m\u00eame ces \u00e9l\u00e9ments aux pages AMP, mais j\u2019ai fini par r\u00e9aliser que c\u2019\u00e9tait beaucoup de travail alors que j\u2019avais d\u00e9j\u00e0 un site optimis\u00e9 pour le mobile et bien assez rapide, au moins depuis l\u2019Europe. Fort de ce constat, j\u2019ai voulu couper totalement AMP pour revenir \u00e0 de simples liens vers mes articles. C\u2019est alors que je me suis aper\u00e7u que Google n\u2019avait pas pr\u00e9vu ce cas de figure. Il n\u2019y a aucun moyen de dire au g\u00e9ant de la recherche que les liens vers une publication doivent s\u2019afficher directement sur le site, et non plus via ses serveurs. Cela n\u2019a pas \u00e9t\u00e9 pr\u00e9vu, et ce n\u2019est pas un oubli, non, c\u2019est une mani\u00e8re tr\u00e8s pernicieuse pour Google d\u2019enfermer les cr\u00e9ateurs de site dans son syst\u00e8me. Pour preuve, les r\u00e9ponses officielles \u00e9voquent toujours de futures am\u00e9liorations \u00e0 AMP, au lieu de proposer une solution. Sur mon serveur, il m\u2019a fallu 30 secondes pour couper le module AMP et vider mon cache, supprimant de fait toutes les versions optimis\u00e9es. Il m\u2019a fallu une minute ou deux pour r\u00e9aliser que je devais ajouter une redirection des liens AMP vers les liens orignaux, et encore quelques minutes pour la mettre en place. Mais disons que j\u2019ai retir\u00e9 AMP tr\u00e8s rapidement\u2026 pour m\u2019apercevoir que Google affichait toujours les versions optimis\u00e9es. V\u00e9rifications faites, il n\u2019est absolument pas possible de g\u00e9rer le cache AMP de Google. Concr\u00e8tement, vous ne pouvez pas ajouter de page au cache, vous ne pouvez pas demander une mise \u00e0 jour du contenu et surtout, vous ne pouvez pas demander de suppression d\u2019un contenu. Pour \u00eatre exact, il y a bien une solution officielle, mais elle est fastidieuse (il faut traiter chaque URL manuellement) et d\u2019apr\u00e8s mon exp\u00e9rience rapide, elle ne fonctionne m\u00eame pas. J\u2019ai demand\u00e9 \u00e0 supprimer des liens AMP, mais une semaine apr\u00e8s, ils \u00e9taient toujours index\u00e9s par Google. Pire, Google pr\u00e9f\u00e8re afficher une erreur comme celle-ci, plut\u00f4t que d\u2019afficher le site original, o\u00f9 le contenu est disponible. C\u2019est un chantage assez honteux pour obliger les propri\u00e9taires de sites \u00e0 faire marche arri\u00e8re et \u00e0 r\u00e9activer AMP. Google pr\u00e9f\u00e8re afficher une erreur, plut\u00f4t que de renvoyer vers l\u2019article original. C\u2019est du chantage, pour forcer les cr\u00e9ateurs de contenu \u00e0 r\u00e9activer AMP par peur de perdre du\u00a0trafic. Le probl\u00e8me, c\u2019est que Google ne laisse pas le choix. \u00c0 partir du moment o\u00f9 on utilise AMP, on accepte que son contenu soit mis en cache sur les serveurs de l\u2019entreprise. De ce c\u00f4t\u00e9, c\u2019est automatique, par contre Google ne s\u2019engage pas \u00e0 vider son cache \u00e0 votre demande, ce qui est tout de m\u00eame g\u00eanant. \u00c0 ce stade, je n\u2019avais qu\u2019une envie\u00a0: fuir. N\u2019ayant pas peur de perdre des visites, j\u2019ai choisi la voie la plus radicale. Je n\u2019ai pas r\u00e9activ\u00e9 AMP, j\u2019ai laiss\u00e9 la redirection 301 de tous les liens AMP vers les articles originaux et j\u2019ai patient\u00e9. Il en faut, de la patience\u00a0: j\u2019ai tout coup\u00e9 le 18 mars, Google indexait encore environ 270 liens AMP trois semaines plus tard. Soit, en gros, un peu plus du quart de ce qui \u00e9tait m\u00e9moris\u00e9 par le moteur de recherche auparavant. La bonne nouvelle, c\u2019est que Google finit par suivre les redirections et par retirer les pages AMP de son index pour mon site. La mauvaise nouvelle, c\u2019est qu\u2019il faudra sans doute autour d\u2019un mois pour les 1000 articles de mon blog. Qu\u2019en sera-t-il pour les plus gros sites\u00a0? Je n\u2019en reviens toujours pas que Google s\u2019en sorte aussi facilement avec ce blocage des contenus AMP. Le moteur de recherche abuse clairement de sa position de force et c\u2019est \u00e0 mes yeux un argument fort pour ne pas utiliser son syst\u00e8me et se tenir compl\u00e8tement \u00e0 l\u2019\u00e9cart du projet. Pour ma part, c\u2019est d\u00e9cid\u00e9, je ne touche plus \u00e0 AMP\u00a0! Quid des Instant Articles\u00a0? Apr\u00e8s cette mauvaise exp\u00e9rience, je me suis pos\u00e9 la question\u00a0: est-ce que je ne devrais pas couper aussi les Instant Articles de Facebook\u00a0? Apr\u00e8s tout, le style est aussi diff\u00e9rent de mon blog, et je ne peux pas afficher du tout certaines informations propos\u00e9es sur le site. Pourquoi mes articles de blog sont sur Instant ArticlesJe l\u2019\u00e9crivais d\u00e9j\u00e0 lors de leur premi\u00e8re pr\u00e9sentation, il y a pr\u00e8s d\u2019un an\u00a0: les Instant Articles de Facebook m\u2019int\u2026medium.com N\u00e9anmoins, le r\u00e9seau social a eu une tr\u00e8s bonne id\u00e9e\u00a0: un bouton global qui permet de couper totalement les Instant Articles \u00e0 n\u2019importe quel moment. C\u2019est rassurant je trouve, et m\u00eame si j\u2019h\u00e9site \u00e0 revenir \u00e0 mon seul site aussi sur Facebook, cette option m\u2019incite \u00e0 prolonger l\u2019exp\u00e9rience. Le fait que ce soit uniquement r\u00e9serv\u00e9 aux apps iOS et Android me rassure aussi, je trouve que c\u2019est moins g\u00eanant que dans un navigateur web. Et Facebook transmet la bonne adresse en cas de partage, un excellent point \u00e9galement. Mon objectif au fond reste le m\u00eame\u00a0: toujours garder la main sur le contenu que je publie. AMP a franchi la ligne jaune en m\u2019emp\u00eachant de repasser rapidement sur mon blog quand je l\u2019ai souhait\u00e9 et je ne veux plus en entendre parler. Pour le moment, Instant Articles reste du bon c\u00f4t\u00e9, mais je dois reconna\u00eetre que je suis moins enthousiaste qu\u2019\u00e0 une \u00e9poque vis \u00e0 vis de ces plateformes de lecture. M\u00eame si le confort apport\u00e9 par l\u2019instantan\u00e9it\u00e9 est un \u00e9l\u00e9ment important, garder le contr\u00f4le complet sur l\u2019exp\u00e9rience de lecture devient de plus en plus essentiel \u00e0 mes yeux. Sur mon blog, h\u00e9berg\u00e9 sur mon serveur, je fais ce que je veux. Sur ces services tiers, je c\u00e8de une grandepartie de mon contr\u00f4le et je commence vraiment \u00e0 me demander si ce n\u2019est pas un mauvais calcul\u2026 Que pensez-vous des articles AMP, en tant que lecteur ou \u00e9diteur\u00a0? Croyez-vous que j\u2019ai fait le bon ou le mauvais choix\u00a0? N\u2019h\u00e9sitez pas \u00e0 t\u00e9moigner en commentaires ou sur Twitter\u00a0! ", "name": "622", "child": "622_1\t622_2\t622_3\t622_4\t622_5\t622_6622_1\t622_2\t622_3\t622_4\t622_5\t622_6622_1\t622_2\t622_3\t622_4\t622_5\t622_6622_1\t622_2\t622_3\t622_4\t622_5\t622_6622_1\t622_2\t622_3\t622_4\t622_5\t622_6622_1\t622_2\t622_3\t622_4\t622_5\t622_6", "timestamp": "Apr 11"}