{"parent": "", "title": "Seitas abusivas: o que s\u00e3o, como agem e quais as suas pr\u00e1ticas\u00a0nocivas", "author": "Daniele Cavalcante", "sentences": [{"df9f": "Seitas abusivas: o que s\u00e3o, como agem e quais as suas pr\u00e1ticas\u00a0nocivas"}, {"01c5": "\u00c9ramos cerca de 40 pessoas, de v\u00e1rias partes do pa\u00eds, reunidas em uma casa relativamente espa\u00e7osa no Rio de Janeiro. Muitos ali eu conhecia apenas atrav\u00e9s da internet, outros eu nunca ouvira falar a respeito. A maioria eu conhecia muito bem\u200a\u2014\u200aeu morava com eles havia anos."}, {"b9a3": "Renata** era uma dessas pessoas que eu n\u00e3o conhecia. Viajou de Minas Gerais para um grande encontro da nossa \u201ccomunidade\u201d. Vamos chamar assim, pois n\u00e3o t\u00ednhamos um nome, e tamb\u00e9m nos recus\u00e1vamos a usar termos como \u201cgrupo\u201d, \u201creligi\u00e3o\u201d, \u201cigreja\u201d. Seita? Nem pensar!"}, {"f836": "Era um feriado de Dia da Crian\u00e7a. Ou P\u00e1scoa. N\u00e3o importa. Renata, e muitas outras pessoas que participavam das nossas reuni\u00f5es online e formavam c\u00e9lulas em outros estados, estava ali, preparando comidas em grande quantidade e organizando o necess\u00e1rio para a reuni\u00e3o."}, {"7710": "Sou uma pessoa de racioc\u00ednio lento, ent\u00e3o demorava um pouco para entender algumas coisas, e muitas estavam acontecendo ali a cada instante. E uma delas \u00e9 que Renata tremia. Muito. Mal conseguia carregar garrafas para guardar na geladeira, de modo que precisou de ajuda para uma tarefa t\u00e3o simples. As pessoas comentavam. Ningu\u00e9m supunha que Renata sofresse de algum tipo de transtorno de ansiedade."}, {"a2fd": "Durante a reuni\u00e3o, Renata se tornou o centro das aten\u00e7\u00f5es quando toda aquela gente a questionava por detalhes pessoais de sua vida, durante toda a madrugada."}, {"b2d6": "Assim ocorria com cada pessoa que fizesse parte da comunidade. Qualquer ind\u00edcio de que voc\u00ea tivesse algum apego \u00e0 sua fam\u00edlia, aos amigos, aos sabores e prazeres mundanos, ou mesmo um relacionamento amoroso, era motivo para questionamentos, sempre na tentativa de te induzir a abdicar dessas coisas. Afinal, se voc\u00ea est\u00e1 l\u00e1 dentro, j\u00e1 deveria ter deixado tudo isso para tr\u00e1s a fim de dedicar-se apenas aos novos \u201cirm\u00e3os\u201d."}, {"bc82": "Abandonar la\u00e7os familiares e desfazer amizades que atrapalhassem sua nova f\u00e9 \u00e9 um requisito, mas o principal \u00e9 compreender que a sua vida\u200a\u2014\u200ae suas posses\u200a\u2014\u200aserve unicamente para servir \u00e0 comunidade."}, {"5a60": "O que s\u00e3o seitas? Quais s\u00e3o realmente suas pr\u00e1ticas? Onde mora o\u00a0perigo?"}, {"2b58": "Voc\u00ea j\u00e1 leu hist\u00f3rias ou assistiu document\u00e1rios e filmes sobre seitas bizarras? Elas fazem parte do imagin\u00e1rio popular, gra\u00e7as a casos tr\u00e1gicos que ganharam as p\u00e1ginas dos jornais e causam grande espanto. Algumas s\u00e3o simples casos de charlatanismo; outras terminam em suic\u00eddio em massa, e se tornam um grande trauma na regi\u00e3o."}, {"8f74": "Todas s\u00e3o uma amea\u00e7a em potencial."}, {"6507": "Uma das caracter\u00edsticas mais perigosas \u00e9 que seitas s\u00e3o sutis. Elas podem at\u00e9 mesmo se denominar como \u201cgrupo de apoio\u201d, mas tendem a pedir segredo. \u201cO que fazemos aqui, a sociedade n\u00e3o entenderia e nos perseguiria\u201d, dizem. O mundo n\u00e3o est\u00e1 pronto para a verdade que trazemos\u201d. \u201cPrecisamos manter segredo de tudo o que fazemos\u201d."}, {"2643": "Por serem secretas, \u00e9 dif\u00edcil saber onde est\u00e3o e como identificar quando algum parente ou amigo se torna v\u00edtima de uma dessas seitas. N\u00e3o pretendo ser sensacionalista e causar alarde, mas o fato \u00e9 que quando uma pessoa \u00e9 \u201cfisgada\u201d, os sinais podem aparecer apenas quando \u00e9 tarde demais."}, {"2541": "Tamb\u00e9m n\u00e3o pretendo colocar todas as seitas no mesmo pacote, pois muitas delas s\u00e3o de fato inofensivas e apenas exercem seu direito constitucional ao culto. Meu objetivo \u00e9 destacar um tipo bem espec\u00edfico: as seitas abusivas."}, {"b19f": "Imagem do filme \u201cHelter Skelter\u201d, sobre a fam\u00edlia\u00a0Manson"}, {"56e3": "Para conceituar melhor, primeiro \u00e9 preciso desmistificar o conceito de seitas, de modo geral. A religi\u00e3o institucionalizada dominante (cristianismo) e a m\u00eddia cercam o assunto com significados que nos afastam da raiz do problema."}, {"a52a": "Por isso, \u00e0s vezes as seitas n\u00e3o s\u00e3o identificadas como tal, nem identificam a si mesmas dessa forma. Preferem outros nomes, pois \u201cseita\u201d se tornou pejorativo, associado a sangue de bode e pentagramas. Elas querem se afastar das teorias sobre sociedades secretas e de \u201csatanistas\u201d. Algumas adotam nomes pr\u00f3prios e inofensivos; outras, nomes gen\u00e9ricos."}, {"3288": "\u201cN\u00e3o temos uma denomina\u00e7\u00e3o, somos apenas pessoas que se uniram por um prop\u00f3sito em\u00a0comum\u201d."}, {"4a12": "Existem muitas abordagens para definir e at\u00e9 mesmo para encontrar o significado da raiz etimol\u00f3gica da palavra (secta). Os mais aceitos s\u00e3o:"}, {"86d5": "Vale lembrar que o pr\u00f3prio cristianismo, nos tempos dos 12 ap\u00f3stolos, era chamado de \u201cseita do Caminho\u201d pela religi\u00e3o dominante. Este \u00e9 um tipo de seita que surge atrav\u00e9s de um grande l\u00edder messi\u00e2nico."}, {"3ea7": "Devido a exemplos muito negativos, como as seitas que envolveram assassinatos, suic\u00eddios, esc\u00e2ndalos sexuais e estupros, as religi\u00f5es afirmam que uma seita \u00e9 uma distor\u00e7\u00e3o religiosa que apresenta doutrinas falsas. Mas para melhor abrang\u00eancia na nossa abordagem, a interpreta\u00e7\u00e3o de \u201cseguidor\u201d \u00e9 mais interessante. Guarde bem esta defini\u00e7\u00e3o."}, {"0722": "Deixemos de lado, portanto, o pensamento crist\u00e3o de \u201cfalsa doutrina\u201d para abordarmos os grupos que surgem de v\u00e1rios meios, n\u00e3o s\u00f3 os religiosos, e se tornam abusivos."}, {"3ffa": "Ou seja, n\u00e3o levamos em conta a f\u00e9 particular de cada uma. Queremos falar necessariamente de seitas abusivas; por isso, vamos excluir tamb\u00e9m da nossa abordagem as seitas pol\u00edticas e filos\u00f3ficas, que n\u00e3o se enquadram nas descri\u00e7\u00f5es que voc\u00ea ver\u00e1 mais abaixo."}, {"b89c": "Pode ser at\u00e9 mesmo um grupo de apoio de narc\u00f3ticos an\u00f4nimos que adota t\u00e1ticas duvidosas de lavagem cerebral para manipular pessoas. Mas isso ficar\u00e1 mais claro durante a leitura. Me acompanhe."}, {"629c": "Na interpreta\u00e7\u00e3o de \u201cseguidores\u201d, um ou mais indiv\u00edduos criam um conjunto de doutrinas e cren\u00e7as religiosas, pol\u00edticas ou filos\u00f3ficas e consegue levar consigo um grupo grande de pessoas. Estes podem ser considerados l\u00edderes de uma seita, por mais que eles neguem este t\u00edtulo."}, {"270b": "Imagem do filme \u201cJim Jones, O Pastor do\u00a0Diabo\u201d"}, {"5476": "O soci\u00f3logo e te\u00f3logo Peter L. Berger definiu seita como a organiza\u00e7\u00e3o de um grupo contra um meio que consideram hostil ou descrente de algo. Os membros se fecham em um corpo de doutrinas e olham o restante da sociedade como inerentemente m\u00e1, \u201ccega\u201d ou pecadora."}, {"bd3d": "As seitas religiosas tem um maior potencial de conquistar a devo\u00e7\u00e3o e o fanatismo dos seus seguidores, pois incluem uma f\u00e9 no divino ou em for\u00e7as ocultas, natureza, ou na pr\u00f3pria divindade do ser humano. Isso \u00e9 um prato cheio para cooptar aqueles que se sentem incapazes diante as dificuldades e dores do mundo."}, {"4e85": "O que s\u00e3o seitas abusivas?"}, {"8621": "S\u00e3o aquelas que fazem promessas, oferecem uma miss\u00e3o ou um prop\u00f3sito, e levam seus membros a guardar segredo sobre suas pr\u00e1ticas para, assim, praticar abusos."}, {"b677": "Tudo come\u00e7a de forma sutil. Em pequenas dosagens, como pedir contribui\u00e7\u00e3o financeira, alimentos ou outros tipos de doa\u00e7\u00e3o para manter o grupo. \u201cTudo ser\u00e1 de todos\u201d, dizem. Com o sucesso das primeiras tentativas, os l\u00edderes podem passar a \u201cexigir\u201d cada vez mais dedica\u00e7\u00e3o. \u00c0s vezes, n\u00e3o ser\u00e1 uma ordem expressa, mas um requisito para que o membro atinja o objetivo da seita; por exemplo, alcan\u00e7ar a evolu\u00e7\u00e3o espiritual."}, {"068b": "Algumas caracter\u00edsticas que podem aparecer:"}, {"4901": "Um l\u00edder carism\u00e1tico e persuasivo"}, {"5fab": "Um grupo que funciona na base do segredo tem todo o potencial para ser abusivo. Principalmente se os seus l\u00edderes t\u00eam conhecimentos sobre psicologia, linguagem, persuas\u00e3o, neurolingu\u00edstica, filosofia e outros assuntos do tipo."}, {"d5eb": "Esses conhecimentos ajudam pessoas abusivas a manipular os mais vulner\u00e1veis."}, {"b318": "Miss\u00e3o"}, {"6c1e": "As seitas desse tipo costumam ter uma \u201cmiss\u00e3o especial\u201d. Candidatos s\u00e3o abordados como se fossem escolhidos para exercer um papel fundamental em tal tarefa."}, {"4731": "Geralmente a miss\u00e3o inclui coisas boas e gen\u00e9ricas, como \u201clevar o amor aos povos\u201d \u201cpaz mundial\u201d \u201cevolu\u00e7\u00e3o do ser humano\u201d \u201ccriar uma sociedade justa\u201d \u201ccausar a volta de Jesus\u201d."}, {"0c4b": "Isolamento"}, {"b8ec": "Uma seita abusiva provavelmente afastar\u00e1 lentamente os indiv\u00edduos de suas fam\u00edlias e amigos. Ser\u00e1 dito que isso \u00e9 para que possam se dedicar cada vez mais \u00e0 sua \u201cmiss\u00e3o\u201d, como se estivessem se preparando para uma dif\u00edcil batalha pela frente. Sim, \u00e9 algo meio \u201cClube da Luta\u201d."}, {"0ec7": "Algumas pregam que, literalmente, protagonizar\u00e3o uma batalha contra \u201celes\u201d, \u201co mal\u201d, \u201co sistema\u201d, \u201cos dominadores do mundo\u201d, \u201cos illuminati\u201d, e submetem os membros a um \u201cpreparo\u201d."}, {"70fa": "Se os amigos e familiares \u201cn\u00e3o entenderem\u201d, eles s\u00e3o inimigos em potencial, e os membros devem abandon\u00e1-los definitivamente. Afinal, \u201cfam\u00edlia \u00e9 aquela que se escolhe\u201d, ou como disse o Cristo, \u201cminha fam\u00edlia s\u00e3o aqueles que fazem a vontade de Deus\u201d. Isso deve ser levado ao p\u00e9 da letra pelos fi\u00e9is."}, {"0027": "Vis\u00e3o de\u00a0mundo"}, {"4920": "Com a aliena\u00e7\u00e3o, doutrina\u00e7\u00e3o e isolamento, os membros s\u00e3o limitados a uma \u00fanica vis\u00e3o de mundo. Uma interpreta\u00e7\u00e3o de toda a realidade sob o ponto de vista daquela doutrina."}, {"1a98": "Embora este n\u00e3o seja o problema em si, isso torna os seguidores suscet\u00edveis \u00e0 lideran\u00e7a, pois \u00e9 o l\u00edder quem trouxe a \u201crevela\u00e7\u00e3o\u201d sobre essa vis\u00e3o de mundo. O que ele disser, provavelmente \u00e9 verdade. Da\u00ed, a brecha para os abusos aparece."}, {"3795": "Abstin\u00eancia"}, {"52be": "Essa prepara\u00e7\u00e3o para a miss\u00e3o inclui se abster das \u201ccoisas do mundo\u201d. Ou seja, coisas agrad\u00e1veis que podem \u201ccomprar\u201d ou \u201cdistrair\u201d os combatentes de uma batalha."}, {"634e": "Se voc\u00ea se abster por tempo o suficiente daquilo que lhe corrompe, passar\u00e1 a n\u00e3o gostar de tais coisas, e resistir\u00e1 a tenta\u00e7\u00f5es futuras. \u00c9 uma \u201creconstru\u00e7\u00e3o\u201d do indiv\u00edduo \u201cpecaminoso\u201d. Dir\u00e3o que \u00e9 bom os membros se prepararem enquanto estamos em \u201ctempos de paz\u201d para que estejam prontos em tempos de batalhas."}, {"9932": "Messianismo"}, {"38a0": "Por fim, \u00e9 seguro dizer que o messianismo \u00e9 uma caracter\u00edstica comum. Seitas desse tipo tendem a pregar que suas doutrinas s\u00e3o as \u00fanicas capazes de mudar o mundo, salvar a humanidade, etc."}, {"6d9b": "O que uma seita abusiva\u00a0faz?"}, {"a72f": "Imagem do filme \u201cMartha Marcy May\u00a0Marlene\u201d"}, {"d4f6": "Em 1998, foi fundada no Brasil a seita Comunidade Evang\u00e9lica Jesus, a Verdade que Marca\u00b9. Eles convenciam os fi\u00e9is a doarem tudo o que tinham para conviver em um espa\u00e7o onde \u201ctudo seria de todos\u201d. Os l\u00edderes foram presos em 2015 por submeter membros \u00e0 condi\u00e7\u00e3o an\u00e1loga \u00e0 de escravo, tr\u00e1fico de pessoas, estelionato, organiza\u00e7\u00e3o criminosa, falsidade ideol\u00f3gica e lavagem de dinheiro. Com as doa\u00e7\u00f5es, eles compravam terrenos, estabelecimentos comerciais e autom\u00f3veis."}, {"816e": "O norte-americano Victor Arden Barnard foi acusado por 59 abusos sexuais como participante da seita River Road Fellowship\u00b2 localizada no estado americano de Minnesota. As jovens abusadas tinham entre 13 e 15 anos de idade."}, {"99a2": "Em 1994, a ordem francesa Solar Temple foi respons\u00e1vel por um caso de assassinato de uma crian\u00e7a de tr\u00eas anos de idade, porque acreditava-se que ele seria o anti-cristo. Ele foi morto com golpes de estaca, no Canad\u00e1. Depois, na Su\u00ed\u00e7a, 15 membros do c\u00edrculo interno cometeram suic\u00eddio com veneno, 30 foram mortos por balas ou sufocados e outros 8 foram mortos por outras causas. 16 pessoas foram encontrados na floresta de Vercors, na regi\u00e3o francesa do Is\u00e9re."}, {"8878": "A Fran\u00e7a \u00e9 um pa\u00eds que tem um bom hist\u00f3rico com seitas e no combate aos perigos que elas podem trazer. Em 2006, o jornal franc\u00eas \u201cLe Parisien\u201d publicou que 60 mil crian\u00e7as s\u00e3o manipuladas por diferentes grupos sect\u00e1rios no pa\u00eds e que \u201cs\u00e3o v\u00edtimas de graves maus-tratos psicol\u00f3gicos, f\u00edsicos e \u00e0s vezes sexuais\u201d."}, {"76dd": "Entre as seitas mencionadas pela publica\u00e7\u00e3o, estava a Tabitha\u2019s Place\u00b3, que fazia das crian\u00e7as \u201cv\u00edtimas da ideologia de seus pais, que imp\u00f5em a elas o estilo de vida dos primeiros crist\u00e3os\u201d."}, {"b2c9": "Em 2001 os pais de um beb\u00ea de 19 meses, membros do Tabita\u2019s Place, foram condenados a doze anos de pris\u00e3o por deixarem a crian\u00e7a morrer ao impedir que recebesse o tratamento m\u00e9dico adequado, por ser contr\u00e1rio \u00e0s normas da seita. Outros 19 membros desta \u201ccomunidade\u201d foram condenados \u00e0 pris\u00e3o por se negarem a escolarizar e a vacinar seus filhos."}, {"4896": "Com o amplo hist\u00f3rico no pa\u00eds, em junho de 2000 o Parlamento Franc\u00eas aprovou uma lei que prev\u00ea deten\u00e7\u00e3o e multa para membros de Igrejas e Seitas que pudessem ser enquadradas na pr\u00e1tica de \u201cmanipula\u00e7\u00e3o mental\u201d e causar um \u201cestado de sujei\u00e7\u00e3o\u201d f\u00edsico ou psicol\u00f3gico."}, {"005f": "Na Inglaterra, \u00e9 proibida publicidade que fa\u00e7a refer\u00eancia a um estado de sofrimento, do tipo \u201c Voc\u00ea que est\u00e1 sofrendo, procure a Igreja\u2026\u201dcomo incentivo para convidar algu\u00e9m a uma reuni\u00e3o ou culto 4."}, {"0423": "Como \u00e9 poss\u00edvel exemplificar em uma extensiva lista de casos famosos, as seitas abusivas t\u00eam uma s\u00e9rie de pr\u00e1ticas, muitas delas criminosas. Vamos apontar algumas caracter\u00edsticas comuns. Mesmo em menor grau que os exemplos acima, elas podem servir como um sinal de que algu\u00e9m esteja sofrendo algum tipo de abuso no grupo que frequenta."}, {"c690": "Imagem do filme \u201cSeita de Fan\u00e1ticos\u201d"}, {"67b6": "Talvez voc\u00ea considere um ou dois itens abaixo n\u00e3o-abusivos, mas importa considerar o conjunto como um todo. Vale lembrar que muitas delas podem parecer grupos inofensivos e bem-intencionados, mas isso n\u00e3o significa que n\u00e3o cometam abusos f\u00edsicos e/ou psicol\u00f3gicos."}, {"f3a4": "Um alerta"}, {"bd6e": "Este n\u00e3o \u00e9 um assunto para se ignorar. Seitas abusivas ainda existem \u00e0s centenas, talvez milhares, aqui mesmo no Brasil, e sabem ser invis\u00edveis. N\u00e3o s\u00f3 precisamos ficar atentos para n\u00e3o cair em seus discursos, mas tamb\u00e9m para evitar que parentes e amigos sejam seduzidos por suas promessas, ideologias e carisma."}, {"0394": "Como a seita costuma isolar os seguidores e aprision\u00e1-los em uma vis\u00e3o \u00fanica de mundo, o pensamento entre todos os membros tende a ser unificado, assim como o comportamento, linguajar, prefer\u00eancias, cren\u00e7as, ideologias, etc. E, no processo, as caracter\u00edsticas mais individuais s\u00e3o anuladas."}, {"2ef4": "Caso algu\u00e9m n\u00e3o se adapte a essa unifica\u00e7\u00e3o ideol\u00f3gica e de comportamento, inevitavelmente carregar\u00e1 sobre si um peso maior; a seita jogar\u00e1 culpa sobre culpa, e com essa culpa haver\u00e1 espa\u00e7o para os maiores abusos na forma de castigos e t\u00e9cnicas de \u201ccorre\u00e7\u00e3o\u201d. E, caso ainda n\u00e3o ocorra a adapta\u00e7\u00e3o, vem o rompimento."}, {"37bc": "Muitas vezes, esse rompimento \u00e9 traum\u00e1tico, marcado por mais julgamentos e condena\u00e7\u00e3o. Ao deixar a seita ou culto, essa pessoa dilacerada carregar\u00e1 dupla culpa\u200a\u2014\u200aaquela que a levou a se submeter aos abusos e aquela despejada sobre si por ter abandonado \u201ca f\u00e9\u201d, \u201co \u00fanico caminho\u201d, a \u201c\u00fanica verdade\u201d."}, {"3384": "Paranoias e medos podem segui-la por bastante tempo, al\u00e9m de uma s\u00e9rie de consequ\u00eancias psicol\u00f3gicas, e ser\u00e1 dif\u00edcil recuperar uma mente consumida por seitas abusivas. Por isso, a \u00faltima coisa que ela precisa \u00e9 de mais culpabiliza\u00e7\u00e3o por parte da fam\u00edlia e amigos."}, {"0435": "*Comecei a escrever sobre o tema em 2016 a partir de minhas pr\u00f3prias experi\u00eancias e este novo texto \u00e9 o primeiro de um \u201creboot\u201d da s\u00e9rie original."}, {"83bd": "**Nome fict\u00edcio"}], "content": "Seitas abusivas: o que s\u00e3o, como agem e quais as suas pr\u00e1ticas\u00a0nocivas \u00c9ramos cerca de 40 pessoas, de v\u00e1rias partes do pa\u00eds, reunidas em uma casa relativamente espa\u00e7osa no Rio de Janeiro. Muitos ali eu conhecia apenas atrav\u00e9s da internet, outros eu nunca ouvira falar a respeito. A maioria eu conhecia muito bem\u200a\u2014\u200aeu morava com eles havia anos. Renata** era uma dessas pessoas que eu n\u00e3o conhecia. Viajou de Minas Gerais para um grande encontro da nossa \u201ccomunidade\u201d. Vamos chamar assim, pois n\u00e3o t\u00ednhamos um nome, e tamb\u00e9m nos recus\u00e1vamos a usar termos como \u201cgrupo\u201d, \u201creligi\u00e3o\u201d, \u201cigreja\u201d. Seita? Nem pensar! Era um feriado de Dia da Crian\u00e7a. Ou P\u00e1scoa. N\u00e3o importa. Renata, e muitas outras pessoas que participavam das nossas reuni\u00f5es online e formavam c\u00e9lulas em outros estados, estava ali, preparando comidas em grande quantidade e organizando o necess\u00e1rio para a reuni\u00e3o. Sou uma pessoa de racioc\u00ednio lento, ent\u00e3o demorava um pouco para entender algumas coisas, e muitas estavam acontecendo ali a cada instante. E uma delas \u00e9 que Renata tremia. Muito. Mal conseguia carregar garrafas para guardar na geladeira, de modo que precisou de ajuda para uma tarefa t\u00e3o simples. As pessoas comentavam. Ningu\u00e9m supunha que Renata sofresse de algum tipo de transtorno de ansiedade. Durante a reuni\u00e3o, Renata se tornou o centro das aten\u00e7\u00f5es quando toda aquela gente a questionava por detalhes pessoais de sua vida, durante toda a madrugada. Assim ocorria com cada pessoa que fizesse parte da comunidade. Qualquer ind\u00edcio de que voc\u00ea tivesse algum apego \u00e0 sua fam\u00edlia, aos amigos, aos sabores e prazeres mundanos, ou mesmo um relacionamento amoroso, era motivo para questionamentos, sempre na tentativa de te induzir a abdicar dessas coisas. Afinal, se voc\u00ea est\u00e1 l\u00e1 dentro, j\u00e1 deveria ter deixado tudo isso para tr\u00e1s a fim de dedicar-se apenas aos novos \u201cirm\u00e3os\u201d. Abandonar la\u00e7os familiares e desfazer amizades que atrapalhassem sua nova f\u00e9 \u00e9 um requisito, mas o principal \u00e9 compreender que a sua vida\u200a\u2014\u200ae suas posses\u200a\u2014\u200aserve unicamente para servir \u00e0 comunidade. O que s\u00e3o seitas? Quais s\u00e3o realmente suas pr\u00e1ticas? Onde mora o\u00a0perigo? Voc\u00ea j\u00e1 leu hist\u00f3rias ou assistiu document\u00e1rios e filmes sobre seitas bizarras? Elas fazem parte do imagin\u00e1rio popular, gra\u00e7as a casos tr\u00e1gicos que ganharam as p\u00e1ginas dos jornais e causam grande espanto. Algumas s\u00e3o simples casos de charlatanismo; outras terminam em suic\u00eddio em massa, e se tornam um grande trauma na regi\u00e3o. Todas s\u00e3o uma amea\u00e7a em potencial. Uma das caracter\u00edsticas mais perigosas \u00e9 que seitas s\u00e3o sutis. Elas podem at\u00e9 mesmo se denominar como \u201cgrupo de apoio\u201d, mas tendem a pedir segredo. \u201cO que fazemos aqui, a sociedade n\u00e3o entenderia e nos perseguiria\u201d, dizem. O mundo n\u00e3o est\u00e1 pronto para a verdade que trazemos\u201d. \u201cPrecisamos manter segredo de tudo o que fazemos\u201d. Por serem secretas, \u00e9 dif\u00edcil saber onde est\u00e3o e como identificar quando algum parente ou amigo se torna v\u00edtima de uma dessas seitas. N\u00e3o pretendo ser sensacionalista e causar alarde, mas o fato \u00e9 que quando uma pessoa \u00e9 \u201cfisgada\u201d, os sinais podem aparecer apenas quando \u00e9 tarde demais. Tamb\u00e9m n\u00e3o pretendo colocar todas as seitas no mesmo pacote, pois muitas delas s\u00e3o de fato inofensivas e apenas exercem seu direito constitucional ao culto. Meu objetivo \u00e9 destacar um tipo bem espec\u00edfico: as seitas abusivas. Imagem do filme \u201cHelter Skelter\u201d, sobre a fam\u00edlia\u00a0Manson Para conceituar melhor, primeiro \u00e9 preciso desmistificar o conceito de seitas, de modo geral. A religi\u00e3o institucionalizada dominante (cristianismo) e a m\u00eddia cercam o assunto com significados que nos afastam da raiz do problema. Por isso, \u00e0s vezes as seitas n\u00e3o s\u00e3o identificadas como tal, nem identificam a si mesmas dessa forma. Preferem outros nomes, pois \u201cseita\u201d se tornou pejorativo, associado a sangue de bode e pentagramas. Elas querem se afastar das teorias sobre sociedades secretas e de \u201csatanistas\u201d. Algumas adotam nomes pr\u00f3prios e inofensivos; outras, nomes gen\u00e9ricos. \u201cN\u00e3o temos uma denomina\u00e7\u00e3o, somos apenas pessoas que se uniram por um prop\u00f3sito em\u00a0comum\u201d. Existem muitas abordagens para definir e at\u00e9 mesmo para encontrar o significado da raiz etimol\u00f3gica da palavra (secta). Os mais aceitos s\u00e3o: Vale lembrar que o pr\u00f3prio cristianismo, nos tempos dos 12 ap\u00f3stolos, era chamado de \u201cseita do Caminho\u201d pela religi\u00e3o dominante. Este \u00e9 um tipo de seita que surge atrav\u00e9s de um grande l\u00edder messi\u00e2nico. Devido a exemplos muito negativos, como as seitas que envolveram assassinatos, suic\u00eddios, esc\u00e2ndalos sexuais e estupros, as religi\u00f5es afirmam que uma seita \u00e9 uma distor\u00e7\u00e3o religiosa que apresenta doutrinas falsas. Mas para melhor abrang\u00eancia na nossa abordagem, a interpreta\u00e7\u00e3o de \u201cseguidor\u201d \u00e9 mais interessante. Guarde bem esta defini\u00e7\u00e3o. Deixemos de lado, portanto, o pensamento crist\u00e3o de \u201cfalsa doutrina\u201d para abordarmos os grupos que surgem de v\u00e1rios meios, n\u00e3o s\u00f3 os religiosos, e se tornam abusivos. Ou seja, n\u00e3o levamos em conta a f\u00e9 particular de cada uma. Queremos falar necessariamente de seitas abusivas; por isso, vamos excluir tamb\u00e9m da nossa abordagem as seitas pol\u00edticas e filos\u00f3ficas, que n\u00e3o se enquadram nas descri\u00e7\u00f5es que voc\u00ea ver\u00e1 mais abaixo. Pode ser at\u00e9 mesmo um grupo de apoio de narc\u00f3ticos an\u00f4nimos que adota t\u00e1ticas duvidosas de lavagem cerebral para manipular pessoas. Mas isso ficar\u00e1 mais claro durante a leitura. Me acompanhe. Na interpreta\u00e7\u00e3o de \u201cseguidores\u201d, um ou mais indiv\u00edduos criam um conjunto de doutrinas e cren\u00e7as religiosas, pol\u00edticas ou filos\u00f3ficas e consegue levar consigo um grupo grande de pessoas. Estes podem ser considerados l\u00edderes de uma seita, por mais que eles neguem este t\u00edtulo. Imagem do filme \u201cJim Jones, O Pastor do\u00a0Diabo\u201d O soci\u00f3logo e te\u00f3logo Peter L. Berger definiu seita como a organiza\u00e7\u00e3o de um grupo contra um meio que consideram hostil ou descrente de algo. Os membros se fecham em um corpo de doutrinas e olham o restante da sociedade como inerentemente m\u00e1, \u201ccega\u201d ou pecadora. As seitas religiosas tem um maior potencial de conquistar a devo\u00e7\u00e3o e o fanatismo dos seus seguidores, pois incluem uma f\u00e9 no divino ou em for\u00e7as ocultas, natureza, ou na pr\u00f3pria divindade do ser humano. Isso \u00e9 um prato cheio para cooptar aqueles que se sentem incapazes diante as dificuldades e dores do mundo. O que s\u00e3o seitas abusivas? S\u00e3o aquelas que fazem promessas, oferecem uma miss\u00e3o ou um prop\u00f3sito, e levam seus membros a guardar segredo sobre suas pr\u00e1ticas para, assim, praticar abusos. Tudo come\u00e7a de forma sutil. Em pequenas dosagens, como pedir contribui\u00e7\u00e3o financeira, alimentos ou outros tipos de doa\u00e7\u00e3o para manter o grupo. \u201cTudo ser\u00e1 de todos\u201d, dizem. Com o sucesso das primeiras tentativas, os l\u00edderes podem passar a \u201cexigir\u201d cada vez mais dedica\u00e7\u00e3o. \u00c0s vezes, n\u00e3o ser\u00e1 uma ordem expressa, mas um requisito para que o membro atinja o objetivo da seita; por exemplo, alcan\u00e7ar a evolu\u00e7\u00e3o espiritual. Algumas caracter\u00edsticas que podem aparecer: Um l\u00edder carism\u00e1tico e persuasivo Um grupo que funciona na base do segredo tem todo o potencial para ser abusivo. Principalmente se os seus l\u00edderes t\u00eam conhecimentos sobre psicologia, linguagem, persuas\u00e3o, neurolingu\u00edstica, filosofia e outros assuntos do tipo. Esses conhecimentos ajudam pessoas abusivas a manipular os mais vulner\u00e1veis. Miss\u00e3o As seitas desse tipo costumam ter uma \u201cmiss\u00e3o especial\u201d. Candidatos s\u00e3o abordados como se fossem escolhidos para exercer um papel fundamental em tal tarefa. Geralmente a miss\u00e3o inclui coisas boas e gen\u00e9ricas, como \u201clevar o amor aos povos\u201d \u201cpaz mundial\u201d \u201cevolu\u00e7\u00e3o do ser humano\u201d \u201ccriar uma sociedade justa\u201d \u201ccausar a volta de Jesus\u201d. Isolamento Uma seita abusiva provavelmente afastar\u00e1 lentamente os indiv\u00edduos de suas fam\u00edlias e amigos. Ser\u00e1 dito que isso \u00e9 para que possam se dedicar cada vez mais \u00e0 sua \u201cmiss\u00e3o\u201d, como se estivessem se preparando para uma dif\u00edcil batalha pela frente. Sim, \u00e9 algo meio \u201cClube da Luta\u201d. Algumas pregam que, literalmente, protagonizar\u00e3o uma batalha contra \u201celes\u201d, \u201co mal\u201d, \u201co sistema\u201d, \u201cos dominadores do mundo\u201d, \u201cos illuminati\u201d, e submetem os membros a um \u201cpreparo\u201d. Se os amigos e familiares \u201cn\u00e3o entenderem\u201d, eles s\u00e3o inimigos em potencial, e os membros devem abandon\u00e1-los definitivamente. Afinal, \u201cfam\u00edlia \u00e9 aquela que se escolhe\u201d, ou como disse o Cristo, \u201cminha fam\u00edlia s\u00e3o aqueles que fazem a vontade de Deus\u201d. Isso deve ser levado ao p\u00e9 da letra pelos fi\u00e9is. Vis\u00e3o de\u00a0mundo Com a aliena\u00e7\u00e3o, doutrina\u00e7\u00e3o e isolamento, os membros s\u00e3o limitados a uma \u00fanica vis\u00e3o de mundo. Uma interpreta\u00e7\u00e3o de toda a realidade sob o ponto de vista daquela doutrina. Embora este n\u00e3o seja o problema em si, isso torna os seguidores suscet\u00edveis \u00e0 lideran\u00e7a, pois \u00e9 o l\u00edder quem trouxe a \u201crevela\u00e7\u00e3o\u201d sobre essa vis\u00e3o de mundo. O que ele disser, provavelmente \u00e9 verdade. Da\u00ed, a brecha para os abusos aparece. Abstin\u00eancia Essa prepara\u00e7\u00e3o para a miss\u00e3o inclui se abster das \u201ccoisas do mundo\u201d. Ou seja, coisas agrad\u00e1veis que podem \u201ccomprar\u201d ou \u201cdistrair\u201d os combatentes de uma batalha. Se voc\u00ea se abster por tempo o suficiente daquilo que lhe corrompe, passar\u00e1 a n\u00e3o gostar de tais coisas, e resistir\u00e1 a tenta\u00e7\u00f5es futuras. \u00c9 uma \u201creconstru\u00e7\u00e3o\u201d do indiv\u00edduo \u201cpecaminoso\u201d. Dir\u00e3o que \u00e9 bom os membros se prepararem enquanto estamos em \u201ctempos de paz\u201d para que estejam prontos em tempos de batalhas. Messianismo Por fim, \u00e9 seguro dizer que o messianismo \u00e9 uma caracter\u00edstica comum. Seitas desse tipo tendem a pregar que suas doutrinas s\u00e3o as \u00fanicas capazes de mudar o mundo, salvar a humanidade, etc. O que uma seita abusiva\u00a0faz? Imagem do filme \u201cMartha Marcy May\u00a0Marlene\u201d Em 1998, foi fundada no Brasil a seita Comunidade Evang\u00e9lica Jesus, a Verdade que Marca\u00b9. Eles convenciam os fi\u00e9is a doarem tudo o que tinham para conviver em um espa\u00e7o onde \u201ctudo seria de todos\u201d. Os l\u00edderes foram presos em 2015 por submeter membros \u00e0 condi\u00e7\u00e3o an\u00e1loga \u00e0 de escravo, tr\u00e1fico de pessoas, estelionato, organiza\u00e7\u00e3o criminosa, falsidade ideol\u00f3gica e lavagem de dinheiro. Com as doa\u00e7\u00f5es, eles compravam terrenos, estabelecimentos comerciais e autom\u00f3veis. O norte-americano Victor Arden Barnard foi acusado por 59 abusos sexuais como participante da seita River Road Fellowship\u00b2 localizada no estado americano de Minnesota. As jovens abusadas tinham entre 13 e 15 anos de idade. Em 1994, a ordem francesa Solar Temple foi respons\u00e1vel por um caso de assassinato de uma crian\u00e7a de tr\u00eas anos de idade, porque acreditava-se que ele seria o anti-cristo. Ele foi morto com golpes de estaca, no Canad\u00e1. Depois, na Su\u00ed\u00e7a, 15 membros do c\u00edrculo interno cometeram suic\u00eddio com veneno, 30 foram mortos por balas ou sufocados e outros 8 foram mortos por outras causas. 16 pessoas foram encontrados na floresta de Vercors, na regi\u00e3o francesa do Is\u00e9re. A Fran\u00e7a \u00e9 um pa\u00eds que tem um bom hist\u00f3rico com seitas e no combate aos perigos que elas podem trazer. Em 2006, o jornal franc\u00eas \u201cLe Parisien\u201d publicou que 60 mil crian\u00e7as s\u00e3o manipuladas por diferentes grupos sect\u00e1rios no pa\u00eds e que \u201cs\u00e3o v\u00edtimas de graves maus-tratos psicol\u00f3gicos, f\u00edsicos e \u00e0s vezes sexuais\u201d. Entre as seitas mencionadas pela publica\u00e7\u00e3o, estava a Tabitha\u2019s Place\u00b3, que fazia das crian\u00e7as \u201cv\u00edtimas da ideologia de seus pais, que imp\u00f5em a elas o estilo de vida dos primeiros crist\u00e3os\u201d. Em 2001 os pais de um beb\u00ea de 19 meses, membros do Tabita\u2019s Place, foram condenados a doze anos de pris\u00e3o por deixarem a crian\u00e7a morrer ao impedir que recebesse o tratamento m\u00e9dico adequado, por ser contr\u00e1rio \u00e0s normas da seita. Outros 19 membros desta \u201ccomunidade\u201d foram condenados \u00e0 pris\u00e3o por se negarem a escolarizar e a vacinar seus filhos. Com o amplo hist\u00f3rico no pa\u00eds, em junho de 2000 o Parlamento Franc\u00eas aprovou uma lei que prev\u00ea deten\u00e7\u00e3o e multa para membros de Igrejas e Seitas que pudessem ser enquadradas na pr\u00e1tica de \u201cmanipula\u00e7\u00e3o mental\u201d e causar um \u201cestado de sujei\u00e7\u00e3o\u201d f\u00edsico ou psicol\u00f3gico. Na Inglaterra, \u00e9 proibida publicidade que fa\u00e7a refer\u00eancia a um estado de sofrimento, do tipo \u201c Voc\u00ea que est\u00e1 sofrendo, procure a Igreja\u2026\u201dcomo incentivo para convidar algu\u00e9m a uma reuni\u00e3o ou culto 4. Como \u00e9 poss\u00edvel exemplificar em uma extensiva lista de casos famosos, as seitas abusivas t\u00eam uma s\u00e9rie de pr\u00e1ticas, muitas delas criminosas. Vamos apontar algumas caracter\u00edsticas comuns. Mesmo em menor grau que os exemplos acima, elas podem servir como um sinal de que algu\u00e9m esteja sofrendo algum tipo de abuso no grupo que frequenta. Imagem do filme \u201cSeita de Fan\u00e1ticos\u201d Talvez voc\u00ea considere um ou dois itens abaixo n\u00e3o-abusivos, mas importa considerar o conjunto como um todo. Vale lembrar que muitas delas podem parecer grupos inofensivos e bem-intencionados, mas isso n\u00e3o significa que n\u00e3o cometam abusos f\u00edsicos e/ou psicol\u00f3gicos. Um alerta Este n\u00e3o \u00e9 um assunto para se ignorar. Seitas abusivas ainda existem \u00e0s centenas, talvez milhares, aqui mesmo no Brasil, e sabem ser invis\u00edveis. N\u00e3o s\u00f3 precisamos ficar atentos para n\u00e3o cair em seus discursos, mas tamb\u00e9m para evitar que parentes e amigos sejam seduzidos por suas promessas, ideologias e carisma. Como a seita costuma isolar os seguidores e aprision\u00e1-los em uma vis\u00e3o \u00fanica de mundo, o pensamento entre todos os membros tende a ser unificado, assim como o comportamento, linguajar, prefer\u00eancias, cren\u00e7as, ideologias, etc. E, no processo, as caracter\u00edsticas mais individuais s\u00e3o anuladas. Caso algu\u00e9m n\u00e3o se adapte a essa unifica\u00e7\u00e3o ideol\u00f3gica e de comportamento, inevitavelmente carregar\u00e1 sobre si um peso maior; a seita jogar\u00e1 culpa sobre culpa, e com essa culpa haver\u00e1 espa\u00e7o para os maiores abusos na forma de castigos e t\u00e9cnicas de \u201ccorre\u00e7\u00e3o\u201d. E, caso ainda n\u00e3o ocorra a adapta\u00e7\u00e3o, vem o rompimento. Muitas vezes, esse rompimento \u00e9 traum\u00e1tico, marcado por mais julgamentos e condena\u00e7\u00e3o. Ao deixar a seita ou culto, essa pessoa dilacerada carregar\u00e1 dupla culpa\u200a\u2014\u200aaquela que a levou a se submeter aos abusos e aquela despejada sobre si por ter abandonado \u201ca f\u00e9\u201d, \u201co \u00fanico caminho\u201d, a \u201c\u00fanica verdade\u201d. Paranoias e medos podem segui-la por bastante tempo, al\u00e9m de uma s\u00e9rie de consequ\u00eancias psicol\u00f3gicas, e ser\u00e1 dif\u00edcil recuperar uma mente consumida por seitas abusivas. Por isso, a \u00faltima coisa que ela precisa \u00e9 de mais culpabiliza\u00e7\u00e3o por parte da fam\u00edlia e amigos. *Comecei a escrever sobre o tema em 2016 a partir de minhas pr\u00f3prias experi\u00eancias e este novo texto \u00e9 o primeiro de um \u201creboot\u201d da s\u00e9rie original. **Nome fict\u00edcio ", "name": "719", "child": "719_1\t719_2719_1\t719_2719_1\t719_2719_1\t719_2", "timestamp": "Apr 5"}