{"parent": "", "title": "6 best practices for 404 pages with killer\u00a0UX", "author": "Justinmind", "sentences": [{"340b": "6 best practices for 404 pages with killer\u00a0UX"}, {"6e23": "Design error pages that boost usability, improve user experience and even raise a smile with these 6 top tips"}, {"55ea": "Urgh, a 404 page! No one likes that, right? But hold on a minute. 404 error pages don\u2019t need to be a total UX nightmare. When designed to delight and direct users, 404 pages can transform from sources of frustration to opportunities for conversion and branding. Good UI design, a focus on user experience and a little human empathy can go a long way towards improving 404 page design."}, {"bd97": "This post will look at 5 error page best practices to make 404 pages more user friendly. Follow them for better usability, stronger branding and delightful user experiences."}, {"fa63": "Turn user error into UX opportunity"}, {"db73": "A standard, out-of-the box 404 page gives users only one option\u200a\u2014\u200ago back to where they came from. What a downer. According to the principles of gamification, users want to feel like they\u2019re making progress. So design 404 pages that allow users to progress to other parts of your site, commonly the home or features pages. This way you\u2019ve got a lot more chance of keeping them on sight and nudging them in the right direction. Justinmind keeps it simple by giving users 5 key paths to follow:"}, {"1b95": "And don\u2019t just give them links. Add a search box to the 404 page to allow give users back a sense of control over their experience and facilitate task success. Designer Steve Lambert combines a search box 404 with a toe-curlingly good video to create a fun and functional 404 user experience."}, {"9d69": "And for usable search box design, Gyorgy Fetete has some great tips right here in Smashing Magazine."}, {"11c9": "Explain, don\u2019t just error\u00a0message"}, {"fa35": "There\u2019s probably nothing more frustrating than landing on an error message, and then being so confused by the error message itself that you have to Google it. Take the prime example below:"}, {"d238": "Excuse me? UX designers everywhere are screaming right now. Good 404 messages should concisely explain what went wrong in plain language, and what to do next. Just like Bloomberg does below."}, {"3acb": "Less clutter, higher user success\u00a0rates"}, {"dc32": "A lot of sites used to fall into the trap of \u201cPanic! The user got a 404! Let\u2019s show them everything we got and see if they bite\u201d Bad idea. Overwhelming the user with a 404 page jam-packed with links to every nook and cranny of your site is a surefire way to cognitively overload an already frustrated user. And as NN Group guru Kathryn Whitenton makes clear, cognitive overload and usability do not go hand in hand."}, {"0d20": "Best practice is to design a 404 page with a handful of key links, including a link to the Home page as an easy get-out for users who\u2019re not sure what they\u2019re looking for yet. Other options to include might be to a blog, product features or About Us."}, {"cd3c": "In general, aiming to include up to 4 links on a 404 page is good practice. Airbnb include more, but they\u2019re Airbnb."}, {"df75": "Read our interview with Airbnb\u2019s Director of Experience Design"}, {"d48a": "Use 404 pages as branding opportunities"}, {"e00d": "For many users, a 404 page might be the very first interaction they have with a brand. That\u2019s a lot of pressure for one little error page. Follow basic best practices such as ensuring that the aesthetics of the page fit with the rest of the site, microcopy mirrors the tone throughout, and that icons and visuals are coherent with other sites or products."}, {"5572": "Just bear in mind that functionality has to come before form in a 404. Make the brand\u2019s look and feel serve the function of the page, like Mailchimp does:"}, {"2083": "Add a little\u00a0humor"}, {"f530": "Make \u2019em laugh, kiddo. This advice isn\u2019t just for would-be comedians and first dates. Adding humor to your 404 page design can also tap into so-called \u2018visceral design principles\u2019. Or, as they explain on blog Mysterious Trousers,"}, {"aa18": "\u201cThe satisfying feeling we get when potential energy is converted to kinetic energy. That point where we release energy from a design in a way that creates surprise, delight, or simply a response that satisfies our desire to engage, manipulate, and shape our experience.\u201d"}, {"b40d": "A 404 page can be an opportunity to convert user frustration into satisfaction not through navigation success, but through laughter. Check out the Justinmind team\u2019s favorite 404 from Bluegg:"}, {"6c82": "Renny Gleeson goes into this in more detail in his fascinating TED talk, which explores how we can fix that broken feeling generated by 404."}, {"1d74": "Pre-empt the need for\u00a0404"}, {"ae4e": "Error messages happen, and no matter how awesome your site or app you\u2019re never going to stop that. People are always going to type URLs wrong. But that inevitability doesn\u2019t mean you shouldn\u2019t work your hardest to reduce the number of people who see your 404 page. Make sure you\u2019re not directly users to broken links internally by staying on top of site maintenance. Use tools such as 404 Checker and Screaming Frog to find and fix broken links and direct them to more appropriate or fresher content."}, {"5ab0": "Best practices for 404 pages with killer UX\u200a\u2014\u200athe\u00a0takeaway"}, {"1baa": "404 error pages used to be a huge source of user frustration and abandonment. But it doesn\u2019t have to be that way. Increasingly UI/UX designers are seeing 404s as a way to keep users engaged, introduce their brand and solve user problems. These 6 best practices will go a long way towards helping you create 404s that feel less like frustrations and more like delightful interactions."}, {"41de": "Read the original post on Justinmind\u2019s blog"}], "content": "6 best practices for 404 pages with killer\u00a0UX Design error pages that boost usability, improve user experience and even raise a smile with these 6 top tips Urgh, a 404 page! No one likes that, right? But hold on a minute. 404 error pages don\u2019t need to be a total UX nightmare. When designed to delight and direct users, 404 pages can transform from sources of frustration to opportunities for conversion and branding. Good UI design, a focus on user experience and a little human empathy can go a long way towards improving 404 page design. This post will look at 5 error page best practices to make 404 pages more user friendly. Follow them for better usability, stronger branding and delightful user experiences. Turn user error into UX opportunity A standard, out-of-the box 404 page gives users only one option\u200a\u2014\u200ago back to where they came from. What a downer. According to the principles of gamification, users want to feel like they\u2019re making progress. So design 404 pages that allow users to progress to other parts of your site, commonly the home or features pages. This way you\u2019ve got a lot more chance of keeping them on sight and nudging them in the right direction. Justinmind keeps it simple by giving users 5 key paths to follow: And don\u2019t just give them links. Add a search box to the 404 page to allow give users back a sense of control over their experience and facilitate task success. Designer Steve Lambert combines a search box 404 with a toe-curlingly good video to create a fun and functional 404 user experience. And for usable search box design, Gyorgy Fetete has some great tips right here in Smashing Magazine. Explain, don\u2019t just error\u00a0message There\u2019s probably nothing more frustrating than landing on an error message, and then being so confused by the error message itself that you have to Google it. Take the prime example below: Excuse me? UX designers everywhere are screaming right now. Good 404 messages should concisely explain what went wrong in plain language, and what to do next. Just like Bloomberg does below. Less clutter, higher user success\u00a0rates A lot of sites used to fall into the trap of \u201cPanic! The user got a 404! Let\u2019s show them everything we got and see if they bite\u201d Bad idea. Overwhelming the user with a 404 page jam-packed with links to every nook and cranny of your site is a surefire way to cognitively overload an already frustrated user. And as NN Group guru Kathryn Whitenton makes clear, cognitive overload and usability do not go hand in hand. Best practice is to design a 404 page with a handful of key links, including a link to the Home page as an easy get-out for users who\u2019re not sure what they\u2019re looking for yet. Other options to include might be to a blog, product features or About Us. In general, aiming to include up to 4 links on a 404 page is good practice. Airbnb include more, but they\u2019re Airbnb. Read our interview with Airbnb\u2019s Director of Experience Design Use 404 pages as branding opportunities For many users, a 404 page might be the very first interaction they have with a brand. That\u2019s a lot of pressure for one little error page. Follow basic best practices such as ensuring that the aesthetics of the page fit with the rest of the site, microcopy mirrors the tone throughout, and that icons and visuals are coherent with other sites or products. Just bear in mind that functionality has to come before form in a 404. Make the brand\u2019s look and feel serve the function of the page, like Mailchimp does: Add a little\u00a0humor Make \u2019em laugh, kiddo. This advice isn\u2019t just for would-be comedians and first dates. Adding humor to your 404 page design can also tap into so-called \u2018visceral design principles\u2019. Or, as they explain on blog Mysterious Trousers, \u201cThe satisfying feeling we get when potential energy is converted to kinetic energy. That point where we release energy from a design in a way that creates surprise, delight, or simply a response that satisfies our desire to engage, manipulate, and shape our experience.\u201d A 404 page can be an opportunity to convert user frustration into satisfaction not through navigation success, but through laughter. Check out the Justinmind team\u2019s favorite 404 from Bluegg: Renny Gleeson goes into this in more detail in his fascinating TED talk, which explores how we can fix that broken feeling generated by 404. Pre-empt the need for\u00a0404 Error messages happen, and no matter how awesome your site or app you\u2019re never going to stop that. People are always going to type URLs wrong. But that inevitability doesn\u2019t mean you shouldn\u2019t work your hardest to reduce the number of people who see your 404 page. Make sure you\u2019re not directly users to broken links internally by staying on top of site maintenance. Use tools such as 404 Checker and Screaming Frog to find and fix broken links and direct them to more appropriate or fresher content. Best practices for 404 pages with killer UX\u200a\u2014\u200athe\u00a0takeaway 404 error pages used to be a huge source of user frustration and abandonment. But it doesn\u2019t have to be that way. Increasingly UI/UX designers are seeing 404s as a way to keep users engaged, introduce their brand and solve user problems. These 6 best practices will go a long way towards helping you create 404s that feel less like frustrations and more like delightful interactions. Read the original post on Justinmind\u2019s blog ", "name": "823", "child": "823_1", "timestamp": "Apr 13"}