{"parent": "", "timestamp": "Apr 14", "title": "What\u2019s wrong with The New Pornographers?", "sentences": [{"4bbb": "What\u2019s wrong with The New Pornographers?"}, {"dd0f": "Turns out it\u2019s us, not them\u200a\u2014\u200aFox Theater, Oakland, Calif., April 13,\u00a02017"}, {"3d90": "My date informed me that she intended to take some pills before we walked from our restaurant to the Fox Theater to catch The New Pornographers in concert. I didn\u2019t know what she meant."}, {"4ac6": "\u201cI need to take my fiber pills,\u201d she re-stated."}, {"1ea9": "Ah. Rock \u2019n\u2019 roll, man. When in Oakland\u00a0\u2026."}, {"9228": "The end of all the\u00a0medicine"}, {"dfe5": "Alas, we are the dominant demographic for The New Pornographers. There are a lot of gray and/or balding and fiber-enhanced TNP fans at their shows. Me and the wife, included."}, {"0975": "Thank God (or at the very least, Canada) for this band and their uncommonly catchy ear candy. Who else to bring the middle-aged out into the darkness and overwhelm our tinnitus with a deep catalog of tightly harmonized, power-pop confections? I feel the need to apologize to The New Pornographers on behalf of the audience for not being younger and better looking. But what do you expect when you hang around for 18 years and seven studio albums?"}, {"7803": "Your audience gets old, that\u2019s what. Nobody feels worse about that than I do."}, {"bb4c": "So there\u2019s your first problem. We\u2019re there for the show. The songs. But we\u2019re going to be reasonable about it. Because we got work tomorrow and more pills to take."}, {"0700": "So do The New Pornographers, too. If this is not a band of introverts, then they are a band of the severely repressed. Showmanship is not their thing\u200a\u2014\u200aTNP is Carl \u201cA.C.\u201d Newman\u2019s baby and all performance cues stem from his initiation. Which runs the gamut from petite, unassuming 40-something man in a t-shirt to the same man with a twitching leg. Freddie Mercury, he is not. Or Billy Squier (warning: you cannot unsee this). Eye contact between band members appears to be rationed. Straying from your spot doesn\u2019t happen. Which is fine."}, {"60d1": "\u201cFine\u201d is not what propels one to passion, of course. For The New Pornographers and their fans in the 3/4-filled Fox Theater, it was all about the songs\u200a\u2014\u200aa vast, deep selection of brainy, if lyrically abstract, soul-lifting bounces with a thick layer of sugary vocal harmonies. If there is one pop songsmith that knows how to consistently top an A-level, hook-laden verse with an even more compelling chorus, it\u2019s Newman."}, {"538a": "As proof, I offer 2014\u2019s \u201cBrill Bruisers,\u201d\u200a\u2014\u200afor my money, one of the finest power-pop constructions of the last decade, 2003\u2019s \u201cThe New Face of Zero and One,\u201d \u201cFrom Blown Speakers,\u201d \u201cThe Laws Have Changed,\u201d \u201cJuly Jones,\u201d or about two-thirds of 2005\u2019s Twin Cinema or 2007\u2019s (underrated) Challengers albums."}, {"c797": "Power pop perfection"}, {"e2a1": "Shut up and tell us about the\u00a0concert"}, {"7df5": "The show kicked off with the first single from Whiteout Conditions, their newest album, \u201cHigh Ticket Attractions.\u201d I\u2019ll nitpick a bit. While \u201cAttractions\u201d ticks off every box\u200a\u2014\u200ahigh energy, throbbing beat, soaring synthesizer atop choppy guitars\u200a\u2014\u200athe song doesn\u2019t do much for me. From the new record, I prefer \u201cThis is the World of the Theater,\u201d \u201cAvalanche Alley\u201d and the title track\u200a\u2014\u200aeach of which got a workout at last night\u2019s show."}, {"ffed": "For those of us oldies awaiting the goodies, we didn\u2019t have to wait long with serviceable renditions of (the afore-mentioned) \u201cThe Laws Have Changed\u201d and \u201cUse It\u201d\u200a\u2014\u200atwo long-held favorites in the Pornographers\u2019 canon."}, {"061d": "But these were not scintillating live versions. The mix was off early on. Keyboardists Blaine Thurler and Kathryn Calder\u2019s playing could barely be heard on \u201cLaws\u201d and \u201cUse It,\u201d and Newman\u2019s vocals strained on some high notes as it appeared he wasn\u2019t warmed up. Both issues worked themselves out in short order."}, {"0024": "Were they just a little flat, energy-wise? Maybe. Not a good sign being only a few shows in to a tour that will take them through much of the U.S. through early May, and then on to Europe after that."}, {"289b": "A highlight: guest touring performer Simi Stone brought some stage sizzle as she sang harmony and added violin and percussion. Placed up front and center alongside Newman and vocal goddess Neko Case, Stone\u2019s enthusiasm for performing clearly contrasted from the more, let\u2019s say Canadian, performing style of the regular Pornographers. But The New Pornographers know their catalog is beloved and will deliver it as required, very true to the original recordings; no more, no less."}, {"4ae4": "As to be expected, the set list was top-heavy with a handful of songs from the just-released Whiteout Conditions and the triumphant Brill Bruisers albums. Newman and company also unearthed a few less common oldies, including \u201cAdventures in Solitude\u201d (2007), \u201cSweet Talk, Sweet Talk\u201d (2010) and \u201cAll the Old Showstoppers\u201d (2007)\u2014 an oldie I had forgotten how much I liked. Love, actually."}, {"ad6c": "The plodding-but-still-catchy \u201cTestament to Youth in Verse\u201d\u200a\u2014\u200aa curious addition at the mid-point of the Oakland set list\u200a\u2014\u200awas delivered with Newman on vocals, which were originally handled by original/occasional Pornographer Dan Bejar, who remains absent on this tour and TNP\u2019s most recent record. I\u2019m going to nitpick again. If you\u2019re going to fill a Bejar song on the tour, how do you not pick the delightfully whimsical, transcendent \u201cMyriad Harbour\u201d or the hard-rocking (for them) \u201cJackie Dressed in Cobras,\u201d both of which killed on the 2014 tour?"}, {"74a6": "What I\u2019m saying is my wife fell asleep at one point. But I feel confident that if TNP had picked one or both of those two songs mid-show, things might have been different. (Don\u2019t be too hard on her. She works hard and had a glass of wine.)"}, {"1cae": "It\u2019s our fault, really. We\u2019re just the prevailing demographic for The New Pornographers in 2017. The songs are an irresistible draw. So much so that we played more of them on the drive back home. Until my wife fell asleep again, of course."}, {"3243": "Catch The New Pornographers on tour this spring. And make sure you\u2019re well rested."}], "author": "julian rogers", "child": "1290_1\t1290_2", "name": "1290", "content": "What\u2019s wrong with The New Pornographers? Turns out it\u2019s us, not them\u200a\u2014\u200aFox Theater, Oakland, Calif., April 13,\u00a02017 My date informed me that she intended to take some pills before we walked from our restaurant to the Fox Theater to catch The New Pornographers in concert. I didn\u2019t know what she meant. \u201cI need to take my fiber pills,\u201d she re-stated. Ah. Rock \u2019n\u2019 roll, man. When in Oakland\u00a0\u2026. The end of all the\u00a0medicine Alas, we are the dominant demographic for The New Pornographers. There are a lot of gray and/or balding and fiber-enhanced TNP fans at their shows. Me and the wife, included. Thank God (or at the very least, Canada) for this band and their uncommonly catchy ear candy. Who else to bring the middle-aged out into the darkness and overwhelm our tinnitus with a deep catalog of tightly harmonized, power-pop confections? I feel the need to apologize to The New Pornographers on behalf of the audience for not being younger and better looking. But what do you expect when you hang around for 18 years and seven studio albums? Your audience gets old, that\u2019s what. Nobody feels worse about that than I do. So there\u2019s your first problem. We\u2019re there for the show. The songs. But we\u2019re going to be reasonable about it. Because we got work tomorrow and more pills to take. So do The New Pornographers, too. If this is not a band of introverts, then they are a band of the severely repressed. Showmanship is not their thing\u200a\u2014\u200aTNP is Carl \u201cA.C.\u201d Newman\u2019s baby and all performance cues stem from his initiation. Which runs the gamut from petite, unassuming 40-something man in a t-shirt to the same man with a twitching leg. Freddie Mercury, he is not. Or Billy Squier (warning: you cannot unsee this). Eye contact between band members appears to be rationed. Straying from your spot doesn\u2019t happen. Which is fine. \u201cFine\u201d is not what propels one to passion, of course. For The New Pornographers and their fans in the 3/4-filled Fox Theater, it was all about the songs\u200a\u2014\u200aa vast, deep selection of brainy, if lyrically abstract, soul-lifting bounces with a thick layer of sugary vocal harmonies. If there is one pop songsmith that knows how to consistently top an A-level, hook-laden verse with an even more compelling chorus, it\u2019s Newman. As proof, I offer 2014\u2019s \u201cBrill Bruisers,\u201d\u200a\u2014\u200afor my money, one of the finest power-pop constructions of the last decade, 2003\u2019s \u201cThe New Face of Zero and One,\u201d \u201cFrom Blown Speakers,\u201d \u201cThe Laws Have Changed,\u201d \u201cJuly Jones,\u201d or about two-thirds of 2005\u2019s Twin Cinema or 2007\u2019s (underrated) Challengers albums. Power pop perfection Shut up and tell us about the\u00a0concert The show kicked off with the first single from Whiteout Conditions, their newest album, \u201cHigh Ticket Attractions.\u201d I\u2019ll nitpick a bit. While \u201cAttractions\u201d ticks off every box\u200a\u2014\u200ahigh energy, throbbing beat, soaring synthesizer atop choppy guitars\u200a\u2014\u200athe song doesn\u2019t do much for me. From the new record, I prefer \u201cThis is the World of the Theater,\u201d \u201cAvalanche Alley\u201d and the title track\u200a\u2014\u200aeach of which got a workout at last night\u2019s show. For those of us oldies awaiting the goodies, we didn\u2019t have to wait long with serviceable renditions of (the afore-mentioned) \u201cThe Laws Have Changed\u201d and \u201cUse It\u201d\u200a\u2014\u200atwo long-held favorites in the Pornographers\u2019 canon. But these were not scintillating live versions. The mix was off early on. Keyboardists Blaine Thurler and Kathryn Calder\u2019s playing could barely be heard on \u201cLaws\u201d and \u201cUse It,\u201d and Newman\u2019s vocals strained on some high notes as it appeared he wasn\u2019t warmed up. Both issues worked themselves out in short order. Were they just a little flat, energy-wise? Maybe. Not a good sign being only a few shows in to a tour that will take them through much of the U.S. through early May, and then on to Europe after that. A highlight: guest touring performer Simi Stone brought some stage sizzle as she sang harmony and added violin and percussion. Placed up front and center alongside Newman and vocal goddess Neko Case, Stone\u2019s enthusiasm for performing clearly contrasted from the more, let\u2019s say Canadian, performing style of the regular Pornographers. But The New Pornographers know their catalog is beloved and will deliver it as required, very true to the original recordings; no more, no less. As to be expected, the set list was top-heavy with a handful of songs from the just-released Whiteout Conditions and the triumphant Brill Bruisers albums. Newman and company also unearthed a few less common oldies, including \u201cAdventures in Solitude\u201d (2007), \u201cSweet Talk, Sweet Talk\u201d (2010) and \u201cAll the Old Showstoppers\u201d (2007)\u2014 an oldie I had forgotten how much I liked. Love, actually. The plodding-but-still-catchy \u201cTestament to Youth in Verse\u201d\u200a\u2014\u200aa curious addition at the mid-point of the Oakland set list\u200a\u2014\u200awas delivered with Newman on vocals, which were originally handled by original/occasional Pornographer Dan Bejar, who remains absent on this tour and TNP\u2019s most recent record. I\u2019m going to nitpick again. If you\u2019re going to fill a Bejar song on the tour, how do you not pick the delightfully whimsical, transcendent \u201cMyriad Harbour\u201d or the hard-rocking (for them) \u201cJackie Dressed in Cobras,\u201d both of which killed on the 2014 tour? What I\u2019m saying is my wife fell asleep at one point. But I feel confident that if TNP had picked one or both of those two songs mid-show, things might have been different. (Don\u2019t be too hard on her. She works hard and had a glass of wine.) It\u2019s our fault, really. We\u2019re just the prevailing demographic for The New Pornographers in 2017. The songs are an irresistible draw. So much so that we played more of them on the drive back home. Until my wife fell asleep again, of course. Catch The New Pornographers on tour this spring. And make sure you\u2019re well rested. "}