{"parent": "", "timestamp": "Apr 16", "title": "Nintendo Shouldn\u2019t Be Running\u00a0Nintendo", "sentences": [{"8c26": "image via ApertureGames"}, {"e37e": "Nintendo Shouldn\u2019t Be Running\u00a0Nintendo"}, {"0a59": "The Absolutely Insane Death of the NES\u00a0Classic"}, {"2f9e": "It\u2019s hard for me to remember being as mad at a tech company announcement as I was a few days ago when Nintendo announced they were killing the NES Classic. You know, their retro gaming device that was so popular when it went on sale last year that it instantly sold out, broke Amazon,\u00b9 and was still impossible to find months later."}, {"a73d": "Yes, after releasing a number of decidedly unpopular products for years, Nintendo is now killing off one of its biggest hits. Yes, it\u2019s infuriating."}, {"11dd": "The theories as to why they\u2019re doing this range from silly to insane (read some of the replies here). But no one seems to want to come out and give the Occam\u2019s Razor take: Nintendo doesn\u2019t know what they\u2019re doing."}, {"3ebb": "I used to get a lot of shit for being an Apple apologist back in the day. Nintendo apologists are far worse. They\u2019re absolutely batshit crazy in their thinking that this latest move by their favorite company is a brilliant marketing maneuver. Or better: a masterful game of mind manipulation. This will only lead to bigger and better things for Nintendo, they say."}, {"8f93": "It\u2019s neither of those things. It\u2019s incompetence."}, {"19ce": "Just read Nintendo\u2019s own statement on the matter:"}, {"95d5": "\u201cThroughout April, NOA territories will receive the last shipments of Nintendo Entertainment System: NES Classic Edition systems for this year. We encourage anyone interested in obtaining this system to check with retail outlets regarding availability. We understand that it has been difficult for many consumers to find a system, and for that we apologize. We have paid close attention to consumer feedback, and we greatly appreciate the incredible level of consumer interest and support for this product.\u201d"}, {"0112": "My rough translation:"}, {"4493": "We\u2019re killing the product, the last shipments are going out now. Don\u2019t ask us if we have anymore, go complain to your local stores. We know most consumers that wanted one couldn\u2019t find a system for the past several months. And now they undoubtedly will never be able to. Whoops. But after reading over the feedback and excitement about the system, we realize we have no idea how to ever please our fans. So instead, we\u2019re aiming our NES Zapper right at our own feet and pulling the trigger. But thanks."}, {"ebf0": "This is a company that drunkenly stumbled down the right path, and once it sobered up, realized they were on the right path, freaked out, and ran back the other way. They accidentally launched a hit product and then literally didn\u2019t know what to do."}, {"8cee": "Whenever I rip the company, I feel the need to reiterate that I love Nintendo. They have some of the best IP ever created by mankind. I desperately want them to succeed. But they\u2019ve done so many dumb things over the years that I\u2019d really just prefer some other entity ran the company. Nintendo, at some point, is going to fuck this up in a way that can\u2019t be unfucked."}, {"ebbc": "The Switch is fine. I\u2019m now a few weeks into owning it. Zelda is amazing. The console itself is fairly \u201cmeh.\u201d Mario Kart can\u2019t come soon enough. In about a month, we\u2019ll be saying the same thing about the next Super Mario game. They were so goddamn close."}, {"2a9d": "Where the fuck are the virtual console games? You could have argued Nintendo was saving those for the NES Classic. You can no longer argue that. At this point, I think we all have to acknowledge that balls might exist simply for Nintendo to drop them. Their other favorite ball game."}, {"8446": "Please buy them, Apple. Or Disney. Someone take this IP out of its company\u2019s misery."}, {"fed2": "\u00b9 I actually tried to buy the NES Classic the moment it went on sale. For about an hour, you couldn\u2019t get the page to load. When you could, it was say it wasn\u2019t yet on sale. It was. It was just already sold out."}], "author": "M.G. Siegler", "child": "1291_1\t1291_2\t1291_31291_1\t1291_2\t1291_3", "name": "1291", "content": "image via ApertureGames Nintendo Shouldn\u2019t Be Running\u00a0Nintendo The Absolutely Insane Death of the NES\u00a0Classic It\u2019s hard for me to remember being as mad at a tech company announcement as I was a few days ago when Nintendo announced they were killing the NES Classic. You know, their retro gaming device that was so popular when it went on sale last year that it instantly sold out, broke Amazon,\u00b9 and was still impossible to find months later. Yes, after releasing a number of decidedly unpopular products for years, Nintendo is now killing off one of its biggest hits. Yes, it\u2019s infuriating. The theories as to why they\u2019re doing this range from silly to insane (read some of the replies here). But no one seems to want to come out and give the Occam\u2019s Razor take: Nintendo doesn\u2019t know what they\u2019re doing. I used to get a lot of shit for being an Apple apologist back in the day. Nintendo apologists are far worse. They\u2019re absolutely batshit crazy in their thinking that this latest move by their favorite company is a brilliant marketing maneuver. Or better: a masterful game of mind manipulation. This will only lead to bigger and better things for Nintendo, they say. It\u2019s neither of those things. It\u2019s incompetence. Just read Nintendo\u2019s own statement on the matter: \u201cThroughout April, NOA territories will receive the last shipments of Nintendo Entertainment System: NES Classic Edition systems for this year. We encourage anyone interested in obtaining this system to check with retail outlets regarding availability. We understand that it has been difficult for many consumers to find a system, and for that we apologize. We have paid close attention to consumer feedback, and we greatly appreciate the incredible level of consumer interest and support for this product.\u201d My rough translation: We\u2019re killing the product, the last shipments are going out now. Don\u2019t ask us if we have anymore, go complain to your local stores. We know most consumers that wanted one couldn\u2019t find a system for the past several months. And now they undoubtedly will never be able to. Whoops. But after reading over the feedback and excitement about the system, we realize we have no idea how to ever please our fans. So instead, we\u2019re aiming our NES Zapper right at our own feet and pulling the trigger. But thanks. This is a company that drunkenly stumbled down the right path, and once it sobered up, realized they were on the right path, freaked out, and ran back the other way. They accidentally launched a hit product and then literally didn\u2019t know what to do. Whenever I rip the company, I feel the need to reiterate that I love Nintendo. They have some of the best IP ever created by mankind. I desperately want them to succeed. But they\u2019ve done so many dumb things over the years that I\u2019d really just prefer some other entity ran the company. Nintendo, at some point, is going to fuck this up in a way that can\u2019t be unfucked. The Switch is fine. I\u2019m now a few weeks into owning it. Zelda is amazing. The console itself is fairly \u201cmeh.\u201d Mario Kart can\u2019t come soon enough. In about a month, we\u2019ll be saying the same thing about the next Super Mario game. They were so goddamn close. Where the fuck are the virtual console games? You could have argued Nintendo was saving those for the NES Classic. You can no longer argue that. At this point, I think we all have to acknowledge that balls might exist simply for Nintendo to drop them. Their other favorite ball game. Please buy them, Apple. Or Disney. Someone take this IP out of its company\u2019s misery. \u00b9 I actually tried to buy the NES Classic the moment it went on sale. For about an hour, you couldn\u2019t get the page to load. When you could, it was say it wasn\u2019t yet on sale. It was. It was just already sold out. "}