{"parent": "", "timestamp": "Feb 9", "title": "The Perks of Small Things\u200a\u2014\u200aSolid State\u00a0Group", "sentences": [{"578e": "The Perks of Small Things\u200a\u2014\u200aSolid State\u00a0Group"}, {"fa90": "*This is a guest post written by Solid State Group*"}, {"de84": "After 14 years Solid State Group has decided it\u2019s about bloody time we hired a marketer."}, {"6394": "Ordinarily we\u2019d have some lovely marketing spiel about who we are, what we stand for, but that\u2019s not how we operate."}, {"e64c": "So, we thought we take some time to talk to you about who we actually are, without all the \u201ccruft\u201d that normally goes with the territory."}, {"915b": "All that glitter\u2019s ain\u2019t\u00a0gold."}, {"1437": "I pity the\u00a0fool\u2026"}, {"683f": "There\u2019s not a company in the world that doesn\u2019t offer customary socialising events, enforced fun we call them, so of course we love getting on the beers, breaking up to play FIFA or Rocket League, occasionally throwing axes\u00a0\u2026 but we have no time for inter-floor play slides, ball pits or other bollocks. It\u2019s a waste of money that could be better spent on the things that matter."}, {"d18f": "We give back to our staff properly with a weekly open invite to The Princess Pub, 2 full on parties a year and taking the whole company to SXSW."}, {"16de": "And while that\u2019s fun, like I said, it\u2019s the small things that matter most to us."}, {"22d3": "Of top priority to us is the work is challenging and fun, the camaraderie is tight and the people we work with are seen as just that\u200a\u2014\u200apeople. We hire for culture first and foremost. And, that\u2019s what the Solid State team feel too."}, {"f9bb": "One of our most vital values is that We take things to heart. Our team means a lot to us. We won\u2019t force people to work long hours and we protect team members from overbearing demands. Our clients are an extension of that team. This doesn\u2019t mean we\u2019re overly sensitive, we\u2019re pragmatic, and we\u2019re radically honest, we believe that our work matters, and we respect that, but most of we expect you to feel the same."}, {"0cc5": "Throwing axes & throwing\u00a0shapes."}, {"9087": "\ud83d\ude4a Values are bullshit if they are not lived up to\u00a0\ud83d\ude4a"}, {"a018": "Perks are not the things we listed above\u200a\u2014\u200aeven if they do beat most companies by a country mile\u200a\u2014\u200afor us our values are the perks."}, {"99a0": "Over the last 14 years we\u2019ve come to identify the values that matter to us all, these can be broken down in to 4 key pints\u200a\u2014\u200asorry, points."}, {"db21": "Oh, and speaking of values"}, {"11d8": "This is some of the things we value -"}, {"6754": "So if you want to work somewhere that understands you\u2019re human, that you want to do great work with other people who believe in craft, passion, empathy and doing great work, then get it touch. We\u2019d love to hear from you."}, {"7d2b": "Here\u2019s the Link to\u00a0apply"}], "author": "Benjamin Southworth", "child": "1325_1\t1325_2\t1325_3", "name": "1325", "content": "The Perks of Small Things\u200a\u2014\u200aSolid State\u00a0Group *This is a guest post written by Solid State Group* After 14 years Solid State Group has decided it\u2019s about bloody time we hired a marketer. Ordinarily we\u2019d have some lovely marketing spiel about who we are, what we stand for, but that\u2019s not how we operate. So, we thought we take some time to talk to you about who we actually are, without all the \u201ccruft\u201d that normally goes with the territory. All that glitter\u2019s ain\u2019t\u00a0gold. I pity the\u00a0fool\u2026 There\u2019s not a company in the world that doesn\u2019t offer customary socialising events, enforced fun we call them, so of course we love getting on the beers, breaking up to play FIFA or Rocket League, occasionally throwing axes\u00a0\u2026 but we have no time for inter-floor play slides, ball pits or other bollocks. It\u2019s a waste of money that could be better spent on the things that matter. We give back to our staff properly with a weekly open invite to The Princess Pub, 2 full on parties a year and taking the whole company to SXSW. And while that\u2019s fun, like I said, it\u2019s the small things that matter most to us. Of top priority to us is the work is challenging and fun, the camaraderie is tight and the people we work with are seen as just that\u200a\u2014\u200apeople. We hire for culture first and foremost. And, that\u2019s what the Solid State team feel too. One of our most vital values is that We take things to heart. Our team means a lot to us. We won\u2019t force people to work long hours and we protect team members from overbearing demands. Our clients are an extension of that team. This doesn\u2019t mean we\u2019re overly sensitive, we\u2019re pragmatic, and we\u2019re radically honest, we believe that our work matters, and we respect that, but most of we expect you to feel the same. Throwing axes & throwing\u00a0shapes. \ud83d\ude4a Values are bullshit if they are not lived up to\u00a0\ud83d\ude4a Perks are not the things we listed above\u200a\u2014\u200aeven if they do beat most companies by a country mile\u200a\u2014\u200afor us our values are the perks. Over the last 14 years we\u2019ve come to identify the values that matter to us all, these can be broken down in to 4 key pints\u200a\u2014\u200asorry, points. Oh, and speaking of values This is some of the things we value - So if you want to work somewhere that understands you\u2019re human, that you want to do great work with other people who believe in craft, passion, empathy and doing great work, then get it touch. We\u2019d love to hear from you. Here\u2019s the Link to\u00a0apply "}