{"parent": "", "timestamp": "Apr 8", "title": "We depend on\u00a0others", "sentences": [{"3c8a": "We depend on\u00a0others"}, {"f099": "Conversation with an Uber\u00a0driver"}, {"c307": "I was in San Jose this week on a work trip but thankfully found some time with my friends too. It was a beautiful trip. But I did have to work on one of the days and that made me take an Uber."}, {"6d43": "The driver was Mexican and he missed his home. He asked me where I was from since it was quite obvious that I was here for work\u200a\u2014\u200aI was dressed in a business suit and was picked up outside the office complex. When I told him that I was from India, he did one of those sighs that seems to communicate empathy, without using too many words. \u201cThat\u2019s far,\u201d he said. \u201cYes,\u201d I replied. \u201cVery far.\u201d"}, {"ab70": "\u201cHalf way across the world, isn\u2019t it?\u201d"}, {"3882": "\u201cThat is correct.\u201d"}, {"9941": "\u201cDid you take a direct flight?\u201d"}, {"2db1": "\u201cNo,\u201d I said. \u201cI had a stopover in Abu Dhabi.\u201d"}, {"7666": "\u201cThey made you check-in your laptop?\u201d"}, {"4fd3": "\u201cYes,\u201d I replied. \u201cAnd one of the passengers on the flight was very upset because he found his laptop crushed. Apparantly, the airlines staff is not gentle with the bags. Who knew!\u201d"}, {"cc69": "Laughs. \u201cBut I would never take a direct flight,\u201d he said. \u201cI am afraid that they might run out of fuel. It is a really long direct flight, yes?\u201d"}, {"5cd6": "\u201cYes,\u201d I said, thinking, \u201cbut they must really plan for these things, I guess. They won\u2019t take any undue risk.\u201d"}, {"6a9e": "\u201cMaybe,\u201d he replied, thinking. \u201cBut I would still be scared.\u201d"}, {"4fb7": "Silence."}, {"ef5b": "\u201cYou know what,\u201d he said, after a long pause, \u201cI just realized that we depend on other people to get anywhere.\u201d"}, {"d109": "\u201cExactly,\u201d I said. \u201cLike I depend on you bringing me home safely right now.\u201d"}, {"38d7": "Laughs. \u201cYes,\u201d he said, \u201cthat too. But you know whenever we are taking any flight or train or cab for that matter, we are putting our lives in the hands of other people hoping that they know what they are doing. It\u2019s a little scary, no?\u201d"}, {"0be2": "\u201cI\u2019ve never really thought about it,\u201d I said. \u201cBut that is definitely correct.\u201d"}, {"3f4c": "\u201cHmm,\u201d he said, thinking."}, {"f3c2": "Of course we spoke of other things on the ride. But they were mundane (population of India\u200a\u2014\u200acompared to the US, size of the country\u200a\u2014\u200acompared to the US and Uber in India\u200a\u2014\u200acompared to the competition) and this is the segment that stuck with me."}, {"bb74": "Needless to say, I gave him 5 stars and tons of complements\u00a0on\u00a0the\u00a0app. Apparently, in the US Uber you can actually select a feedback option that says \u201cGreat Conversation\u201d! That\u2019s thoughtful."}, {"21d7": "No matter how individualistic the society becomes, we depend on other people around us more and more. We use lesser words, we don\u2019t socialize over dinners as much as we did a generation ago. We don\u2019t randomly walk over to our neighbour\u2019s house anymore at 5:30 PM to have tea with them. But we do depend on people to get anything done. The biggest change, however, is that the people we depend on now are strangers\u200a\u2014\u200acar makers, train makers, plane makers and people who are involved in fuelling and flying them. Among several others, of course. We depend increasingly little our neighbours or cousins or the closest friends for survival. We do depend on them for good times, though."}, {"4bf2": "Not surprising then that we are also starting to have\u00a0stimulating, thought provoking conversations with these strangers too! I may not know (or remember) the names of my pilots, airline staff, etc. but Jorge\u200a\u2014\u200athe\u00a0driver of a Subaru\u00a0Forester, I do know yours\u00a0now."}], "author": "Kartik Sharma", "child": "1364_1\t1364_2", "name": "1364", "content": "We depend on\u00a0others Conversation with an Uber\u00a0driver I was in San Jose this week on a work trip but thankfully found some time with my friends too. It was a beautiful trip. But I did have to work on one of the days and that made me take an Uber. The driver was Mexican and he missed his home. He asked me where I was from since it was quite obvious that I was here for work\u200a\u2014\u200aI was dressed in a business suit and was picked up outside the office complex. When I told him that I was from India, he did one of those sighs that seems to communicate empathy, without using too many words. \u201cThat\u2019s far,\u201d he said. \u201cYes,\u201d I replied. \u201cVery far.\u201d \u201cHalf way across the world, isn\u2019t it?\u201d \u201cThat is correct.\u201d \u201cDid you take a direct flight?\u201d \u201cNo,\u201d I said. \u201cI had a stopover in Abu Dhabi.\u201d \u201cThey made you check-in your laptop?\u201d \u201cYes,\u201d I replied. \u201cAnd one of the passengers on the flight was very upset because he found his laptop crushed. Apparantly, the airlines staff is not gentle with the bags. Who knew!\u201d Laughs. \u201cBut I would never take a direct flight,\u201d he said. \u201cI am afraid that they might run out of fuel. It is a really long direct flight, yes?\u201d \u201cYes,\u201d I said, thinking, \u201cbut they must really plan for these things, I guess. They won\u2019t take any undue risk.\u201d \u201cMaybe,\u201d he replied, thinking. \u201cBut I would still be scared.\u201d Silence. \u201cYou know what,\u201d he said, after a long pause, \u201cI just realized that we depend on other people to get anywhere.\u201d \u201cExactly,\u201d I said. \u201cLike I depend on you bringing me home safely right now.\u201d Laughs. \u201cYes,\u201d he said, \u201cthat too. But you know whenever we are taking any flight or train or cab for that matter, we are putting our lives in the hands of other people hoping that they know what they are doing. It\u2019s a little scary, no?\u201d \u201cI\u2019ve never really thought about it,\u201d I said. \u201cBut that is definitely correct.\u201d \u201cHmm,\u201d he said, thinking. Of course we spoke of other things on the ride. But they were mundane (population of India\u200a\u2014\u200acompared to the US, size of the country\u200a\u2014\u200acompared to the US and Uber in India\u200a\u2014\u200acompared to the competition) and this is the segment that stuck with me. Needless to say, I gave him 5 stars and tons of complements\u00a0on\u00a0the\u00a0app. Apparently, in the US Uber you can actually select a feedback option that says \u201cGreat Conversation\u201d! That\u2019s thoughtful. No matter how individualistic the society becomes, we depend on other people around us more and more. We use lesser words, we don\u2019t socialize over dinners as much as we did a generation ago. We don\u2019t randomly walk over to our neighbour\u2019s house anymore at 5:30 PM to have tea with them. But we do depend on people to get anything done. The biggest change, however, is that the people we depend on now are strangers\u200a\u2014\u200acar makers, train makers, plane makers and people who are involved in fuelling and flying them. Among several others, of course. We depend increasingly little our neighbours or cousins or the closest friends for survival. We do depend on them for good times, though. Not surprising then that we are also starting to have\u00a0stimulating, thought provoking conversations with these strangers too! I may not know (or remember) the names of my pilots, airline staff, etc. but Jorge\u200a\u2014\u200athe\u00a0driver of a Subaru\u00a0Forester, I do know yours\u00a0now. "}