{"parent": "", "timestamp": "Apr 6", "title": "Why We\u2019ve Stopped Saying \u201cCulture Fit\u201d\u200a\u2014\u200aand What We\u2019re Saying\u00a0Instead", "sentences": [{"3979": "Why We\u2019ve Stopped Saying \u201cCulture Fit\u201d\u200a\u2014\u200aand What We\u2019re Saying\u00a0Instead"}, {"0c5d": "By Courtney Seiter"}, {"31f3": "The phrase \u201cculture fit\u201d is a bit of an Inkblot test in the world of work\u200a\u2014\u200aeven when we all hear the same two words, we might be thinking entirely different things."}, {"63ab": "There are countless filters and interpretations of the phrase\u200a\u2014\u200aand a growing amount of interest in figuring out just what it means."}, {"d5f4": "When the phrase \u201cculture fit\u201d is thoughtfully and deliberately applied, it can mean a gauge for your company\u2019s essential values. At other companies, it might simply mean, \u201cIs this a person with whom you want to have a beer after work?\u201d"}, {"7ecc": "Wondering where that leaves people who don\u2019t drink, people who don\u2019t like beer or people who have after-work responsibilities like kids? Then you\u2019re asking some great questions."}, {"c8db": "Image courtesy of\u00a0Pixabay"}, {"0ecf": "Culture fit can be an exclusive term, perhaps even a new way to discriminate without even realizing we\u2019re doing it."}, {"31e1": "\u201cIt is an incredibly vague term, and it\u2019s a vague term often based on gut instinct,\u201d says Wharton management professor Katherine Klein. \u201cThe biggest problem is that while we invoke cultural fit as a reason to hire someone, it is far more common to use it to not hire someone. People can\u2019t tell you what aspect of the culture they are worried about.\u201d"}, {"f034": "The challenges of \u2018culture\u00a0fit\u2019"}, {"9c1d": "There are often good reasons to look for teammates who will \u201cfit in\u201d\u200a\u2014\u200athey might feel more comfortable, they could be happier and more engaged, they might stay in the role longer."}, {"6901": "The challenge is, we don\u2019t know how to measure or define a culture fit."}, {"7acf": "Even though culture fit is incredibly tough to define, most of us seem to think it\u2019s important."}, {"5cf6": "In a survey by Cubiks on job and culture fit, 82 percent of those asked said they believed measuring cultural fit was an important part of the recruitment process. But only 54 percent said that their organization has a clearly defined culture."}, {"8e49": "That means many of us are trying to measure potential newcomers to a company according to a broken scale that we wouldn\u2019t even know how to use on ourselves. Here are some of the ways the Cubiks study participants try to measure culture fit:"}, {"3ae5": "\u2026so we come up with our own flawed \u2018metrics\u2019"}, {"142f": "Without a real scale, things like gut feeling and the \u201cairport test\u201d (aka, \u201cWould I want to be stuck at an airport with this person?\u201d) are able to gain prominence to test cultural fit, even though they\u2019re far from scientific and can introduce tons of bias."}, {"8561": "When Lauren Rivera interviewed 120 decision makers at top U.S. investment banks, management consultancies and law firms about their recruiting practices, she learned that \u201cshared experiences\u201d was one of the biggest factors those hiring were using to check culture fit."}, {"214e": "\u201cShared experiences was one of the most powerful sources of chemistry, but interviewers were primarily interested in new hires whose hobbies, hometowns and biographies matched their own. Bonding over rowing college crew, getting certified in scuba, sipping single-malt Scotches in the Highlands or dining at Michelin-starred restaurants was evidence of fit; sharing a love of teamwork or a passion for pleasing clients was not. Some (former) athletes fit exclusively with other athletes; others fit only with those who played the same sport. At one hiring committee meeting I attended, I watched a partner who was an avid Red Sox fan argue for rejecting a Yankees supporter on the grounds of misfit.\u201d"}, {"9145": "When we use these kinds of methods\u200a\u2014\u200agut feeling, the \u201cairport test,\u201d or looking for shared experiences, we run the risk of creating a culture in which everyone is similar. In the best-case scenario, this leads to a lack of creativity and stunts a company\u2019s problem-solving capacity. In the worst-case scenario, it creates a faulty feedback loop that fulfills existing prejudices."}, {"b692": "Back to the Cubiks study: Although a significant number of respondents said their organization doesn\u2019t have a definition of its culture or methods in place to measure how individuals fit with it, 59 percent said they have rejected a candidate because they lacked cultural fit."}, {"036d": "Two new phrases we\u2019re trying\u00a0instead"}, {"951f": "While we\u2019re phasing the idea of \u201cculture fit\u201d out of Buffer, we still need a common language to express how a teammate works within our values and what they bring to our organization. There are two specific terms that feel like a better fit for us right now\u200a\u2014\u200awe\u2019re learning that they\u2019re particularly powerful when used together."}, {"e6f7": "Cultural contribution: What do you\u00a0add?"}, {"ed70": "One of the most resonant articles I\u2019ve read about the importance of diversity in building a team is Hiring: It\u2019s About Cultural Contribution, Not Cultural Fit by Diego Rodriguez of IDEO."}, {"59f3": "In the post, Rodriguez explains why he chooses candidates not because they fit in today but because they could make a positive contribution to the future of his company\u2019s culture."}, {"d72d": "\u201cI don\u2019t optimize for fit with our existing culture, because over time that will lead to uniformity and irrelevancy. Instead, I try to envision a future where this person\u2019s unique point of view has shifted how we work and what we value. I hire for an individual\u2019s potential cultural contribution.\u201d"}, {"2335": "This wording tweak seems to a ripe area for improvement. Jeff Vijungco, VP Employee Experience at Adobe, calls it a \u201cculture complement.\u201d Pandora employs a similar phrasing, focusing on \u201ccultural add.\u201d"}, {"c9b0": "\u201cWe believe that \u2018culture add\u2019 goes beyond recruiting,\u201d Pandora\u2019s Director of Employee Experience & Marketing, Marta Riggins, told Forbes. \u201cIt\u2019s about creating an integrated B2E (business to employee) marketing strategy to engage and attract great talent from all communities and backgrounds, develop programs to uncover and overcome bias, and fostering a culture of inclusiveness and belonging.\u201d"}, {"a5be": "Prioritizing cultural contribution over present-day fit is an exciting shift! Asking, as Rodriguez suggests, questions like \u201cWhat\u2019s lacking?\u201d and \u201cWhere do we want to go?\u201d opens up honest conversations about gaps in culture."}, {"2399": "At Buffer, this has allowed us to name aspects of our culture that aren\u2019t where we would like them to be, and then strive to improve on those areas. We ask questions like:"}, {"b93d": "Ideally, we\u2019re always asking what perspectives we\u2019re lacking as we make a decision or build a product. We also ask how we can make Buffer a better place to work for parents, LGBT teammates, those with disabilities, those for whom English is not their first language, and other aspects of identity. Working towards improving Buffer\u2019s culture where we\u2019re lacking is a strategic decision and one that feels positive to us."}, {"197c": "Values fit: Are you aligned with specific\u00a0values?"}, {"97c2": "Bringing in diverse viewpoints is great, but without any common ground to unite teammates, we could end up with a lot of division and inclusion challenges."}, {"b6ff": "That\u2019s where the other phrase getting a lot of play at Buffer comes in. \u201cValues fit\u201d is a slight but meaningful iteration on culture fit that came to us via Aubrey Blanche of Atlassian."}, {"dd6f": "\u201cShifting our focus from \u2018culture fit\u2019 to \u2018values fit\u2019 helps us hire people who share our goals, not necessarily our viewpoints or backgrounds,\u201d Blanche explained to Fast Company in 2016."}, {"5a63": "Making this shift led to improved diversity among more teams at Atlassian. For us at Buffer, it has provided us with a way to stay true to our values and united in the core beliefs that make Buffer the company that we know and love, while also leaving plenty of room for bringing your authentic self to work, including all the perspectives and experiences that make you unique."}, {"a954": "We don\u2019t all have to have the same background, life experiences or abilities to focus on the values that guide our work."}, {"4272": "We try to be specific about how we measure values fit, too. We ask specific, deliberate interview questions (the same ones, in the same order, for every candidate) designed to speak to each of our core values, and everyone who interviews at Buffer knows how to test a good, not-so-good or just OK answer for every question."}, {"2a2b": "It\u2019s quite encouraging to see this phrase inching up in popularity over time\u2013it might even be primed to take over \u201cculture fit,\u201d which would be a positive change in my mind."}, {"1106": "I\u2019m not convinced \u201cvalues fit\u201d is a 100% bias-free framework to evaluate potential teammates, but when we combine it with the concept of cultural contribution, it feels like a healthy step forward."}, {"f2f3": "Over to\u00a0you!"}, {"3f6e": "Like many elements of Buffer, our vocabulary around culture and \u201cculture fit\u201d is constantly evolving, and I imagine it will continue to do so. We learn so much from our community, so I\u2019d love to hear from you if you have thoughts on this topic."}, {"8e57": "How does the phrase \u201cculture fit\u201d feel to you? Do you use it or another phrase?"}, {"9146": "Tell us all about in the comments!"}, {"48bf": "Originally published at open.buffer.com on April 6, 2017."}], "author": "Buffer", "child": "1377_1\t1377_2\t1377_3\t1377_4\t1377_5\t1377_61377_1\t1377_2\t1377_3\t1377_4\t1377_5\t1377_6", "name": "1377", "content": "Why We\u2019ve Stopped Saying \u201cCulture Fit\u201d\u200a\u2014\u200aand What We\u2019re Saying\u00a0Instead By Courtney Seiter The phrase \u201cculture fit\u201d is a bit of an Inkblot test in the world of work\u200a\u2014\u200aeven when we all hear the same two words, we might be thinking entirely different things. There are countless filters and interpretations of the phrase\u200a\u2014\u200aand a growing amount of interest in figuring out just what it means. When the phrase \u201cculture fit\u201d is thoughtfully and deliberately applied, it can mean a gauge for your company\u2019s essential values. At other companies, it might simply mean, \u201cIs this a person with whom you want to have a beer after work?\u201d Wondering where that leaves people who don\u2019t drink, people who don\u2019t like beer or people who have after-work responsibilities like kids? Then you\u2019re asking some great questions. Image courtesy of\u00a0Pixabay Culture fit can be an exclusive term, perhaps even a new way to discriminate without even realizing we\u2019re doing it. \u201cIt is an incredibly vague term, and it\u2019s a vague term often based on gut instinct,\u201d says Wharton management professor Katherine Klein. \u201cThe biggest problem is that while we invoke cultural fit as a reason to hire someone, it is far more common to use it to not hire someone. People can\u2019t tell you what aspect of the culture they are worried about.\u201d The challenges of \u2018culture\u00a0fit\u2019 There are often good reasons to look for teammates who will \u201cfit in\u201d\u200a\u2014\u200athey might feel more comfortable, they could be happier and more engaged, they might stay in the role longer. The challenge is, we don\u2019t know how to measure or define a culture fit. Even though culture fit is incredibly tough to define, most of us seem to think it\u2019s important. In a survey by Cubiks on job and culture fit, 82 percent of those asked said they believed measuring cultural fit was an important part of the recruitment process. But only 54 percent said that their organization has a clearly defined culture. That means many of us are trying to measure potential newcomers to a company according to a broken scale that we wouldn\u2019t even know how to use on ourselves. Here are some of the ways the Cubiks study participants try to measure culture fit: \u2026so we come up with our own flawed \u2018metrics\u2019 Without a real scale, things like gut feeling and the \u201cairport test\u201d (aka, \u201cWould I want to be stuck at an airport with this person?\u201d) are able to gain prominence to test cultural fit, even though they\u2019re far from scientific and can introduce tons of bias. When Lauren Rivera interviewed 120 decision makers at top U.S. investment banks, management consultancies and law firms about their recruiting practices, she learned that \u201cshared experiences\u201d was one of the biggest factors those hiring were using to check culture fit. \u201cShared experiences was one of the most powerful sources of chemistry, but interviewers were primarily interested in new hires whose hobbies, hometowns and biographies matched their own. Bonding over rowing college crew, getting certified in scuba, sipping single-malt Scotches in the Highlands or dining at Michelin-starred restaurants was evidence of fit; sharing a love of teamwork or a passion for pleasing clients was not. Some (former) athletes fit exclusively with other athletes; others fit only with those who played the same sport. At one hiring committee meeting I attended, I watched a partner who was an avid Red Sox fan argue for rejecting a Yankees supporter on the grounds of misfit.\u201d When we use these kinds of methods\u200a\u2014\u200agut feeling, the \u201cairport test,\u201d or looking for shared experiences, we run the risk of creating a culture in which everyone is similar. In the best-case scenario, this leads to a lack of creativity and stunts a company\u2019s problem-solving capacity. In the worst-case scenario, it creates a faulty feedback loop that fulfills existing prejudices. Back to the Cubiks study: Although a significant number of respondents said their organization doesn\u2019t have a definition of its culture or methods in place to measure how individuals fit with it, 59 percent said they have rejected a candidate because they lacked cultural fit. Two new phrases we\u2019re trying\u00a0instead While we\u2019re phasing the idea of \u201cculture fit\u201d out of Buffer, we still need a common language to express how a teammate works within our values and what they bring to our organization. There are two specific terms that feel like a better fit for us right now\u200a\u2014\u200awe\u2019re learning that they\u2019re particularly powerful when used together. Cultural contribution: What do you\u00a0add? One of the most resonant articles I\u2019ve read about the importance of diversity in building a team is Hiring: It\u2019s About Cultural Contribution, Not Cultural Fit by Diego Rodriguez of IDEO. In the post, Rodriguez explains why he chooses candidates not because they fit in today but because they could make a positive contribution to the future of his company\u2019s culture. \u201cI don\u2019t optimize for fit with our existing culture, because over time that will lead to uniformity and irrelevancy. Instead, I try to envision a future where this person\u2019s unique point of view has shifted how we work and what we value. I hire for an individual\u2019s potential cultural contribution.\u201d This wording tweak seems to a ripe area for improvement. Jeff Vijungco, VP Employee Experience at Adobe, calls it a \u201cculture complement.\u201d Pandora employs a similar phrasing, focusing on \u201ccultural add.\u201d \u201cWe believe that \u2018culture add\u2019 goes beyond recruiting,\u201d Pandora\u2019s Director of Employee Experience & Marketing, Marta Riggins, told Forbes. \u201cIt\u2019s about creating an integrated B2E (business to employee) marketing strategy to engage and attract great talent from all communities and backgrounds, develop programs to uncover and overcome bias, and fostering a culture of inclusiveness and belonging.\u201d Prioritizing cultural contribution over present-day fit is an exciting shift! Asking, as Rodriguez suggests, questions like \u201cWhat\u2019s lacking?\u201d and \u201cWhere do we want to go?\u201d opens up honest conversations about gaps in culture. At Buffer, this has allowed us to name aspects of our culture that aren\u2019t where we would like them to be, and then strive to improve on those areas. We ask questions like: Ideally, we\u2019re always asking what perspectives we\u2019re lacking as we make a decision or build a product. We also ask how we can make Buffer a better place to work for parents, LGBT teammates, those with disabilities, those for whom English is not their first language, and other aspects of identity. Working towards improving Buffer\u2019s culture where we\u2019re lacking is a strategic decision and one that feels positive to us. Values fit: Are you aligned with specific\u00a0values? Bringing in diverse viewpoints is great, but without any common ground to unite teammates, we could end up with a lot of division and inclusion challenges. That\u2019s where the other phrase getting a lot of play at Buffer comes in. \u201cValues fit\u201d is a slight but meaningful iteration on culture fit that came to us via Aubrey Blanche of Atlassian. \u201cShifting our focus from \u2018culture fit\u2019 to \u2018values fit\u2019 helps us hire people who share our goals, not necessarily our viewpoints or backgrounds,\u201d Blanche explained to Fast Company in 2016. Making this shift led to improved diversity among more teams at Atlassian. For us at Buffer, it has provided us with a way to stay true to our values and united in the core beliefs that make Buffer the company that we know and love, while also leaving plenty of room for bringing your authentic self to work, including all the perspectives and experiences that make you unique. We don\u2019t all have to have the same background, life experiences or abilities to focus on the values that guide our work. We try to be specific about how we measure values fit, too. We ask specific, deliberate interview questions (the same ones, in the same order, for every candidate) designed to speak to each of our core values, and everyone who interviews at Buffer knows how to test a good, not-so-good or just OK answer for every question. It\u2019s quite encouraging to see this phrase inching up in popularity over time\u2013it might even be primed to take over \u201cculture fit,\u201d which would be a positive change in my mind. I\u2019m not convinced \u201cvalues fit\u201d is a 100% bias-free framework to evaluate potential teammates, but when we combine it with the concept of cultural contribution, it feels like a healthy step forward. Over to\u00a0you! Like many elements of Buffer, our vocabulary around culture and \u201cculture fit\u201d is constantly evolving, and I imagine it will continue to do so. We learn so much from our community, so I\u2019d love to hear from you if you have thoughts on this topic. How does the phrase \u201cculture fit\u201d feel to you? Do you use it or another phrase? Tell us all about in the comments! Originally published at open.buffer.com on April 6, 2017. "}