{"parent": "", "timestamp": "Apr 13", "title": "Mavi\u2019nin kurucusundan mesaj: \u201c88 ya\u015f\u0131nda yeni marka kuraca\u011f\u0131m\u201d", "sentences": [{"4baf": "Mavi\u2019nin kurucusundan mesaj: \u201c88 ya\u015f\u0131nda yeni marka kuraca\u011f\u0131m\u201d"}, {"abae": "Mavi Jeans ne kadar biliniyorsa, Sait Akarl\u0131lar da o kadar az tan\u0131n\u0131yor. Bu onun ki\u015fisel tercihi, ama vizyonu ve mesleki birikimi Mavi olarak g\u00f6z \u00f6n\u00fcnde varl\u0131\u011f\u0131n\u0131 s\u00fcrd\u00fcr\u00fcyor."}, {"9f83": "25 y\u0131l \u00f6nce Mavi Jeans do\u011fdu\u011funda Sait Akarl\u0131lar 51 ya\u015f\u0131ndayd\u0131. Kendisi 14 ya\u015f\u0131nda tekstil sekt\u00f6r\u00fcnde \u00e7al\u0131\u015fmaya ba\u015flam\u0131\u015ft\u0131. 37 y\u0131ll\u0131k deneyimi ve birikimi Mavi\u2019yi ortaya \u00e7\u0131kard\u0131. Yeni marka i\u00e7in daha fazla birikim oldu\u011funa g\u00f6re, \u00e7ok ileri giden bir marka bekliyoruz."}, {"7210": "Beklentiyi geride b\u0131rak\u0131p, vak\u0131aya bakal\u0131m."}, {"2dab": "E\u011fer, d\u00fcnyan\u0131n en \u00e7\u0131lg\u0131n milyarderi olarak tan\u0131nan Sir Richard Branson, \u0130stanbul TALKS konferans\u0131na gelmeseydi, bu yaz\u0131 ortaya \u00e7\u0131kmayabilirdi. Mavi, Branson\u2019\u0131n konu\u015fmas\u0131na sponsor olmu\u015ftu."}, {"2cd4": "Do\u011fru bir tercihte bulundu. \u00c7\u00fcnk\u00fc uzay meki\u011fi lansman\u0131ndan, d\u00fcnyan\u0131n bir k\u00f6\u015fesindeki yard\u0131m aktivitesine kadar hayat\u0131n\u0131n her an\u0131nda Mavi jeanlerini giyen Branson\u2019dan ba\u015fkas\u0131 olabilir miydi?"}, {"89d4": "D\u00fcnyan\u0131n en sosyal CEO\u2019su ve LinkedIn\u2019de d\u00fcnyan\u0131n en \u00e7ok takip edilen ki\u015fisi olarak \u201conline\u201d hayat\u0131n rekorlar\u0131na sahip Branson, konferansa da \u00f6zel ya\u015fam\u0131nda tercih etti\u011fi Mavi Jean\u2019iyle kat\u0131ld\u0131."}, {"a201": "Richard Branson, Virgin Galactic Spaceship Two lansman\u0131nda da Mavi Jean\u2019ini giymi\u015f ve havalara u\u00e7tu\u011fu, haf\u0131zalara kaz\u0131nan foto\u011fraf\u0131 b\u00fct\u00fcn d\u00fcnyayla payla\u015f\u0131lm\u0131\u015ft\u0131. Konferans s\u0131ras\u0131nda fonda yer alan bu foto\u011fraf, dinleyiciler aras\u0131nda da ilgi oda\u011f\u0131 oldu. Mavi CEO\u2019su C\u00fcneyt Yavuz\u2019un s\u00f6yledi\u011fine g\u00f6re k\u0131yafet sponsoru olmad\u0131klar\u0131n\u0131, bunun Branson\u2019un ki\u015fisel tercihi oldu\u011funu vurgulad\u0131."}, {"c6b3": "Sadece Branson mu? Benim neslim ad\u0131n\u0131 yeni duymu\u015f olabilir ama tutkulu takip\u00e7ileri olan Francisco Lachowski, Vini Uehara ve Luck Blue Smith de Mavi\u2019yi ta\u015f\u0131yan \u00fcnl\u00fcler."}, {"a2ce": "Biraz bizim nesildekilere bakarsak: Chelsea Clinton\u2019dan Geri Halliwell\u2019a, Cher\u2019den Antonio Banderas\u2019a, Dannii Minogue\u2019dan Billy Zane\u2019e kadar bir\u00e7ok \u00fcnl\u00fcn\u00fcn favorisi yine Mavi\u2019ydi."}, {"b950": "Amerika\u2019da \u00f6nce \u2018Made in Maviland\u2019, arkas\u0131ndan \u2018Mavifits\u2019 reklam kampanyalar\u0131 y\u00fcr\u00fcten Mavi\u2019nin art\u0131k bir \u2018d\u00fcnya markas\u0131\u2019 oldu\u011fu kabul ediliyor. D\u00fcnyan\u0131n \u00f6nde gelen haftal\u0131k haber dergilerinden Time, \u201c\u0130\u015f D\u00fcnyas\u0131\u201d b\u00f6l\u00fcm\u00fcnde Mavi Jeans\u2019e yer verdi. Amerika\u2019n\u0131n \u00fcnl\u00fc erkek moda dergisi DNR\u2019\u0131n belirledi\u011fi \u2018Erkek Giyiminde En G\u00fc\u00e7l\u00fc 100\u2019 ki\u015fi aras\u0131nda Mavi Amerika Ba\u015fkan\u0131 Ersin Akarl\u0131lar da yer ald\u0131."}, {"d708": "Peki, bu duruma nas\u0131l gelindi?"}, {"57a8": "Mavi Jeans\u2019i \u00fcreten Erak Giyim\u2019in arkas\u0131nda bug\u00fcn 76 y\u0131ll\u0131k bir deneyim var. Sait Akarl\u0131lar, i\u015f hayat\u0131na 14 ya\u015f\u0131nda terzi \u00e7\u0131ra\u011f\u0131 olarak ba\u015flad\u0131. 1954 y\u0131l\u0131nda tekstille tan\u0131\u015f\u0131yor. \u00d6nce spor giyim dikimi ile mesle\u011fe ba\u015flayan Akarl\u0131lar, sonra mont, pantolon dikmeyi \u00f6\u011freniyor. 5 y\u0131l sonra i\u015fverenli\u011fe ad\u0131m atarak 1960 y\u0131l\u0131nda at\u00f6lye kuruyor. 1971 y\u0131l\u0131nda G\u00fcven Giyim ile \u00fcretim ve \u00e7al\u0131\u015fma alan\u0131n\u0131 geni\u015fletiyor."}, {"68ca": "80 \u00f6ncesi hem ihracat cazip de\u011fildi. K\u00fcresel deneyiminde ve kendi marka s\u00fcrecine katk\u0131 yapan ise, 1984 y\u0131l\u0131nda kurdu\u011fu Erak \u015firketiyle Lee, Mustang, Wrangler gibi d\u00fcnya markalar\u0131n\u0131n \u00fcretimini T\u00fcrkiye\u2019de yapmaya ba\u015fl\u0131yor. Akarl\u0131lar, \u201cYola \u00e7\u0131karken 100 y\u0131ll\u0131k jean \u015firketlerini \u00f6rnek ald\u0131k, nesillere intikal eden \u015firket olmay\u0131 hedefledik\u201d diyerek d\u00fc\u015f\u00fcncelerini payla\u015f\u0131yor. Yedi y\u0131l sonra 1991 y\u0131l\u0131nda ise grubun \u2018amiral gemisi\u2019 Mavi Jeans\u2019in kurulu\u015fu ger\u00e7ekle\u015fiyor."}, {"ca01": "Sait Akarl\u0131lar, Mavi vizyonunu ve kurulu\u015funu \u015f\u00f6yle anlat\u0131yor: \u201c1980\u2019li y\u0131llarda ihracatta bir patlama oldu. Daha \u00f6nce blue jean kuma\u015f\u0131 \u00fcreten fabrikalar yoktu. Bu d\u0131\u015fa a\u00e7\u0131lma y\u0131llar\u0131nda bu fabrikalar olu\u015ftu. Bu fabrikalar olunca ve di\u011fer yabanc\u0131 markalar T\u00fcrkiye\u2019ye girince biz de bu i\u015fte bir gelecek g\u00f6rd\u00fck. Kuma\u015f var, pamuk var dedik ve konfeksiyon \u00fcretimine girmeyi d\u00fc\u015f\u00fcnd\u00fck. Mavi Jeans de, bu fikrimizden sonra olu\u015ftu. T\u00fcrkiye \u00e7ok gen\u00e7 n\u00fcfusa sahip bir \u00fclke. Biz de gen\u00e7 insanlar\u0131n spor giyim i\u00e7erisinde jean pantolona ilgi duyacaklar\u0131n\u0131 d\u00fc\u015f\u00fcnd\u00fck. Baz\u0131 ara\u015ft\u0131rmalar yapt\u0131k. Spor giyim i\u00e7erisinde jeanin yerinin iyi zamanlarda y\u00fczde 80\u201385\u2019lere ula\u015ft\u0131\u011f\u0131n\u0131, en d\u00fc\u015f\u00fck zamanlarda bile y\u00fczde 60\u2019lara d\u00fc\u015fmedi\u011fini g\u00f6rd\u00fck. Bu ara\u015ft\u0131rmalardan sonra fabrikaya ve markaya yat\u0131r\u0131m yapt\u0131k\u201d."}, {"b94b": "Hala ayn\u0131 vizyon do\u011frultusunda markan\u0131n konumland\u0131r\u0131ld\u0131\u011f\u0131n\u0131 d\u00fc\u015f\u00fcn\u00fcyorum."}, {"3684": "\u0130zleyen y\u0131llarda Mavi\u2019nin geli\u015fmeleri \u00fczerine \u015fu notlar d\u00fc\u015f\u00fclebilir:"}, {"7f14": "1993\u2019te Mavi Jeans\u2019in geni\u015f kapsaml\u0131 ilk yurti\u00e7i reklam kampanyas\u0131 yap\u0131ld\u0131. Akmerkez ve Galeria ma\u011fazalar\u0131 ile perakendecili\u011fe ba\u015fland\u0131."}, {"3db1": "1994\u2019te ilk ihracat\u0131\u00a0ba\u015flad\u0131."}, {"2d58": "Mavi Jeans, jeanin anavatan\u0131 kabul edilen ABD\u2019de ba\u015far\u0131s\u0131 T\u00fcrkiye\u2019den g\u00f6rd\u00fc\u011f\u00fcm\u00fcz kadar parlak de\u011fil. Asl\u0131nda yurtd\u0131\u015f\u0131nda yapacaklar\u0131 i\u015f \u00e7ok ve son 15 y\u0131l yeni deneyimler ile ge\u00e7ti. Her \u00fclkede kendi stratejisini olu\u015fturacak Mavi \u015eirketleri kuruldu."}, {"a358": "Rusya da bu ba\u011flamda de\u011ferlendirilmelidir. 2015 y\u0131l\u0131 Rusya i\u00e7in hamle y\u0131l\u0131 olacakt\u0131 ama kriz dolay\u0131s\u0131yla \u015fimdilik beklemeye al\u0131nd\u0131. Yani Avrupa\u2019da, Rusya\u2019da veya herhangi bir d\u00fcnya \u00fclkesinde birinci T\u00fcrk markas\u0131 Mavi de\u011fil. Zaten reklam kampanyalar\u0131na bakarsak, i\u00e7 pazara hitap eden mottolar var. Bakal\u0131m k\u00fcresel bir s\u00f6ylemle ne zaman \u00e7\u0131k\u0131\u015f yapacak?"}, {"c92c": "Unutmayal\u0131m ki, sat\u0131\u015f rakamlar\u0131ndan bahsediyorum. Alg\u0131s\u0131 her zaman sat\u0131\u015f rakamlar\u0131n\u0131z\u0131n \u00fcst\u00fcnde olan bir marka olu\u015fturuldu\u011funun hakk\u0131n\u0131 verelim. Peki, bundan sonra Mavi nereye ko\u015facak? Bunun cevab\u0131n\u0131 da Sait Akarl\u0131lar\u2019\u0131n bir r\u00f6portajdaki s\u00f6zlerinde sakl\u0131."}, {"4913": "\u201cAile \u015firketiyiz, ancak ailenin kontrol\u00fcnde profesyonellerin liderli\u011finde y\u00f6netiliyor. Son karar ise, olumlu ya da olumsuz, ailenin en b\u00fcy\u00fc\u011f\u00fc oldu\u011fum i\u00e7in benim taraf\u0131mdan veriliyor. \u00d6rne\u011fin, bizim her departman\u0131m\u0131z i\u015fe al\u0131mda kendi g\u00f6r\u00fc\u015fmelerini kendileri yapar, kendi ekiplerini kendileri kurarlar. Bu eleman\u0131 al burada \u00e7al\u0131\u015ft\u0131r zihniyeti hi\u00e7bir yerde yoktur.\u201d"}, {"d062": "Yani kontroll\u00fc profesyonel kararlar ne kadar sa\u011fl\u0131kl\u0131 olur ve gen\u00e7ler ne kadar ko\u015fturursa Mavi, o ufuk noktalar\u0131na da ko\u015facak. En \u00f6nemlisi de, 88 ya\u015f\u0131nda yeni marka nas\u0131l olacak?"}, {"e8be": "Mavi Jeans'i kuran Sait Akarl\u0131lar'dan 25 y\u0131l mesaj\u0131 \"88 ya\u015f\u0131nda yeni marka kuraca\u011f\u0131m\"Mavi Jeans ne kadar biliniyorsa, Sait Akarl\u0131lar da o kadar az tan\u0131n\u0131yor. Bu onun ki\u015fisel tercihi, ama vizyonu ve mesleki\u2026thebrandage.com"}], "author": "Fikri T\u00fcrkel", "child": "1555_1\t1555_2", "name": "1555", "content": "Mavi\u2019nin kurucusundan mesaj: \u201c88 ya\u015f\u0131nda yeni marka kuraca\u011f\u0131m\u201d Mavi Jeans ne kadar biliniyorsa, Sait Akarl\u0131lar da o kadar az tan\u0131n\u0131yor. Bu onun ki\u015fisel tercihi, ama vizyonu ve mesleki birikimi Mavi olarak g\u00f6z \u00f6n\u00fcnde varl\u0131\u011f\u0131n\u0131 s\u00fcrd\u00fcr\u00fcyor. 25 y\u0131l \u00f6nce Mavi Jeans do\u011fdu\u011funda Sait Akarl\u0131lar 51 ya\u015f\u0131ndayd\u0131. Kendisi 14 ya\u015f\u0131nda tekstil sekt\u00f6r\u00fcnde \u00e7al\u0131\u015fmaya ba\u015flam\u0131\u015ft\u0131. 37 y\u0131ll\u0131k deneyimi ve birikimi Mavi\u2019yi ortaya \u00e7\u0131kard\u0131. Yeni marka i\u00e7in daha fazla birikim oldu\u011funa g\u00f6re, \u00e7ok ileri giden bir marka bekliyoruz. Beklentiyi geride b\u0131rak\u0131p, vak\u0131aya bakal\u0131m. E\u011fer, d\u00fcnyan\u0131n en \u00e7\u0131lg\u0131n milyarderi olarak tan\u0131nan Sir Richard Branson, \u0130stanbul TALKS konferans\u0131na gelmeseydi, bu yaz\u0131 ortaya \u00e7\u0131kmayabilirdi. Mavi, Branson\u2019\u0131n konu\u015fmas\u0131na sponsor olmu\u015ftu. Do\u011fru bir tercihte bulundu. \u00c7\u00fcnk\u00fc uzay meki\u011fi lansman\u0131ndan, d\u00fcnyan\u0131n bir k\u00f6\u015fesindeki yard\u0131m aktivitesine kadar hayat\u0131n\u0131n her an\u0131nda Mavi jeanlerini giyen Branson\u2019dan ba\u015fkas\u0131 olabilir miydi? D\u00fcnyan\u0131n en sosyal CEO\u2019su ve LinkedIn\u2019de d\u00fcnyan\u0131n en \u00e7ok takip edilen ki\u015fisi olarak \u201conline\u201d hayat\u0131n rekorlar\u0131na sahip Branson, konferansa da \u00f6zel ya\u015fam\u0131nda tercih etti\u011fi Mavi Jean\u2019iyle kat\u0131ld\u0131. Richard Branson, Virgin Galactic Spaceship Two lansman\u0131nda da Mavi Jean\u2019ini giymi\u015f ve havalara u\u00e7tu\u011fu, haf\u0131zalara kaz\u0131nan foto\u011fraf\u0131 b\u00fct\u00fcn d\u00fcnyayla payla\u015f\u0131lm\u0131\u015ft\u0131. Konferans s\u0131ras\u0131nda fonda yer alan bu foto\u011fraf, dinleyiciler aras\u0131nda da ilgi oda\u011f\u0131 oldu. Mavi CEO\u2019su C\u00fcneyt Yavuz\u2019un s\u00f6yledi\u011fine g\u00f6re k\u0131yafet sponsoru olmad\u0131klar\u0131n\u0131, bunun Branson\u2019un ki\u015fisel tercihi oldu\u011funu vurgulad\u0131. Sadece Branson mu? Benim neslim ad\u0131n\u0131 yeni duymu\u015f olabilir ama tutkulu takip\u00e7ileri olan Francisco Lachowski, Vini Uehara ve Luck Blue Smith de Mavi\u2019yi ta\u015f\u0131yan \u00fcnl\u00fcler. Biraz bizim nesildekilere bakarsak: Chelsea Clinton\u2019dan Geri Halliwell\u2019a, Cher\u2019den Antonio Banderas\u2019a, Dannii Minogue\u2019dan Billy Zane\u2019e kadar bir\u00e7ok \u00fcnl\u00fcn\u00fcn favorisi yine Mavi\u2019ydi. Amerika\u2019da \u00f6nce \u2018Made in Maviland\u2019, arkas\u0131ndan \u2018Mavifits\u2019 reklam kampanyalar\u0131 y\u00fcr\u00fcten Mavi\u2019nin art\u0131k bir \u2018d\u00fcnya markas\u0131\u2019 oldu\u011fu kabul ediliyor. D\u00fcnyan\u0131n \u00f6nde gelen haftal\u0131k haber dergilerinden Time, \u201c\u0130\u015f D\u00fcnyas\u0131\u201d b\u00f6l\u00fcm\u00fcnde Mavi Jeans\u2019e yer verdi. Amerika\u2019n\u0131n \u00fcnl\u00fc erkek moda dergisi DNR\u2019\u0131n belirledi\u011fi \u2018Erkek Giyiminde En G\u00fc\u00e7l\u00fc 100\u2019 ki\u015fi aras\u0131nda Mavi Amerika Ba\u015fkan\u0131 Ersin Akarl\u0131lar da yer ald\u0131. Peki, bu duruma nas\u0131l gelindi? Mavi Jeans\u2019i \u00fcreten Erak Giyim\u2019in arkas\u0131nda bug\u00fcn 76 y\u0131ll\u0131k bir deneyim var. Sait Akarl\u0131lar, i\u015f hayat\u0131na 14 ya\u015f\u0131nda terzi \u00e7\u0131ra\u011f\u0131 olarak ba\u015flad\u0131. 1954 y\u0131l\u0131nda tekstille tan\u0131\u015f\u0131yor. \u00d6nce spor giyim dikimi ile mesle\u011fe ba\u015flayan Akarl\u0131lar, sonra mont, pantolon dikmeyi \u00f6\u011freniyor. 5 y\u0131l sonra i\u015fverenli\u011fe ad\u0131m atarak 1960 y\u0131l\u0131nda at\u00f6lye kuruyor. 1971 y\u0131l\u0131nda G\u00fcven Giyim ile \u00fcretim ve \u00e7al\u0131\u015fma alan\u0131n\u0131 geni\u015fletiyor. 80 \u00f6ncesi hem ihracat cazip de\u011fildi. K\u00fcresel deneyiminde ve kendi marka s\u00fcrecine katk\u0131 yapan ise, 1984 y\u0131l\u0131nda kurdu\u011fu Erak \u015firketiyle Lee, Mustang, Wrangler gibi d\u00fcnya markalar\u0131n\u0131n \u00fcretimini T\u00fcrkiye\u2019de yapmaya ba\u015fl\u0131yor. Akarl\u0131lar, \u201cYola \u00e7\u0131karken 100 y\u0131ll\u0131k jean \u015firketlerini \u00f6rnek ald\u0131k, nesillere intikal eden \u015firket olmay\u0131 hedefledik\u201d diyerek d\u00fc\u015f\u00fcncelerini payla\u015f\u0131yor. Yedi y\u0131l sonra 1991 y\u0131l\u0131nda ise grubun \u2018amiral gemisi\u2019 Mavi Jeans\u2019in kurulu\u015fu ger\u00e7ekle\u015fiyor. Sait Akarl\u0131lar, Mavi vizyonunu ve kurulu\u015funu \u015f\u00f6yle anlat\u0131yor: \u201c1980\u2019li y\u0131llarda ihracatta bir patlama oldu. Daha \u00f6nce blue jean kuma\u015f\u0131 \u00fcreten fabrikalar yoktu. Bu d\u0131\u015fa a\u00e7\u0131lma y\u0131llar\u0131nda bu fabrikalar olu\u015ftu. Bu fabrikalar olunca ve di\u011fer yabanc\u0131 markalar T\u00fcrkiye\u2019ye girince biz de bu i\u015fte bir gelecek g\u00f6rd\u00fck. Kuma\u015f var, pamuk var dedik ve konfeksiyon \u00fcretimine girmeyi d\u00fc\u015f\u00fcnd\u00fck. Mavi Jeans de, bu fikrimizden sonra olu\u015ftu. T\u00fcrkiye \u00e7ok gen\u00e7 n\u00fcfusa sahip bir \u00fclke. Biz de gen\u00e7 insanlar\u0131n spor giyim i\u00e7erisinde jean pantolona ilgi duyacaklar\u0131n\u0131 d\u00fc\u015f\u00fcnd\u00fck. Baz\u0131 ara\u015ft\u0131rmalar yapt\u0131k. Spor giyim i\u00e7erisinde jeanin yerinin iyi zamanlarda y\u00fczde 80\u201385\u2019lere ula\u015ft\u0131\u011f\u0131n\u0131, en d\u00fc\u015f\u00fck zamanlarda bile y\u00fczde 60\u2019lara d\u00fc\u015fmedi\u011fini g\u00f6rd\u00fck. Bu ara\u015ft\u0131rmalardan sonra fabrikaya ve markaya yat\u0131r\u0131m yapt\u0131k\u201d. Hala ayn\u0131 vizyon do\u011frultusunda markan\u0131n konumland\u0131r\u0131ld\u0131\u011f\u0131n\u0131 d\u00fc\u015f\u00fcn\u00fcyorum. \u0130zleyen y\u0131llarda Mavi\u2019nin geli\u015fmeleri \u00fczerine \u015fu notlar d\u00fc\u015f\u00fclebilir: 1993\u2019te Mavi Jeans\u2019in geni\u015f kapsaml\u0131 ilk yurti\u00e7i reklam kampanyas\u0131 yap\u0131ld\u0131. Akmerkez ve Galeria ma\u011fazalar\u0131 ile perakendecili\u011fe ba\u015fland\u0131. 1994\u2019te ilk ihracat\u0131\u00a0ba\u015flad\u0131. Mavi Jeans, jeanin anavatan\u0131 kabul edilen ABD\u2019de ba\u015far\u0131s\u0131 T\u00fcrkiye\u2019den g\u00f6rd\u00fc\u011f\u00fcm\u00fcz kadar parlak de\u011fil. Asl\u0131nda yurtd\u0131\u015f\u0131nda yapacaklar\u0131 i\u015f \u00e7ok ve son 15 y\u0131l yeni deneyimler ile ge\u00e7ti. Her \u00fclkede kendi stratejisini olu\u015fturacak Mavi \u015eirketleri kuruldu. Rusya da bu ba\u011flamda de\u011ferlendirilmelidir. 2015 y\u0131l\u0131 Rusya i\u00e7in hamle y\u0131l\u0131 olacakt\u0131 ama kriz dolay\u0131s\u0131yla \u015fimdilik beklemeye al\u0131nd\u0131. Yani Avrupa\u2019da, Rusya\u2019da veya herhangi bir d\u00fcnya \u00fclkesinde birinci T\u00fcrk markas\u0131 Mavi de\u011fil. Zaten reklam kampanyalar\u0131na bakarsak, i\u00e7 pazara hitap eden mottolar var. Bakal\u0131m k\u00fcresel bir s\u00f6ylemle ne zaman \u00e7\u0131k\u0131\u015f yapacak? Unutmayal\u0131m ki, sat\u0131\u015f rakamlar\u0131ndan bahsediyorum. Alg\u0131s\u0131 her zaman sat\u0131\u015f rakamlar\u0131n\u0131z\u0131n \u00fcst\u00fcnde olan bir marka olu\u015fturuldu\u011funun hakk\u0131n\u0131 verelim. Peki, bundan sonra Mavi nereye ko\u015facak? Bunun cevab\u0131n\u0131 da Sait Akarl\u0131lar\u2019\u0131n bir r\u00f6portajdaki s\u00f6zlerinde sakl\u0131. \u201cAile \u015firketiyiz, ancak ailenin kontrol\u00fcnde profesyonellerin liderli\u011finde y\u00f6netiliyor. Son karar ise, olumlu ya da olumsuz, ailenin en b\u00fcy\u00fc\u011f\u00fc oldu\u011fum i\u00e7in benim taraf\u0131mdan veriliyor. \u00d6rne\u011fin, bizim her departman\u0131m\u0131z i\u015fe al\u0131mda kendi g\u00f6r\u00fc\u015fmelerini kendileri yapar, kendi ekiplerini kendileri kurarlar. Bu eleman\u0131 al burada \u00e7al\u0131\u015ft\u0131r zihniyeti hi\u00e7bir yerde yoktur.\u201d Yani kontroll\u00fc profesyonel kararlar ne kadar sa\u011fl\u0131kl\u0131 olur ve gen\u00e7ler ne kadar ko\u015fturursa Mavi, o ufuk noktalar\u0131na da ko\u015facak. En \u00f6nemlisi de, 88 ya\u015f\u0131nda yeni marka nas\u0131l olacak? Mavi Jeans'i kuran Sait Akarl\u0131lar'dan 25 y\u0131l mesaj\u0131 \"88 ya\u015f\u0131nda yeni marka kuraca\u011f\u0131m\"Mavi Jeans ne kadar biliniyorsa, Sait Akarl\u0131lar da o kadar az tan\u0131n\u0131yor. Bu onun ki\u015fisel tercihi, ama vizyonu ve mesleki\u2026thebrandage.com "}