{"name": "1882", "title": "I haven\u2019t cussed in 5 years. My willpower has skyrocketed.", "sentences": [{"0978": "I haven\u2019t cussed in 5 years. My willpower has skyrocketed."}, {"1988": "\u201cNo person is free who is not master of themselves.\u201d\u200a\u2014\u200aEpictetus"}, {"98e3": "I\u2019ve tried a number of multi-year experiments to boost my willpower:"}, {"2bb8": "And yet by far the easiest thing I\u2019ve done to strengthen my will was to quit saying certain 4-letter English words."}, {"ca4a": "Five years ago, I decided that going forward, I would refrain from saying any cuss word that you couldn\u2019t find in the Old Testament."}, {"1485": "My commitment was immediately put to the test. I was at my brother\u2019s house (a no-shoes household), and we had dimmed the lights so we could watch a movie. I was walking back to his living room with a bowl of freshly-popped popcorn, when suddenly a solid wood table leg appeared out of the shadows."}, {"7be8": "I stubbed my toe so hard that the entire table screeched across his hardwood floor."}, {"f968": "My family went silent. They glanced down at my gushing pinky toe. Then up at my face."}, {"07d3": "\u201cWoah!\u201d my brother\u2019s wife said. \u201cDoesn\u2019t that hurt?\u201d"}, {"d9b5": "I just stood there, squeezing my popcorn bowl. Through my clenched teeth\u200a\u2014\u200aand without really thinking about it\u200a\u2014\u200aI said: \u201cNot if you\u2019re tough.\u201d"}, {"0103": "I don\u2019t know what came over me. In truth, my toe hurt like crazy. Whatever it was, that night a family-wide meme was born."}, {"982c": "Ever since, whenever someone in our family gets injured somehow, they jokingly reply to inevitable questions about pain with \u201cNot if you\u2019re tough.\u201d Then everybody laughs."}, {"a4bc": "If this had happened before I\u2019d taken my vow of profanity silence, I would have no doubt jumped up and down shouting curse words. But instead, a serene side began to emerge and take hold of my personality."}, {"4910": "Substituting profanity with \u201caliases\u201d"}, {"ba19": "Darn. Heck. Shoot. There were softer versions of pretty much every cuss word out there, and I quickly adopted these."}, {"2399": "But one word was missing. The big one that everyone uses as a verb, adjective, and even a noun\u200a\u2014\u200asometimes all in the same sentence. And no, \u201cfudge\u201d wasn\u2019t going to cut it for me."}, {"ae5f": "Fortunately, my wife and I had just binge-watched the entire series of Battlestar Galactica over one rainy winter in Shanghai."}, {"b515": "Battlestar Galactica features a civilization that is technologically advanced, but also brooding, alcoholic, and potty-mouthed. And instead of omitting the f-word from the show entirely, like similarly gritty\u200a\u2014\u200ayet still PG-13\u200a\u2014\u200ashows did, the writers decided to make up their own f-word so that the actors could freely say on TV: frak."}, {"eaa1": "When you first watch the show, and notice them saying \u201cfrak,\u201d it\u2019s quite cheesy. The characters say things to one another like \u201cFrak you!\u201d, \u201cWhat the frak?\u201d and even \u201cGo frak yourself.\u201d"}, {"5fc8": "And of course, this was before the term \u201cfracking\u201d\u200a\u2014\u200athe environmentally questionable act of pumping high-pressure fluid into the ground to extract oil and natural gas\u200a\u2014\u200ahad entered popular lexicon."}, {"8bf9": "This made use of the word \u201cfrak\u201d even more absurd. And that absurdity lended it a certain humor. A certain power."}, {"fdeb": "So with this final addition to my array of cuss word aliases, I had everything I needed to go profanity-free."}, {"6842": "Just like how the Mr. Robot protagonist Elliot Alderson would later condition himself to hear the words \u201cEvil Corp\u201d whenever someone uttered \u201cE Corp\u201d, I conditioned myself to hear the Battlestar Galactica \u201cfrak\u201d in place of other people\u2019s f-bombs."}, {"54e2": "Over time, I reached for these aliases less and less. Sure, there were occasions where I would shout, \u201cOh, frak! Our production servers are down!\u201d But more often than not, I would just respond to bad situations with stoic silence."}, {"6a43": "A less %@#$ed-up tomorrow"}, {"2e29": "Quitting cussing wasn\u2019t all that hard to do. And in addition to strengthening my willpower, it seems to have made my day-to-day outlook a bit brighter."}, {"e198": "There isn\u2019t much solid research about the role of profanity in human psychology. There are a few one-off studies that suggest that people who cuss frequently might be smarter or perceived by others as being more honest. These conclusions seem counter-intuitive to me, but I\u2019ll keep an open mind in case more studies support this."}, {"4383": "I personally don\u2019t feel I\u2019ve lost any of my dynamic range as a result of not cussing. Not that there\u2019s anything wrong with cussing, or that it should be censored in any way. People cuss. No big deal. As of 2017, we\u2019ve got bigger issues to worry about."}, {"d88f": "On the contrary, I think that cuss words can often add a valuable dramatic effect."}, {"4a53": "Back in 1934, Hollywood studios asked the producers of the 1934 film \u201cGone with the Wind\u201d to change the now-famous line: \u201cFrankly, my dear, I don\u2019t give a damn\u201d to \u201cFrankly, my dear, I don\u2019t care.\u201d"}, {"6358": "But the producers successfully argued that the word \u201cdamn\u201d was necessary to convey the extent of the emotion, and it was left in the film."}, {"53dc": "Producers also successfully advocated for the right to use the word \u201chell\u201d in Captain Kirk\u2019s famous line, \u201cLet\u2019s get the hell out of here.\u201d This was one of the first times the word \u201chell\u201d had been used like this on broadcast television. It was in the classic 1967 Star Trek episode \u201cCity on the Edge of Forever.\u201d (By the way, if you haven\u2019t seen this episode, it\u2019s on Netflix and you should totally watch it)."}, {"0089": "One side benefit of not cussing is that I no longer have to self-censor my speech around polite company, or in front of kids. Profanity doesn\u2019t just \u201cslip out\u201d in casual banter like it used to."}, {"0ad0": "I can now just say what\u2019s on my mind, confident that, while some people may take issue with my ideas, they probably won\u2019t flinch at the words I use."}, {"2b93": "If you want to learn more about little hacks like this one that you can use to improve your willpower\u200a\u2014\u200aand thus your productivity\u200a\u2014\u200aI recommend reading this book by Stanford psychology professor Kelly McGonigal:"}, {"0142": "The Willpower Instinct: How Self-Control Works, Why It Matters, and What You Can Do to Get More of\u2026Edit descriptionamzn.to"}, {"1b67": "I plan to continue exploring habits that can boost my willpower. For as the great poet once wrote:"}, {"7295": "\u201cTis in ourselves that we are thus or thus. Our bodies are our gardens to the which our wills are gardeners.\u201d\u2015William Shakespeare, Othello"}, {"8e7f": "Thanks for reading! If you liked this article, click the \ud83d\udc9a below so other people will see this here on Medium."}], "child": "1882_1\t1882_2\t1882_3\t1882_4\t1882_5\t1882_6\t1882_7\t1882_8\t1882_9\t1882_10\t1882_11\t1882_12\t1882_13\t1882_14\t1882_15\t1882_16\t1882_17\t1882_18\t1882_19\t1882_20\t1882_21\t1882_22\t1882_23\t1882_24\t1882_25", "timestamp": "Apr 5", "content": "I haven\u2019t cussed in 5 years. My willpower has skyrocketed. \u201cNo person is free who is not master of themselves.\u201d\u200a\u2014\u200aEpictetus I\u2019ve tried a number of multi-year experiments to boost my willpower: And yet by far the easiest thing I\u2019ve done to strengthen my will was to quit saying certain 4-letter English words. Five years ago, I decided that going forward, I would refrain from saying any cuss word that you couldn\u2019t find in the Old Testament. My commitment was immediately put to the test. I was at my brother\u2019s house (a no-shoes household), and we had dimmed the lights so we could watch a movie. I was walking back to his living room with a bowl of freshly-popped popcorn, when suddenly a solid wood table leg appeared out of the shadows. I stubbed my toe so hard that the entire table screeched across his hardwood floor. My family went silent. They glanced down at my gushing pinky toe. Then up at my face. \u201cWoah!\u201d my brother\u2019s wife said. \u201cDoesn\u2019t that hurt?\u201d I just stood there, squeezing my popcorn bowl. Through my clenched teeth\u200a\u2014\u200aand without really thinking about it\u200a\u2014\u200aI said: \u201cNot if you\u2019re tough.\u201d I don\u2019t know what came over me. In truth, my toe hurt like crazy. Whatever it was, that night a family-wide meme was born. Ever since, whenever someone in our family gets injured somehow, they jokingly reply to inevitable questions about pain with \u201cNot if you\u2019re tough.\u201d Then everybody laughs. If this had happened before I\u2019d taken my vow of profanity silence, I would have no doubt jumped up and down shouting curse words. But instead, a serene side began to emerge and take hold of my personality. Substituting profanity with \u201caliases\u201d Darn. Heck. Shoot. There were softer versions of pretty much every cuss word out there, and I quickly adopted these. But one word was missing. The big one that everyone uses as a verb, adjective, and even a noun\u200a\u2014\u200asometimes all in the same sentence. And no, \u201cfudge\u201d wasn\u2019t going to cut it for me. Fortunately, my wife and I had just binge-watched the entire series of Battlestar Galactica over one rainy winter in Shanghai. Battlestar Galactica features a civilization that is technologically advanced, but also brooding, alcoholic, and potty-mouthed. And instead of omitting the f-word from the show entirely, like similarly gritty\u200a\u2014\u200ayet still PG-13\u200a\u2014\u200ashows did, the writers decided to make up their own f-word so that the actors could freely say on TV: frak. When you first watch the show, and notice them saying \u201cfrak,\u201d it\u2019s quite cheesy. The characters say things to one another like \u201cFrak you!\u201d, \u201cWhat the frak?\u201d and even \u201cGo frak yourself.\u201d And of course, this was before the term \u201cfracking\u201d\u200a\u2014\u200athe environmentally questionable act of pumping high-pressure fluid into the ground to extract oil and natural gas\u200a\u2014\u200ahad entered popular lexicon. This made use of the word \u201cfrak\u201d even more absurd. And that absurdity lended it a certain humor. A certain power. So with this final addition to my array of cuss word aliases, I had everything I needed to go profanity-free. Just like how the Mr. Robot protagonist Elliot Alderson would later condition himself to hear the words \u201cEvil Corp\u201d whenever someone uttered \u201cE Corp\u201d, I conditioned myself to hear the Battlestar Galactica \u201cfrak\u201d in place of other people\u2019s f-bombs. Over time, I reached for these aliases less and less. Sure, there were occasions where I would shout, \u201cOh, frak! Our production servers are down!\u201d But more often than not, I would just respond to bad situations with stoic silence. A less %@#$ed-up tomorrow Quitting cussing wasn\u2019t all that hard to do. And in addition to strengthening my willpower, it seems to have made my day-to-day outlook a bit brighter. There isn\u2019t much solid research about the role of profanity in human psychology. There are a few one-off studies that suggest that people who cuss frequently might be smarter or perceived by others as being more honest. These conclusions seem counter-intuitive to me, but I\u2019ll keep an open mind in case more studies support this. I personally don\u2019t feel I\u2019ve lost any of my dynamic range as a result of not cussing. Not that there\u2019s anything wrong with cussing, or that it should be censored in any way. People cuss. No big deal. As of 2017, we\u2019ve got bigger issues to worry about. On the contrary, I think that cuss words can often add a valuable dramatic effect. Back in 1934, Hollywood studios asked the producers of the 1934 film \u201cGone with the Wind\u201d to change the now-famous line: \u201cFrankly, my dear, I don\u2019t give a damn\u201d to \u201cFrankly, my dear, I don\u2019t care.\u201d But the producers successfully argued that the word \u201cdamn\u201d was necessary to convey the extent of the emotion, and it was left in the film. Producers also successfully advocated for the right to use the word \u201chell\u201d in Captain Kirk\u2019s famous line, \u201cLet\u2019s get the hell out of here.\u201d This was one of the first times the word \u201chell\u201d had been used like this on broadcast television. It was in the classic 1967 Star Trek episode \u201cCity on the Edge of Forever.\u201d (By the way, if you haven\u2019t seen this episode, it\u2019s on Netflix and you should totally watch it). One side benefit of not cussing is that I no longer have to self-censor my speech around polite company, or in front of kids. Profanity doesn\u2019t just \u201cslip out\u201d in casual banter like it used to. I can now just say what\u2019s on my mind, confident that, while some people may take issue with my ideas, they probably won\u2019t flinch at the words I use. If you want to learn more about little hacks like this one that you can use to improve your willpower\u200a\u2014\u200aand thus your productivity\u200a\u2014\u200aI recommend reading this book by Stanford psychology professor Kelly McGonigal: The Willpower Instinct: How Self-Control Works, Why It Matters, and What You Can Do to Get More of\u2026Edit descriptionamzn.to I plan to continue exploring habits that can boost my willpower. For as the great poet once wrote: \u201cTis in ourselves that we are thus or thus. Our bodies are our gardens to the which our wills are gardeners.\u201d\u2015William Shakespeare, Othello Thanks for reading! If you liked this article, click the \ud83d\udc9a below so other people will see this here on Medium. ", "author": "Quincy Larson", "parent": ""}