{"name": "1032", "parent": "", "content": "A Chech\u00eania \u00e9\u00a0aqui Diversos ve\u00edculos de comunica\u00e7\u00e3o russos denunciaram na \u00faltima semana a exist\u00eancia de um campo de concentra\u00e7\u00e3o destinado a prender, torturar e assassinar LGBTs na Chech\u00eania, uma das rep\u00fablicas da Federa\u00e7\u00e3o Russa. Os relatos apontam que pelo menos 100 pessoas foram raptadas e que 3 delas foram mortas por conta de sua orienta\u00e7\u00e3o sexual. Autoridades locais recha\u00e7am a possibilidade da exist\u00eancia de tal campo. O l\u00edder checheno, Razman Kadyrov, um dos respons\u00e1veis pela implanta\u00e7\u00e3o de leis mu\u00e7ulmanas na regi\u00e3o, informou, por meio de um porta-voz, que a den\u00fancia \u00e9 falsa, pois n\u00e3o existem homossexuais na Chech\u00eania e, se existissem, \u201cn\u00e3o haveria necessidade de leis punitivas porque os pr\u00f3prios parentes ficariam respons\u00e1veis por mand\u00e1-los a um lugar de onde n\u00e3o retornariam\u201d. Deixemos a veracidade dessa not\u00edcia para uma discuss\u00e3o \u00e0 parte. Concentremo-nos na discuss\u00e3o que ela nos permite fazer neste momento: que rumos a LGBTfobia tem tomado, em especial, no nosso pa\u00eds? Ser\u00e1 que o Brasil est\u00e1 muito distante da Chech\u00eania, regi\u00e3o dominada pelo extremismo? Tomemos como exemplos o espancamento da travesti Dandara e o assassinato de Itaberli Lozano pela pr\u00f3pria m\u00e3e, dentre tantos outros casos que, todos os dias, surgem no nosso pa\u00eds. O Brasil n\u00e3o precisa de um campo de concentra\u00e7\u00e3o para prender e matar LGBTs. O Brasil faz isso em plena luz do dia, em meio aos pedestres, diante dos nossos olhos, no seio familiar e no trabalho. N\u00e3o somos encarcerados pela nossa orienta\u00e7\u00e3o sexual ou identidade de g\u00eanero neste pa\u00eds. Mas somos igualmente mortos. Desde a nossa classe pol\u00edtica, at\u00e9 as nossas rela\u00e7\u00f5es familiares, a sociedade brasileira \u00e9 LGBTf\u00f3bica e incentiva o exterm\u00ednio de minorias sexuais e de g\u00eanero. Por isso, LGBTs vivem suas vidas com medo. Por isso, casais LGBTs saem \u00e0s ruas com medo. Por isso, ser LGBT no Brasil \u00e9 sin\u00f4nimo de sentir medo. N\u00e3o estamos muito distantes da Chech\u00eania. Com ou sem campo de concentra\u00e7\u00e3o, a LGBTfobia mostra sua face em todos os lugares. Aqui, de forma mais velada. L\u00e1, de forma expl\u00edcita. L\u00e1, as mortes motivadas por LGBTfobia s\u00e3o puni\u00e7\u00f5es pelo \u201ccrime\u201d de ser diverso. Aqui, as mortes motivadas por LGBTfobia s\u00e3o puni\u00e7\u00f5es pelo \u201cpecado\u201d de ser diverso. L\u00e1, pecado e crime s\u00e3o a mesma coisa. Aqui, n\u00e3o mais. Mas ainda existem aqueles que pensam que sim. Por isso, a vida de um LGBT no Brasil \u00e9 um campo de concentra\u00e7\u00e3o. Afinal, nunca se sabe em qual esquina o carrasco aparecer\u00e1. Mas o que se sabe \u00e9 que existem muitas Dandaras e Itaberlis por a\u00ed, que morrem ser serem noticiados. O que se sabe \u00e9 que o medo \u00e9 o denominador comum de todos os LGBTs desse pa\u00eds. Gostou? Clique no \u2764 e deixe um coment\u00e1rio, ele \u00e9 muito importante para n\u00f3s! N\u00e3o deixe de nos seguir e curtir nas redes sociais: Twitter; Facebook; Instagram. N\u00e3o perca nenhum texto, assine a nossa Newsletter: Revista Subjetiva by Revista SubjetivaEdit descriptiontinyletter.com ", "title": "A Chech\u00eania \u00e9\u00a0aqui", "sentences": [{"f5b7": "A Chech\u00eania \u00e9\u00a0aqui"}, {"53cd": "Diversos ve\u00edculos de comunica\u00e7\u00e3o russos denunciaram na \u00faltima semana a exist\u00eancia de um campo de concentra\u00e7\u00e3o destinado a prender, torturar e assassinar LGBTs na Chech\u00eania, uma das rep\u00fablicas da Federa\u00e7\u00e3o Russa. Os relatos apontam que pelo menos 100 pessoas foram raptadas e que 3 delas foram mortas por conta de sua orienta\u00e7\u00e3o sexual."}, {"1fcd": "Autoridades locais recha\u00e7am a possibilidade da exist\u00eancia de tal campo. O l\u00edder checheno, Razman Kadyrov, um dos respons\u00e1veis pela implanta\u00e7\u00e3o de leis mu\u00e7ulmanas na regi\u00e3o, informou, por meio de um porta-voz, que a den\u00fancia \u00e9 falsa, pois n\u00e3o existem homossexuais na Chech\u00eania e, se existissem, \u201cn\u00e3o haveria necessidade de leis punitivas porque os pr\u00f3prios parentes ficariam respons\u00e1veis por mand\u00e1-los a um lugar de onde n\u00e3o retornariam\u201d."}, {"1fe6": "Deixemos a veracidade dessa not\u00edcia para uma discuss\u00e3o \u00e0 parte. Concentremo-nos na discuss\u00e3o que ela nos permite fazer neste momento: que rumos a LGBTfobia tem tomado, em especial, no nosso pa\u00eds? Ser\u00e1 que o Brasil est\u00e1 muito distante da Chech\u00eania, regi\u00e3o dominada pelo extremismo?"}, {"8ca1": "Tomemos como exemplos o espancamento da travesti Dandara e o assassinato de Itaberli Lozano pela pr\u00f3pria m\u00e3e, dentre tantos outros casos que, todos os dias, surgem no nosso pa\u00eds."}, {"fb2c": "O Brasil n\u00e3o precisa de um campo de concentra\u00e7\u00e3o para prender e matar LGBTs. O Brasil faz isso em plena luz do dia, em meio aos pedestres, diante dos nossos olhos, no seio familiar e no trabalho. N\u00e3o somos encarcerados pela nossa orienta\u00e7\u00e3o sexual ou identidade de g\u00eanero neste pa\u00eds. Mas somos igualmente mortos."}, {"aa1a": "Desde a nossa classe pol\u00edtica, at\u00e9 as nossas rela\u00e7\u00f5es familiares, a sociedade brasileira \u00e9 LGBTf\u00f3bica e incentiva o exterm\u00ednio de minorias sexuais e de g\u00eanero. Por isso, LGBTs vivem suas vidas com medo. Por isso, casais LGBTs saem \u00e0s ruas com medo. Por isso, ser LGBT no Brasil \u00e9 sin\u00f4nimo de sentir medo."}, {"4b31": "N\u00e3o estamos muito distantes da Chech\u00eania. Com ou sem campo de concentra\u00e7\u00e3o, a LGBTfobia mostra sua face em todos os lugares. Aqui, de forma mais velada. L\u00e1, de forma expl\u00edcita. L\u00e1, as mortes motivadas por LGBTfobia s\u00e3o puni\u00e7\u00f5es pelo \u201ccrime\u201d de ser diverso. Aqui, as mortes motivadas por LGBTfobia s\u00e3o puni\u00e7\u00f5es pelo \u201cpecado\u201d de ser diverso. L\u00e1, pecado e crime s\u00e3o a mesma coisa. Aqui, n\u00e3o mais. Mas ainda existem aqueles que pensam que sim."}, {"c7f3": "Por isso, a vida de um LGBT no Brasil \u00e9 um campo de concentra\u00e7\u00e3o. Afinal, nunca se sabe em qual esquina o carrasco aparecer\u00e1. Mas o que se sabe \u00e9 que existem muitas Dandaras e Itaberlis por a\u00ed, que morrem ser serem noticiados. O que se sabe \u00e9 que o medo \u00e9 o denominador comum de todos os LGBTs desse pa\u00eds."}, {"0984": "Gostou? Clique no \u2764 e deixe um coment\u00e1rio, ele \u00e9 muito importante para n\u00f3s!"}, {"e126": "N\u00e3o deixe de nos seguir e curtir nas redes sociais: Twitter; Facebook; Instagram."}, {"454d": "N\u00e3o perca nenhum texto, assine a nossa Newsletter:"}, {"dba0": "Revista Subjetiva by Revista SubjetivaEdit descriptiontinyletter.com"}], "child": "1032_11032_11032_11032_1"}