{"name": "1115", "parent": "", "content": "Trump White House won\u2019t condemn Steve King\u2019s racist\u00a0comments A day after punting on the question, Press Secretary Sean Spicer offers the weakest response possible. Sean Spicer at his daily briefing on Tuesday CREDIT:\u00a0MSNBC Two days after Rep. Steve King\u2019s (R-IA) white nationalist tweet warning that \u201cWe can\u2019t restore our civilization with somebody else\u2019s babies,\u201d the White House finally responded on Tuesday\u2026 barely. At his daily press briefing on Monday, White House Press Secretary Sean Spicer had declined to weigh in on the tweet\u200a\u2014\u200aor the Monday interview in which King strongly reaffirmed its sentiments\u200a\u2014\u200asaying that he would \u201ctouch base with the president.\u201d Asked again on Tuesday, he declined to criticize King\u200a\u2014\u200awho Trump endorsed in 2014 as a \u201cspecial guy, a smart person with really the right views on almost everything.\u201d Instead, Spicer said simply that \u201cI think the president believes that this is not a point of view that he shares.\u201d \u201cHe believes he is the president for all Americans,\u201d Spicer concluded, before announcing that he would \u201cleave it at that.\u201d Watch: This is not the first time the Trump White House has opted not to condemn hate. Its official statement on International Holocaust Remembrance Day omitted any mention of the fact that 6 million Jews were exterminated. After a string of anti-Semitic attacks in the United States, Trump responded by reminding Americans of his Electoral College victory in 2016. And the administration has been either silent on\u200a\u2014\u200aor behind\u200a\u2014\u200aattacks on Muslim Americans. There have been at least 261 documented incidents of hate in America since Trump\u2019s election. Last month a top Trump surrogate explained that \u201cthe president is controlling the bully pulpit and the news cycle, and he doesn\u2019t want to overly discuss the stuff because you\u2019re worried that in itself will cause a fire.\u201d House Minority Leader Nancy Pelosi (D-CA) urged Republican leaders to strip King of his subcommittee chairmanship. But far from doing that, they have largely they have taken pains to avoid criticizing King directly. Speaker of the House Paul Ryan (R-WI) said Monday that he disagreed with King\u2019s comments, but would \u201clike to think he misspoke and it wasn\u2019t really meant the way it sounds and hopefully he\u2019s clarified that.\u201d ", "title": "Trump White House won\u2019t condemn Steve King\u2019s racist\u00a0comments", "sentences": [{"c76b": "Trump White House won\u2019t condemn Steve King\u2019s racist\u00a0comments"}, {"98aa": "A day after punting on the question, Press Secretary Sean Spicer offers the weakest response possible."}, {"d66f": "Sean Spicer at his daily briefing on Tuesday CREDIT:\u00a0MSNBC"}, {"8453": "Two days after Rep. Steve King\u2019s (R-IA) white nationalist tweet warning that \u201cWe can\u2019t restore our civilization with somebody else\u2019s babies,\u201d the White House finally responded on Tuesday\u2026 barely."}, {"d444": "At his daily press briefing on Monday, White House Press Secretary Sean Spicer had declined to weigh in on the tweet\u200a\u2014\u200aor the Monday interview in which King strongly reaffirmed its sentiments\u200a\u2014\u200asaying that he would \u201ctouch base with the president.\u201d"}, {"46d5": "Asked again on Tuesday, he declined to criticize King\u200a\u2014\u200awho Trump endorsed in 2014 as a \u201cspecial guy, a smart person with really the right views on almost everything.\u201d Instead, Spicer said simply that \u201cI think the president believes that this is not a point of view that he shares.\u201d"}, {"d7e9": "\u201cHe believes he is the president for all Americans,\u201d Spicer concluded, before announcing that he would \u201cleave it at that.\u201d"}, {"4948": "Watch:"}, {"106d": "This is not the first time the Trump White House has opted not to condemn hate. Its official statement on International Holocaust Remembrance Day omitted any mention of the fact that 6 million Jews were exterminated. After a string of anti-Semitic attacks in the United States, Trump responded by reminding Americans of his Electoral College victory in 2016. And the administration has been either silent on\u200a\u2014\u200aor behind\u200a\u2014\u200aattacks on Muslim Americans."}, {"bf4a": "There have been at least 261 documented incidents of hate in America since Trump\u2019s election. Last month a top Trump surrogate explained that \u201cthe president is controlling the bully pulpit and the news cycle, and he doesn\u2019t want to overly discuss the stuff because you\u2019re worried that in itself will cause a fire.\u201d"}, {"e910": "House Minority Leader Nancy Pelosi (D-CA) urged Republican leaders to strip King of his subcommittee chairmanship. But far from doing that, they have largely they have taken pains to avoid criticizing King directly. Speaker of the House Paul Ryan (R-WI) said Monday that he disagreed with King\u2019s comments, but would \u201clike to think he misspoke and it wasn\u2019t really meant the way it sounds and hopefully he\u2019s clarified that.\u201d"}], "child": "1115_1\t1115_2\t1115_3\t1115_4\t1115_5\t1115_6\t1115_7\t1115_8\t1115_9\t1115_10"}