{"name": "1136", "parent": "", "content": "La Tch\u00e9tch\u00e9nie ouvre un camp de concentration pour les homosexuels. Ils sont tortur\u00e9s \u00e0 l\u2019\u00e9lectricit\u00e9 et battus \u00e0\u00a0mort. Le Pr\u00e9sident Ramzan Kadyrov alli\u00e9 cl\u00e9 de Vladimir Poutine, aurait ordonn\u00e9 une r\u00e9pression sans pr\u00e9c\u00e9dent. Premier camp de concentration pour les homosexuels depuis Hitler. Ceux qui ont fui ont rapport\u00e9s que les prisonniers \u00e9taient battus et tortur\u00e9s. Forc\u00e9s \u00e0 r\u00e9v\u00e9ler d\u2019autres membres de la communaut\u00e9 gay Plus d\u2019une centaine d\u2019homosexuels ont \u00e9t\u00e9 arr\u00eat\u00e9s et trois tu\u00e9s la semaine derni\u00e8re en Tch\u00e9tch\u00e9nie. Un rapport de Novaya Gazeta dit que les autorit\u00e9s auraient mis en place plusieurs camps o\u00f9 les homosexuels seraient tu\u00e9s ou contraints de promettre de quitter la R\u00e9publique Tch\u00e9tch\u00e9nie. L\u2019un des camps est apparemment l\u2019ancien quartier g\u00e9n\u00e9ral militaire de la ville d\u2019Argoun. Aucunes sources ne le confirme mais les t\u00e9moignages convergent. Svetlana Zakharova, du R\u00e9seau LGBT russe, a d\u00e9clar\u00e9\u00a0: \u201cDes homosexuels ont \u00e9t\u00e9 arr\u00eat\u00e9s et nous travaillons pour \u00e9vacuer les gens des camps et certains, par crainte, ont quitt\u00e9 la r\u00e9gion.\u201d\u201cCeux qui y ont \u00e9chapp\u00e9 disent qu\u2019ils sont d\u00e9tenus dans une seule et m\u00eame pi\u00e8ce, environ 30 ou 40 personnes. Ils sont tortur\u00e9s avec des courants \u00e9lectriques et sauvagement battus, parfois, jusqu\u2019\u00e0 la mort.\u201d Ceux qui se sont \u00e9chapp\u00e9s, dit Novoya Gazeta ont rapport\u00e9s que\u00a0\u201cles prisonniers ont \u00e9t\u00e9 battus pour les forcer \u00e0 r\u00e9v\u00e9ler d\u2019autres membres de la communaut\u00e9 gay dans la r\u00e9gion.\u201d Un autre prisonnier qui a fui dit que, avant d\u2019\u00eatre incarc\u00e9r\u00e9 dans l\u2019un des camps, il avait \u00e9t\u00e9 contraint de payer des pots de vin \u00e0 la police tch\u00e9tch\u00e8ne pour survivre. Alexander Artemyev, d\u2019Amnesty International en Russie, a d\u00e9clar\u00e9\u00a0:\u00a0\u201cNous ne pouvons appeler les autorit\u00e9s russes \u00e0 enqu\u00eater sur les all\u00e9gations. Les homosexuels ont peur de parler. Ils doivent se cacher ou quitter la r\u00e9publique.\u201d Nous maintenons le contact avec le r\u00e9seau LGBT local qui aide les gens \u00e0 trouver un abri. Le probl\u00e8me est que les gens l\u00e0-bas ne peuvent pas parler car ils mettent leur vie en danger. Ekaterina Sokirianskaia, directrice de projet pour l\u2019International Crisis Group, a d\u00e9clar\u00e9e\u00a0: \u201cLa situation se d\u00e9veloppe et ne fait qu\u2019empirer, les victimes fuient.\u201d Tanya Lokshina, de Human Rights Watch \u00e0 Moscou, a d\u00e9clar\u00e9e: \u201cDepuis plusieurs semaines, une campagne brutale contre les personnes LGBT se passe en Tch\u00e9tch\u00e9nie\u201d \u201cCes jours-ci, tr\u00e8s peu de gens en Tch\u00e9tch\u00e9nie n\u2019osent parler aux observateurs des droits de l\u2019homme ou aux journalistes, m\u00eame de fa\u00e7on anonyme parce que le climat de peur est \u00e9crasant et les gens ont \u00e9t\u00e9 intimid\u00e9s, intim\u00e9s de garder le silence sous peine de repr\u00e9sailles.\u201d Les personnes LGBT sont vuln\u00e9rables en Tch\u00e9tch\u00e9nie, l\u2019homophobie est intense et end\u00e9mique. Les personnes LGBT sont en danger, non seulement la pers\u00e9cution se fait par les autorit\u00e9s, mais aussi par sa propre famille. R\u00e9guli\u00e8rement des \u00abcrimes d\u2019honneur\u00bb sont r\u00e9pertori\u00e9s. Le pr\u00e9sident Ramzan Kadyrov, aurait ordonn\u00e9 la r\u00e9pression, bien qu\u2019officiellement son r\u00e9gime ait ni\u00e9 les arrestations en affirmant\u00a0\u201cqu\u2019il est impossible de les pers\u00e9cuter parce que les gays n\u2019existent pas en Tch\u00e9tch\u00e9nie.\u201d Kadyrov, qui a introduit la loi islamique dans la r\u00e9gion, \u00e0 majorit\u00e9 musulmane, a \u00e9t\u00e9 accus\u00e9 de violation des droits de l\u2019homme \u00e0 plusieurs reprises. il a d\u00e9crit les all\u00e9gations comme \u201cmensonges absolus et de la d\u00e9sinformation.\u201d Le porte-parole de Kadyrov, Alvi Karimov a d\u00e9clar\u00e9 \u00e0 l\u2019Agence Interfax Nouvelles: \u201cVous ne pouvez pas arr\u00eater ou r\u00e9primer des gens qui n\u2019existent pas dans la r\u00e9publique.\u201d Selon le New York Times, les homosexuels dans la r\u00e9gion ont proc\u00e9d\u00e9 \u00e0 l\u2019effacement de toutes traces sur les r\u00e9seaux sociaux, blogs et sites de rencontre apr\u00e8s qu\u2019il a \u00e9t\u00e9 rapport\u00e9 que les autorit\u00e9s essayaient d\u2019attirer les hommes gays dans des guets-apens pour les arr\u00eater. La France semble peu s\u2019en soucier tant le silence m\u00e9diatique est assourdissant\u00a0! Les presses anglo-saxonne et am\u00e9ricaine sont les seules \u00e0 prendre la mesure de la gravit\u00e9 de la situation. Nous demandons aux dirigeants europ\u00e9ens de prendre des mesures de v\u00e9rification et d\u2019entreprendre des actions de protection pour prot\u00e9ger cette minorit\u00e9 pers\u00e9cut\u00e9e. Nous demandons aux candidats \u00e0 l\u2019\u00e9lection pr\u00e9sidentielle de s\u2019exprimer publiquement sur le sujet. Nous demandons aux journalistes des m\u00e9dias mainstream de faire leur travail d\u2019investigation et de relayer massivement l\u2019information pour une prise de conscience collective. Le silence m\u00e9diatique fran\u00e7ais est inacceptable. Il est coupable\u00a0! Faut-il attendre de compter les morts et les charniers pour s\u2019en \u00e9mouvoir et en faire votre UNE\u00a0? Il est temps de faire votre travail. La presse \u00e9trang\u00e8re s\u2019en charge, pourquoi ce silence\u00a0? Il est incompr\u00e9hensible. Ne commettons pas les erreurs du pass\u00e9 \u00e0 regarder de loin en se demandant si les faits sont av\u00e9r\u00e9s et si les morts s\u2019y accumulent vraiment\u2026 Mehdi AIFA Pr\u00e9sident de l\u2019Amicale des Jeunes du Refuge. m.aifa@le-refuge.org tel: 06.01.32.31.43 Source\u00a0:\u00a0* dailymail* thesun* rfi* courrierinternational* thenewyorktime* novayagazeta* france24 \u2014 MAJ\u00a0: Paris Match Belgique vient \u00e0 l\u2019instant de publier un article faisant \u00e9cho \u00e0 notre d\u00e9nonciation\u00a0: https://parismatch.be/actualites/societe/31495/tchetchenie-homosexuels-prisons-camps-concentration ", "title": "La Tch\u00e9tch\u00e9nie ouvre un camp de concentration pour les homosexuels.", "sentences": [{"df6a": "La Tch\u00e9tch\u00e9nie ouvre un camp de concentration pour les homosexuels."}, {"8a17": "Ils sont tortur\u00e9s \u00e0 l\u2019\u00e9lectricit\u00e9 et battus \u00e0\u00a0mort."}, {"2a8e": "Le Pr\u00e9sident Ramzan Kadyrov alli\u00e9 cl\u00e9 de Vladimir Poutine, aurait ordonn\u00e9 une r\u00e9pression sans pr\u00e9c\u00e9dent."}, {"9f9e": "Premier camp de concentration pour les homosexuels depuis Hitler."}, {"a8a5": "Ceux qui ont fui ont rapport\u00e9s que les prisonniers \u00e9taient battus et tortur\u00e9s. Forc\u00e9s \u00e0 r\u00e9v\u00e9ler d\u2019autres membres de la communaut\u00e9 gay"}, {"1319": "Plus d\u2019une centaine d\u2019homosexuels ont \u00e9t\u00e9 arr\u00eat\u00e9s et trois tu\u00e9s la semaine derni\u00e8re en Tch\u00e9tch\u00e9nie."}, {"c7bc": "Un rapport de Novaya Gazeta dit que les autorit\u00e9s auraient mis en place plusieurs camps o\u00f9 les homosexuels seraient tu\u00e9s ou contraints de promettre de quitter la R\u00e9publique Tch\u00e9tch\u00e9nie."}, {"1a53": "L\u2019un des camps est apparemment l\u2019ancien quartier g\u00e9n\u00e9ral militaire de la ville d\u2019Argoun. Aucunes sources ne le confirme mais les t\u00e9moignages convergent."}, {"ce22": "Svetlana Zakharova, du R\u00e9seau LGBT russe, a d\u00e9clar\u00e9\u00a0: \u201cDes homosexuels ont \u00e9t\u00e9 arr\u00eat\u00e9s et nous travaillons pour \u00e9vacuer les gens des camps et certains, par crainte, ont quitt\u00e9 la r\u00e9gion.\u201d\u201cCeux qui y ont \u00e9chapp\u00e9 disent qu\u2019ils sont d\u00e9tenus dans une seule et m\u00eame pi\u00e8ce, environ 30 ou 40 personnes. Ils sont tortur\u00e9s avec des courants \u00e9lectriques et sauvagement battus, parfois, jusqu\u2019\u00e0 la mort.\u201d"}, {"c01b": "Ceux qui se sont \u00e9chapp\u00e9s, dit Novoya Gazeta ont rapport\u00e9s que\u00a0\u201cles prisonniers ont \u00e9t\u00e9 battus pour les forcer \u00e0 r\u00e9v\u00e9ler d\u2019autres membres de la communaut\u00e9 gay dans la r\u00e9gion.\u201d"}, {"009e": "Un autre prisonnier qui a fui dit que, avant d\u2019\u00eatre incarc\u00e9r\u00e9 dans l\u2019un des camps, il avait \u00e9t\u00e9 contraint de payer des pots de vin \u00e0 la police tch\u00e9tch\u00e8ne pour survivre."}, {"8efe": "Alexander Artemyev, d\u2019Amnesty International en Russie, a d\u00e9clar\u00e9\u00a0:\u00a0\u201cNous ne pouvons appeler les autorit\u00e9s russes \u00e0 enqu\u00eater sur les all\u00e9gations. Les homosexuels ont peur de parler. Ils doivent se cacher ou quitter la r\u00e9publique.\u201d"}, {"a469": "Nous maintenons le contact avec le r\u00e9seau LGBT local qui aide les gens \u00e0 trouver un abri. Le probl\u00e8me est que les gens l\u00e0-bas ne peuvent pas parler car ils mettent leur vie en danger."}, {"c777": "Ekaterina Sokirianskaia, directrice de projet pour l\u2019International Crisis Group, a d\u00e9clar\u00e9e\u00a0: \u201cLa situation se d\u00e9veloppe et ne fait qu\u2019empirer, les victimes fuient.\u201d"}, {"62cf": "Tanya Lokshina, de Human Rights Watch \u00e0 Moscou, a d\u00e9clar\u00e9e: \u201cDepuis plusieurs semaines, une campagne brutale contre les personnes LGBT se passe en Tch\u00e9tch\u00e9nie\u201d"}, {"a4b6": "\u201cCes jours-ci, tr\u00e8s peu de gens en Tch\u00e9tch\u00e9nie n\u2019osent parler aux observateurs des droits de l\u2019homme ou aux journalistes, m\u00eame de fa\u00e7on anonyme parce que le climat de peur est \u00e9crasant et les gens ont \u00e9t\u00e9 intimid\u00e9s, intim\u00e9s de garder le silence sous peine de repr\u00e9sailles.\u201d"}, {"217d": "Les personnes LGBT sont vuln\u00e9rables en Tch\u00e9tch\u00e9nie, l\u2019homophobie est intense et end\u00e9mique. Les personnes LGBT sont en danger, non seulement la pers\u00e9cution se fait par les autorit\u00e9s, mais aussi par sa propre famille. R\u00e9guli\u00e8rement des \u00abcrimes d\u2019honneur\u00bb sont r\u00e9pertori\u00e9s."}, {"02d5": "Le pr\u00e9sident Ramzan Kadyrov, aurait ordonn\u00e9 la r\u00e9pression, bien qu\u2019officiellement son r\u00e9gime ait ni\u00e9 les arrestations en affirmant\u00a0\u201cqu\u2019il est impossible de les pers\u00e9cuter parce que les gays n\u2019existent pas en Tch\u00e9tch\u00e9nie.\u201d"}, {"e016": "Kadyrov, qui a introduit la loi islamique dans la r\u00e9gion, \u00e0 majorit\u00e9 musulmane, a \u00e9t\u00e9 accus\u00e9 de violation des droits de l\u2019homme \u00e0 plusieurs reprises."}, {"7dd6": "il a d\u00e9crit les all\u00e9gations comme \u201cmensonges absolus et de la d\u00e9sinformation.\u201d"}, {"37d7": "Le porte-parole de Kadyrov, Alvi Karimov a d\u00e9clar\u00e9 \u00e0 l\u2019Agence Interfax Nouvelles: \u201cVous ne pouvez pas arr\u00eater ou r\u00e9primer des gens qui n\u2019existent pas dans la r\u00e9publique.\u201d"}, {"9823": "Selon le New York Times, les homosexuels dans la r\u00e9gion ont proc\u00e9d\u00e9 \u00e0 l\u2019effacement de toutes traces sur les r\u00e9seaux sociaux, blogs et sites de rencontre apr\u00e8s qu\u2019il a \u00e9t\u00e9 rapport\u00e9 que les autorit\u00e9s essayaient d\u2019attirer les hommes gays dans des guets-apens pour les arr\u00eater."}, {"4958": "La France semble peu s\u2019en soucier tant le silence m\u00e9diatique est assourdissant\u00a0! Les presses anglo-saxonne et am\u00e9ricaine sont les seules \u00e0 prendre la mesure de la gravit\u00e9 de la situation."}, {"9dff": "Nous demandons aux dirigeants europ\u00e9ens de prendre des mesures de v\u00e9rification et d\u2019entreprendre des actions de protection pour prot\u00e9ger cette minorit\u00e9 pers\u00e9cut\u00e9e."}, {"3ac0": "Nous demandons aux candidats \u00e0 l\u2019\u00e9lection pr\u00e9sidentielle de s\u2019exprimer publiquement sur le sujet."}, {"6c50": "Nous demandons aux journalistes des m\u00e9dias mainstream de faire leur travail d\u2019investigation et de relayer massivement l\u2019information pour une prise de conscience collective."}, {"2839": "Le silence m\u00e9diatique fran\u00e7ais est inacceptable. Il est coupable\u00a0!"}, {"b7f4": "Faut-il attendre de compter les morts et les charniers pour s\u2019en \u00e9mouvoir et en faire votre UNE\u00a0? Il est temps de faire votre travail. La presse \u00e9trang\u00e8re s\u2019en charge, pourquoi ce silence\u00a0? Il est incompr\u00e9hensible."}, {"1498": "Ne commettons pas les erreurs du pass\u00e9 \u00e0 regarder de loin en se demandant si les faits sont av\u00e9r\u00e9s et si les morts s\u2019y accumulent vraiment\u2026"}, {"d7e1": "Mehdi AIFA"}, {"e30c": "Pr\u00e9sident de l\u2019Amicale des Jeunes du Refuge."}, {"ea63": "m.aifa@le-refuge.org tel: 06.01.32.31.43"}, {"ea5d": "Source\u00a0:\u00a0* dailymail* thesun* rfi* courrierinternational* thenewyorktime* novayagazeta* france24"}, {"4f96": "\u2014 MAJ\u00a0: Paris Match Belgique vient \u00e0 l\u2019instant de publier un article faisant \u00e9cho \u00e0 notre d\u00e9nonciation\u00a0: https://parismatch.be/actualites/societe/31495/tchetchenie-homosexuels-prisons-camps-concentration"}], "child": "1136_1\t1136_2\t1136_3\t1136_4\t1136_5\t1136_6\t1136_7\t1136_8\t1136_9\t1136_10\t1136_11\t1136_12\t1136_13\t1136_14\t1136_15\t1136_16\t1136_17\t1136_18\t1136_19\t1136_20\t1136_21\t1136_22\t1136_23\t1136_24\t1136_251136_1\t1136_2\t1136_3\t1136_4\t1136_5\t1136_6\t1136_7\t1136_8\t1136_9\t1136_10\t1136_11\t1136_12\t1136_13\t1136_14\t1136_15\t1136_16\t1136_17\t1136_18\t1136_19\t1136_20\t1136_21\t1136_22\t1136_23\t1136_24\t1136_25"}