{"name": "1173", "parent": "", "content": "Bim\u00a0! L\u2019incroyable rapprochement Le Petit Ballon & vente-privee Paris, le 12 avril 2017. Le Petit Ballon est fier de vous annoncer une \u00e9tape strat\u00e9gique de son d\u00e9veloppement avec la prise de participation de vente-privee dans son capital. Un rapprochement qui signe la volont\u00e9 commune de r\u00e9inventer l\u2019exp\u00e9rience de shopping du vin en ligne\u00a0. 6 ans apr\u00e8s mon premier d\u00e9jeuner avec ce cher et grand sommelier Jean-Michel Deluc, l\u2019inarr\u00eatable Matthieu Lesne et le talentueux Cl\u00e9ment Thibault\u2026 nous voici d\u00e9sormais de m\u00e8che avec le cr\u00e9ateur du concept m\u00eame de ventes \u00e9v\u00e8nementielles sur Internet et le leader mondial du secteur\u00a0: vente-privee. Vous me l\u2019auriez dit il y a 6 ans je ne vous aurais pas cru. Un heureux\u00a0hasard En f\u00e9vrier 2016, je re\u00e7ois un coup de fil de Matthieu qui veut me pr\u00e9senter les \u00e9quipes vins & food de vente-privee rencontr\u00e9es dans un salon. Le plus gros vendeur de vin en France, rendez-vous compte! Alors pourquoi ne pas aller \u00e9changer sur nos pratiques et faire germer quelques bonnes id\u00e9es\u00a0? Venus pour discuter sur nos strat\u00e9gies respectives, nous d\u00e9couvrons que le mastodonte VP \u00e9tait en fait une super \u00e9quipe, dirig\u00e9e avec un v\u00e9ritable esprit entrepreneurial, avec cette m\u00eame vision du futur du vin\u00a0, ses probl\u00e9matiques, et une volont\u00e9 toute aussi forte que la n\u00f4tre. Apr\u00e8s quelques heures dans leurs locaux de Saint-Denis, nous voici ressortis avec l\u2019intime conviction qu\u2019ensemble, nous pourrions faire quelque chose d\u2019\u00e9norme. La machine \u00e9tait en marche\u00a0! Proposer une exp\u00e9rience vin encore plus\u00a0dingue Au Petit Ballon, nous avons toujours eu l\u2019ambition de proposer \u00e0 notre grande famille une exp\u00e9rience toujours plus innovante et toujours plus simple pour d\u00e9couvrir, apprendre et acheter du vin. Nous avons commenc\u00e9 avec l\u2019abonnement et notre ton simple et ludique. Puis nous avons enrichis l\u2019exp\u00e9rience avec la cr\u00e9ation de nos labels et d\u2019un profil vin pour vous faire d\u00e9couvrir les vins que vous aimez. Nous restons cependant convaincus que beaucoup de choses restent \u00e0 faire pour remplir cette mission et devenir le plus gros vendeur de vins en France (pour commencer\u00a0:)). Gr\u00e2ce \u00e0 ce partenariat, nous allons d\u00e9velopper un laboratoire d\u2019id\u00e9es au service de l\u2019innovation dans la distribution du vin en France et en Europe. Nous allons encore am\u00e9liorer l\u2019exp\u00e9rience utilisateur en nous appuyant sur les savoir-faire bien diff\u00e9rents de nos deux entreprises et aller au-del\u00e0\u00a0! Et que vive la\u00a0libert\u00e9 Soyez-en s\u00fbrs, Le Petit Ballon restera ind\u00e9pendant, et les synergies de ce rapprochement vont nous permettre de poursuivre notre croissance pour toujours simplifier d\u2019avantage l\u2019achat et la consommation de vin. L\u2019offre reste inchang\u00e9e sur Le Petit Ballon. Jean-Michel Deluc, continuera \u00e0 vous proposer ses magnifiques s\u00e9lections. Notre exigence et notre fa\u00e7on de travailler avec les vignerons seront toujours les m\u00eames. Attach\u00e9s \u00e0 la relation de confiance mutuelle et de respect pour leur travail acharn\u00e9, nous ne changerons cela pour rien au monde. C\u2019est d\u2019ailleurs pour eux la garantie de travailler encore plus avec nous. Gardez les yeux bien ouverts chers abonn\u00e9s, nous vous r\u00e9servons quelques bonnes surprises. Quant au site vente-privee.com, les membres pourront y d\u00e9couvrir de nombreuses nouveaut\u00e9s. Ils pourront bient\u00f4t profiter d\u2019un contenu enrichi pour mieux les guider dans leur s\u00e9lection et leurs achats\u00a0: les labels du Petit Ballon les y guideront, leur profil vin leur permettra d\u2019affiner leurs go\u00fbts et nos conseils et astuces sp\u00e9cialement cr\u00e9\u00e9s pour eux leur permettront de devenir des as de la d\u00e9gustation. R\u00e9\u00e9crire l\u2019histoire du\u00a0vin Il est temps d\u2019\u00e9crire un nouveau chapitre dans l\u2019aventure du Petit Ballon. Ce chapitre, nous sommes fiers de l\u2019\u00e9crire avec vente-privee afin d\u2019imaginer le vin de demain\u2026eux aussi semblent l\u2019\u00eatre un petit peu\u00a0: \u00ab\u00a0Nous sommes tr\u00e8s heureux d\u2019accueillir Le Petit Ballon et ses \u00e9quipes, avec qui nous partageons des valeurs communes d\u2019innovation, de qualit\u00e9 et d\u2019excellence. Ce partenariat ouvre de nouvelles perspectives de croissance dans le secteur du vin. Il s\u2019inscrit dans notre vision long terme de l\u2019entreprise, et va nous permettre d\u2019offrir une exp\u00e9rience de shopping toujours plus innovante \u00e0 nos membres. Nous sommes tr\u00e8s heureux de collaborer avec une jeune \u00e9quipe ambitieuse, anim\u00e9e par la volont\u00e9 d\u2019\u00e9crire le vin de demain.\u00a0\u00bb comme l\u2019explique Jacques-Antoine Granjon, PDG et fondateur de vente-privee. Et \u00e7a c\u2019est beau. Un grand\u00a0merci J\u2019en profite pour remercier toute notre \u00e9quipe de croire en ce projet fou. Vous \u00eates en or. Par ordre d\u2019apparition, Moop, Soso, Eric, Yannick, Greg, Nao Thibaut, L\u00e9o, Max, Josie, Pauline, Lucie, Anna, Myriam, Oliv, Jeanne, Wiwi, Alex, Anne, L\u00e9opoldine, Christabel et Cl\u00e9ment\u2026 Mes associ\u00e9s de toujours #forever #lafamille, Jean-Michel, Matthieu et Cl\u00e9ment, Nos incroyables investisseurs, merci encore pour vos bons conseils\u00a0!!! Marc M\u00e9nas\u00e9, David Nedzela, les fr\u00e8res Hadida, Fabrice L\u00e9pine, Bertile Burel et James Blouzard, Jacques-Antoine Granjon, mon idole, Emmanuel, Paloma, Jean-Baptiste et toute l\u2019\u00e9quipe vente-privee. \u00c0 mon Pap, \u00e0 JP et \u00e0 ma femme \u2764 Et enfin nos vignerons qui rendent cette histoire possible en nous proposant toujours le meilleur. Et pour finir\u2026 Vous, nos chers abonn\u00e9s, les v\u00e9ritables ambassadeurs du Petit Ballon. Merci pour votre confiance et votre soutien depuis le d\u00e9but de l\u2019aventure. Ca nous donne tous les jours plus de force pour trouver de nouvelles id\u00e9es et enrichir l\u2019exp\u00e9rience. ", "title": "Bim\u00a0! L\u2019incroyable rapprochement Le Petit Ballon & vente-privee", "sentences": [{"e7fb": "Bim\u00a0! L\u2019incroyable rapprochement Le Petit Ballon & vente-privee"}, {"6477": "Paris, le 12 avril 2017. Le Petit Ballon est fier de vous annoncer une \u00e9tape strat\u00e9gique de son d\u00e9veloppement avec la prise de participation de vente-privee dans son capital. Un rapprochement qui signe la volont\u00e9 commune de r\u00e9inventer l\u2019exp\u00e9rience de shopping du vin en ligne\u00a0."}, {"0439": "6 ans apr\u00e8s mon premier d\u00e9jeuner avec ce cher et grand sommelier Jean-Michel Deluc, l\u2019inarr\u00eatable Matthieu Lesne et le talentueux Cl\u00e9ment Thibault\u2026 nous voici d\u00e9sormais de m\u00e8che avec le cr\u00e9ateur du concept m\u00eame de ventes \u00e9v\u00e8nementielles sur Internet et le leader mondial du secteur\u00a0: vente-privee. Vous me l\u2019auriez dit il y a 6 ans je ne vous aurais pas cru."}, {"919a": "Un heureux\u00a0hasard"}, {"49f9": "En f\u00e9vrier 2016, je re\u00e7ois un coup de fil de Matthieu qui veut me pr\u00e9senter les \u00e9quipes vins & food de vente-privee rencontr\u00e9es dans un salon. Le plus gros vendeur de vin en France, rendez-vous compte! Alors pourquoi ne pas aller \u00e9changer sur nos pratiques et faire germer quelques bonnes id\u00e9es\u00a0?"}, {"6970": "Venus pour discuter sur nos strat\u00e9gies respectives, nous d\u00e9couvrons que le mastodonte VP \u00e9tait en fait une super \u00e9quipe, dirig\u00e9e avec un v\u00e9ritable esprit entrepreneurial, avec cette m\u00eame vision du futur du vin\u00a0, ses probl\u00e9matiques, et une volont\u00e9 toute aussi forte que la n\u00f4tre."}, {"9112": "Apr\u00e8s quelques heures dans leurs locaux de Saint-Denis, nous voici ressortis avec l\u2019intime conviction qu\u2019ensemble, nous pourrions faire quelque chose d\u2019\u00e9norme. La machine \u00e9tait en marche\u00a0!"}, {"0bfc": "Proposer une exp\u00e9rience vin encore plus\u00a0dingue"}, {"80ac": "Au Petit Ballon, nous avons toujours eu l\u2019ambition de proposer \u00e0 notre grande famille une exp\u00e9rience toujours plus innovante et toujours plus simple pour d\u00e9couvrir, apprendre et acheter du vin. Nous avons commenc\u00e9 avec l\u2019abonnement et notre ton simple et ludique. Puis nous avons enrichis l\u2019exp\u00e9rience avec la cr\u00e9ation de nos labels et d\u2019un profil vin pour vous faire d\u00e9couvrir les vins que vous aimez. Nous restons cependant convaincus que beaucoup de choses restent \u00e0 faire pour remplir cette mission et devenir le plus gros vendeur de vins en France (pour commencer\u00a0:))."}, {"fbb5": "Gr\u00e2ce \u00e0 ce partenariat, nous allons d\u00e9velopper un laboratoire d\u2019id\u00e9es au service de l\u2019innovation dans la distribution du vin en France et en Europe. Nous allons encore am\u00e9liorer l\u2019exp\u00e9rience utilisateur en nous appuyant sur les savoir-faire bien diff\u00e9rents de nos deux entreprises et aller au-del\u00e0\u00a0!"}, {"b89e": "Et que vive la\u00a0libert\u00e9"}, {"01c0": "Soyez-en s\u00fbrs, Le Petit Ballon restera ind\u00e9pendant, et les synergies de ce rapprochement vont nous permettre de poursuivre notre croissance pour toujours simplifier d\u2019avantage l\u2019achat et la consommation de vin."}, {"dcea": "L\u2019offre reste inchang\u00e9e sur Le Petit Ballon."}, {"4f07": "Jean-Michel Deluc, continuera \u00e0 vous proposer ses magnifiques s\u00e9lections."}, {"90d8": "Notre exigence et notre fa\u00e7on de travailler avec les vignerons seront toujours les m\u00eames. Attach\u00e9s \u00e0 la relation de confiance mutuelle et de respect pour leur travail acharn\u00e9, nous ne changerons cela pour rien au monde. C\u2019est d\u2019ailleurs pour eux la garantie de travailler encore plus avec nous. Gardez les yeux bien ouverts chers abonn\u00e9s, nous vous r\u00e9servons quelques bonnes surprises."}, {"f285": "Quant au site vente-privee.com, les membres pourront y d\u00e9couvrir de nombreuses nouveaut\u00e9s. Ils pourront bient\u00f4t profiter d\u2019un contenu enrichi pour mieux les guider dans leur s\u00e9lection et leurs achats\u00a0: les labels du Petit Ballon les y guideront, leur profil vin leur permettra d\u2019affiner leurs go\u00fbts et nos conseils et astuces sp\u00e9cialement cr\u00e9\u00e9s pour eux leur permettront de devenir des as de la d\u00e9gustation."}, {"900a": "R\u00e9\u00e9crire l\u2019histoire du\u00a0vin"}, {"3daf": "Il est temps d\u2019\u00e9crire un nouveau chapitre dans l\u2019aventure du Petit Ballon. Ce chapitre, nous sommes fiers de l\u2019\u00e9crire avec vente-privee afin d\u2019imaginer le vin de demain\u2026eux aussi semblent l\u2019\u00eatre un petit peu\u00a0: \u00ab\u00a0Nous sommes tr\u00e8s heureux d\u2019accueillir Le Petit Ballon et ses \u00e9quipes, avec qui nous partageons des valeurs communes d\u2019innovation, de qualit\u00e9 et d\u2019excellence. Ce partenariat ouvre de nouvelles perspectives de croissance dans le secteur du vin. Il s\u2019inscrit dans notre vision long terme de l\u2019entreprise, et va nous permettre d\u2019offrir une exp\u00e9rience de shopping toujours plus innovante \u00e0 nos membres. Nous sommes tr\u00e8s heureux de collaborer avec une jeune \u00e9quipe ambitieuse, anim\u00e9e par la volont\u00e9 d\u2019\u00e9crire le vin de demain.\u00a0\u00bb comme l\u2019explique Jacques-Antoine Granjon, PDG et fondateur de vente-privee. Et \u00e7a c\u2019est beau."}, {"fe6e": "Un grand\u00a0merci"}, {"f4bb": "J\u2019en profite pour remercier toute notre \u00e9quipe de croire en ce projet fou. Vous \u00eates en or. Par ordre d\u2019apparition, Moop, Soso, Eric, Yannick, Greg, Nao Thibaut, L\u00e9o, Max, Josie, Pauline, Lucie, Anna, Myriam, Oliv, Jeanne, Wiwi, Alex, Anne, L\u00e9opoldine, Christabel et Cl\u00e9ment\u2026"}, {"a07b": "Mes associ\u00e9s de toujours #forever #lafamille, Jean-Michel, Matthieu et Cl\u00e9ment,"}, {"8fb7": "Nos incroyables investisseurs, merci encore pour vos bons conseils\u00a0!!! Marc M\u00e9nas\u00e9, David Nedzela, les fr\u00e8res Hadida, Fabrice L\u00e9pine, Bertile Burel et James Blouzard,"}, {"ebf5": "Jacques-Antoine Granjon, mon idole, Emmanuel, Paloma, Jean-Baptiste et toute l\u2019\u00e9quipe vente-privee."}, {"1c8a": "\u00c0 mon Pap, \u00e0 JP et \u00e0 ma femme \u2764"}, {"6988": "Et enfin nos vignerons qui rendent cette histoire possible en nous proposant toujours le meilleur."}, {"4646": "Et pour finir\u2026 Vous, nos chers abonn\u00e9s, les v\u00e9ritables ambassadeurs du Petit Ballon. Merci pour votre confiance et votre soutien depuis le d\u00e9but de l\u2019aventure. Ca nous donne tous les jours plus de force pour trouver de nouvelles id\u00e9es et enrichir l\u2019exp\u00e9rience."}], "child": "1173_1\t1173_2"}