{"name": "1179", "parent": "", "content": "Save rejoint Remade\u00a0Group Je suis sorti du tribunal ce matin avec beaucoup de soulagement. Le plan de continuation de l\u2019activit\u00e9 vient d\u2019\u00eatre accept\u00e9. L\u2019histoire de Save va continuer. C\u2019est la fin d\u2019un cycle compliqu\u00e9 et la suite d\u2019une belle aventure. Il \u00e9tait une\u00a0fois\u2026 Je me revois plein d\u2019enthousiasme entre les quatre murs de la premi\u00e8re boutique Save my Smartphone en travaux. Jamais je n\u2019aurais pu imaginer que 3 ans plus tard nous serions 500 salari\u00e9s, r\u00e9partis dans 137 points de ventes dans 6 pays en Europe, chouchous de la presse, de nos investisseurs, de nos amis et de tout le reste de l\u2019\u00e9cosyst\u00e8me. En r\u00e9alit\u00e9, on s\u2019est rapidement mis dans une bulle, isol\u00e9s de toute critique, ne craignant aucune barri\u00e8re et priv\u00e9s de tout discernement. Les marges n\u2019\u00e9taient pas encore au rendez-vous, les op\u00e9rations se d\u00e9roulaient sans r\u00e9elle ma\u00eetrise, on a lev\u00e9 des fonds, on \u00e9tait en hyper croissance et on se dit que c\u2019est normal. Sauf qu\u2019en mars 2016, Save consomme beaucoup trop de cash par mois et va dans le mur. La f\u00eate est finie. Le mur n\u2019est pas pass\u00e9 loin. Tout tient \u00e0 un d\u00e9jeuner avec un entrepreneur chevronn\u00e9 des t\u00e9l\u00e9coms qui a v\u00e9cu une histoire similaire. 5 Juillet 2016. Mise en redressement judiciaire. Fini les m\u00e9dias. Fini la conqu\u00eate du monde. On se retrousse les manches et on attaque les probl\u00e8mes un \u00e0 un (http://bit.ly/save-2016). Les derniers arriv\u00e9s partent, les guerriers restent, certains sont remerci\u00e9s. On se met en mode survie et on traite tous les sujets pour retrouver un p\u00e9rim\u00e8tre financier et op\u00e9rationnel qui permette de donner \u00e0 Save et \u00e0 ses salari\u00e9s un avenir. Fermetures de magasins, fermeture de filiales, plan social\u2026 La restructuration est douloureuse mais les \u00e9quipes donnent tout avec force et talent. Apr\u00e8s 6 mois, nous avons presque arr\u00eat\u00e9 de consommer de l\u2019argent et retrouv\u00e9 un p\u00e9rim\u00e8tre de magasins rentables. La gestion de notre stock qui \u00e9tait l\u2019une de nos plus grandes faiblesses est devenue notre force. On est pass\u00e9 du flou \u00e0 la pr\u00e9cision. C\u2019\u00e9tait alors le bon moment de s\u2019assoir avec nos actionnaires et de faire des choix: http://bit.ly/save--2017 Remade Group. Dans ma recherche d\u2019opportunit\u00e9s pour la suite de Save, on a naturellement parl\u00e9 avec Matthieu Millet, le fondateur et dirigeant de Remade Group leader dans le march\u00e9 des smartphones reconditionn\u00e9s. Gr\u00e2ce \u00e0 Remade, la marque de Save est conserv\u00e9e, nos magasins et nos sauveteurs aussi. Les cr\u00e9anciers vont \u00eatre rembours\u00e9s gr\u00e2ce au plan de continuation, les int\u00e9r\u00eats de nos investisseurs sont pr\u00e9serv\u00e9s et 20% du montant de la cession revient aux dirigeants et managers cl\u00e9s. Merci Matthieu pour ta pro-activit\u00e9 et ton engagement tout au long du process. La suite\u00a0. Save va int\u00e9grer Remade Group et reprendre activement son d\u00e9veloppement gr\u00e2ce \u00e0 leur ma\u00eetrise industrielle: Elle sera notre nouveau socle et nous pourrons y d\u00e9ployer toute notre \u00e9nergie. Ayant retrouv\u00e9 le chemin de la croissance, la soci\u00e9t\u00e9 sera recapitalis\u00e9e. Remade c\u2019est autant de comp\u00e9tences que d\u2019exp\u00e9riences qu\u2019il nous manquait pour aller au bout de notre projet. Notre mod\u00e8le va enfin pouvoir \u00e9voluer vers la franchise et ainsi attirer des entrepreneurs \u201clocalement\u201d. (Pour rejoindre l \u2018aventure: franchise@save.co). Quatre ans apr\u00e8s, les quatre murs sont plus \u00e9pais et plus solides. L\u2019\u00e9nergie est toujours la m\u00eame. Nous avons pris de sacr\u00e9s coups, travers\u00e9 des d\u00e9serts, retrouv\u00e9 l\u2019espoir et nous voil\u00e0 pr\u00e8s \u00e0 relever tous les d\u00e9fis. C\u2019est une belle aventure humaine qui continue. On a pris de sacr\u00e9es le\u00e7ons et on n\u2019oubliera pas tous ceux qui ont \u00e9t\u00e9 l\u00e0 sans r\u00e9serve, dans les moments difficiles. \u2192 Remerciements (click) DM. ", "title": "Save rejoint Remade\u00a0Group", "sentences": [{"4ea3": "Save rejoint Remade\u00a0Group"}, {"3768": "Je suis sorti du tribunal ce matin avec beaucoup de soulagement. Le plan de continuation de l\u2019activit\u00e9 vient d\u2019\u00eatre accept\u00e9. L\u2019histoire de Save va continuer. C\u2019est la fin d\u2019un cycle compliqu\u00e9 et la suite d\u2019une belle aventure."}, {"24c7": "Il \u00e9tait une\u00a0fois\u2026"}, {"6577": "Je me revois plein d\u2019enthousiasme entre les quatre murs de la premi\u00e8re boutique Save my Smartphone en travaux. Jamais je n\u2019aurais pu imaginer que 3 ans plus tard nous serions 500 salari\u00e9s, r\u00e9partis dans 137 points de ventes dans 6 pays en Europe, chouchous de la presse, de nos investisseurs, de nos amis et de tout le reste de l\u2019\u00e9cosyst\u00e8me."}, {"6aab": "En r\u00e9alit\u00e9, on s\u2019est rapidement mis dans une bulle, isol\u00e9s de toute critique, ne craignant aucune barri\u00e8re et priv\u00e9s de tout discernement. Les marges n\u2019\u00e9taient pas encore au rendez-vous, les op\u00e9rations se d\u00e9roulaient sans r\u00e9elle ma\u00eetrise, on a lev\u00e9 des fonds, on \u00e9tait en hyper croissance et on se dit que c\u2019est normal. Sauf qu\u2019en mars 2016, Save consomme beaucoup trop de cash par mois et va dans le mur. La f\u00eate est finie."}, {"4087": "Le mur n\u2019est pas pass\u00e9 loin. Tout tient \u00e0 un d\u00e9jeuner avec un entrepreneur chevronn\u00e9 des t\u00e9l\u00e9coms qui a v\u00e9cu une histoire similaire."}, {"2b84": "5 Juillet 2016. Mise en redressement judiciaire."}, {"ff1b": "Fini les m\u00e9dias. Fini la conqu\u00eate du monde. On se retrousse les manches et on attaque les probl\u00e8mes un \u00e0 un (http://bit.ly/save-2016). Les derniers arriv\u00e9s partent, les guerriers restent, certains sont remerci\u00e9s. On se met en mode survie et on traite tous les sujets pour retrouver un p\u00e9rim\u00e8tre financier et op\u00e9rationnel qui permette de donner \u00e0 Save et \u00e0 ses salari\u00e9s un avenir."}, {"122d": "Fermetures de magasins, fermeture de filiales, plan social\u2026 La restructuration est douloureuse mais les \u00e9quipes donnent tout avec force et talent. Apr\u00e8s 6 mois, nous avons presque arr\u00eat\u00e9 de consommer de l\u2019argent et retrouv\u00e9 un p\u00e9rim\u00e8tre de magasins rentables. La gestion de notre stock qui \u00e9tait l\u2019une de nos plus grandes faiblesses est devenue notre force. On est pass\u00e9 du flou \u00e0 la pr\u00e9cision."}, {"3ac8": "C\u2019\u00e9tait alors le bon moment de s\u2019assoir avec nos actionnaires et de faire des choix: http://bit.ly/save--2017"}, {"cc22": "Remade Group."}, {"42e0": "Dans ma recherche d\u2019opportunit\u00e9s pour la suite de Save, on a naturellement parl\u00e9 avec Matthieu Millet, le fondateur et dirigeant de Remade Group leader dans le march\u00e9 des smartphones reconditionn\u00e9s."}, {"3823": "Gr\u00e2ce \u00e0 Remade, la marque de Save est conserv\u00e9e, nos magasins et nos sauveteurs aussi. Les cr\u00e9anciers vont \u00eatre rembours\u00e9s gr\u00e2ce au plan de continuation, les int\u00e9r\u00eats de nos investisseurs sont pr\u00e9serv\u00e9s et 20% du montant de la cession revient aux dirigeants et managers cl\u00e9s."}, {"dd7b": "Merci Matthieu pour ta pro-activit\u00e9 et ton engagement tout au long du process."}, {"9fdb": "La suite\u00a0."}, {"b69d": "Save va int\u00e9grer Remade Group et reprendre activement son d\u00e9veloppement gr\u00e2ce \u00e0 leur ma\u00eetrise industrielle: Elle sera notre nouveau socle et nous pourrons y d\u00e9ployer toute notre \u00e9nergie. Ayant retrouv\u00e9 le chemin de la croissance, la soci\u00e9t\u00e9 sera recapitalis\u00e9e. Remade c\u2019est autant de comp\u00e9tences que d\u2019exp\u00e9riences qu\u2019il nous manquait pour aller au bout de notre projet."}, {"4a5b": "Notre mod\u00e8le va enfin pouvoir \u00e9voluer vers la franchise et ainsi attirer des entrepreneurs \u201clocalement\u201d. (Pour rejoindre l \u2018aventure: franchise@save.co)."}, {"d852": "Quatre ans apr\u00e8s, les quatre murs sont plus \u00e9pais et plus solides. L\u2019\u00e9nergie est toujours la m\u00eame. Nous avons pris de sacr\u00e9s coups, travers\u00e9 des d\u00e9serts, retrouv\u00e9 l\u2019espoir et nous voil\u00e0 pr\u00e8s \u00e0 relever tous les d\u00e9fis. C\u2019est une belle aventure humaine qui continue. On a pris de sacr\u00e9es le\u00e7ons et on n\u2019oubliera pas tous ceux qui ont \u00e9t\u00e9 l\u00e0 sans r\u00e9serve, dans les moments difficiles."}, {"d43d": "\u2192 Remerciements (click)"}, {"562e": "DM."}], "child": "1179_1\t1179_2"}