{"name": "1390", "parent": "", "content": "Porque eu larguei a comunica\u00e7\u00e3o Talvez o texto mais dif\u00edcil de escrever (pra mim n\u00e9). J\u00e1 faz uns 3 meses que eu escolhi sair da minha \u201cag\u00eancia de propaganda\u201d e t\u00f4 dirigindo pro Uber desde ent\u00e3o. Vou resumir minha carreira ao m\u00e1ximo e logo vou pra parte que eu reclamo. Se n\u00e3o quiser ler a minha biografia, vai rolando at\u00e9 tu ler \u201cPARA AQUI\u201d um pouco maior. Vai ser f\u00e1cil de achar. Quando eu tinha 15 anos, ainda no Ensino M\u00e9dio, eu consegui um est\u00e1gio trabalhando com Social Media. Bem no in\u00edcio do boom. A\u00ed, quando eu tinha 17 rec\u00e9m-feitos entrei pra uma ag\u00eancia \u201cgrande\u201d como Assistente de Reda\u00e7\u00e3o. Logo ganhei um pr\u00eamio de melhor redator numa competi\u00e7\u00e3o da faculdade. A\u00ed fui promovido e ganhei um setor de comunica\u00e7\u00e3o online quase s\u00f3 pra mim. Nessa a\u00ed eu e meu dupla ganhamos Colunistas e entramos pro Anu\u00e1rio da ARP. PREMIOS NEAM\u00a0CARA Respira. A\u00ed uns 6 meses depois consegui ir pra uma ag\u00eancia BEM grande do RS, trabalhando com um cliente GIGANTESCO (worldwide shit). A\u00ed logo recebi proposta pra voltar pra ag\u00eancia \u201cgrande\u201d. Ali, com 2o anos, virei Gerente de Conte\u00fado. 3 meses como gerente e fui pra uma multinacional atr\u00e1s de uma promessa que acabou n\u00e3o decolando. No fim da caminhada na multinacional, abri uma empresa que ia trabalhar com Marketing Pol\u00edtico nas elei\u00e7\u00f5es municipais de 2016. Deu tudo certo. Elegemos todos nossos clientes importantes. Um deles, candidato a prefeito, come\u00e7ou a campanha com 3% e foi eleito com 41%. PARA AQUI\u200a\u2014\u200aFIM DA BIOGRAFIA Eu decidi sair \u201cda comunica\u00e7\u00e3o\u201d logo depois disso. Recusei empregos de ag\u00eancias, freelas de conte\u00fado, freelas de marketing. Tudo. N\u00e3o fa\u00e7o mais. Honestamente, eu larguei porque cansei do teatro. Quando eu tava dentro de ag\u00eancia, o cliente parecia cagar pro meu trampo. O cliente queria saber do neg\u00f3cio dele. Pra ele se n\u00e3o convertia em n\u00famero imediatamente, n\u00e3o valia. Pra ele ou tinha que ser \u201clegal\u201d ou tinha que \u201cfuncionar\u201d. Mas nenhuma das duas palavras traduzia. O que \u00e9 legal pra ti? N\u00e3o tinha resposta. O que funciona pra ti? \u2026 Mas beleza. Indefini\u00e7\u00f5es acontecem. Eu pensei que talvez rolaria mudar a mentalidade do cliente se eu tivesse dentro. L\u00e1 foi o retardado e n\u00e3o deu muito certo. A ag\u00eancia n\u00e3o consegue ver o neg\u00f3cio e s\u00f3 quer fazer coisas \u201clegais\u201d ou que \u201cfuncionem\u201d. Percebeu o problema? Quando eu tava no cliente, via coisas legais. Muitas coisas legais. Mas que s\u00f3 tinham sa\u00eddo da ag\u00eancia porque a dupla l\u00e1 queria pr\u00eamio. Quando eu tava no cliente, via coisas que funcionariam. Mas funcionariam nas m\u00e9tricas toscas de impress\u00e3o/pageview/intera\u00e7\u00e3o do Facebook/Google/Whatever. O que eu fiz? Desisti, porque n\u00e3o sou brasileiro. Mas at\u00e9 hoje n\u00e3o dei a minha opini\u00e3o sobre o assunto pra ningu\u00e9m. Mas l\u00e1 vai: eu acho que o problema da comunica\u00e7\u00e3o \u00e9 a terceiriza\u00e7\u00e3o. Na minha opini\u00e3o, a depend\u00eancia de ag\u00eancia fudeu com a comunica\u00e7\u00e3o. Deixa eu me explicar melhor: pra mim, a profiss\u00e3o de \u201cpublicit\u00e1rio\u201d \u00e9 burra\u200a\u2014\u200afazendo amigos em cada frase, n\u00e9? Se eu tivesse um neg\u00f3cio que vende geladeiras, todo mundo que me ajuda a vender mais geladeiras precisa trabalhar com geladeiras. Um publicit\u00e1rio n\u00e3o t\u00e1 no BUSINESS de vender geladeira. Ele t\u00e1 no BUSINESS de criar propaganda. Ele n\u00e3o t\u00e1 nem a\u00ed pras geladeiras. E \u00e9 bem natural na verdade. N\u00e3o tinha como ser diferente. Ele passa o dia inteiro dentro de uma ag\u00eancia cheia de gente sedenta por pr\u00eamios. Todos ali querem pr\u00eamios. Uns tentando vender geladeira, outros tentando vender sof\u00e1 e um terceiro grupo querendo vender chinelinho. As vezes as mesmas pessoas precisam vender os 3 no mesmo dia. Mas e como faz pra vender? Com campanhas, u\u00e9. Foi o que disseram na faculdade. Um problema de comunica\u00e7\u00e3o nem sempre \u00e9 resolvido com campanhas. Mas \u00e9 sempre o que sai da ag\u00eancia. Todo problema \u00e9 resolvido com uma campanhazinha. Com um conceito desdobrado em 100 pe\u00e7as. Com um slogan aplicado em 50 an\u00fancios. Com a ID aplicada em x\u00edcara, moleskine pra conven\u00e7\u00e3o de vendas e uma hashtag. Mas voc\u00eas n\u00e3o acharam que eu ia terminar o texto aqui n\u00e9? Preciso pelo menos sugerir alguma coisa (por mais furado que seja). Minha ideia: a comunica\u00e7\u00e3o toda deveria ser feita dentro da empresa. Eu produzo a geladeira. Eu sei como ela funciona. Eu sei o que meus clientes precisam saber. Eu sou o pai das minhas geladeiras. A General Electric tem uma abordagem parecida com isso\u200a\u2014\u200amas n\u00e3o necessariamente com geladeiras. Eles criaram um setor editorial, com uma revista dentro da empresa. Se a empresa acha que a solu\u00e7\u00e3o pra ajudar a vender t\u00e1 fora da empresa, tem algo errado. Se a ag\u00eancia acha que vai resolver o problema de comunica\u00e7\u00e3o de uma empresa olhando de fora, t\u00e1 mentindo. Toda empresa tem uma alma, uma personalidade. E essa personalidade n\u00e3o sobrevive ao telefone sem fio com a ag\u00eancia. Muita gente fala que o formato tradicional de ag\u00eancia t\u00e1 morto mas o formato novo ningu\u00e9m sabe. Eu tenho uma sugest\u00e3o: formato nenhum. Acabamos com a mentalidade de \u201cAGENCIAMENTO DE M\u00cdDIA\u201d e discutimos qual a fun\u00e7\u00e3o de quem pensa a comunica\u00e7\u00e3o. Vender \u00e9 muito diferente de criar conte\u00fado pra marca. A mesma pessoa fazer as duas coisas \u00e9 burrice. N\u00e3o tem nada errado em procurar gente de fora pra ajudar dentro. Mas ent\u00e3o contrata um consultor, n\u00e3o um agenciador. Eu realmente acho que se organizar direitinho, todo mundo transa. Mas se tiver esses agenciadores no meio, vai sobrar gente com o pau na m\u00e3o\u200a\u2014\u200ae normalmente s\u00e3o os pr\u00f3prios agenciadores. E a\u00ed? Concorda? Discorda? Deixa uma resposta\u00a0a\u00ed! Se curtiu, ajuda a divulgar essa ideia. Compartilha, recomenda\u2026 Obrigado por ter lido at\u00e9\u00a0aqui. Se tiver um tempo, d\u00e1 uma conferida no meu canal. Tenho produzido algumas coisinhas l\u00e1 tamb\u00e9m! ", "title": "Porque eu larguei a comunica\u00e7\u00e3o", "sentences": [{"ed2a": "Porque eu larguei a comunica\u00e7\u00e3o"}, {"b6e4": "Talvez o texto mais dif\u00edcil de escrever (pra mim n\u00e9)."}, {"e99f": "J\u00e1 faz uns 3 meses que eu escolhi sair da minha \u201cag\u00eancia de propaganda\u201d e t\u00f4 dirigindo pro Uber desde ent\u00e3o. Vou resumir minha carreira ao m\u00e1ximo e logo vou pra parte que eu reclamo. Se n\u00e3o quiser ler a minha biografia, vai rolando at\u00e9 tu ler \u201cPARA AQUI\u201d um pouco maior. Vai ser f\u00e1cil de achar."}, {"08a9": "Quando eu tinha 15 anos, ainda no Ensino M\u00e9dio, eu consegui um est\u00e1gio trabalhando com Social Media. Bem no in\u00edcio do boom."}, {"eb89": "A\u00ed, quando eu tinha 17 rec\u00e9m-feitos entrei pra uma ag\u00eancia \u201cgrande\u201d como Assistente de Reda\u00e7\u00e3o. Logo ganhei um pr\u00eamio de melhor redator numa competi\u00e7\u00e3o da faculdade. A\u00ed fui promovido e ganhei um setor de comunica\u00e7\u00e3o online quase s\u00f3 pra mim. Nessa a\u00ed eu e meu dupla ganhamos Colunistas e entramos pro Anu\u00e1rio da ARP."}, {"8b24": "PREMIOS NEAM\u00a0CARA"}, {"b278": "Respira."}, {"07c2": "A\u00ed uns 6 meses depois consegui ir pra uma ag\u00eancia BEM grande do RS, trabalhando com um cliente GIGANTESCO (worldwide shit). A\u00ed logo recebi proposta pra voltar pra ag\u00eancia \u201cgrande\u201d. Ali, com 2o anos, virei Gerente de Conte\u00fado. 3 meses como gerente e fui pra uma multinacional atr\u00e1s de uma promessa que acabou n\u00e3o decolando."}, {"271d": "No fim da caminhada na multinacional, abri uma empresa que ia trabalhar com Marketing Pol\u00edtico nas elei\u00e7\u00f5es municipais de 2016. Deu tudo certo. Elegemos todos nossos clientes importantes. Um deles, candidato a prefeito, come\u00e7ou a campanha com 3% e foi eleito com 41%."}, {"ed35": "PARA AQUI\u200a\u2014\u200aFIM DA BIOGRAFIA"}, {"d94e": "Eu decidi sair \u201cda comunica\u00e7\u00e3o\u201d logo depois disso. Recusei empregos de ag\u00eancias, freelas de conte\u00fado, freelas de marketing. Tudo. N\u00e3o fa\u00e7o mais."}, {"2a51": "Honestamente, eu larguei porque cansei do teatro."}, {"91d4": "Quando eu tava dentro de ag\u00eancia, o cliente parecia cagar pro meu trampo. O cliente queria saber do neg\u00f3cio dele. Pra ele se n\u00e3o convertia em n\u00famero imediatamente, n\u00e3o valia. Pra ele ou tinha que ser \u201clegal\u201d ou tinha que \u201cfuncionar\u201d. Mas nenhuma das duas palavras traduzia."}, {"c53b": "O que \u00e9 legal pra ti?"}, {"7a5b": "N\u00e3o tinha resposta."}, {"ba3c": "O que funciona pra ti?"}, {"9b15": "\u2026"}, {"fb7e": "Mas beleza. Indefini\u00e7\u00f5es acontecem. Eu pensei que talvez rolaria mudar a mentalidade do cliente se eu tivesse dentro."}, {"0f94": "L\u00e1 foi o retardado e n\u00e3o deu muito certo."}, {"596c": "A ag\u00eancia n\u00e3o consegue ver o neg\u00f3cio e s\u00f3 quer fazer coisas \u201clegais\u201d ou que \u201cfuncionem\u201d."}, {"ace6": "Percebeu o problema?"}, {"8e8c": "Quando eu tava no cliente, via coisas legais. Muitas coisas legais. Mas que s\u00f3 tinham sa\u00eddo da ag\u00eancia porque a dupla l\u00e1 queria pr\u00eamio."}, {"631e": "Quando eu tava no cliente, via coisas que funcionariam. Mas funcionariam nas m\u00e9tricas toscas de impress\u00e3o/pageview/intera\u00e7\u00e3o do Facebook/Google/Whatever."}, {"ec1a": "O que eu fiz? Desisti, porque n\u00e3o sou brasileiro. Mas at\u00e9 hoje n\u00e3o dei a minha opini\u00e3o sobre o assunto pra ningu\u00e9m."}, {"8679": "Mas l\u00e1 vai: eu acho que o problema da comunica\u00e7\u00e3o \u00e9 a terceiriza\u00e7\u00e3o."}, {"3337": "Na minha opini\u00e3o, a depend\u00eancia de ag\u00eancia fudeu com a comunica\u00e7\u00e3o."}, {"d4e4": "Deixa eu me explicar melhor: pra mim, a profiss\u00e3o de \u201cpublicit\u00e1rio\u201d \u00e9 burra\u200a\u2014\u200afazendo amigos em cada frase, n\u00e9?"}, {"e6ee": "Se eu tivesse um neg\u00f3cio que vende geladeiras, todo mundo que me ajuda a vender mais geladeiras precisa trabalhar com geladeiras."}, {"4bea": "Um publicit\u00e1rio n\u00e3o t\u00e1 no BUSINESS de vender geladeira. Ele t\u00e1 no BUSINESS de criar propaganda. Ele n\u00e3o t\u00e1 nem a\u00ed pras geladeiras."}, {"33a3": "E \u00e9 bem natural na verdade. N\u00e3o tinha como ser diferente. Ele passa o dia inteiro dentro de uma ag\u00eancia cheia de gente sedenta por pr\u00eamios. Todos ali querem pr\u00eamios."}, {"781a": "Uns tentando vender geladeira, outros tentando vender sof\u00e1 e um terceiro grupo querendo vender chinelinho. As vezes as mesmas pessoas precisam vender os 3 no mesmo dia."}, {"4139": "Mas e como faz pra vender? Com campanhas, u\u00e9. Foi o que disseram na faculdade."}, {"84d3": "Um problema de comunica\u00e7\u00e3o nem sempre \u00e9 resolvido com campanhas. Mas \u00e9 sempre o que sai da ag\u00eancia."}, {"b39d": "Todo problema \u00e9 resolvido com uma campanhazinha. Com um conceito desdobrado em 100 pe\u00e7as. Com um slogan aplicado em 50 an\u00fancios. Com a ID aplicada em x\u00edcara, moleskine pra conven\u00e7\u00e3o de vendas e uma hashtag."}, {"1a6a": "Mas voc\u00eas n\u00e3o acharam que eu ia terminar o texto aqui n\u00e9? Preciso pelo menos sugerir alguma coisa (por mais furado que seja)."}, {"84a8": "Minha ideia: a comunica\u00e7\u00e3o toda deveria ser feita dentro da empresa. Eu produzo a geladeira. Eu sei como ela funciona. Eu sei o que meus clientes precisam saber. Eu sou o pai das minhas geladeiras. A General Electric tem uma abordagem parecida com isso\u200a\u2014\u200amas n\u00e3o necessariamente com geladeiras. Eles criaram um setor editorial, com uma revista dentro da empresa."}, {"182c": "Se a empresa acha que a solu\u00e7\u00e3o pra ajudar a vender t\u00e1 fora da empresa, tem algo errado. Se a ag\u00eancia acha que vai resolver o problema de comunica\u00e7\u00e3o de uma empresa olhando de fora, t\u00e1 mentindo."}, {"0e28": "Toda empresa tem uma alma, uma personalidade. E essa personalidade n\u00e3o sobrevive ao telefone sem fio com a ag\u00eancia."}, {"fb71": "Muita gente fala que o formato tradicional de ag\u00eancia t\u00e1 morto mas o formato novo ningu\u00e9m sabe."}, {"d157": "Eu tenho uma sugest\u00e3o: formato nenhum. Acabamos com a mentalidade de \u201cAGENCIAMENTO DE M\u00cdDIA\u201d e discutimos qual a fun\u00e7\u00e3o de quem pensa a comunica\u00e7\u00e3o. Vender \u00e9 muito diferente de criar conte\u00fado pra marca. A mesma pessoa fazer as duas coisas \u00e9 burrice. N\u00e3o tem nada errado em procurar gente de fora pra ajudar dentro. Mas ent\u00e3o contrata um consultor, n\u00e3o um agenciador."}, {"ba8c": "Eu realmente acho que se organizar direitinho, todo mundo transa. Mas se tiver esses agenciadores no meio, vai sobrar gente com o pau na m\u00e3o\u200a\u2014\u200ae normalmente s\u00e3o os pr\u00f3prios agenciadores."}, {"07fb": "E a\u00ed? Concorda? Discorda? Deixa uma resposta\u00a0a\u00ed!"}, {"1b13": "Se curtiu, ajuda a divulgar essa ideia. Compartilha, recomenda\u2026"}, {"6002": "Obrigado por ter lido at\u00e9\u00a0aqui."}, {"8919": "Se tiver um tempo, d\u00e1 uma conferida no meu canal. Tenho produzido algumas coisinhas l\u00e1 tamb\u00e9m!"}], "child": "1390_1\t1390_2\t1390_31390_1\t1390_2\t1390_31390_1\t1390_2\t1390_3"}