{"name": "1391", "parent": "", "content": "Sobre ser millennial, ter crises existenciais e ficar de\u00a0boa. Eu decidi ser publicit\u00e1ria aos 11 anos. Nem veterin\u00e1ria, nem m\u00e9dica, nem professora. Publicit\u00e1ria. O que me levou a tomar essa decis\u00e3o, t\u00e3o nova, \u00e9 uma anedota que mais envergonha que acrescenta, ent\u00e3o deixa pra l\u00e1. Enfim. Me orgulhava de ter sido uma pessoa t\u00e3o decidida. Um prod\u00edgio. Aos 12 anos, j\u00e1 tinha todo o meu plano de vida tra\u00e7ado: Estudar > me formar > trabalhar > ficar rica. Era basicamente isso. At\u00e9 uns 16 fui acrescentando coisas como: ir morar em S\u00e3o Paulo, trabalhar numa grande ag\u00eancia, ir morar no exterior, casar, ter filhos, ter uma licen\u00e7a maternidade infinita porque eu seria t\u00e3o importante que poderia fazer meus hor\u00e1rios tudo, e assim vai. Bem millennial mesmo. N\u00e3o demorou muitos anos de faculdade at\u00e9 eu cair na real. Essa coisa da gente acreditar que \u00e9 especial e que vai ganhar o mundo \u00e9 o que fode com o nosso c\u00e9rebro. O que come\u00e7a como um empurr\u00e3o pra vencer na vida, acaba virando um assunto mal- resolvido pra uma sess\u00e3o de terapia e uma cr\u00f4nica S\u00edndrome do Impostor. Ouso dizer que 90% dos publicit\u00e1rios que eu conhe\u00e7o\u200a\u2014\u200acom quem estudei ou trabalhei\u200a\u2014\u200aj\u00e1 passaram por uma crise existencial daquelas que fazem a gente querer se esconder debaixo da mesa, voltar pro \u00fatero da m\u00e3e, ter passado na fila-pro-dom-em-exatas mais uma 3 vezes pra ver se d\u00e1 jeito. Eu presidi esse clubinho por uns tempos: tava frustrada, questionando as minhas escolhas, numa bad das bravas, revendo tudo que havia dentro de mim. Me sentia um cordeio de sacrif\u00edcio de Santan\u00e1s trabalhando a favor do capitalismo. Basicamente, eu acordava todos os dias me sentindo a pessoa mais in\u00fatil que j\u00e1 pisou na Terra discutindo o engajamento num post de Facebook enquanto tenho amigos salvando vidas. VIDAS. Sabe? Se o m\u00e9dico n\u00e3o faz o trampo direito ALGU\u00c9M MORRE. MORRE!!!! \u201cCaralho, que que eu to fazendo com a minha vida?\u201d era o letreiro em neon pink e verde que piscava na minha cabe\u00e7a todo dia antes de\u00a0dormir. Pra algumas pessoas que j\u00e1 passaram por isso, essa \u00e9 a hora de ler aquele text\u00e3o maravilhoso sobre \u201cO FULANO QUE LARGOU O TRABALHO E FOI VIVER DE VOLUNT\u00c1RIO NA \u00c1FRICA\u201d ou \u201cA FULANINHA QUE TROCOU A PROFISS\u00c3O X (geralmente \u00e9 publicit\u00e1rio, n\u00e9? quase sempre \u00e9 publicit\u00e1rio!) PARA SER O QUE SEMPRE SONHOU\u201d. Pra mim n\u00e3o. Lembra que eu disse que tinha escolhido ser publicit\u00e1ria aos 11 anos. Pois \u00e9. Eu escolhi ser publicit\u00e1ria aos 11 anos. E s\u00f3 isso. Eu n\u00e3o tinha, n\u00e3o tive\u200a\u2014\u200ae a essa altura, sejamos honestos\u200a\u2014\u200anunca mais terei um FUCKING. PLANO. B. Comigo n\u00e3o tinha segunda op\u00e7\u00e3o, n\u00e3o tinha essa de largar a profiss\u00e3o pra viver a minha voca\u00e7\u00e3o. E QUANDO VOC\u00ca T\u00c1 VIVENDO O SEU SONHO E T\u00c1 UMA MERDA? Ningu\u00e9m me contou que tinha isso! N\u00e3o tem pra onde correr. Me conformei que ia viver o resto da vida carregando esse fardo, tendo que viver com a consequ\u00eancia das minhas escolhas WHY GOD WHY, e segue o baile. na vdd eu tava\u00a0assim At\u00e9 que um dia, scrollando a timeline buscando o sentido da vida, eu vi uma frase que era mais ou menos assim: \u201cLembre-se que um dia voc\u00ea desejou estar exatamente onde est\u00e1\u00a0hoje\u201d Isso fez tanto sentido pra mim que transformou a minha rela\u00e7\u00e3o com as minhas escolhas. Resgatar na mem\u00f3ria\u200a\u2014\u200aainda que pare\u00e7a estar l\u00e1\u00e1\u00e1\u00e1\u00e1\u00e1 no fundo\u200a\u2014\u200ao que fez eu me interessar e, mais tarde, me apaixonar pela minha profiss\u00e3o \u00e9 o que faz eu acordar de manh\u00e3 e estar disposta a fazer o meu melhor, ainda que isso custe muitas horas de sono e alguns olhares de reprova\u00e7\u00e3o. E essa \u00e9 a li\u00e7\u00e3o do dia: quando voc\u00ea estiver se sentindo decepcionada, frustrada, arrasada, desgra\u00e7ada da cabe\u00e7a: pare, respire e lembre do porqu\u00ea voc\u00ea chegou at\u00e9 aqui. Se for preciso, fa\u00e7a uma lista. E o mais importante: se cerque de pessoas que despertem esse sentimento em voc\u00ea. De pessoas que te lembrem que fazer o que voc\u00ea faz pode ser sensacional se voc\u00ea quiser. Resgate seus \u00eddolos da inf\u00e2ncia, reveja aquele filme que marcou a sua vida, aquela s\u00e9rie que moldou o seu car\u00e1ter, se debruce na hist\u00f3ria daquela personagem que \u00e9 sua musa, rodeie-se de coisas que te lembrem constantemente que \u00e9 poss\u00edvel conviver bem com as suas escolhas e que viver o seu sonho depende do que voc\u00ea faz com ele. Tente valorizar aqueles minutos em que tudo parece valer a pena. Tem dias que vai parecer f\u00e1cil, tem dias que vai parecer imposs\u00edvel. Se voc\u00ea leu at\u00e9 aqui esperando uma conclus\u00e3o, eu sinto muito. Mas tamo tudo no mesmo barco, ficando bem. Um dia de cada vez. ", "title": "Sobre ser millennial, ter crises existenciais e ficar de\u00a0boa.", "sentences": [{"0ff6": "Sobre ser millennial, ter crises existenciais e ficar de\u00a0boa."}, {"516d": "Eu decidi ser publicit\u00e1ria aos 11 anos."}, {"7e6b": "Nem veterin\u00e1ria, nem m\u00e9dica, nem professora. Publicit\u00e1ria."}, {"959b": "O que me levou a tomar essa decis\u00e3o, t\u00e3o nova, \u00e9 uma anedota que mais envergonha que acrescenta, ent\u00e3o deixa pra l\u00e1."}, {"2f83": "Enfim."}, {"831e": "Me orgulhava de ter sido uma pessoa t\u00e3o decidida. Um prod\u00edgio. Aos 12 anos, j\u00e1 tinha todo o meu plano de vida tra\u00e7ado:"}, {"75d8": "Estudar > me formar > trabalhar > ficar rica."}, {"a2f7": "Era basicamente isso."}, {"9686": "At\u00e9 uns 16 fui acrescentando coisas como: ir morar em S\u00e3o Paulo, trabalhar numa grande ag\u00eancia, ir morar no exterior, casar, ter filhos, ter uma licen\u00e7a maternidade infinita porque eu seria t\u00e3o importante que poderia fazer meus hor\u00e1rios tudo, e assim vai. Bem millennial mesmo."}, {"a284": "N\u00e3o demorou muitos anos de faculdade at\u00e9 eu cair na real."}, {"5009": "Essa coisa da gente acreditar que \u00e9 especial e que vai ganhar o mundo \u00e9 o que fode com o nosso c\u00e9rebro. O que come\u00e7a como um empurr\u00e3o pra vencer na vida, acaba virando um assunto mal- resolvido pra uma sess\u00e3o de terapia e uma cr\u00f4nica S\u00edndrome do Impostor."}, {"f679": "Ouso dizer que 90% dos publicit\u00e1rios que eu conhe\u00e7o\u200a\u2014\u200acom quem estudei ou trabalhei\u200a\u2014\u200aj\u00e1 passaram por uma crise existencial daquelas que fazem a gente querer se esconder debaixo da mesa, voltar pro \u00fatero da m\u00e3e, ter passado na fila-pro-dom-em-exatas mais uma 3 vezes pra ver se d\u00e1 jeito. Eu presidi esse clubinho por uns tempos: tava frustrada, questionando as minhas escolhas, numa bad das bravas, revendo tudo que havia dentro de mim. Me sentia um cordeio de sacrif\u00edcio de Santan\u00e1s trabalhando a favor do capitalismo."}, {"8be0": "Basicamente, eu acordava todos os dias me sentindo a pessoa mais in\u00fatil que j\u00e1 pisou na Terra discutindo o engajamento num post de Facebook enquanto tenho amigos salvando vidas. VIDAS. Sabe? Se o m\u00e9dico n\u00e3o faz o trampo direito ALGU\u00c9M MORRE. MORRE!!!!"}, {"0093": "\u201cCaralho, que que eu to fazendo com a minha vida?\u201d era o letreiro em neon pink e verde que piscava na minha cabe\u00e7a todo dia antes de\u00a0dormir."}, {"771f": "Pra algumas pessoas que j\u00e1 passaram por isso, essa \u00e9 a hora de ler aquele text\u00e3o maravilhoso sobre \u201cO FULANO QUE LARGOU O TRABALHO E FOI VIVER DE VOLUNT\u00c1RIO NA \u00c1FRICA\u201d ou \u201cA FULANINHA QUE TROCOU A PROFISS\u00c3O X (geralmente \u00e9 publicit\u00e1rio, n\u00e9? quase sempre \u00e9 publicit\u00e1rio!) PARA SER O QUE SEMPRE SONHOU\u201d."}, {"c4a6": "Pra mim n\u00e3o."}, {"0f0f": "Lembra que eu disse que tinha escolhido ser publicit\u00e1ria aos 11 anos. Pois \u00e9. Eu escolhi ser publicit\u00e1ria aos 11 anos. E s\u00f3 isso. Eu n\u00e3o tinha, n\u00e3o tive\u200a\u2014\u200ae a essa altura, sejamos honestos\u200a\u2014\u200anunca mais terei um FUCKING. PLANO. B. Comigo n\u00e3o tinha segunda op\u00e7\u00e3o, n\u00e3o tinha essa de largar a profiss\u00e3o pra viver a minha voca\u00e7\u00e3o. E QUANDO VOC\u00ca T\u00c1 VIVENDO O SEU SONHO E T\u00c1 UMA MERDA? Ningu\u00e9m me contou que tinha isso! N\u00e3o tem pra onde correr."}, {"d9a6": "Me conformei que ia viver o resto da vida carregando esse fardo, tendo que viver com a consequ\u00eancia das minhas escolhas WHY GOD WHY, e segue o baile."}, {"81cc": "na vdd eu tava\u00a0assim"}, {"04d2": "At\u00e9 que um dia, scrollando a timeline buscando o sentido da vida, eu vi uma frase que era mais ou menos assim:"}, {"853d": "\u201cLembre-se que um dia voc\u00ea desejou estar exatamente onde est\u00e1\u00a0hoje\u201d"}, {"f052": "Isso fez tanto sentido pra mim que transformou a minha rela\u00e7\u00e3o com as minhas escolhas. Resgatar na mem\u00f3ria\u200a\u2014\u200aainda que pare\u00e7a estar l\u00e1\u00e1\u00e1\u00e1\u00e1\u00e1 no fundo\u200a\u2014\u200ao que fez eu me interessar e, mais tarde, me apaixonar pela minha profiss\u00e3o \u00e9 o que faz eu acordar de manh\u00e3 e estar disposta a fazer o meu melhor, ainda que isso custe muitas horas de sono e alguns olhares de reprova\u00e7\u00e3o."}, {"807a": "E essa \u00e9 a li\u00e7\u00e3o do dia: quando voc\u00ea estiver se sentindo decepcionada, frustrada, arrasada, desgra\u00e7ada da cabe\u00e7a: pare, respire e lembre do porqu\u00ea voc\u00ea chegou at\u00e9 aqui. Se for preciso, fa\u00e7a uma lista. E o mais importante: se cerque de pessoas que despertem esse sentimento em voc\u00ea. De pessoas que te lembrem que fazer o que voc\u00ea faz pode ser sensacional se voc\u00ea quiser."}, {"f718": "Resgate seus \u00eddolos da inf\u00e2ncia, reveja aquele filme que marcou a sua vida, aquela s\u00e9rie que moldou o seu car\u00e1ter, se debruce na hist\u00f3ria daquela personagem que \u00e9 sua musa, rodeie-se de coisas que te lembrem constantemente que \u00e9 poss\u00edvel conviver bem com as suas escolhas e que viver o seu sonho depende do que voc\u00ea faz com ele."}, {"da08": "Tente valorizar aqueles minutos em que tudo parece valer a pena."}, {"2001": "Tem dias que vai parecer f\u00e1cil, tem dias que vai parecer imposs\u00edvel. Se voc\u00ea leu at\u00e9 aqui esperando uma conclus\u00e3o, eu sinto muito. Mas tamo tudo no mesmo barco, ficando bem. Um dia de cada vez."}], "child": "1391_1"}