{"name": "1595", "parent": "", "content": "Republican senator says Elizabeth Warren shouldn\u2019t criticize Sessions\u200a\u2014\u200aeven if it\u2019s the\u00a0truth \u201cThink of his\u00a0wife.\u201d Sen. Orrin Hatch (R-UT) CREDIT: AP Photo/Alex Brandon The world\u2019s greatest deliberative body can\u2019t handle the truth, apparently. A top Republican senator was \u201castounded\u201d that Democratic Sen. Elizabeth Warren (MA) lacked the \u201cetiquette and courtesy\u201d to \u201cthink of the wife\u201d of colleague Jeff Sessions, the U.S. attorney general nominee, before criticizing his record on voting rights. Sen. Orrin Hatch (R-UT) took to the Senate floor Tuesday night to accuse Warren of lacking the appropriate decorum. In his speech, Hatch accused Warren of being indelicate in her opposition, saying that senators \u201cought to be ashamed of ourselves\u201d and that he \u201cresented the constant diatribe against a fellow senator.\u201d Earlier, Warren read a letter by Coretta Scott King, the widow of Martin Luther King Jr., which opposed the nomination of Sessions to a federal judgeship in 1986. King\u2019s letter accused Sessions of blunting the rights of black citizens when he was a U.S. attorney in Alabama. The senate voted to silence Warren in a party-line vote. \u201cJeff Sessions is a very fine person,\u201d Hatch said in his speech. \u201cThink of his wife. She is a really fine person. Jeff has been here 20 years. He\u2019s interchanged with almost all of us. Sometimes you agree with him and sometimes you disagree with him, but he\u2019s always been a gentleman. He\u2019s always been kind and considerate of his colleagues. I can\u2019t name one time when he wasn\u2019t. And yet we\u2019re treating him like he is some terrible person that doesn\u2019t deserve to be chosen by the current president of the United States to be attorney general of the United States.\u201d \u201cI think we have to grow up and I suggest all of us take stock in ourselves and see if we can treat each other with greater respect,\u201d Hatch added. \u201cBut I have to say, I resented\u200a\u2014\u200aas much as I like the distinguished senator from Massachusetts\u200a\u2014\u200aI resented the constant diatribe against a fellow senator. Even if everything she said was true, I don\u2019t think that was the right thing to do.\u201d Hatch later accused Democratic senators for not treating Sessions with respect because they were still \u201cvery upset\u201d that President Donald Trump won the general election in November. Elizabeth Warren was just silenced on the Senate floor. Her crime was quoting Coretta Scott King.A low moment for the world\u2019s greatest deliberative body.thinkprogress.org Warren\u2019s opposition to Sessions follows accusations that he supported white supremacist groups and used racially charged remarks in the past. Among some of his most egregious offenses, Sessions allegedly called a black assistant U.S. assistant \u201cboy,\u201d joked that the Ku Klux Klan was \u201cokay\u201d until he found out that members smoked marijuana, dismissed comprehensive immigration reform as an \u201cethnic politics,\u201d and has called the Voting Rights Act a \u201cpiece of intrusive legislation.\u201d ", "title": "Republican senator says Elizabeth Warren shouldn\u2019t criticize Sessions\u200a\u2014\u200aeven if it\u2019s the\u00a0truth", "sentences": [{"3b5f": "Republican senator says Elizabeth Warren shouldn\u2019t criticize Sessions\u200a\u2014\u200aeven if it\u2019s the\u00a0truth"}, {"2f15": "\u201cThink of his\u00a0wife.\u201d"}, {"2ed0": "Sen. Orrin Hatch (R-UT) CREDIT: AP Photo/Alex Brandon"}, {"60c4": "The world\u2019s greatest deliberative body can\u2019t handle the truth, apparently."}, {"9871": "A top Republican senator was \u201castounded\u201d that Democratic Sen. Elizabeth Warren (MA) lacked the \u201cetiquette and courtesy\u201d to \u201cthink of the wife\u201d of colleague Jeff Sessions, the U.S. attorney general nominee, before criticizing his record on voting rights."}, {"91ce": "Sen. Orrin Hatch (R-UT) took to the Senate floor Tuesday night to accuse Warren of lacking the appropriate decorum. In his speech, Hatch accused Warren of being indelicate in her opposition, saying that senators \u201cought to be ashamed of ourselves\u201d and that he \u201cresented the constant diatribe against a fellow senator.\u201d"}, {"e6a7": "Earlier, Warren read a letter by Coretta Scott King, the widow of Martin Luther King Jr., which opposed the nomination of Sessions to a federal judgeship in 1986. King\u2019s letter accused Sessions of blunting the rights of black citizens when he was a U.S. attorney in Alabama. The senate voted to silence Warren in a party-line vote."}, {"daf6": "\u201cJeff Sessions is a very fine person,\u201d Hatch said in his speech. \u201cThink of his wife. She is a really fine person. Jeff has been here 20 years. He\u2019s interchanged with almost all of us. Sometimes you agree with him and sometimes you disagree with him, but he\u2019s always been a gentleman. He\u2019s always been kind and considerate of his colleagues. I can\u2019t name one time when he wasn\u2019t. And yet we\u2019re treating him like he is some terrible person that doesn\u2019t deserve to be chosen by the current president of the United States to be attorney general of the United States.\u201d"}, {"bc08": "\u201cI think we have to grow up and I suggest all of us take stock in ourselves and see if we can treat each other with greater respect,\u201d Hatch added. \u201cBut I have to say, I resented\u200a\u2014\u200aas much as I like the distinguished senator from Massachusetts\u200a\u2014\u200aI resented the constant diatribe against a fellow senator. Even if everything she said was true, I don\u2019t think that was the right thing to do.\u201d"}, {"25bb": "Hatch later accused Democratic senators for not treating Sessions with respect because they were still \u201cvery upset\u201d that President Donald Trump won the general election in November."}, {"487f": "Elizabeth Warren was just silenced on the Senate floor. Her crime was quoting Coretta Scott King.A low moment for the world\u2019s greatest deliberative body.thinkprogress.org"}, {"7b68": "Warren\u2019s opposition to Sessions follows accusations that he supported white supremacist groups and used racially charged remarks in the past."}, {"325f": "Among some of his most egregious offenses, Sessions allegedly called a black assistant U.S. assistant \u201cboy,\u201d joked that the Ku Klux Klan was \u201cokay\u201d until he found out that members smoked marijuana, dismissed comprehensive immigration reform as an \u201cethnic politics,\u201d and has called the Voting Rights Act a \u201cpiece of intrusive legislation.\u201d"}], "child": "1595_1\t1595_2\t1595_3\t1595_4\t1595_5\t1595_6\t1595_7\t1595_8\t1595_9\t1595_10\t1595_11\t1595_12\t1595_13\t1595_14\t1595_15\t1595_16\t1595_17"}