{"name": "1673", "parent": "", "content": "Cloudflare has been leaking HTTPS data from thousands of major websites for\u00a0months Here are three links worth your time: Bonus: How an AI is learning how to beat the best human players at Super Smash Bros. Melee (10 minute read) Thought of the\u00a0day: \u201cThe mantra of any good security engineer is: \u201cSecurity is a not a product, but a process.\u201d It\u2019s more than designing strong cryptography into a system; it\u2019s designing the entire system such that all security measures, including cryptography, work together.\u201d\u200a\u2014\u200aBruce Schneier Funny of the\u00a0day: Webcomic by CommitStrip Study group of the\u00a0day: freeCodeCamp Nairobi Happy coding! \u2013 Quincy Larson, teacher at freeCodeCamp ", "title": "Cloudflare has been leaking HTTPS data from thousands of major websites for\u00a0months", "sentences": [{"3df9": "Cloudflare has been leaking HTTPS data from thousands of major websites for\u00a0months"}, {"9585": "Here are three links worth your time:"}, {"58e5": "Bonus: How an AI is learning how to beat the best human players at Super Smash Bros. Melee (10 minute read)"}, {"4749": "Thought of the\u00a0day:"}, {"ce74": "\u201cThe mantra of any good security engineer is: \u201cSecurity is a not a product, but a process.\u201d It\u2019s more than designing strong cryptography into a system; it\u2019s designing the entire system such that all security measures, including cryptography, work together.\u201d\u200a\u2014\u200aBruce Schneier"}, {"48ac": "Funny of the\u00a0day:"}, {"e58a": "Webcomic by CommitStrip"}, {"3125": "Study group of the\u00a0day:"}, {"5b2b": "freeCodeCamp Nairobi"}, {"f2f9": "Happy coding!"}, {"ee9d": "\u2013 Quincy Larson, teacher at freeCodeCamp"}], "child": "1673_1\t1673_2\t1673_3\t1673_4\t1673_5\t1673_6"}