{"sentences": [{"7a0d": "Rethinking Internet Marketing"}, {"a34b": "I am sick of being sold to. And by extension, I\u2019m dead sick of\u00a0selling."}, {"e3a7": "Every month my email inbox is clogged with a dozen people all hawking the same products\u200a\u2014\u200aaffiliates taking part in some joint venture. It\u2019s such an overload that even if I was inclined to buy the thing, I\u2019d skip it just on principle."}, {"9245": "I think that a certain type of Internet campaign was once very effective, but it\u2019s jumped the shark. Used to be you could create a class or a coaching program or some other sort of program, slap a $499 (or $1499 or $2499 or\u00a0.\u00a0.\u00a0.) price tag on it, send out a sequence of emails, and make a ton of money."}, {"7011": "If someone can\u2019t afford $499? Well, they\u2019re not trying hard enough. Or they don\u2019t want it badly enough. Or they\u2019re not manifesting with enough intensity. They aren\u2019t using the Law of Attraction properly."}, {"f72c": "And besides, if they don\u2019t pay, they won\u2019t respect the thing anyway."}, {"8e1d": "Just ask any Internet marketer. They\u2019ll tell you."}, {"8fd7": "Maybe there are people who aren\u2019t tired of being sold to, or who aren\u2019t sick of selling. Maybe the old model still works for some people. I don\u2019t know. What I do know is that I want to find a different way."}, {"e489": "Here\u2019s what I want to do: I want to teach people how to write their stories. And I want to write my own stories for people to read."}, {"08fc": "I do not want to be an internet marketer. Even though for me to find students to teach, I kind of have to be. I don\u2019t want to have to go back to my shitty day job, after all."}, {"9b78": "So, let\u2019s put it this way: I don\u2019t want to be THAT KIND of internet marketer."}, {"33da": "I want to create things and trust that if people get something from what I\u2019m offering, they\u2019ll want to be part of and support the community I\u2019m creating. And I want a model that doesn\u2019t require some people to choose between doing the cool thing with me or eating for the next month or two."}, {"2a9a": "About six weeks ago, I started a Patreon page around the idea that I could say to people: hey, I\u2019m doing this cool thing. Want to do it with me? And they would want to. And they\u2019d be willing to support the community in the process."}, {"5432": "And it\u2019s working."}, {"bf0a": "For ten bucks a month any writer can join The 1000 Day MFA. It\u2019s the cool thing I\u2019m doing and inviting other writers to do with me: combining Ray Bradbury\u2019s advice to new writers and my own traditional MFA experience and turning into something that anyone can do, if they put the time and effort into it, without needing to spend $20,000 a semester."}, {"8249": "It\u2019s unaccredited (of course), but seriously fun. And at the end of 1000 days, anyone who joins in will have built a writing community that will support their burgeoning careers, they\u2019ll have become very well read, and they\u2019ll have more than 150 short stories under their writerly belts. Plus three novel drafts."}, {"7dff": "I love that anyone can join in for ten bucks. Maybe it seems weird to you, but I get excited by the idea that anyone can be part of this thing if they want to be. And I really, really enjoy building this thing into a community that has room for everyone who might benefit from it."}, {"7926": "So. I\u2019m doing this cool thing. Want to join me?"}, {"c619": "Don\u2019t forget to click the heart to recommend this article."}, {"1939": "Shaunta Grimes is a writer and teacher. She lives in Reno with her husband, three superstar kids, and a yellow rescue dog named Maybelline Scout. She\u2019s on Twitter @shauntagrimes, is the author of Viral Nation and Rebel Nation, and is the original Ninja Writer."}], "child": "2202_1\t2202_2\t2202_3\t2202_4\t2202_5\t2202_6\t2202_7\t2202_8\t2202_9\t2202_10\t2202_112202_1\t2202_2\t2202_3\t2202_4\t2202_5\t2202_6\t2202_7\t2202_8\t2202_9\t2202_10\t2202_112202_1\t2202_2\t2202_3\t2202_4\t2202_5\t2202_6\t2202_7\t2202_8\t2202_9\t2202_10\t2202_11", "parent": "", "title": "Rethinking Internet Marketing", "content": "Rethinking Internet Marketing I am sick of being sold to. And by extension, I\u2019m dead sick of\u00a0selling. Every month my email inbox is clogged with a dozen people all hawking the same products\u200a\u2014\u200aaffiliates taking part in some joint venture. It\u2019s such an overload that even if I was inclined to buy the thing, I\u2019d skip it just on principle. I think that a certain type of Internet campaign was once very effective, but it\u2019s jumped the shark. Used to be you could create a class or a coaching program or some other sort of program, slap a $499 (or $1499 or $2499 or\u00a0.\u00a0.\u00a0.) price tag on it, send out a sequence of emails, and make a ton of money. If someone can\u2019t afford $499? Well, they\u2019re not trying hard enough. Or they don\u2019t want it badly enough. Or they\u2019re not manifesting with enough intensity. They aren\u2019t using the Law of Attraction properly. And besides, if they don\u2019t pay, they won\u2019t respect the thing anyway. Just ask any Internet marketer. They\u2019ll tell you. Maybe there are people who aren\u2019t tired of being sold to, or who aren\u2019t sick of selling. Maybe the old model still works for some people. I don\u2019t know. What I do know is that I want to find a different way. Here\u2019s what I want to do: I want to teach people how to write their stories. And I want to write my own stories for people to read. I do not want to be an internet marketer. Even though for me to find students to teach, I kind of have to be. I don\u2019t want to have to go back to my shitty day job, after all. So, let\u2019s put it this way: I don\u2019t want to be THAT KIND of internet marketer. I want to create things and trust that if people get something from what I\u2019m offering, they\u2019ll want to be part of and support the community I\u2019m creating. And I want a model that doesn\u2019t require some people to choose between doing the cool thing with me or eating for the next month or two. About six weeks ago, I started a Patreon page around the idea that I could say to people: hey, I\u2019m doing this cool thing. Want to do it with me? And they would want to. And they\u2019d be willing to support the community in the process. And it\u2019s working. For ten bucks a month any writer can join The 1000 Day MFA. It\u2019s the cool thing I\u2019m doing and inviting other writers to do with me: combining Ray Bradbury\u2019s advice to new writers and my own traditional MFA experience and turning into something that anyone can do, if they put the time and effort into it, without needing to spend $20,000 a semester. It\u2019s unaccredited (of course), but seriously fun. And at the end of 1000 days, anyone who joins in will have built a writing community that will support their burgeoning careers, they\u2019ll have become very well read, and they\u2019ll have more than 150 short stories under their writerly belts. Plus three novel drafts. I love that anyone can join in for ten bucks. Maybe it seems weird to you, but I get excited by the idea that anyone can be part of this thing if they want to be. And I really, really enjoy building this thing into a community that has room for everyone who might benefit from it. So. I\u2019m doing this cool thing. Want to join me? Don\u2019t forget to click the heart to recommend this article. Shaunta Grimes is a writer and teacher. She lives in Reno with her husband, three superstar kids, and a yellow rescue dog named Maybelline Scout. She\u2019s on Twitter @shauntagrimes, is the author of Viral Nation and Rebel Nation, and is the original Ninja Writer. ", "name": "2202"}