{"sentences": [{"1c50": "Why Learning Is A New Procrastination"}, {"dc4d": "BY MAX LUKOMINSKYI"}, {"57f0": "The tremendous world of online courses, blogs, social media, free eBooks, podcasts, and webinars provides the best ever opportunity to broaden your knowledge in almost every sphere you can imagine."}, {"91af": "Thanks to technological advancement and the instant access to the internet, everyone can now study from home. It seems like it would be foolishly not to seize this opportunity and improve your skills and knowledge."}, {"1496": "Moreover, you are kind of forced to do so since the contemporary world has raised the bar higher than ever before. It literally invited you to gather the pace and accelerate even more."}, {"b987": "It is not surprising that, ultimately, you try to be everywhere and do everything. No doubt, you do your best to constantly gather tiny bits of information from as many channels as possible, because you are afraid that you will fall behind if you stop."}, {"9415": "After all, you enter a learning crunch mode. You do not afford to miss anything and try to read every book you could get your hands on. You listen to every single podcast your smartphone could download and take every online course your paycheck would allow to take."}, {"7d6a": "All in all, you learn. As much as possible. As intense as you manage to."}, {"4ff5": "You learn how to write and publish a new book. You learn how to launch a successful blog. You learn how to hit your goal on Kickstarter. You learn how to build the next \u201cunicorn\u201d. You learn how to land a job of your dream. You learn how to successfully sell thousands of items on Amazon. You learn how to make millions of dollars in passive income."}, {"abf1": "However, the problem is that you do everything except taking\u00a0action."}, {"0fc4": "All those activities do not take you closer to the things you want to accomplish. Better knowledge does not make you more influential, powerful, and successful unless you apply it."}, {"e829": "The key secret to success is not excessive expertise, but the ability to use it."}, {"475f": "Knowledge is worthless unless it is\u00a0applied."}, {"95e5": "Needless to say that studying is crucial. However, the thing is that it should take the entirely new form now. You should stop learning from someone else`s experiences, knowledge, failures, and wins and start learning from your own mistakes, adventures, achievements, and bold actions."}, {"ae64": "Learning has become a major trend of the 21st century. Sadly, it has also become a new form of procrastination."}, {"980e": "You consciously postpone the first step justifying this by your eagerness to broaden the knowledge and learn new things. You put the start date off justifying this by your desire to pick up new skills that would help you succeed faster. You procrastinate over chasing your own aspirations because doing the things on your own and creating your own story of success is far more complicated than reading about someone else`s one."}, {"f721": "Meanwhile, no one would really reproach you for wasting your time. Moreover, you feel comfortable about staying within this zone of ease and convenience forever."}, {"c61c": "However, the point is that you already have and know everything you need to start off. In fact, there is nothing more you need to learn in order to take the first step."}, {"4422": "Embrace the truth. No matter how good your theoretical knowledge is, you will face a lot of obstacles while applying it. You will have to deal with issues that have never been described or covered in any book. You will have to look for the solutions and make the spontaneous decisions that no one probably has ever thought of. You will have to design your own road to success."}, {"594e": "Stop learning by consuming. Start learning by creating."}, {"5968": "Stop learning by researching. Start learning by doing."}, {"e42c": "Stop learning by listening. Start learning by talking."}, {"da91": "Stop learning by reading. Start learning by writing."}, {"0621": "Stop learning by watching the game. Start learning by playing it."}, {"7b96": "Stop postponing. Start taking action."}, {"98ac": "Transform your learning process from the continuous the procrastination into an unstoppable process of absorbing invaluable expertise based on your own experience."}, {"b2e7": "It might seem counterintuitive, but the old-fashioned way of learning is what holds you back. This is what makes your achievements suck."}, {"ea47": "Constant learning, evaluating of ideas, thinking, and visualizing your journey towards your major aspirations will not take you far from the place you are now. Actions will."}, {"2211": "You can sit and research, and research, and research, while someone else is already reaping huge rewards for his or her fruitful and hard work."}, {"d08a": "Stop learning now. Become bold enough to take the first step and start learning from your own experience."}, {"abc0": "Thanks for reading! If you liked this article, please take a second to hit a heart button so more people can enjoy it. That would mean a world to me!"}], "child": "2204_1\t2204_2\t2204_3\t2204_4\t2204_5\t2204_6\t2204_7\t2204_8\t2204_9\t2204_10\t2204_11\t2204_12\t2204_13\t2204_14\t2204_15\t2204_16\t2204_17\t2204_18\t2204_19\t2204_20\t2204_21\t2204_22\t2204_23\t2204_24\t2204_25", "parent": "", "title": "Why Learning Is A New Procrastination", "content": "Why Learning Is A New Procrastination BY MAX LUKOMINSKYI The tremendous world of online courses, blogs, social media, free eBooks, podcasts, and webinars provides the best ever opportunity to broaden your knowledge in almost every sphere you can imagine. Thanks to technological advancement and the instant access to the internet, everyone can now study from home. It seems like it would be foolishly not to seize this opportunity and improve your skills and knowledge. Moreover, you are kind of forced to do so since the contemporary world has raised the bar higher than ever before. It literally invited you to gather the pace and accelerate even more. It is not surprising that, ultimately, you try to be everywhere and do everything. No doubt, you do your best to constantly gather tiny bits of information from as many channels as possible, because you are afraid that you will fall behind if you stop. After all, you enter a learning crunch mode. You do not afford to miss anything and try to read every book you could get your hands on. You listen to every single podcast your smartphone could download and take every online course your paycheck would allow to take. All in all, you learn. As much as possible. As intense as you manage to. You learn how to write and publish a new book. You learn how to launch a successful blog. You learn how to hit your goal on Kickstarter. You learn how to build the next \u201cunicorn\u201d. You learn how to land a job of your dream. You learn how to successfully sell thousands of items on Amazon. You learn how to make millions of dollars in passive income. However, the problem is that you do everything except taking\u00a0action. All those activities do not take you closer to the things you want to accomplish. Better knowledge does not make you more influential, powerful, and successful unless you apply it. The key secret to success is not excessive expertise, but the ability to use it. Knowledge is worthless unless it is\u00a0applied. Needless to say that studying is crucial. However, the thing is that it should take the entirely new form now. You should stop learning from someone else`s experiences, knowledge, failures, and wins and start learning from your own mistakes, adventures, achievements, and bold actions. Learning has become a major trend of the 21st century. Sadly, it has also become a new form of procrastination. You consciously postpone the first step justifying this by your eagerness to broaden the knowledge and learn new things. You put the start date off justifying this by your desire to pick up new skills that would help you succeed faster. You procrastinate over chasing your own aspirations because doing the things on your own and creating your own story of success is far more complicated than reading about someone else`s one. Meanwhile, no one would really reproach you for wasting your time. Moreover, you feel comfortable about staying within this zone of ease and convenience forever. However, the point is that you already have and know everything you need to start off. In fact, there is nothing more you need to learn in order to take the first step. Embrace the truth. No matter how good your theoretical knowledge is, you will face a lot of obstacles while applying it. You will have to deal with issues that have never been described or covered in any book. You will have to look for the solutions and make the spontaneous decisions that no one probably has ever thought of. You will have to design your own road to success. Stop learning by consuming. Start learning by creating. Stop learning by researching. Start learning by doing. Stop learning by listening. Start learning by talking. Stop learning by reading. Start learning by writing. Stop learning by watching the game. Start learning by playing it. Stop postponing. Start taking action. Transform your learning process from the continuous the procrastination into an unstoppable process of absorbing invaluable expertise based on your own experience. It might seem counterintuitive, but the old-fashioned way of learning is what holds you back. This is what makes your achievements suck. Constant learning, evaluating of ideas, thinking, and visualizing your journey towards your major aspirations will not take you far from the place you are now. Actions will. You can sit and research, and research, and research, while someone else is already reaping huge rewards for his or her fruitful and hard work. Stop learning now. Become bold enough to take the first step and start learning from your own experience. Thanks for reading! If you liked this article, please take a second to hit a heart button so more people can enjoy it. That would mean a world to me! ", "name": "2204"}