{"sentences": [{"90aa": "Can Just Anyone Make a Fancy Tiki\u00a0Drink?"}, {"e384": "An investigation."}, {"e585": "Art: Kelly"}, {"4231": "Do you make cocktails at home? (Don\u2019t answer.) I like making cocktails at home because you get to do a little something, and then you get a cocktail. Juice a fruit. Muddle mint. Pour \u201ctoo much\u201d olive juice into a cocktail shaker. Fill a martini glass with \u201ctoo many\u201d olives. \u201cFreeze\u201d the olives to make \u201ccold olives.\u201d Eat olives \u201con the side\u201d also, just as a snack. And so on. It\u2019s fun."}, {"f380": "If you\u2019re not at home and are instead at your (my) favorite cocktail bar Clover Club, a cocktail I recommend getting is the \u201cVoodoo Child.\u201d It\u2019s in the \u201cTiki Drink\u201d section of the menu, which only exists during the summertime. (Though I think the \u201cVoodoo Child\u201d is offered regularly during other seasons, too.) (But I don\u2019t know for sure.) (Find out for yourself.)"}, {"56b4": "It\u2019s tart-y fruity and tastes good."}, {"c405": "\u201cYou make it sound so delicious,\u201d you\u2019re thinking, \u201cbut what if I am at home and I want to \u2018get the \u201cVoodoo Child?\u201d\u2019\u201d Amazing question. I had the same question, and it led me to this video from Fox News, my favorite news outlet:"}, {"86cf": "Wow. I didn\u2019t think the internet would provide me with exactly how to make this drink, but it did in about three seconds. Here are the ingredients:"}, {"edd5": "\u201cCacha\u00e7a,\u201d as snobs will eagerly tell you with a tone that indicates they assume you do not know already, is Brazil\u2019s most popular spirit. It\u2019s like rum. Hmm. Would the Rio Olympics have been a better \u201cpeg\u201d for this post? Better than \u201cno peg\u201d? Almost certainly. But we\u2019ve gotten off track."}, {"12d3": "Even though we know the ingredients and proportions, this drink still seemed a little daunting to me because what is lili\u2019koi syrup? I wondered: Can just anyone make this drink that I like, from that place?"}, {"2202": "Amazing question."}, {"d4bd": "I thought the hardest part would be finding the cacha\u00e7a, but that was actually the easiest part. It\u2019s funny how life will surprise you. One minute you\u2019re thinking finding the cacha\u00e7a will be the hardest part, the next minute you\u2019ve found the cacha\u00e7a."}, {"44fc": "I found it at Smith & Vine, in case you\u2019re in Carroll Gardens and need to either make this tiki drink or get rid of $40 (!!!!!!!!!!!!!!) real fast."}, {"9ab9": "The hardest part was finding \u201cSt. Elizabeth Allspice Dram,\u201d because it was impossible and I did not find it. I looked in two places and then called another place and none of the places had it. Then I looked for allspice bitters at two more places, and couldn\u2019t find that either. So I said, \u201cfuck it.\u201d You only need a \u00bc oz anyway, who cares. I wish I never looked."}, {"fb76": "Lili\u2019koi syrup is passion fruit syrup. I could not find passion fruit syrup anywhere, but you know what I did find? Passion fruits."}, {"f016": "Wow. Here\u2019s how I made passion fruit syrup:"}, {"902e": "Boiling passion fruit syrup\u00a0,\u00a0yum."}, {"c944": "Honey syrup I made the same way, except with honey and no sugar."}, {"efee": "I juiced the fruits with my citrus juicer. I crushed the ice with my terrible blender that I bought on Amazon because it was the cheapest one."}, {"57ed": "Then I poured the ice into a tall glass, then poured all of the ingredients into a cocktail shaker with ice, then shook it up, and then spilled it everywhere:"}, {"8975": "It\u2019s fine."}, {"c1c7": "I have a citrus zester so I zested some grapefruit zest for the top, but if you don\u2019t have a citrus zester you don\u2019t need the zest, I guess, if that\u2019s the kind of life you want to live."}, {"e3e3": "Guess what: Even without the fucking allspice dram, it tasted great and nearly perfect. Except it had passion fruit seeds, which was unfortunate. Here is a picture of the real cocktail on the left, compared with the fake cocktail on the floor of my apartment:"}, {"9794": "Looks like a different color but I think we can all agree that that doesn\u2019t matter."}, {"1097": "So that brings me to my question:"}, {"966f": "Can just anyone make this\u00a0drink?"}, {"01bc": "And the answer is:"}, {"8455": "OK."}, {"1f94": "Well, the end."}], "child": "2277_1", "parent": "", "title": "Can Just Anyone Make a Fancy Tiki\u00a0Drink?", "content": "Can Just Anyone Make a Fancy Tiki\u00a0Drink? An investigation. Art: Kelly Do you make cocktails at home? (Don\u2019t answer.) I like making cocktails at home because you get to do a little something, and then you get a cocktail. Juice a fruit. Muddle mint. Pour \u201ctoo much\u201d olive juice into a cocktail shaker. Fill a martini glass with \u201ctoo many\u201d olives. \u201cFreeze\u201d the olives to make \u201ccold olives.\u201d Eat olives \u201con the side\u201d also, just as a snack. And so on. It\u2019s fun. If you\u2019re not at home and are instead at your (my) favorite cocktail bar Clover Club, a cocktail I recommend getting is the \u201cVoodoo Child.\u201d It\u2019s in the \u201cTiki Drink\u201d section of the menu, which only exists during the summertime. (Though I think the \u201cVoodoo Child\u201d is offered regularly during other seasons, too.) (But I don\u2019t know for sure.) (Find out for yourself.) It\u2019s tart-y fruity and tastes good. \u201cYou make it sound so delicious,\u201d you\u2019re thinking, \u201cbut what if I am at home and I want to \u2018get the \u201cVoodoo Child?\u201d\u2019\u201d Amazing question. I had the same question, and it led me to this video from Fox News, my favorite news outlet: Wow. I didn\u2019t think the internet would provide me with exactly how to make this drink, but it did in about three seconds. Here are the ingredients: \u201cCacha\u00e7a,\u201d as snobs will eagerly tell you with a tone that indicates they assume you do not know already, is Brazil\u2019s most popular spirit. It\u2019s like rum. Hmm. Would the Rio Olympics have been a better \u201cpeg\u201d for this post? Better than \u201cno peg\u201d? Almost certainly. But we\u2019ve gotten off track. Even though we know the ingredients and proportions, this drink still seemed a little daunting to me because what is lili\u2019koi syrup? I wondered: Can just anyone make this drink that I like, from that place? Amazing question. I thought the hardest part would be finding the cacha\u00e7a, but that was actually the easiest part. It\u2019s funny how life will surprise you. One minute you\u2019re thinking finding the cacha\u00e7a will be the hardest part, the next minute you\u2019ve found the cacha\u00e7a. I found it at Smith & Vine, in case you\u2019re in Carroll Gardens and need to either make this tiki drink or get rid of $40 (!!!!!!!!!!!!!!) real fast. The hardest part was finding \u201cSt. Elizabeth Allspice Dram,\u201d because it was impossible and I did not find it. I looked in two places and then called another place and none of the places had it. Then I looked for allspice bitters at two more places, and couldn\u2019t find that either. So I said, \u201cfuck it.\u201d You only need a \u00bc oz anyway, who cares. I wish I never looked. Lili\u2019koi syrup is passion fruit syrup. I could not find passion fruit syrup anywhere, but you know what I did find? Passion fruits. Wow. Here\u2019s how I made passion fruit syrup: Boiling passion fruit syrup\u00a0,\u00a0yum. Honey syrup I made the same way, except with honey and no sugar. I juiced the fruits with my citrus juicer. I crushed the ice with my terrible blender that I bought on Amazon because it was the cheapest one. Then I poured the ice into a tall glass, then poured all of the ingredients into a cocktail shaker with ice, then shook it up, and then spilled it everywhere: It\u2019s fine. I have a citrus zester so I zested some grapefruit zest for the top, but if you don\u2019t have a citrus zester you don\u2019t need the zest, I guess, if that\u2019s the kind of life you want to live. Guess what: Even without the fucking allspice dram, it tasted great and nearly perfect. Except it had passion fruit seeds, which was unfortunate. Here is a picture of the real cocktail on the left, compared with the fake cocktail on the floor of my apartment: Looks like a different color but I think we can all agree that that doesn\u2019t matter. So that brings me to my question: Can just anyone make this\u00a0drink? And the answer is: OK. Well, the end. ", "name": "2277"}