{"sentences": [{"b6fe": "76% of high-performance employees say trade mastery, not money, most important in career decisions."}, {"7457": "Connecting with our people through trade mastery, instead of money, is key to productive and happy\u00a0folks."}, {"d363": "\u2192 Are you a high-performance employee? Please help me better understand you by contributing to a 30-second anonymous survey. Thank you! http://bit.ly/high-performance-survey \u2190"}, {"55bf": "This article is part of an ongoing series on optimizing corporate environments for the High-Performance Employee (HPE). Part 1 is here. Part 2 is here."}, {"e248": "As the pace of global technology continues to accelerate, competition in emerging micro-segments is becoming incredibly dense. Many of our modern enterprises are struggling to sustain a backlog of innovation projects necessary for the growth demanded by investors and public markets. These same companies are showing signs of a disconnect between executives and high-performance employees. This disconnect shows in the way we design cultures for performance and results in a difficulty retaining and incentivizing our critical employees."}, {"e34c": "Could it be that the key ingredient to retention, morale, productivity and sustainable innovation, is simply to cultivate the trade mastery potential of our high-performance employees (HPEs)?"}, {"3059": "Rather than being tasked with doing the most, high-performance employees (HPEs) are asked to solve the hardest problems in every company. They are the technicians, builders, designers, creatives, culture shapers, narrators and innovators."}, {"0ca7": "My latest survey data* shows that 76% of high-performance employees say trade mastery is more important than money when considering career decisions. (*Over 3,000 respondents. For more on how I define HPEs read here.)"}, {"49a4": "Many companies lose touch with the concepts of truth in craft and trade mastery\u2014vague concepts to be sure, yet somewhere deep in the mind of the HPE they hold vital importance."}, {"9a41": "Perhaps companies like Patagonia, BMW, Dow Chemical, Intel, Github, Gucci, The North Face, Nike, Apple, Google, Basecamp, NPM, and Amazon can serve as examples. These companies seem to have proven over time that their fundamental focus, either by directive or happenstance, has been to sustain the energy incubated by their founders\u200a\u2014\u200aan energy focused on technical/creative purity before financial gain."}, {"7ced": "This focus on purity shows itself in high-performance people\u2014reflected by their core principles, the way they think, and their dedication to vocational values. Most importantly, the HPE focus on trade mastery greatly influences where they work and how long they stay."}, {"c19b": "Let\u2019s go\u00a0deeper."}, {"1aa6": "My latest data shows that 76% of HPEs are not primarily motivated by money. But why?"}, {"6b42": "The mysteries are hard to\u00a0explain."}, {"04dd": "It may sound strange, but let\u2019s first talk about the concept of karma. We can consider karma as the mysterious inertia of life\u2019s puzzle. Karma may be better explored by asking some simple questions:"}, {"4061": "Many times more expansive than should be pondered here, the concept of karma encircles the mysteries of life, generational inheritance, and much more. It\u2019s a mysterious concept that addresses the endless mysteries that surround us."}, {"d222": "Do we find our core skills, or do skills find\u00a0us?"}, {"1dc7": "Maybe we can think about trade skills and dedication to craft as a similar type of mystery. How do we choose our skills? The answer to this question is incredibly complex and if followed to its root, will begin to expose the fundamental questions of life itself."}, {"0758": "What of the folks who were born into a technical or creative family? Simple. But what about the question of why and how they were born into that family? It\u2019s so much more than a game of strategy and Life Building 101. I have no capacity to practically decode it without a simple-minded explanation based on linear thinking."}, {"d370": "Perhaps a more compelling way to consider the HPE\u2019s connection with their vocational skill set would be that in most cases skills choose us, rather than we choose our skills."}, {"d507": "Perhaps our intersection with trade skills manifests more like mountaineers drawn to the range, or surfers to the ocean. The Japanese have an interesting concept called Ikigai, likely translated as \u201ca reason for being\u201d or \u201ca reason to get up in the morning.\u201d Surely our HPEs understand this inertia\u2014a compulsion to start or finish each day solving interesting puzzles on the path to mastery."}, {"cb2d": "It\u2019s so much more interesting than\u00a0money."}, {"fad1": "Let\u2019s circle back to our original data point: 76% of high-performance employees (HPEs) say trade mastery is more important than money when considering career decisions. The utility of money as a long-term motivator or a proxy for core understanding and empathy are limited\u2014if not completely misdirected\u2014because an HPE\u2019s connection to their trade resembles more a mysterious spiritual illumination and growing devotion than it does an evolution of practical decisions aimed in a concise direction."}, {"01fb": "And so\u2026using our corporate, bureaucratic, linear and financial logic to understand, reward and empathise with HPEs is silly. HPEs are so often on a mysterious quest to do their best work according to the truth and purity of their craft. This can result in earning great money. Yet how many of our rich HPEs consider money to be the endgame? I wonder how many of them look back later in life with fluffed and lined pockets, only to yearn for their past that focused primarily on the modesty of their principles."}, {"ed20": "If we can understand our HPE\u2019s dedication to craft and skill, and encourage the mastery of such talents by way of corporate culture and directive\u2014then we will be more likely to really listen to our people while designing environments and process systems around them to maximize efficiency, retention, productivity and morale. In doing so, our companies can sustain innovation over long periods of time. Our products will be great. Our people will be happy. And if even for a short time, our work life might seem to make a bit more sense."}, {"65d7": "\u2192 Are you a high-performance employee? Please help me better understand you by contributing to a 30-second anonymous survey. Thank you! http://bit.ly/high-performance-survey \u2190"}, {"9637": "This article is part of an ongoing series on optimizing corporate environments for the High-Performance Employee (HPE). Part 1 is here. Part 2 is here."}], "child": "2317_1\t2317_2\t2317_3\t2317_4\t2317_5\t2317_6\t2317_7\t2317_8\t2317_9\t2317_10\t2317_112317_1\t2317_2\t2317_3\t2317_4\t2317_5\t2317_6\t2317_7\t2317_8\t2317_9\t2317_10\t2317_112317_1\t2317_2\t2317_3\t2317_4\t2317_5\t2317_6\t2317_7\t2317_8\t2317_9\t2317_10\t2317_112317_1\t2317_2\t2317_3\t2317_4\t2317_5\t2317_6\t2317_7\t2317_8\t2317_9\t2317_10\t2317_11", "parent": "", "title": "76% of high-performance employees say trade mastery, not money, most important in career decisions.", "content": "76% of high-performance employees say trade mastery, not money, most important in career decisions. Connecting with our people through trade mastery, instead of money, is key to productive and happy\u00a0folks. \u2192 Are you a high-performance employee? Please help me better understand you by contributing to a 30-second anonymous survey. Thank you! http://bit.ly/high-performance-survey \u2190 This article is part of an ongoing series on optimizing corporate environments for the High-Performance Employee (HPE). Part 1 is here. Part 2 is here. As the pace of global technology continues to accelerate, competition in emerging micro-segments is becoming incredibly dense. Many of our modern enterprises are struggling to sustain a backlog of innovation projects necessary for the growth demanded by investors and public markets. These same companies are showing signs of a disconnect between executives and high-performance employees. This disconnect shows in the way we design cultures for performance and results in a difficulty retaining and incentivizing our critical employees. Could it be that the key ingredient to retention, morale, productivity and sustainable innovation, is simply to cultivate the trade mastery potential of our high-performance employees (HPEs)? Rather than being tasked with doing the most, high-performance employees (HPEs) are asked to solve the hardest problems in every company. They are the technicians, builders, designers, creatives, culture shapers, narrators and innovators. My latest survey data* shows that 76% of high-performance employees say trade mastery is more important than money when considering career decisions. (*Over 3,000 respondents. For more on how I define HPEs read here.) Many companies lose touch with the concepts of truth in craft and trade mastery\u2014vague concepts to be sure, yet somewhere deep in the mind of the HPE they hold vital importance. Perhaps companies like Patagonia, BMW, Dow Chemical, Intel, Github, Gucci, The North Face, Nike, Apple, Google, Basecamp, NPM, and Amazon can serve as examples. These companies seem to have proven over time that their fundamental focus, either by directive or happenstance, has been to sustain the energy incubated by their founders\u200a\u2014\u200aan energy focused on technical/creative purity before financial gain. This focus on purity shows itself in high-performance people\u2014reflected by their core principles, the way they think, and their dedication to vocational values. Most importantly, the HPE focus on trade mastery greatly influences where they work and how long they stay. Let\u2019s go\u00a0deeper. My latest data shows that 76% of HPEs are not primarily motivated by money. But why? The mysteries are hard to\u00a0explain. It may sound strange, but let\u2019s first talk about the concept of karma. We can consider karma as the mysterious inertia of life\u2019s puzzle. Karma may be better explored by asking some simple questions: Many times more expansive than should be pondered here, the concept of karma encircles the mysteries of life, generational inheritance, and much more. It\u2019s a mysterious concept that addresses the endless mysteries that surround us. Do we find our core skills, or do skills find\u00a0us? Maybe we can think about trade skills and dedication to craft as a similar type of mystery. How do we choose our skills? The answer to this question is incredibly complex and if followed to its root, will begin to expose the fundamental questions of life itself. What of the folks who were born into a technical or creative family? Simple. But what about the question of why and how they were born into that family? It\u2019s so much more than a game of strategy and Life Building 101. I have no capacity to practically decode it without a simple-minded explanation based on linear thinking. Perhaps a more compelling way to consider the HPE\u2019s connection with their vocational skill set would be that in most cases skills choose us, rather than we choose our skills. Perhaps our intersection with trade skills manifests more like mountaineers drawn to the range, or surfers to the ocean. The Japanese have an interesting concept called Ikigai, likely translated as \u201ca reason for being\u201d or \u201ca reason to get up in the morning.\u201d Surely our HPEs understand this inertia\u2014a compulsion to start or finish each day solving interesting puzzles on the path to mastery. It\u2019s so much more interesting than\u00a0money. Let\u2019s circle back to our original data point: 76% of high-performance employees (HPEs) say trade mastery is more important than money when considering career decisions. The utility of money as a long-term motivator or a proxy for core understanding and empathy are limited\u2014if not completely misdirected\u2014because an HPE\u2019s connection to their trade resembles more a mysterious spiritual illumination and growing devotion than it does an evolution of practical decisions aimed in a concise direction. And so\u2026using our corporate, bureaucratic, linear and financial logic to understand, reward and empathise with HPEs is silly. HPEs are so often on a mysterious quest to do their best work according to the truth and purity of their craft. This can result in earning great money. Yet how many of our rich HPEs consider money to be the endgame? I wonder how many of them look back later in life with fluffed and lined pockets, only to yearn for their past that focused primarily on the modesty of their principles. If we can understand our HPE\u2019s dedication to craft and skill, and encourage the mastery of such talents by way of corporate culture and directive\u2014then we will be more likely to really listen to our people while designing environments and process systems around them to maximize efficiency, retention, productivity and morale. In doing so, our companies can sustain innovation over long periods of time. Our products will be great. Our people will be happy. And if even for a short time, our work life might seem to make a bit more sense. \u2192 Are you a high-performance employee? Please help me better understand you by contributing to a 30-second anonymous survey. Thank you! http://bit.ly/high-performance-survey \u2190 This article is part of an ongoing series on optimizing corporate environments for the High-Performance Employee (HPE). Part 1 is here. Part 2 is here. ", "name": "2317"}