{"name": "244", "parent": "", "content": "3 car\u00eancias humanas que voc\u00ea j\u00e1 sabia; mas n\u00e3o presta\u00a0aten\u00e7\u00e3o Se resolvidas, muita coisa melhoraria em\u00a0cascata Tenho uma amiga fil\u00f3sofa de botequim maravilhosa. Ela \u00e9 capaz de escarafunchar um bom pensamento de absolutamente qualquer coisa, incluindo m\u00fasicas carnavalescas, best-sellers de autoajuda e perfis populares das redes sociais. E como sabe que eu gosto desse tipo de conversa, vira e mexe ela me liga para tomarmos um caf\u00e9. Ou uma cerveja, nas \u00e9pocas em que bebo um pouco. Esta semana combinamos de nos encontrar para papear por duas horas. Acabamos ficando seis, como \u00e9 de praxe. De tudo o que conversamos, tr\u00eas coisas me chamaram aten\u00e7\u00e3o. Geralmente eu anoto em algum lugar mas, desta vez, pensei: porqu\u00ea n\u00e3o compartilhar? Racquel e eu est\u00e1vamos falando sobre a situa\u00e7\u00e3o n\u00e3o apenas daqui, deste pa\u00eds, mas da humanidade. \u00c9 \u00f3bvio que os nossos desafios s\u00e3o numericamente muito maiores mas, depois de muita saliva, chegamos a uma conclus\u00e3o interessante. Dentro, naturalmente, da nossa imensa despretens\u00e3o filos\u00f3fica. Enumeramos tr\u00eas car\u00eancias humanas atuais que, se resolvidas, muita coisa melhoraria em cascata. A real \u00e9 que, na minha opini\u00e3o, esses tr\u00eas itens\u200a\u2014\u200aa falta deles\u200a\u2014\u200as\u00e3o verdadeiras epidemias. Eu sempre saio diferente depois de uma conversa com a Racquel. Diferente pra melhor. Acho que na pr\u00f3xima vez vou filmar. Da\u00ed posto aqui\u00a0;-) ", "title": "3 car\u00eancias humanas que voc\u00ea j\u00e1 sabia; mas n\u00e3o presta\u00a0aten\u00e7\u00e3o", "sentences": [{"dfad": "3 car\u00eancias humanas que voc\u00ea j\u00e1 sabia; mas n\u00e3o presta\u00a0aten\u00e7\u00e3o"}, {"2c70": "Se resolvidas, muita coisa melhoraria em\u00a0cascata"}, {"e14b": "Tenho uma amiga fil\u00f3sofa de botequim maravilhosa. Ela \u00e9 capaz de escarafunchar um bom pensamento de absolutamente qualquer coisa, incluindo m\u00fasicas carnavalescas, best-sellers de autoajuda e perfis populares das redes sociais. E como sabe que eu gosto desse tipo de conversa, vira e mexe ela me liga para tomarmos um caf\u00e9. Ou uma cerveja, nas \u00e9pocas em que bebo um pouco."}, {"ec69": "Esta semana combinamos de nos encontrar para papear por duas horas. Acabamos ficando seis, como \u00e9 de praxe."}, {"b9c6": "De tudo o que conversamos, tr\u00eas coisas me chamaram aten\u00e7\u00e3o. Geralmente eu anoto em algum lugar mas, desta vez, pensei: porqu\u00ea n\u00e3o compartilhar?"}, {"d08a": "Racquel e eu est\u00e1vamos falando sobre a situa\u00e7\u00e3o n\u00e3o apenas daqui, deste pa\u00eds, mas da humanidade. \u00c9 \u00f3bvio que os nossos desafios s\u00e3o numericamente muito maiores mas, depois de muita saliva, chegamos a uma conclus\u00e3o interessante. Dentro, naturalmente, da nossa imensa despretens\u00e3o filos\u00f3fica."}, {"a463": "Enumeramos tr\u00eas car\u00eancias humanas atuais que, se resolvidas, muita coisa melhoraria em cascata. A real \u00e9 que, na minha opini\u00e3o, esses tr\u00eas itens\u200a\u2014\u200aa falta deles\u200a\u2014\u200as\u00e3o verdadeiras epidemias."}, {"6693": "Eu sempre saio diferente depois de uma conversa com a Racquel."}, {"3f61": "Diferente pra melhor."}, {"bbe2": "Acho que na pr\u00f3xima vez vou filmar."}, {"2f04": "Da\u00ed posto aqui\u00a0;-)"}], "child": "244_1\t244_2"}