{"name": "770", "parent": "", "content": "Sobre ser voc\u00ea\u00a0mesmo Era 2011, e minha agenda indicava que eu estava cada vez mais pr\u00f3xima de uma das reuni\u00f5es mais importantes de neg\u00f3cio que eu faria at\u00e9 ali. Do outro lado da mesa eu almo\u00e7aria com uma pessoa respons\u00e1vel por um uma companhia gigante da ind\u00fastria da internet, at\u00e9 IPO em NASDAQ j\u00e1 fizeram. Uma companhia que voc\u00ea respeita. Ter\u00edamos uma hora no rel\u00f3gio para um almo\u00e7o que levei quase um ano para fazer virar. Para mim, um momento t\u00e3o importante que a preocupa\u00e7\u00e3o em n\u00e3o exibir uma das minhas 7 tatuagens, ou de falar o que n\u00e3o devo e pior, de fazer perguntas poucos inteligentes estavam me confundindo e tirando o foco do que eu realmente queria com aquele almo\u00e7o. Ap\u00f3s uma semana nesse dilema resolvi escrever para uma dos meus mentores e perguntar como deveria me apresentar nessa reuni\u00e3o. A resposta foi direta e na carne: \"Seja voc\u00ea Bru! Independente de qualquer coisa, seja voc\u00ea!\u201d Essa resposta breve e direta veio como um al\u00edvio, e me levou a reavaliar minha jornada at\u00e9 ali. Sempre muito convicta das minhas escolhas, nunca concordei com muitas coisas impostas pelo mundo corporativo, e come\u00e7ando pelo dress code apenas para citar um exemplo, fica muito claro que esse \u00e9 mais um dos movimentos desse mundo para colocar todas as pessoas na mesma caixa, ignorando assim sinais, indicativos e mensagens profundas sobre indiv\u00edduos. Indicativos esses que jamais deveriam ser ignorados se considerarmos que o aprendizado \u00e9 um ciclo que n\u00e3o termina em n\u00f3s mesmos, e de que estamos sempre aprendendo, com tudo e com todos. Respeitando claro os diferentes ambientes, de fato, um dress code \u00e9 carregado de mensagens sobre quem as pessoas s\u00e3o, independente de todo pre conceito estabelecido. Acredito de verdade que n\u00e3o exista uma f\u00f3rmula \u00fanica a ser seguida por todo e qualquer indiv\u00edduo no mundo dos neg\u00f3cios, ou em qualquer outro ambiente. Um dos livros que li ano passado me trouxe a intrigante reflex\u00e3o quando o autor afirma que somos a m\u00e9dia dos 5 h\u00e1bitos que cultivamos, das 5 pessoas com as quais mais estamos juntos, das 5 coisas que mais comemos, dos 5 tipos de conte\u00fado que mais consumimos, etc. Questionei muito a profundidade dessa afirma\u00e7\u00e3o, mas fiz uma longa an\u00e1lise das minhas experi\u00eancias pessoais e de fato fez todo sentido para mim. Vivo uma incansante busca por aprender com todos, independente de padr\u00f5es ou situa\u00e7\u00f5es. Pratico constantemente estar em contato e encontrando pessoas que respeito para aprender com elas, e vejam s\u00f3, hoje tenho mentores mais novos do que eu, dos 20 e poucos aos 70 e poucos anos. Fa\u00e7o disso tudo um infinito aprendizado, o que me assegura a cada dia a n\u00e3o negociar ser eu mesma, n\u00e3o investir no que n\u00e3o existe em mim, e a acreditar que o melhor material que temos \u00e9 a constru\u00e7\u00e3o de n\u00f3s mesmos. Afinal, \u201cqual a sua forma\u00e7\u00e3o?\u201d, se n\u00e3o um somat\u00f3rio de experi\u00eancias e aprendizados que constru\u00edmos na vida, e que n\u00e3o est\u00e3o nos diplomas!? O almo\u00e7o correu bem, eu me vesti como de costume, agi com transpar\u00eancia e fiz meu dever de casa, estudando tudo sobre o que precisava, al\u00e9m de ter levado umas perguntas na cabe\u00e7a (fica a dica). E o meu convidado? Estava at\u00e9 mais despojado do que eu imaginei, vestia cal\u00e7a jeans, t\u00eanis e camiseta. Ao fim do almo\u00e7o trocou comigo um abracinho e aquele famoso \"aperto de m\u00e3os contratual\", que nos transformaria de desconhecidos a s\u00f3cios. Dahora a vida.Cheers\u00a0:) ", "title": "Sobre ser voc\u00ea\u00a0mesmo", "sentences": [{"d336": "Sobre ser voc\u00ea\u00a0mesmo"}, {"43d0": "Era 2011, e minha agenda indicava que eu estava cada vez mais pr\u00f3xima de uma das reuni\u00f5es mais importantes de neg\u00f3cio que eu faria at\u00e9 ali. Do outro lado da mesa eu almo\u00e7aria com uma pessoa respons\u00e1vel por um uma companhia gigante da ind\u00fastria da internet, at\u00e9 IPO em NASDAQ j\u00e1 fizeram. Uma companhia que voc\u00ea respeita."}, {"5920": "Ter\u00edamos uma hora no rel\u00f3gio para um almo\u00e7o que levei quase um ano para fazer virar. Para mim, um momento t\u00e3o importante que a preocupa\u00e7\u00e3o em n\u00e3o exibir uma das minhas 7 tatuagens, ou de falar o que n\u00e3o devo e pior, de fazer perguntas poucos inteligentes estavam me confundindo e tirando o foco do que eu realmente queria com aquele almo\u00e7o."}, {"021f": "Ap\u00f3s uma semana nesse dilema resolvi escrever para uma dos meus mentores e perguntar como deveria me apresentar nessa reuni\u00e3o. A resposta foi direta e na carne:"}, {"5ee4": "\"Seja voc\u00ea Bru! Independente de qualquer coisa, seja voc\u00ea!\u201d"}, {"d879": "Essa resposta breve e direta veio como um al\u00edvio, e me levou a reavaliar minha jornada at\u00e9 ali."}, {"9a4d": "Sempre muito convicta das minhas escolhas, nunca concordei com muitas coisas impostas pelo mundo corporativo, e come\u00e7ando pelo dress code apenas para citar um exemplo, fica muito claro que esse \u00e9 mais um dos movimentos desse mundo para colocar todas as pessoas na mesma caixa, ignorando assim sinais, indicativos e mensagens profundas sobre indiv\u00edduos. Indicativos esses que jamais deveriam ser ignorados se considerarmos que o aprendizado \u00e9 um ciclo que n\u00e3o termina em n\u00f3s mesmos, e de que estamos sempre aprendendo, com tudo e com todos. Respeitando claro os diferentes ambientes, de fato, um dress code \u00e9 carregado de mensagens sobre quem as pessoas s\u00e3o, independente de todo pre conceito estabelecido."}, {"92ea": "Acredito de verdade que n\u00e3o exista uma f\u00f3rmula \u00fanica a ser seguida por todo e qualquer indiv\u00edduo no mundo dos neg\u00f3cios, ou em qualquer outro ambiente."}, {"82e5": "Um dos livros que li ano passado me trouxe a intrigante reflex\u00e3o quando o autor afirma que somos a m\u00e9dia dos 5 h\u00e1bitos que cultivamos, das 5 pessoas com as quais mais estamos juntos, das 5 coisas que mais comemos, dos 5 tipos de conte\u00fado que mais consumimos, etc. Questionei muito a profundidade dessa afirma\u00e7\u00e3o, mas fiz uma longa an\u00e1lise das minhas experi\u00eancias pessoais e de fato fez todo sentido para mim."}, {"8dfe": "Vivo uma incansante busca por aprender com todos, independente de padr\u00f5es ou situa\u00e7\u00f5es. Pratico constantemente estar em contato e encontrando pessoas que respeito para aprender com elas, e vejam s\u00f3, hoje tenho mentores mais novos do que eu, dos 20 e poucos aos 70 e poucos anos."}, {"697f": "Fa\u00e7o disso tudo um infinito aprendizado, o que me assegura a cada dia a n\u00e3o negociar ser eu mesma, n\u00e3o investir no que n\u00e3o existe em mim, e a acreditar que o melhor material que temos \u00e9 a constru\u00e7\u00e3o de n\u00f3s mesmos."}, {"1c7c": "Afinal, \u201cqual a sua forma\u00e7\u00e3o?\u201d, se n\u00e3o um somat\u00f3rio de experi\u00eancias e aprendizados que constru\u00edmos na vida, e que n\u00e3o est\u00e3o nos diplomas!?"}, {"3716": "O almo\u00e7o correu bem, eu me vesti como de costume, agi com transpar\u00eancia e fiz meu dever de casa, estudando tudo sobre o que precisava, al\u00e9m de ter levado umas perguntas na cabe\u00e7a (fica a dica)."}, {"7868": "E o meu convidado? Estava at\u00e9 mais despojado do que eu imaginei, vestia cal\u00e7a jeans, t\u00eanis e camiseta. Ao fim do almo\u00e7o trocou comigo um abracinho e aquele famoso \"aperto de m\u00e3os contratual\", que nos transformaria de desconhecidos a s\u00f3cios."}, {"ece0": "Dahora a vida.Cheers\u00a0:)"}], "child": "770_1\t770_2"}