{"name": "909", "parent": "", "content": "Recrutar para UX \u00e9\u00a0dif\u00edcil Ent\u00e3o vamos facilitar \u2013 para voc\u00ea e para mim. Candidatos: parem de se esconder atr\u00e1s dos post-its. Desde que eu mudei para Try uma das fun\u00e7\u00f5es que eu tenho exercido mais \u2013 muito mais, comparando a todos outros anos em outros lugares \u2013 \u00e9 conversar e recrutar pessoas. E mesmo que n\u00e3o tenhamos nada aberto, dada a natureza super vol\u00e1til e din\u00e2mica do mercado atualmente, a cada dia me conven\u00e7o mais de que preciso estar sempre conhecendo algu\u00e9m novo. Parece f\u00e1cil, n\u00e3o? Entretanto, n\u00e3o \u00e9 \u2013 nem de longe. \u00c9 uma tarefa que consome tempo e muito esfor\u00e7o. Agora, se as startups s\u00e3o os rockstars do dia e se j\u00e1 superamos o que eu chamo de Vale da Depress\u00e3o de Social Media \u2013 assunto para outro texto \u2013 o que transforma a tarefa em algo t\u00e3o dif\u00edcil assim? Recrutar para qualquer posi\u00e7\u00e3o \u00e9\u00a0dif\u00edcil Eu passei os \u00faltimos doze anos espalhado por diversas empresas e queria come\u00e7ar dizendo \u2013 achar bons profissionais em qualquer ramo est\u00e1 dif\u00edcil. Acho que nunca n\u00e3o esteve. Ponto. Passou-se por longe a era em que o curr\u00edculo formal era capaz de contar a hist\u00f3ria da qualifica\u00e7\u00e3o e do perfil da pessoa, e n\u00e3o tem rem\u00e9dio sen\u00e3o o que preferi usar \u2013 conhecer as pessoas. Tem muitas raz\u00f5es pelas quais isso deve acontecer. O streamlining da educa\u00e7\u00e3o do ensino m\u00e9dio e a mercantiliza\u00e7\u00e3o do ensino superior podem ser apontados. Da mesma forma, a cisma \u2013 il\u00f3gica \u2013 entre mercado e academia, que insiste em ensinar que ou voc\u00ea critica ou voc\u00ea faz. E mesmo que n\u00e3o seja isso, Ainda podemos falar sobre grades curriculares \u2013 e pior, m\u00e9todos de ensino \u2013 datados. De qualquer forma, triar a base \u00e9 uma dificuldade. Eu acho que o que mais me choca \u00e9 como podem profissionais que estudaram \u00e1reas relacionadas na pr\u00e1tica\u200a\u2014\u200aDesign Gr\u00e1fico, Design Digital, Desenho Industria, Arquitetura, Engenheira de Software, Propaganda e Marketing, Editora\u00e7\u00e3o, Psicologia\u200a\u2014\u200an\u00e3o conseguirem abstrair o b\u00e1sico e relacionar \u00e0 pr\u00e1tica de UX. Dessas \u00e1reas de estudo para UX n\u00e3o \u00e9 uma guinada plena de carreira, \u00e9 uma apropria\u00e7\u00e3o b\u00e1sica dentro de coisas que pensamos todos os dias. T\u00e9cnicas t\u00eam de montes\u200a\u2014\u200ae nenhuma \u00e9 o suficiente Eu nunca saio entrevistando esperando t\u00e9cnicas. Verdade seja dita, eu raramente come\u00e7o a conversar com algu\u00e9m esperando ser deslumbrado pelo seu esmero t\u00e9cnico\u200a\u2014\u200acertamente, quando e se isso ocorrer, \u00e9 uma boa surpresa. Entretanto, o que eu espero \u00e9 encontrar uma pessoa que pense como um designer de experi\u00eancia do usu\u00e1rio. Isso \u00e9 amplo e vago, portanto, tomando emprestado um pouco de livros muito legais que tenho lido\u200a\u2014\u200acomo Design for Dasein, por exemplo\u200a\u2014\u200aeu procuro conversar com pessoas que demonstrem uma capacidade de pensamento abdutivo, especulativo, e que sejam capaz de amarrar isso em um contexto de problemas ou de neg\u00f3cios. A defini\u00e7\u00e3o parece simpl\u00f3ria e ela com certeza o \u00e9\u200a\u2014\u200aela deixa de fora uma s\u00e9rie de caracter\u00edsticas pessoais. E existe uma s\u00e9rie de coisas que podem apontar bons sinais: interesse, flexibilidade cognitiva, a capacidade de me contar uma hist\u00f3ria do come\u00e7o ao fim\u200a\u2014\u200ae isso, como sabem os que convivem comigo, \u00e9 muito importante\u200a\u2014\u200a, curiosidade, o olhar sobre h\u00e1bitos e comportamentos\u2026 Eu consigo abrir m\u00e3o de algu\u00e9m que conhe\u00e7a mais t\u00e9cnicas por uma pessoa que demonstre ter um tino para as coisas. T\u00e9cnicas, a gente ensina com facilidade. O mercado est\u00e1 polu\u00eddo por buzzwords e cursos e conte\u00fados de baixa qualidade O hype imenso em experi\u00eancia do usu\u00e1rio, design thinking e design de servi\u00e7os fez com que o mundo se povoasse rapidamente de entusiastas. Alguns pregam aos convertidos e transformam o di\u00e1logo em sua sala de aula, e outros\u200a\u2014\u200amais ousados\u200a\u2014\u200aquerem logo montar uma disciplina e repass\u00e1-la. Eu vejo com bons olhos qualquer tentativa de elucidar as pessoas, e reconhe\u00e7o que alguns pocket cursos e conte\u00fados falhem em sua ingenuidade ou na pr\u00f3pria falta de corpus necess\u00e1ria para inserir um olhar cr\u00edtico necess\u00e1rio para a cria\u00e7\u00e3o de um profissional pleno. N\u00e3o \u00e9 \u00e0 toa que eu sinto com frequ\u00eancia que seja necess\u00e1rio retornar \u00e0s bases do que \u00e9 e deveria ser o design. O que acontece \u00e9 que muito disso tudo s\u00e3o clickbaits que, em vez de elucidar, confundem e geram maus h\u00e1bitos nos profissionais\u200a\u2014\u200acomo se fossem aquele link perp\u00e9tuo de site qualquer que fala que comer chocolate todo dia emagrece ou algo assim. E o duro do clickbait \u00e9 que voc\u00ea fica louco para prov\u00e1-lo\u200a\u2014\u200aou seja, na conversa coloquial aparecem muitos desses tru\u00edsmos e falhas que mostram que a pessoa nunca elaborou um pensamento de design de cabo a rabo. Voc\u00ea \u00e9 lembrado que UX \u00e9 o que importa e que tudo precisa estar a dois cliques da home e que UX tem que ser lean sempre e que todo mundo entende o menu hamburger, afinal. Mas n\u00e3o \u00e9 assim que funciona o dia a dia, e qualquer pessoa da \u00e1rea o dir\u00e1. Ali\u00e1s, o que torna a profiss\u00e3o t\u00e3o legal no dia a dia \u00e9 como um comportamento perfeitamente eficiente em um contexto com um grupo de pessoas pode se tornar inadequado em outro contexto e para outros tipos de pessoas. Trabalhar com UX \u00e9 aprender a descondicionar o olhar para poder ver as coisas sempre como uma constru\u00e7\u00e3o, e n\u00e3o jogar regras \u00e0\u00a0toa. Saiba porque voc\u00ea est\u00e1\u00a0aqui Acho que isso deveria ser um mandamento em toda e qualquer entrevista de sempre. N\u00e3o, eu n\u00e3o espero que voc\u00ea saiba a hist\u00f3ria da empresa que o entrevista. Tampouco espero que voc\u00ea saiba a minha hist\u00f3ria, carreira, etc. Mas eu preciso que voc\u00ea d\u00ea algum sinal de que voc\u00ea sabe porque voc\u00ea est\u00e1 aqui, nesta sala, nesta call, neste Skype, falando comigo. \u00c9 triste admitir isso, mas isso n\u00e3o \u00e9 o que observamos com frequ\u00eancia, infelizmente. Eu preciso que voc\u00ea fale comigo e demonstre que voc\u00ea tem alguma no\u00e7\u00e3o do que isso se trata. N\u00e3o espero que voc\u00ea me responda uma chamada oral\u200a\u2014\u200amas que saiba minimamente o que \u00e9 UX, saiba minimamente o que voc\u00ea poderia fazer e qual seu norte magn\u00e9tico. E quanto mais experiente for o perfil, mais essa expectativa sobe. De novo\u200a\u2014\u200aparece uma obviedade, mas nem sempre \u00e9. E n\u00e3o, amigo, a porta da campanha publicit\u00e1ria \u00e9 do outro lado da rua\u200a\u2014\u200aela \u00e9 uma porta super bacana, super legal, mas n\u00e3o \u00e9 a mesma. E, segredo? A gente sabe quando voc\u00ea est\u00e1 aqui por engano. Entendo seu momento, mas preciso que voc\u00ea\u00a0relaxe Se voc\u00ea tem certeza de que nada disso \u00e9 seu caso, ainda h\u00e1 um \u00faltimo ponto que esquecemos mas que \u00e9 pivotal\u200a\u2014\u200aquando trabalhamos com uma pessoa, corremos o risco de acabar numa situa\u00e7\u00e3o muito louca como, por exemplo, passar 40 horas numa semana sentado do lado dela. Por isso, \u00e9 muito importante que nos sintamos bem. Eu entendo que de repente uma vaga em UX seja tudo o que voc\u00ea sonha, mas se voc\u00ea n\u00e3o relaxar e a gente n\u00e3o conseguir engatar numa conversa bacana, a gente provavelmente n\u00e3o vai se sair t\u00e3o bem trabalhando juntos. Quando eu menciono relaxar, entenda, \u00e9 realmente falar numa boa. Tentar impressionar demais n\u00e3o \u00e9 estar relaxado. Fazer uma piadinha tudo bem, mas v\u00e1rias? Na sequ\u00eancia? N\u00e3o parece relaxado. N\u00e3o conseguir me olhar na cara e travar pra contar um pouco de prosa tamb\u00e9m n\u00e3o parece relaxado. E isso tudo conta muito. Outra coisa\u200a\u2014\u200aquem cai na bobagem de tentar impressionar principalmente contando coisas que n\u00e3o aconteceram, uma dica. O mercado e a academia coletivamente n\u00e3o esquecem. Quem entrevista nem sempre est\u00e1\u00a0certo Eu sei que isso tudo que eu coloquei levanta uma s\u00e9rie de pontos\u200a\u2014\u200ase o entrevistador \u00e9 mais S\u00eanior, se ele teve uma postura adequada, se a empresa contratante colocou uma vaga adequada\u2026 Todos os pontos s\u00e3o v\u00e1lidos, mas isso n\u00e3o quer dizer que os mesmos invalidam os outros pontos que eu levantei. Acho que podemos abrir um outro espa\u00e7o justamente para a cr\u00edtica devida da contrata\u00e7\u00e3o de UX. Hoje, entretanto, escrevi apenas para abrir uma porta muito importante e pedir: se quiser, falem comigo. Sempre tem algu\u00e9m precisando de um bom UX. ", "title": "Recrutar para UX \u00e9\u00a0dif\u00edcil", "sentences": [{"f690": "Recrutar para UX \u00e9\u00a0dif\u00edcil"}, {"566a": "Ent\u00e3o vamos facilitar \u2013 para voc\u00ea e para mim."}, {"8077": "Candidatos: parem de se esconder atr\u00e1s dos post-its."}, {"1cf1": "Desde que eu mudei para Try uma das fun\u00e7\u00f5es que eu tenho exercido mais \u2013 muito mais, comparando a todos outros anos em outros lugares \u2013 \u00e9 conversar e recrutar pessoas. E mesmo que n\u00e3o tenhamos nada aberto, dada a natureza super vol\u00e1til e din\u00e2mica do mercado atualmente, a cada dia me conven\u00e7o mais de que preciso estar sempre conhecendo algu\u00e9m novo."}, {"2980": "Parece f\u00e1cil, n\u00e3o? Entretanto, n\u00e3o \u00e9 \u2013 nem de longe. \u00c9 uma tarefa que consome tempo e muito esfor\u00e7o."}, {"0612": "Agora, se as startups s\u00e3o os rockstars do dia e se j\u00e1 superamos o que eu chamo de Vale da Depress\u00e3o de Social Media \u2013 assunto para outro texto \u2013 o que transforma a tarefa em algo t\u00e3o dif\u00edcil assim?"}, {"3eb0": "Recrutar para qualquer posi\u00e7\u00e3o \u00e9\u00a0dif\u00edcil"}, {"da43": "Eu passei os \u00faltimos doze anos espalhado por diversas empresas e queria come\u00e7ar dizendo \u2013 achar bons profissionais em qualquer ramo est\u00e1 dif\u00edcil. Acho que nunca n\u00e3o esteve. Ponto. Passou-se por longe a era em que o curr\u00edculo formal era capaz de contar a hist\u00f3ria da qualifica\u00e7\u00e3o e do perfil da pessoa, e n\u00e3o tem rem\u00e9dio sen\u00e3o o que preferi usar \u2013 conhecer as pessoas."}, {"17d4": "Tem muitas raz\u00f5es pelas quais isso deve acontecer. O streamlining da educa\u00e7\u00e3o do ensino m\u00e9dio e a mercantiliza\u00e7\u00e3o do ensino superior podem ser apontados. Da mesma forma, a cisma \u2013 il\u00f3gica \u2013 entre mercado e academia, que insiste em ensinar que ou voc\u00ea critica ou voc\u00ea faz. E mesmo que n\u00e3o seja isso, Ainda podemos falar sobre grades curriculares \u2013 e pior, m\u00e9todos de ensino \u2013 datados."}, {"1022": "De qualquer forma, triar a base \u00e9 uma dificuldade. Eu acho que o que mais me choca \u00e9 como podem profissionais que estudaram \u00e1reas relacionadas na pr\u00e1tica\u200a\u2014\u200aDesign Gr\u00e1fico, Design Digital, Desenho Industria, Arquitetura, Engenheira de Software, Propaganda e Marketing, Editora\u00e7\u00e3o, Psicologia\u200a\u2014\u200an\u00e3o conseguirem abstrair o b\u00e1sico e relacionar \u00e0 pr\u00e1tica de UX. Dessas \u00e1reas de estudo para UX n\u00e3o \u00e9 uma guinada plena de carreira, \u00e9 uma apropria\u00e7\u00e3o b\u00e1sica dentro de coisas que pensamos todos os dias."}, {"edf8": "T\u00e9cnicas t\u00eam de montes\u200a\u2014\u200ae nenhuma \u00e9 o suficiente"}, {"e6da": "Eu nunca saio entrevistando esperando t\u00e9cnicas. Verdade seja dita, eu raramente come\u00e7o a conversar com algu\u00e9m esperando ser deslumbrado pelo seu esmero t\u00e9cnico\u200a\u2014\u200acertamente, quando e se isso ocorrer, \u00e9 uma boa surpresa. Entretanto, o que eu espero \u00e9 encontrar uma pessoa que pense como um designer de experi\u00eancia do usu\u00e1rio."}, {"547c": "Isso \u00e9 amplo e vago, portanto, tomando emprestado um pouco de livros muito legais que tenho lido\u200a\u2014\u200acomo Design for Dasein, por exemplo\u200a\u2014\u200aeu procuro conversar com pessoas que demonstrem uma capacidade de pensamento abdutivo, especulativo, e que sejam capaz de amarrar isso em um contexto de problemas ou de neg\u00f3cios."}, {"5060": "A defini\u00e7\u00e3o parece simpl\u00f3ria e ela com certeza o \u00e9\u200a\u2014\u200aela deixa de fora uma s\u00e9rie de caracter\u00edsticas pessoais. E existe uma s\u00e9rie de coisas que podem apontar bons sinais: interesse, flexibilidade cognitiva, a capacidade de me contar uma hist\u00f3ria do come\u00e7o ao fim\u200a\u2014\u200ae isso, como sabem os que convivem comigo, \u00e9 muito importante\u200a\u2014\u200a, curiosidade, o olhar sobre h\u00e1bitos e comportamentos\u2026"}, {"4cc9": "Eu consigo abrir m\u00e3o de algu\u00e9m que conhe\u00e7a mais t\u00e9cnicas por uma pessoa que demonstre ter um tino para as coisas. T\u00e9cnicas, a gente ensina com facilidade."}, {"174f": "O mercado est\u00e1 polu\u00eddo por buzzwords e cursos e conte\u00fados de baixa qualidade"}, {"44f3": "O hype imenso em experi\u00eancia do usu\u00e1rio, design thinking e design de servi\u00e7os fez com que o mundo se povoasse rapidamente de entusiastas. Alguns pregam aos convertidos e transformam o di\u00e1logo em sua sala de aula, e outros\u200a\u2014\u200amais ousados\u200a\u2014\u200aquerem logo montar uma disciplina e repass\u00e1-la."}, {"5445": "Eu vejo com bons olhos qualquer tentativa de elucidar as pessoas, e reconhe\u00e7o que alguns pocket cursos e conte\u00fados falhem em sua ingenuidade ou na pr\u00f3pria falta de corpus necess\u00e1ria para inserir um olhar cr\u00edtico necess\u00e1rio para a cria\u00e7\u00e3o de um profissional pleno. N\u00e3o \u00e9 \u00e0 toa que eu sinto com frequ\u00eancia que seja necess\u00e1rio retornar \u00e0s bases do que \u00e9 e deveria ser o design."}, {"ec83": "O que acontece \u00e9 que muito disso tudo s\u00e3o clickbaits que, em vez de elucidar, confundem e geram maus h\u00e1bitos nos profissionais\u200a\u2014\u200acomo se fossem aquele link perp\u00e9tuo de site qualquer que fala que comer chocolate todo dia emagrece ou algo assim."}, {"35b8": "E o duro do clickbait \u00e9 que voc\u00ea fica louco para prov\u00e1-lo\u200a\u2014\u200aou seja, na conversa coloquial aparecem muitos desses tru\u00edsmos e falhas que mostram que a pessoa nunca elaborou um pensamento de design de cabo a rabo. Voc\u00ea \u00e9 lembrado que UX \u00e9 o que importa e que tudo precisa estar a dois cliques da home e que UX tem que ser lean sempre e que todo mundo entende o menu hamburger, afinal."}, {"9c75": "Mas n\u00e3o \u00e9 assim que funciona o dia a dia, e qualquer pessoa da \u00e1rea o dir\u00e1. Ali\u00e1s, o que torna a profiss\u00e3o t\u00e3o legal no dia a dia \u00e9 como um comportamento perfeitamente eficiente em um contexto com um grupo de pessoas pode se tornar inadequado em outro contexto e para outros tipos de pessoas."}, {"66e9": "Trabalhar com UX \u00e9 aprender a descondicionar o olhar para poder ver as coisas sempre como uma constru\u00e7\u00e3o, e n\u00e3o jogar regras \u00e0\u00a0toa."}, {"e407": "Saiba porque voc\u00ea est\u00e1\u00a0aqui"}, {"ed8e": "Acho que isso deveria ser um mandamento em toda e qualquer entrevista de sempre."}, {"0d1e": "N\u00e3o, eu n\u00e3o espero que voc\u00ea saiba a hist\u00f3ria da empresa que o entrevista."}, {"0747": "Tampouco espero que voc\u00ea saiba a minha hist\u00f3ria, carreira, etc."}, {"e5c1": "Mas eu preciso que voc\u00ea d\u00ea algum sinal de que voc\u00ea sabe porque voc\u00ea est\u00e1 aqui, nesta sala, nesta call, neste Skype, falando comigo. \u00c9 triste admitir isso, mas isso n\u00e3o \u00e9 o que observamos com frequ\u00eancia, infelizmente."}, {"fa4a": "Eu preciso que voc\u00ea fale comigo e demonstre que voc\u00ea tem alguma no\u00e7\u00e3o do que isso se trata. N\u00e3o espero que voc\u00ea me responda uma chamada oral\u200a\u2014\u200amas que saiba minimamente o que \u00e9 UX, saiba minimamente o que voc\u00ea poderia fazer e qual seu norte magn\u00e9tico. E quanto mais experiente for o perfil, mais essa expectativa sobe. De novo\u200a\u2014\u200aparece uma obviedade, mas nem sempre \u00e9."}, {"9eb4": "E n\u00e3o, amigo, a porta da campanha publicit\u00e1ria \u00e9 do outro lado da rua\u200a\u2014\u200aela \u00e9 uma porta super bacana, super legal, mas n\u00e3o \u00e9 a mesma."}, {"e1b7": "E, segredo? A gente sabe quando voc\u00ea est\u00e1 aqui por engano."}, {"1794": "Entendo seu momento, mas preciso que voc\u00ea\u00a0relaxe"}, {"efdd": "Se voc\u00ea tem certeza de que nada disso \u00e9 seu caso, ainda h\u00e1 um \u00faltimo ponto que esquecemos mas que \u00e9 pivotal\u200a\u2014\u200aquando trabalhamos com uma pessoa, corremos o risco de acabar numa situa\u00e7\u00e3o muito louca como, por exemplo, passar 40 horas numa semana sentado do lado dela. Por isso, \u00e9 muito importante que nos sintamos bem."}, {"5b82": "Eu entendo que de repente uma vaga em UX seja tudo o que voc\u00ea sonha, mas se voc\u00ea n\u00e3o relaxar e a gente n\u00e3o conseguir engatar numa conversa bacana, a gente provavelmente n\u00e3o vai se sair t\u00e3o bem trabalhando juntos."}, {"7ac6": "Quando eu menciono relaxar, entenda, \u00e9 realmente falar numa boa."}, {"7ac7": "Tentar impressionar demais n\u00e3o \u00e9 estar relaxado."}, {"a529": "Fazer uma piadinha tudo bem, mas v\u00e1rias? Na sequ\u00eancia? N\u00e3o parece relaxado."}, {"26f2": "N\u00e3o conseguir me olhar na cara e travar pra contar um pouco de prosa tamb\u00e9m n\u00e3o parece relaxado."}, {"5701": "E isso tudo conta muito."}, {"f24a": "Outra coisa\u200a\u2014\u200aquem cai na bobagem de tentar impressionar principalmente contando coisas que n\u00e3o aconteceram, uma dica. O mercado e a academia coletivamente n\u00e3o esquecem."}, {"4193": "Quem entrevista nem sempre est\u00e1\u00a0certo"}, {"48c4": "Eu sei que isso tudo que eu coloquei levanta uma s\u00e9rie de pontos\u200a\u2014\u200ase o entrevistador \u00e9 mais S\u00eanior, se ele teve uma postura adequada, se a empresa contratante colocou uma vaga adequada\u2026 Todos os pontos s\u00e3o v\u00e1lidos, mas isso n\u00e3o quer dizer que os mesmos invalidam os outros pontos que eu levantei."}, {"d900": "Acho que podemos abrir um outro espa\u00e7o justamente para a cr\u00edtica devida da contrata\u00e7\u00e3o de UX. Hoje, entretanto, escrevi apenas para abrir uma porta muito importante e pedir: se quiser, falem comigo. Sempre tem algu\u00e9m precisando de um bom UX."}], "child": "909_1\t909_2\t909_3\t909_4\t909_5\t909_6\t909_7\t909_8\t909_9\t909_10\t909_11"}